20:16:06.398586 IP6 (hlim 64, next-header TCP (6) payload length: 40) ::1.52892 > ::1.8080: Flags [S], cksum 0x0030 (incorrect -> 0xcb24), seq 45055032, win 43690, options [mss 65476,sackOK,TS val 2386662 ecr 0,nop,wscale 7], length 0
20:16:06.398624 IP6 (hlim 64, next-header TCP (6) payload length: 20) ::1.8080 > ::1.52892: Flags [R.], cksum 0x001c (incorrect -> 0x42ba), seq 0, ack 45055033, win 0, length 0
20:16:06.398969 IP (tos 0x0, ttl 64, id 32886, offset 0, flags [DF], proto TCP (6), length 60)
    127.0.0.1.59050 > 127.0.0.1.8080: Flags [S], cksum 0xfe30 (incorrect -> 0x98f5), seq 2959207057, win 43690, options [mss 65495,sackOK,TS val 2386663 ecr 0,nop,wscale 7], length 0
20:16:06.399011 IP (tos 0x0, ttl 64, id 36322, offset 0, flags [DF], proto TCP (6), length 40)
    127.0.0.1.8080 > 127.0.0.1.59050: Flags [R.], cksum 0x109f (correct), seq 0, ack 2959207058, win 0, length 0
20:16:06.408940 IP6 (hlim 64, next-header TCP (6) payload length: 40) ::1.52896 > ::1.8080: Flags [S], cksum 0x0030 (incorrect -> 0x1983), seq 105392691, win 43690, options [mss 65476,sackOK,TS val 2386672 ecr 0,nop,wscale 7], length 0
20:16:06.408993 IP6 (hlim 64, next-header TCP (6) payload length: 20) ::1.8080 > ::1.52896: Flags [R.], cksum 0x001c (incorrect -> 0x9122), seq 0, ack 105392692, win 0, length 0
20:16:06.409200 IP (tos 0x0, ttl 64, id 39695, offset 0, flags [DF], proto TCP (6), length 60)
    127.0.0.1.59054 > 127.0.0.1.8080: Flags [S], cksum 0xfe30 (incorrect -> 0xf23c), seq 1335882238, win 43690, options [mss 65495,sackOK,TS val 2386673 ecr 0,nop,wscale 7], length 0
20:16:06.409223 IP (tos 0x0, ttl 64, id 36325, offset 0, flags [DF], proto TCP (6), length 40)
    127.0.0.1.8080 > 127.0.0.1.59054: Flags [R.], cksum 0x69f0 (correct), seq 0, ack 1335882239, win 0, length 0
20:16:06.418890 IP6 (hlim 64, next-header TCP (6) payload length: 40) ::1.52900 > ::1.8080: Flags [S], cksum 0x0030 (incorrect -> 0xcacd), seq 2155347625, win 43690, options [mss 65476,sackOK,TS val 2386683 ecr 0,nop,wscale 7], length 0
20:16:06.418915 IP6 (hlim 64, next-header TCP (6) payload length: 20) ::1.8080 > ::1.52900: Flags [R.], cksum 0x001c (incorrect -> 0x4278), seq 0, ack 2155347626, win 0, length 0
20:16:06.419186 IP (tos 0x0, ttl 64, id 28712, offset 0, flags [DF], proto TCP (6), length 60)
    127.0.0.1.59058 > 127.0.0.1.8080: Flags [S], cksum 0xfe30 (incorrect -> 0xc141), seq 1471683283, win 43690, options [mss 65495,sackOK,TS val 2386683 ecr 0,nop,wscale 7], length 0
20:16:06.419210 IP (tos 0x0, ttl 64, id 36334, offset 0, flags [DF], proto TCP (6), length 40)
    127.0.0.1.8080 > 127.0.0.1.59058: Flags [R.], cksum 0x38ff (correct), seq 0, ack 1471683284, win 0, length 0
20:16:06.429250 IP6 (hlim 64, next-header TCP (6) payload length: 40) ::1.52904 > ::1.8080: Flags [S], cksum 0x0030 (incorrect -> 0xa6a6), seq 673610516, win 43690, options [mss 65476,sackOK,TS val 2386693 ecr 0,nop,wscale 7], length 0
20:16:06.429296 IP6 (hlim 64, next-header TCP (6) payload length: 20) ::1.8080 > ::1.52904: Flags [R.], cksum 0x001c (incorrect -> 0x1e5b), seq 0, ack 673610517, win 0, length 0
20:16:06.429502 IP (tos 0x0, ttl 64, id 56244, offset 0, flags [DF], proto TCP (6), length 60)
    127.0.0.1.59062 > 127.0.0.1.8080: Flags [S], cksum 0xfe30 (incorrect -> 0x814c), seq 29470897, win 43690, options [mss 65495,sackOK,TS val 2386693 ecr 0,nop,wscale 7], length 0
20:16:06.429525 IP (tos 0x0, ttl 64, id 36337, offset 0, flags [DF], proto TCP (6), length 40)
    127.0.0.1.8080 > 127.0.0.1.59062: Flags [R.], cksum 0xf913 (correct), seq 0, ack 29470898, win 0, length 0
20:16:06.439159 IP6 (hlim 64, next-header TCP (6) payload length: 40) ::1.52908 > ::1.8080: Flags [S], cksum 0x0030 (incorrect -> 0xc963), seq 2440425209, win 43690, options [mss 65476,sackOK,TS val 2386703 ecr 0,nop,wscale 7], length 0
20:16:06.439177 IP6 (hlim 64, next-header TCP (6) payload length: 20) ::1.8080 > ::1.52908: Flags [R.], cksum 0x001c (incorrect -> 0x4122), seq 0, ack 2440425210, win 0, length 0
20:16:06.439396 IP (tos 0x0, ttl 64, id 654, offset 0, flags [DF], proto TCP (6), length 60)
    127.0.0.1.59066 > 127.0.0.1.8080: Flags [S], cksum 0xfe30 (incorrect -> 0xb8fc), seq 288582017, win 43690, options [mss 65495,sackOK,TS val 2386703 ecr 0,nop,wscale 7], length 0
20:16:06.439413 IP (tos 0x0, ttl 64, id 36341, offset 0, flags [DF], proto TCP (6), length 40)
    127.0.0.1.8080 > 127.0.0.1.59066: Flags [R.], cksum 0x30ce (correct), seq 0, ack 288582018, win 0, length 0
20:16:06.448150 IP6 (hlim 64, next-header TCP (6) payload length: 40) ::1.52912 > ::1.8080: Flags [S], cksum 0x0030 (incorrect -> 0x16d3), seq 1154805278, win 43690, options [mss 65476,sackOK,TS val 2386712 ecr 0,nop,wscale 7], length 0
20:16:06.448165 IP6 (hlim 64, next-header TCP (6) payload length: 20) ::1.8080 > ::1.52912: Flags [R.], cksum 0x001c (incorrect -> 0x8e9a), seq 0, ack 1154805279, win 0, length 0
20:16:06.448324 IP (tos 0x0, ttl 64, id 61360, offset 0, flags [DF], proto TCP (6), length 60)
    127.0.0.1.59070 > 127.0.0.1.8080: Flags [S], cksum 0xfe30 (incorrect -> 0xa4d5), seq 170296488, win 43690, options [mss 65495,sackOK,TS val 2386712 ecr 0,nop,wscale 7], length 0
20:16:06.448339 IP (tos 0x0, ttl 64, id 36347, offset 0, flags [DF], proto TCP (6), length 40)
    127.0.0.1.8080 > 127.0.0.1.59070: Flags [R.], cksum 0x1cb0 (correct), seq 0, ack 170296489, win 0, length 0
20:16:06.458014 IP6 (hlim 64, next-header TCP (6) payload length: 40) ::1.52916 > ::1.8080: Flags [S], cksum 0x0030 (incorrect -> 0x22c5), seq 978447521, win 43690, options [mss 65476,sackOK,TS val 2386722 ecr 0,nop,wscale 7], length 0
20:16:06.458036 IP6 (hlim 64, next-header TCP (6) payload length: 20) ::1.8080 > ::1.52916: Flags [R.], cksum 0x001c (incorrect -> 0x9a96), seq 0, ack 978447522, win 0, length 0
20:16:06.458240 IP (tos 0x0, ttl 64, id 24669, offset 0, flags [DF], proto TCP (6), length 60)
    127.0.0.1.59074 > 127.0.0.1.8080: Flags [S], cksum 0xfe30 (incorrect -> 0xfd69), seq 715983743, win 43690, options [mss 65495,sackOK,TS val 2386722 ecr 0,nop,wscale 7], length 0
20:16:06.458266 IP (tos 0x0, ttl 64, id 36352, offset 0, flags [DF], proto TCP (6), length 40)
    127.0.0.1.8080 > 127.0.0.1.59074: Flags [R.], cksum 0x754e (correct), seq 0, ack 715983744, win 0, length 0
20:16:06.468998 IP6 (hlim 64, next-header TCP (6) payload length: 40) ::1.52920 > ::1.8080: Flags [S], cksum 0x0030 (incorrect -> 0xb29b), seq 2882530109, win 43690, options [mss 65476,sackOK,TS val 2386733 ecr 0,nop,wscale 7], length 0
20:16:06.469016 IP6 (hlim 64, next-header TCP (6) payload length: 20) ::1.8080 > ::1.52920: Flags [R.], cksum 0x001c (incorrect -> 0x2a78), seq 0, ack 2882530110, win 0, length 0
20:16:06.469217 IP (tos 0x0, ttl 64, id 3887, offset 0, flags [DF], proto TCP (6), length 60)
    127.0.0.1.59078 > 127.0.0.1.8080: Flags [S], cksum 0xfe30 (incorrect -> 0xc1fb), seq 227107842, win 43690, options [mss 65495,sackOK,TS val 2386733 ecr 0,nop,wscale 7], length 0
20:16:06.469234 IP (tos 0x0, ttl 64, id 36363, offset 0, flags [DF], proto TCP (6), length 40)
    127.0.0.1.8080 > 127.0.0.1.59078: Flags [R.], cksum 0x39eb (correct), seq 0, ack 227107843, win 0, length 0
20:16:06.482667 IP6 (hlim 64, next-header TCP (6) payload length: 40) ::1.52924 > ::1.8080: Flags [S], cksum 0x0030 (incorrect -> 0x0df3), seq 130823129, win 43690, options [mss 65476,sackOK,TS val 2386746 ecr 0,nop,wscale 7], length 0
20:16:06.482693 IP6 (hlim 64, next-header TCP (6) payload length: 20) ::1.8080 > ::1.52924: Flags [R.], cksum 0x001c (incorrect -> 0x85dc), seq 0, ack 130823130, win 0, length 0
20:16:06.482909 IP (tos 0x0, ttl 64, id 51344, offset 0, flags [DF], proto TCP (6), length 60)
    127.0.0.1.59082 > 127.0.0.1.8080: Flags [S], cksum 0xfe30 (incorrect -> 0xfd7c), seq 2454496171, win 43690, options [mss 65495,sackOK,TS val 2386747 ecr 0,nop,wscale 7], length 0
20:16:06.482935 IP (tos 0x0, ttl 64, id 36373, offset 0, flags [DF], proto TCP (6), length 40)
    127.0.0.1.8080 > 127.0.0.1.59082: Flags [R.], cksum 0x757a (correct), seq 0, ack 2454496172, win 0, length 0
20:16:06.492686 IP6 (hlim 64, next-header TCP (6) payload length: 40) ::1.52928 > ::1.8080: Flags [S], cksum 0x0030 (incorrect -> 0x9327), seq 1279355425, win 43690, options [mss 65476,sackOK,TS val 2386756 ecr 0,nop,wscale 7], length 0
20:16:06.492707 IP6 (hlim 64, next-header TCP (6) payload length: 20) ::1.8080 > ::1.52928: Flags [R.], cksum 0x001c (incorrect -> 0x0b1b), seq 0, ack 1279355426, win 0, length 0
20:16:06.492948 IP (tos 0x0, ttl 64, id 17817, offset 0, flags [DF], proto TCP (6), length 60)
    127.0.0.1.59086 > 127.0.0.1.8080: Flags [S], cksum 0xfe30 (incorrect -> 0x190b), seq 3950980828, win 43690, options [mss 65495,sackOK,TS val 2386757 ecr 0,nop,wscale 7], length 0
20:16:06.492966 IP (tos 0x0, ttl 64, id 36376, offset 0, flags [DF], proto TCP (6), length 40)
    127.0.0.1.8080 > 127.0.0.1.59086: Flags [R.], cksum 0x9112 (correct), seq 0, ack 3950980829, win 0, length 0
20:16:06.503271 IP6 (hlim 64, next-header TCP (6) payload length: 40) ::1.52932 > ::1.8080: Flags [S], cksum 0x0030 (incorrect -> 0xc167), seq 2123041160, win 43690, options [mss 65476,sackOK,TS val 2386767 ecr 0,nop,wscale 7], length 0
20:16:06.503293 IP6 (hlim 64, next-header TCP (6) payload length: 20) ::1.8080 > ::1.52932: Flags [R.], cksum 0x001c (incorrect -> 0x3966), seq 0, ack 2123041161, win 0, length 0
20:16:06.503500 IP (tos 0x0, ttl 64, id 25453, offset 0, flags [DF], proto TCP (6), length 60)
    127.0.0.1.59090 > 127.0.0.1.8080: Flags [S], cksum 0xfe30 (incorrect -> 0x84b9), seq 2793211938, win 43690, options [mss 65495,sackOK,TS val 2386767 ecr 0,nop,wscale 7], length 0
20:16:06.503518 IP (tos 0x0, ttl 64, id 36384, offset 0, flags [DF], proto TCP (6), length 40)
    127.0.0.1.8080 > 127.0.0.1.59090: Flags [R.], cksum 0xfcca (correct), seq 0, ack 2793211939, win 0, length 0
20:16:06.516768 IP6 (hlim 64, next-header TCP (6) payload length: 40) ::1.52936 > ::1.8080: Flags [S], cksum 0x0030 (incorrect -> 0x3387), seq 186452678, win 43690, options [mss 65476,sackOK,TS val 2386780 ecr 0,nop,wscale 7], length 0
20:16:06.516785 IP6 (hlim 64, next-header TCP (6) payload length: 20) ::1.8080 > ::1.52936: Flags [R.], cksum 0x001c (incorrect -> 0xab92), seq 0, ack 186452679, win 0, length 0
20:16:06.517068 IP (tos 0x0, ttl 64, id 10606, offset 0, flags [DF], proto TCP (6), length 60)
    127.0.0.1.59094 > 127.0.0.1.8080: Flags [S], cksum 0xfe30 (incorrect -> 0xe550), seq 197345843, win 43690, options [mss 65495,sackOK,TS val 2386781 ecr 0,nop,wscale 7], length 0
20:16:06.517089 IP (tos 0x0, ttl 64, id 36386, offset 0, flags [DF], proto TCP (6), length 40)
    127.0.0.1.8080 > 127.0.0.1.59094: Flags [R.], cksum 0x5d70 (correct), seq 0, ack 197345844, win 0, length 0
20:16:06.527916 IP6 (hlim 64, next-header TCP (6) payload length: 40) ::1.52940 > ::1.8080: Flags [S], cksum 0x0030 (incorrect -> 0x8a54), seq 3572099611, win 43690, options [mss 65476,sackOK,TS val 2386792 ecr 0,nop,wscale 7], length 0
20:16:06.527932 IP6 (hlim 64, next-header TCP (6) payload length: 20) ::1.8080 > ::1.52940: Flags [R.], cksum 0x001c (incorrect -> 0x026c), seq 0, ack 3572099612, win 0, length 0
20:16:06.528094 IP (tos 0x0, ttl 64, id 39907, offset 0, flags [DF], proto TCP (6), length 60)
    127.0.0.1.59098 > 127.0.0.1.8080: Flags [S], cksum 0xfe30 (incorrect -> 0x8697), seq 3155488907, win 43690, options [mss 65495,sackOK,TS val 2386792 ecr 0,nop,wscale 7], length 0
20:16:06.528108 IP (tos 0x0, ttl 64, id 36390, offset 0, flags [DF], proto TCP (6), length 40)
    127.0.0.1.8080 > 127.0.0.1.59098: Flags [R.], cksum 0xfec1 (correct), seq 0, ack 3155488908, win 0, length 0
20:16:06.536664 IP6 (hlim 64, next-header TCP (6) payload length: 40) ::1.52944 > ::1.8080: Flags [S], cksum 0x0030 (incorrect -> 0xb520), seq 3597647293, win 43690, options [mss 65476,sackOK,TS val 2386800 ecr 0,nop,wscale 7], length 0
20:16:06.536677 IP6 (hlim 64, next-header TCP (6) payload length: 20) ::1.8080 > ::1.52944: Flags [R.], cksum 0x001c (incorrect -> 0x2d40), seq 0, ack 3597647294, win 0, length 0
20:16:06.536870 IP (tos 0x0, ttl 64, id 35669, offset 0, flags [DF], proto TCP (6), length 60)
    127.0.0.1.59102 > 127.0.0.1.8080: Flags [S], cksum 0xfe30 (incorrect -> 0xaaee), seq 2820136997, win 43690, options [mss 65495,sackOK,TS val 2386800 ecr 0,nop,wscale 7], length 0
20:16:06.536885 IP (tos 0x0, ttl 64, id 36391, offset 0, flags [DF], proto TCP (6), length 40)
    127.0.0.1.8080 > 127.0.0.1.59102: Flags [R.], cksum 0x2321 (correct), seq 0, ack 2820136998, win 0, length 0
20:16:06.550265 IP6 (hlim 64, next-header TCP (6) payload length: 40) ::1.52948 > ::1.8080: Flags [S], cksum 0x0030 (incorrect -> 0x9794), seq 172795739, win 43690, options [mss 65476,sackOK,TS val 2386814 ecr 0,nop,wscale 7], length 0
20:16:06.550281 IP6 (hlim 64, next-header TCP (6) payload length: 20) ::1.8080 > ::1.52948: Flags [R.], cksum 0x001c (incorrect -> 0x0fc2), seq 0, ack 172795740, win 0, length 0
20:16:06.550448 IP (tos 0x0, ttl 64, id 65088, offset 0, flags [DF], proto TCP (6), length 60)
    127.0.0.1.59106 > 127.0.0.1.8080: Flags [S], cksum 0xfe30 (incorrect -> 0x13dd), seq 2315162942, win 43690, options [mss 65495,sackOK,TS val 2386814 ecr 0,nop,wscale 7], length 0
20:16:06.550463 IP (tos 0x0, ttl 64, id 36395, offset 0, flags [DF], proto TCP (6), length 40)
    127.0.0.1.8080 > 127.0.0.1.59106: Flags [R.], cksum 0x8c1d (correct), seq 0, ack 2315162943, win 0, length 0
20:16:06.559316 IP6 (hlim 64, next-header TCP (6) payload length: 40) ::1.52952 > ::1.8080: Flags [S], cksum 0x0030 (incorrect -> 0x68c4), seq 2355975165, win 43690, options [mss 65476,sackOK,TS val 2386823 ecr 0,nop,wscale 7], length 0
20:16:06.559339 IP6 (hlim 64, next-header TCP (6) payload length: 20) ::1.8080 > ::1.52952: Flags [R.], cksum 0x001c (incorrect -> 0xe0fa), seq 0, ack 2355975166, win 0, length 0
20:16:06.559523 IP (tos 0x0, ttl 64, id 10046, offset 0, flags [DF], proto TCP (6), length 60)
    127.0.0.1.59110 > 127.0.0.1.8080: Flags [S], cksum 0xfe30 (incorrect -> 0x1b2c), seq 3408350393, win 43690, options [mss 65495,sackOK,TS val 2386823 ecr 0,nop,wscale 7], length 0
20:16:06.559543 IP (tos 0x0, ttl 64, id 36402, offset 0, flags [DF], proto TCP (6), length 40)
    127.0.0.1.8080 > 127.0.0.1.59110: Flags [R.], cksum 0x9375 (correct), seq 0, ack 3408350394, win 0, length 0
20:16:06.569368 IP6 (hlim 64, next-header TCP (6) payload length: 40) ::1.52956 > ::1.8080: Flags [S], cksum 0x0030 (incorrect -> 0xb1aa), seq 789276779, win 43690, options [mss 65476,sackOK,TS val 2386833 ecr 0,nop,wscale 7], length 0
20:16:06.569389 IP6 (hlim 64, next-header TCP (6) payload length: 20) ::1.8080 > ::1.52956: Flags [R.], cksum 0x001c (incorrect -> 0x29eb), seq 0, ack 789276780, win 0, length 0
20:16:06.569593 IP (tos 0x0, ttl 64, id 29140, offset 0, flags [DF], proto TCP (6), length 60)
    127.0.0.1.59114 > 127.0.0.1.8080: Flags [S], cksum 0xfe30 (incorrect -> 0xa3e1), seq 1960319557, win 43690, options [mss 65495,sackOK,TS val 2386833 ecr 0,nop,wscale 7], length 0
20:16:06.569608 IP (tos 0x0, ttl 64, id 36405, offset 0, flags [DF], proto TCP (6), length 40)
    127.0.0.1.8080 > 127.0.0.1.59114: Flags [R.], cksum 0x1c35 (correct), seq 0, ack 1960319558, win 0, length 0
20:16:06.579618 IP6 (hlim 64, next-header TCP (6) payload length: 40) ::1.52960 > ::1.8080: Flags [S], cksum 0x0030 (incorrect -> 0x6e26), seq 2466531304, win 43690, options [mss 65476,sackOK,TS val 2386843 ecr 0,nop,wscale 7], length 0
20:16:06.579637 IP6 (hlim 64, next-header TCP (6) payload length: 20) ::1.8080 > ::1.52960: Flags [R.], cksum 0x001c (incorrect -> 0xe670), seq 0, ack 2466531305, win 0, length 0
20:16:06.579858 IP (tos 0x0, ttl 64, id 33530, offset 0, flags [DF], proto TCP (6), length 60)
    127.0.0.1.59118 > 127.0.0.1.8080: Flags [S], cksum 0xfe30 (incorrect -> 0x4ed7), seq 4206356833, win 43690, options [mss 65495,sackOK,TS val 2386843 ecr 0,nop,wscale 7], length 0
20:16:06.579876 IP (tos 0x0, ttl 64, id 36410, offset 0, flags [DF], proto TCP (6), length 40)
    127.0.0.1.8080 > 127.0.0.1.59118: Flags [R.], cksum 0xc734 (correct), seq 0, ack 4206356834, win 0, length 0
20:16:06.593267 IP6 (hlim 64, next-header TCP (6) payload length: 40) ::1.52964 > ::1.8080: Flags [S], cksum 0x0030 (incorrect -> 0x5155), seq 1978368448, win 43690, options [mss 65476,sackOK,TS val 2386857 ecr 0,nop,wscale 7], length 0
20:16:06.593285 IP6 (hlim 64, next-header TCP (6) payload length: 20) ::1.8080 > ::1.52964: Flags [R.], cksum 0x001c (incorrect -> 0xc9ad), seq 0, ack 1978368449, win 0, length 0
20:16:06.593495 IP (tos 0x0, ttl 64, id 2256, offset 0, flags [DF], proto TCP (6), length 60)
    127.0.0.1.59122 > 127.0.0.1.8080: Flags [S], cksum 0xfe30 (incorrect -> 0x9e2b), seq 825910137, win 43690, options [mss 65495,sackOK,TS val 2386857 ecr 0,nop,wscale 7], length 0
20:16:06.593515 IP (tos 0x0, ttl 64, id 36422, offset 0, flags [DF], proto TCP (6), length 40)
    127.0.0.1.8080 > 127.0.0.1.59122: Flags [R.], cksum 0x1697 (correct), seq 0, ack 825910138, win 0, length 0
20:16:06.604634 IP6 (hlim 64, next-header TCP (6) payload length: 40) ::1.52968 > ::1.8080: Flags [S], cksum 0x0030 (incorrect -> 0x2b75), seq 1323290269, win 43690, options [mss 65476,sackOK,TS val 2386868 ecr 0,nop,wscale 7], length 0
20:16:06.604690 IP6 (hlim 64, next-header TCP (6) payload length: 20) ::1.8080 > ::1.52968: Flags [R.], cksum 0x001c (incorrect -> 0xa3d8), seq 0, ack 1323290270, win 0, length 0
20:16:06.604923 IP (tos 0x0, ttl 64, id 53005, offset 0, flags [DF], proto TCP (6), length 60)
    127.0.0.1.59126 > 127.0.0.1.8080: Flags [S], cksum 0xfe30 (incorrect -> 0xa5bf), seq 3897992376, win 43690, options [mss 65495,sackOK,TS val 2386869 ecr 0,nop,wscale 7], length 0
20:16:06.604942 IP (tos 0x0, ttl 64, id 36428, offset 0, flags [DF], proto TCP (6), length 40)
    127.0.0.1.8080 > 127.0.0.1.59126: Flags [R.], cksum 0x1e37 (correct), seq 0, ack 3897992377, win 0, length 0
20:16:06.613964 IP6 (hlim 64, next-header TCP (6) payload length: 40) ::1.52972 > ::1.8080: Flags [S], cksum 0x0030 (incorrect -> 0xace9), seq 718237995, win 43690, options [mss 65476,sackOK,TS val 2386878 ecr 0,nop,wscale 7], length 0
20:16:06.613986 IP6 (hlim 64, next-header TCP (6) payload length: 20) ::1.8080 > ::1.52972: Flags [R.], cksum 0x001c (incorrect -> 0x2557), seq 0, ack 718237996, win 0, length 0
20:16:06.614162 IP (tos 0x0, ttl 64, id 47125, offset 0, flags [DF], proto TCP (6), length 60)
    127.0.0.1.59130 > 127.0.0.1.8080: Flags [S], cksum 0xfe30 (incorrect -> 0x9a2f), seq 3303461803, win 43690, options [mss 65495,sackOK,TS val 2386878 ecr 0,nop,wscale 7], length 0
20:16:06.614183 IP (tos 0x0, ttl 64, id 36435, offset 0, flags [DF], proto TCP (6), length 40)
    127.0.0.1.8080 > 127.0.0.1.59130: Flags [R.], cksum 0x12b0 (correct), seq 0, ack 3303461804, win 0, length 0
20:16:06.627261 IP6 (hlim 64, next-header TCP (6) payload length: 40) ::1.52976 > ::1.8080: Flags [S], cksum 0x0030 (incorrect -> 0x6003), seq 973385419, win 43690, options [mss 65476,sackOK,TS val 2386891 ecr 0,nop,wscale 7], length 0
20:16:06.627285 IP6 (hlim 64, next-header TCP (6) payload length: 20) ::1.8080 > ::1.52976: Flags [R.], cksum 0x001c (incorrect -> 0xd87d), seq 0, ack 973385420, win 0, length 0
20:16:06.627557 IP (tos 0x0, ttl 64, id 3916, offset 0, flags [DF], proto TCP (6), length 60)
    127.0.0.1.59134 > 127.0.0.1.8080: Flags [S], cksum 0xfe30 (incorrect -> 0xc27c), seq 195912839, win 43690, options [mss 65495,sackOK,TS val 2386891 ecr 0,nop,wscale 7], length 0
20:16:06.627582 IP (tos 0x0, ttl 64, id 36437, offset 0, flags [DF], proto TCP (6), length 40)
    127.0.0.1.8080 > 127.0.0.1.59134: Flags [R.], cksum 0x3b0a (correct), seq 0, ack 195912840, win 0, length 0
20:16:06.641650 IP6 (hlim 64, next-header TCP (6) payload length: 40) ::1.52980 > ::1.8080: Flags [S], cksum 0x0030 (incorrect -> 0xa7f6), seq 3644508047, win 43690, options [mss 65476,sackOK,TS val 2386905 ecr 0,nop,wscale 7], length 0
20:16:06.641698 IP6 (hlim 64, next-header TCP (6) payload length: 20) ::1.8080 > ::1.52980: Flags [R.], cksum 0x001c (incorrect -> 0x207f), seq 0, ack 3644508048, win 0, length 0
20:16:06.641924 IP (tos 0x0, ttl 64, id 43085, offset 0, flags [DF], proto TCP (6), length 60)
    127.0.0.1.59138 > 127.0.0.1.8080: Flags [S], cksum 0xfe30 (incorrect -> 0x15e4), seq 1495450519, win 43690, options [mss 65495,sackOK,TS val 2386906 ecr 0,nop,wscale 7], length 0
20:16:06.641943 IP (tos 0x0, ttl 64, id 36439, offset 0, flags [DF], proto TCP (6), length 40)
    127.0.0.1.8080 > 127.0.0.1.59138: Flags [R.], cksum 0x8e80 (correct), seq 0, ack 1495450520, win 0, length 0
20:16:06.652368 IP6 (hlim 64, next-header TCP (6) payload length: 40) ::1.52984 > ::1.8080: Flags [S], cksum 0x0030 (incorrect -> 0x1d32), seq 4292291496, win 43690, options [mss 65476,sackOK,TS val 2386916 ecr 0,nop,wscale 7], length 0
20:16:06.652385 IP6 (hlim 64, next-header TCP (6) payload length: 20) ::1.8080 > ::1.52984: Flags [R.], cksum 0x001c (incorrect -> 0x95c5), seq 0, ack 4292291497, win 0, length 0
20:16:06.652580 IP (tos 0x0, ttl 64, id 5552, offset 0, flags [DF], proto TCP (6), length 60)
    127.0.0.1.59142 > 127.0.0.1.8080: Flags [S], cksum 0xfe30 (incorrect -> 0xd757), seq 3705896532, win 43690, options [mss 65495,sackOK,TS val 2386916 ecr 0,nop,wscale 7], length 0
20:16:06.652596 IP (tos 0x0, ttl 64, id 36448, offset 0, flags [DF], proto TCP (6), length 40)
    127.0.0.1.8080 > 127.0.0.1.59142: Flags [R.], cksum 0x4ffe (correct), seq 0, ack 3705896533, win 0, length 0
20:16:06.667694 IP6 (hlim 64, next-header TCP (6) payload length: 40) ::1.52988 > ::1.8080: Flags [S], cksum 0x0030 (incorrect -> 0xe0f4), seq 3073486968, win 43690, options [mss 65476,sackOK,TS val 2386931 ecr 0,nop,wscale 7], length 0
20:16:06.667723 IP6 (hlim 64, next-header TCP (6) payload length: 20) ::1.8080 > ::1.52988: Flags [R.], cksum 0x001c (incorrect -> 0x5997), seq 0, ack 3073486969, win 0, length 0
20:16:06.667976 IP (tos 0x0, ttl 64, id 8081, offset 0, flags [DF], proto TCP (6), length 60)
    127.0.0.1.59146 > 127.0.0.1.8080: Flags [S], cksum 0xfe30 (incorrect -> 0x8318), seq 989754469, win 43690, options [mss 65495,sackOK,TS val 2386932 ecr 0,nop,wscale 7], length 0
20:16:06.667989 IP (tos 0x0, ttl 64, id 36460, offset 0, flags [DF], proto TCP (6), length 40)
    127.0.0.1.8080 > 127.0.0.1.59146: Flags [R.], cksum 0xfbce (correct), seq 0, ack 989754470, win 0, length 0
20:16:06.676946 IP6 (hlim 64, next-header TCP (6) payload length: 40) ::1.52992 > ::1.8080: Flags [S], cksum 0x0030 (incorrect -> 0xfb8e), seq 2811340144, win 43690, options [mss 65476,sackOK,TS val 2386941 ecr 0,nop,wscale 7], length 0
20:16:06.676960 IP6 (hlim 64, next-header TCP (6) payload length: 20) ::1.8080 > ::1.52992: Flags [R.], cksum 0x001c (incorrect -> 0x743b), seq 0, ack 2811340145, win 0, length 0
20:16:06.677123 IP (tos 0x0, ttl 64, id 23248, offset 0, flags [DF], proto TCP (6), length 60)
    127.0.0.1.59150 > 127.0.0.1.8080: Flags [S], cksum 0xfe30 (incorrect -> 0x2a62), seq 3604951341, win 43690, options [mss 65495,sackOK,TS val 2386941 ecr 0,nop,wscale 7], length 0
20:16:06.677138 IP (tos 0x0, ttl 64, id 36465, offset 0, flags [DF], proto TCP (6), length 40)
    127.0.0.1.8080 > 127.0.0.1.59150: Flags [R.], cksum 0xa321 (correct), seq 0, ack 3604951342, win 0, length 0
20:16:06.685716 IP6 (hlim 64, next-header TCP (6) payload length: 40) ::1.52996 > ::1.8080: Flags [S], cksum 0x0030 (incorrect -> 0x65de), seq 3080137487, win 43690, options [mss 65476,sackOK,TS val 2386949 ecr 0,nop,wscale 7], length 0
20:16:06.685731 IP6 (hlim 64, next-header TCP (6) payload length: 20) ::1.8080 > ::1.52996: Flags [R.], cksum 0x001c (incorrect -> 0xde92), seq 0, ack 3080137488, win 0, length 0
20:16:06.685939 IP (tos 0x0, ttl 64, id 13696, offset 0, flags [DF], proto TCP (6), length 60)
    127.0.0.1.59154 > 127.0.0.1.8080: Flags [S], cksum 0xfe30 (incorrect -> 0x2f13), seq 2848479622, win 43690, options [mss 65495,sackOK,TS val 2386950 ecr 0,nop,wscale 7], length 0
20:16:06.685954 IP (tos 0x0, ttl 64, id 36472, offset 0, flags [DF], proto TCP (6), length 40)
    127.0.0.1.8080 > 127.0.0.1.59154: Flags [R.], cksum 0xa7db (correct), seq 0, ack 2848479623, win 0, length 0
20:16:06.695688 IP6 (hlim 64, next-header TCP (6) payload length: 40) ::1.53000 > ::1.8080: Flags [S], cksum 0x0030 (incorrect -> 0xe19c), seq 479087180, win 43690, options [mss 65476,sackOK,TS val 2386959 ecr 0,nop,wscale 7], length 0
20:16:06.695737 IP6 (hlim 64, next-header TCP (6) payload length: 20) ::1.8080 > ::1.53000: Flags [R.], cksum 0x001c (incorrect -> 0x5a5b), seq 0, ack 479087181, win 0, length 0
20:16:06.695977 IP (tos 0x0, ttl 64, id 47953, offset 0, flags [DF], proto TCP (6), length 60)
    127.0.0.1.59158 > 127.0.0.1.8080: Flags [S], cksum 0xfe30 (incorrect -> 0xf887), seq 1653266241, win 43690, options [mss 65495,sackOK,TS val 2386960 ecr 0,nop,wscale 7], length 0
20:16:06.695995 IP (tos 0x0, ttl 64, id 36482, offset 0, flags [DF], proto TCP (6), length 40)
    127.0.0.1.8080 > 127.0.0.1.59158: Flags [R.], cksum 0x715a (correct), seq 0, ack 1653266242, win 0, length 0
20:16:06.708827 IP6 (hlim 64, next-header TCP (6) payload length: 40) ::1.53004 > ::1.8080: Flags [S], cksum 0x0030 (incorrect -> 0x93a5), seq 2330143197, win 43690, options [mss 65476,sackOK,TS val 2386972 ecr 0,nop,wscale 7], length 0
20:16:06.708860 IP6 (hlim 64, next-header TCP (6) payload length: 20) ::1.8080 > ::1.53004: Flags [R.], cksum 0x001c (incorrect -> 0x0c71), seq 0, ack 2330143198, win 0, length 0
20:16:06.709037 IP (tos 0x0, ttl 64, id 63513, offset 0, flags [DF], proto TCP (6), length 60)
    127.0.0.1.59162 > 127.0.0.1.8080: Flags [S], cksum 0xfe30 (incorrect -> 0xcae0), seq 3546125316, win 43690, options [mss 65495,sackOK,TS val 2386973 ecr 0,nop,wscale 7], length 0
20:16:06.709051 IP (tos 0x0, ttl 64, id 36494, offset 0, flags [DF], proto TCP (6), length 40)
    127.0.0.1.8080 > 127.0.0.1.59162: Flags [R.], cksum 0x43c0 (correct), seq 0, ack 3546125317, win 0, length 0
20:16:06.717897 IP6 (hlim 64, next-header TCP (6) payload length: 40) ::1.53008 > ::1.8080: Flags [S], cksum 0x0030 (incorrect -> 0x6b8d), seq 48421352, win 43690, options [mss 65476,sackOK,TS val 2386982 ecr 0,nop,wscale 7], length 0
20:16:06.717913 IP6 (hlim 64, next-header TCP (6) payload length: 20) ::1.8080 > ::1.53008: Flags [R.], cksum 0x001c (incorrect -> 0xe462), seq 0, ack 48421353, win 0, length 0
20:16:06.718079 IP (tos 0x0, ttl 64, id 32758, offset 0, flags [DF], proto TCP (6), length 60)
    127.0.0.1.59166 > 127.0.0.1.8080: Flags [S], cksum 0xfe30 (incorrect -> 0x7da3), seq 2697073616, win 43690, options [mss 65495,sackOK,TS val 2386982 ecr 0,nop,wscale 7], length 0
20:16:06.718093 IP (tos 0x0, ttl 64, id 36497, offset 0, flags [DF], proto TCP (6), length 40)
    127.0.0.1.8080 > 127.0.0.1.59166: Flags [R.], cksum 0xf68b (correct), seq 0, ack 2697073617, win 0, length 0
20:16:06.727914 IP6 (hlim 64, next-header TCP (6) payload length: 40) ::1.53012 > ::1.8080: Flags [S], cksum 0x0030 (incorrect -> 0x69e5), seq 2957258272, win 43690, options [mss 65476,sackOK,TS val 2386992 ecr 0,nop,wscale 7], length 0
20:16:06.727932 IP6 (hlim 64, next-header TCP (6) payload length: 20) ::1.8080 > ::1.53012: Flags [R.], cksum 0x001c (incorrect -> 0xe2c4), seq 0, ack 2957258273, win 0, length 0
20:16:06.728141 IP (tos 0x0, ttl 64, id 50066, offset 0, flags [DF], proto TCP (6), length 60)
    127.0.0.1.59170 > 127.0.0.1.8080: Flags [S], cksum 0xfe30 (incorrect -> 0x8c8c), seq 4126715810, win 43690, options [mss 65495,sackOK,TS val 2386992 ecr 0,nop,wscale 7], length 0
20:16:06.728156 IP (tos 0x0, ttl 64, id 36505, offset 0, flags [DF], proto TCP (6), length 40)
    127.0.0.1.8080 > 127.0.0.1.59170: Flags [R.], cksum 0x057f (correct), seq 0, ack 4126715811, win 0, length 0
20:16:06.737991 IP6 (hlim 64, next-header TCP (6) payload length: 40) ::1.53016 > ::1.8080: Flags [S], cksum 0x0030 (incorrect -> 0x586d), seq 3174904465, win 43690, options [mss 65476,sackOK,TS val 2387002 ecr 0,nop,wscale 7], length 0
20:16:06.738038 IP6 (hlim 64, next-header TCP (6) payload length: 20) ::1.8080 > ::1.53016: Flags [R.], cksum 0x001c (incorrect -> 0xd156), seq 0, ack 3174904466, win 0, length 0
20:16:06.738248 IP (tos 0x0, ttl 64, id 31777, offset 0, flags [DF], proto TCP (6), length 60)
    127.0.0.1.59174 > 127.0.0.1.8080: Flags [S], cksum 0xfe30 (incorrect -> 0x5026), seq 3520598043, win 43690, options [mss 65495,sackOK,TS val 2387002 ecr 0,nop,wscale 7], length 0
20:16:06.738264 IP (tos 0x0, ttl 64, id 36513, offset 0, flags [DF], proto TCP (6), length 40)
    127.0.0.1.8080 > 127.0.0.1.59174: Flags [R.], cksum 0xc922 (correct), seq 0, ack 3520598044, win 0, length 0
20:16:06.751047 IP6 (hlim 64, next-header TCP (6) payload length: 40) ::1.53020 > ::1.8080: Flags [S], cksum 0x0030 (incorrect -> 0xb709), seq 193496473, win 43690, options [mss 65476,sackOK,TS val 2387015 ecr 0,nop,wscale 7], length 0
20:16:06.751081 IP6 (hlim 64, next-header TCP (6) payload length: 20) ::1.8080 > ::1.53020: Flags [R.], cksum 0x001c (incorrect -> 0x3000), seq 0, ack 193496474, win 0, length 0
20:16:06.751293 IP (tos 0x0, ttl 64, id 9067, offset 0, flags [DF], proto TCP (6), length 60)
    127.0.0.1.59178 > 127.0.0.1.8080: Flags [S], cksum 0xfe30 (incorrect -> 0x59ef), seq 2297253676, win 43690, options [mss 65495,sackOK,TS val 2387015 ecr 0,nop,wscale 7], length 0
20:16:06.751312 IP (tos 0x0, ttl 64, id 36526, offset 0, flags [DF], proto TCP (6), length 40)
    127.0.0.1.8080 > 127.0.0.1.59178: Flags [R.], cksum 0xd2f8 (correct), seq 0, ack 2297253677, win 0, length 0
20:16:06.764424 IP6 (hlim 64, next-header TCP (6) payload length: 40) ::1.53024 > ::1.8080: Flags [S], cksum 0x0030 (incorrect -> 0xbd7f), seq 91063597, win 43690, options [mss 65476,sackOK,TS val 2387028 ecr 0,nop,wscale 7], length 0
20:16:06.764445 IP6 (hlim 64, next-header TCP (6) payload length: 20) ::1.8080 > ::1.53024: Flags [R.], cksum 0x001c (incorrect -> 0x3683), seq 0, ack 91063598, win 0, length 0
20:16:06.764657 IP (tos 0x0, ttl 64, id 60622, offset 0, flags [DF], proto TCP (6), length 60)
    127.0.0.1.59182 > 127.0.0.1.8080: Flags [S], cksum 0xfe30 (incorrect -> 0x8966), seq 670531738, win 43690, options [mss 65495,sackOK,TS val 2387028 ecr 0,nop,wscale 7], length 0
20:16:06.764675 IP (tos 0x0, ttl 64, id 36527, offset 0, flags [DF], proto TCP (6), length 40)
    127.0.0.1.8080 > 127.0.0.1.59182: Flags [R.], cksum 0x027d (correct), seq 0, ack 670531739, win 0, length 0
20:16:06.774926 IP6 (hlim 64, next-header TCP (6) payload length: 40) ::1.53028 > ::1.8080: Flags [S], cksum 0x0030 (incorrect -> 0x1f57), seq 2864020990, win 43690, options [mss 65476,sackOK,TS val 2387039 ecr 0,nop,wscale 7], length 0
20:16:06.774954 IP6 (hlim 64, next-header TCP (6) payload length: 20) ::1.8080 > ::1.53028: Flags [R.], cksum 0x001c (incorrect -> 0x9865), seq 0, ack 2864020991, win 0, length 0
20:16:06.775159 IP (tos 0x0, ttl 64, id 31737, offset 0, flags [DF], proto TCP (6), length 60)
    127.0.0.1.59186 > 127.0.0.1.8080: Flags [S], cksum 0xfe30 (incorrect -> 0x54a7), seq 3315275686, win 43690, options [mss 65495,sackOK,TS val 2387039 ecr 0,nop,wscale 7], length 0
20:16:06.775176 IP (tos 0x0, ttl 64, id 36536, offset 0, flags [DF], proto TCP (6), length 40)
    127.0.0.1.8080 > 127.0.0.1.59186: Flags [R.], cksum 0xcdc8 (correct), seq 0, ack 3315275687, win 0, length 0
20:16:06.784715 IP6 (hlim 64, next-header TCP (6) payload length: 40) ::1.53032 > ::1.8080: Flags [S], cksum 0x0030 (incorrect -> 0x501f), seq 4170186574, win 43690, options [mss 65476,sackOK,TS val 2387048 ecr 0,nop,wscale 7], length 0
20:16:06.784726 IP6 (hlim 64, next-header TCP (6) payload length: 20) ::1.8080 > ::1.53032: Flags [R.], cksum 0x001c (incorrect -> 0xc936), seq 0, ack 4170186575, win 0, length 0
20:16:06.784897 IP (tos 0x0, ttl 64, id 53911, offset 0, flags [DF], proto TCP (6), length 60)
    127.0.0.1.59190 > 127.0.0.1.8080: Flags [S], cksum 0xfe30 (incorrect -> 0x0a48), seq 1754578686, win 43690, options [mss 65495,sackOK,TS val 2387049 ecr 0,nop,wscale 7], length 0
20:16:06.784908 IP (tos 0x0, ttl 64, id 36541, offset 0, flags [DF], proto TCP (6), length 40)
    127.0.0.1.8080 > 127.0.0.1.59190: Flags [R.], cksum 0x8373 (correct), seq 0, ack 1754578687, win 0, length 0
20:16:06.797724 IP6 (hlim 64, next-header TCP (6) payload length: 40) ::1.53036 > ::1.8080: Flags [S], cksum 0x0030 (incorrect -> 0x7bb3), seq 326351046, win 43690, options [mss 65476,sackOK,TS val 2387061 ecr 0,nop,wscale 7], length 0
20:16:06.797744 IP6 (hlim 64, next-header TCP (6) payload length: 20) ::1.8080 > ::1.53036: Flags [R.], cksum 0x001c (incorrect -> 0xf4d7), seq 0, ack 326351047, win 0, length 0
20:16:06.797956 IP (tos 0x0, ttl 64, id 19361, offset 0, flags [DF], proto TCP (6), length 60)
    127.0.0.1.59194 > 127.0.0.1.8080: Flags [S], cksum 0xfe30 (incorrect -> 0xd990), seq 811739095, win 43690, options [mss 65495,sackOK,TS val 2387062 ecr 0,nop,wscale 7], length 0
20:16:06.797974 IP (tos 0x0, ttl 64, id 36543, offset 0, flags [DF], proto TCP (6), length 40)
    127.0.0.1.8080 > 127.0.0.1.59194: Flags [R.], cksum 0x52c9 (correct), seq 0, ack 811739096, win 0, length 0
20:16:06.808649 IP6 (hlim 64, next-header TCP (6) payload length: 40) ::1.53040 > ::1.8080: Flags [S], cksum 0x0030 (incorrect -> 0xe854), seq 2837100142, win 43690, options [mss 65476,sackOK,TS val 2387072 ecr 0,nop,wscale 7], length 0
20:16:06.808679 IP6 (hlim 64, next-header TCP (6) payload length: 20) ::1.8080 > ::1.53040: Flags [R.], cksum 0x001c (incorrect -> 0x6184), seq 0, ack 2837100143, win 0, length 0
20:16:06.809021 IP (tos 0x0, ttl 64, id 57096, offset 0, flags [DF], proto TCP (6), length 60)
    127.0.0.1.59198 > 127.0.0.1.8080: Flags [S], cksum 0xfe30 (incorrect -> 0xd4ca), seq 2842080137, win 43690, options [mss 65495,sackOK,TS val 2387073 ecr 0,nop,wscale 7], length 0
20:16:06.809056 IP (tos 0x0, ttl 64, id 36549, offset 0, flags [DF], proto TCP (6), length 40)
    127.0.0.1.8080 > 127.0.0.1.59198: Flags [R.], cksum 0x4e0e (correct), seq 0, ack 2842080138, win 0, length 0
20:16:06.819805 IP6 (hlim 64, next-header TCP (6) payload length: 40) ::1.53044 > ::1.8080: Flags [S], cksum 0x0030 (incorrect -> 0x4eaf), seq 426303415, win 43690, options [mss 65476,sackOK,TS val 2387083 ecr 0,nop,wscale 7], length 0
20:16:06.819821 IP6 (hlim 64, next-header TCP (6) payload length: 20) ::1.8080 > ::1.53044: Flags [R.], cksum 0x001c (incorrect -> 0xc7e9), seq 0, ack 426303416, win 0, length 0
20:16:06.820065 IP (tos 0x0, ttl 64, id 57302, offset 0, flags [DF], proto TCP (6), length 60)
    127.0.0.1.59202 > 127.0.0.1.8080: Flags [S], cksum 0xfe30 (incorrect -> 0x8b70), seq 4074812250, win 43690, options [mss 65495,sackOK,TS val 2387084 ecr 0,nop,wscale 7], length 0
20:16:06.820078 IP (tos 0x0, ttl 64, id 36551, offset 0, flags [DF], proto TCP (6), length 40)
    127.0.0.1.8080 > 127.0.0.1.59202: Flags [R.], cksum 0x04bf (correct), seq 0, ack 4074812251, win 0, length 0
20:16:06.829734 IP6 (hlim 64, next-header TCP (6) payload length: 40) ::1.53048 > ::1.8080: Flags [S], cksum 0x0030 (incorrect -> 0x10db), seq 4029892274, win 43690, options [mss 65476,sackOK,TS val 2387093 ecr 0,nop,wscale 7], length 0
20:16:06.829750 IP6 (hlim 64, next-header TCP (6) payload length: 20) ::1.8080 > ::1.53048: Flags [R.], cksum 0x001c (incorrect -> 0x8a1f), seq 0, ack 4029892275, win 0, length 0
20:16:06.829963 IP (tos 0x0, ttl 64, id 50748, offset 0, flags [DF], proto TCP (6), length 60)
    127.0.0.1.59206 > 127.0.0.1.8080: Flags [S], cksum 0xfe30 (incorrect -> 0x2e8d), seq 1483123370, win 43690, options [mss 65495,sackOK,TS val 2387094 ecr 0,nop,wscale 7], length 0
20:16:06.829977 IP (tos 0x0, ttl 64, id 36557, offset 0, flags [DF], proto TCP (6), length 40)
    127.0.0.1.8080 > 127.0.0.1.59206: Flags [R.], cksum 0xa7e5 (correct), seq 0, ack 1483123371, win 0, length 0
20:16:06.839665 IP6 (hlim 64, next-header TCP (6) payload length: 40) ::1.53052 > ::1.8080: Flags [S], cksum 0x0030 (incorrect -> 0xb13f), seq 1428767050, win 43690, options [mss 65476,sackOK,TS val 2387103 ecr 0,nop,wscale 7], length 0
20:16:06.839684 IP6 (hlim 64, next-header TCP (6) payload length: 20) ::1.8080 > ::1.53052: Flags [R.], cksum 0x001c (incorrect -> 0x2a8e), seq 0, ack 1428767051, win 0, length 0
20:16:06.839875 IP (tos 0x0, ttl 64, id 6133, offset 0, flags [DF], proto TCP (6), length 60)
    127.0.0.1.59210 > 127.0.0.1.8080: Flags [S], cksum 0xfe30 (incorrect -> 0x5abb), seq 1533770602, win 43690, options [mss 65495,sackOK,TS val 2387103 ecr 0,nop,wscale 7], length 0
20:16:06.839894 IP (tos 0x0, ttl 64, id 36560, offset 0, flags [DF], proto TCP (6), length 40)
    127.0.0.1.8080 > 127.0.0.1.59210: Flags [R.], cksum 0xd41c (correct), seq 0, ack 1533770603, win 0, length 0
20:16:06.848316 IP6 (hlim 64, next-header TCP (6) payload length: 40) ::1.53056 > ::1.8080: Flags [S], cksum 0x0030 (incorrect -> 0xd0da), seq 3169434081, win 43690, options [mss 65476,sackOK,TS val 2387112 ecr 0,nop,wscale 7], length 0
20:16:06.848336 IP6 (hlim 64, next-header TCP (6) payload length: 20) ::1.8080 > ::1.53056: Flags [R.], cksum 0x001c (incorrect -> 0x4a32), seq 0, ack 3169434082, win 0, length 0
20:16:06.848505 IP (tos 0x0, ttl 64, id 460, offset 0, flags [DF], proto TCP (6), length 60)
    127.0.0.1.59214 > 127.0.0.1.8080: Flags [S], cksum 0xfe30 (incorrect -> 0x473d), seq 2095213924, win 43690, options [mss 65495,sackOK,TS val 2387112 ecr 0,nop,wscale 7], length 0
20:16:06.848523 IP (tos 0x0, ttl 64, id 36565, offset 0, flags [DF], proto TCP (6), length 40)
    127.0.0.1.8080 > 127.0.0.1.59214: Flags [R.], cksum 0xc0a7 (correct), seq 0, ack 2095213925, win 0, length 0
20:16:06.857512 IP6 (hlim 64, next-header TCP (6) payload length: 40) ::1.53060 > ::1.8080: Flags [S], cksum 0x0030 (incorrect -> 0x80d6), seq 1783454837, win 43690, options [mss 65476,sackOK,TS val 2387121 ecr 0,nop,wscale 7], length 0
20:16:06.857530 IP6 (hlim 64, next-header TCP (6) payload length: 20) ::1.8080 > ::1.53060: Flags [R.], cksum 0x001c (incorrect -> 0xfa36), seq 0, ack 1783454838, win 0, length 0
20:16:06.857693 IP (tos 0x0, ttl 64, id 12159, offset 0, flags [DF], proto TCP (6), length 60)
    127.0.0.1.59218 > 127.0.0.1.8080: Flags [S], cksum 0xfe30 (incorrect -> 0xb2f3), seq 984957902, win 43690, options [mss 65495,sackOK,TS val 2387121 ecr 0,nop,wscale 7], length 0
20:16:06.857710 IP (tos 0x0, ttl 64, id 36568, offset 0, flags [DF], proto TCP (6), length 40)
    127.0.0.1.8080 > 127.0.0.1.59218: Flags [R.], cksum 0x2c67 (correct), seq 0, ack 984957903, win 0, length 0
20:16:06.865953 IP6 (hlim 64, next-header TCP (6) payload length: 40) ::1.53064 > ::1.8080: Flags [S], cksum 0x0030 (incorrect -> 0x6318), seq 3928226383, win 43690, options [mss 65476,sackOK,TS val 2387130 ecr 0,nop,wscale 7], length 0
20:16:06.865971 IP6 (hlim 64, next-header TCP (6) payload length: 20) ::1.8080 > ::1.53064: Flags [R.], cksum 0x001c (incorrect -> 0xdc81), seq 0, ack 3928226384, win 0, length 0
20:16:06.866133 IP (tos 0x0, ttl 64, id 7386, offset 0, flags [DF], proto TCP (6), length 60)
    127.0.0.1.59222 > 127.0.0.1.8080: Flags [S], cksum 0xfe30 (incorrect -> 0x8ed2), seq 842494048, win 43690, options [mss 65495,sackOK,TS val 2387130 ecr 0,nop,wscale 7], length 0
20:16:06.866149 IP (tos 0x0, ttl 64, id 36577, offset 0, flags [DF], proto TCP (6), length 40)
    127.0.0.1.8080 > 127.0.0.1.59222: Flags [R.], cksum 0x084f (correct), seq 0, ack 842494049, win 0, length 0
20:16:06.874418 IP6 (hlim 64, next-header TCP (6) payload length: 40) ::1.53068 > ::1.8080: Flags [S], cksum 0x0030 (incorrect -> 0x20e4), seq 3807855524, win 43690, options [mss 65476,sackOK,TS val 2387138 ecr 0,nop,wscale 7], length 0
