[ec2-user@ip-172-31-21-6 ~]$ cat test.log
05:23:25.406783 IP (tos 0x0, ttl 255, id 39816, offset 0, flags [DF], proto TCP (6), length 60)
    localhost.39574 > localhost.webcache: Flags [S], cksum 0xfe30 (incorrect -> 0xc071), seq 1273905942, win 43690, options [mss 65495,sackOK,TS val 4117341736 ecr 0,nop,wscale 7], length 0
05:23:25.406792 IP (tos 0x0, ttl 255, id 0, offset 0, flags [DF], proto TCP (6), length 40)
    localhost.webcache > localhost.39574: Flags [R.], cksum 0x68a2 (correct), seq 0, ack 1273905943, win 0, length 0
05:24:42.986159 IP (tos 0x0, ttl 255, id 55824, offset 0, flags [DF], proto TCP (6), length 60)
    localhost.39576 > localhost.webcache: Flags [S], cksum 0xfe30 (incorrect -> 0xad1e), seq 1960246896, win 43690, options [mss 65495,sackOK,TS val 4117419317 ecr 0,nop,wscale 7], length 0
05:24:42.986166 IP (tos 0x0, ttl 255, id 0, offset 0, flags [DF], proto TCP (6), length 60)
    localhost.webcache > localhost.39576: Flags [S.], cksum 0xfe30 (incorrect -> 0x8b54), seq 1439629641, ack 1960246897, win 43690, options [mss 65495,sackOK,TS val 4117419317 ecr 4117419317,nop,wscale 7], length 0
05:24:42.986174 IP (tos 0x0, ttl 255, id 55825, offset 0, flags [DF], proto TCP (6), length 52)
    localhost.39576 > localhost.webcache: Flags [.], cksum 0xfe28 (incorrect -> 0x5d99), seq 1, ack 1, win 342, options [nop,nop,TS val 4117419317 ecr 4117419317], length 0
05:24:42.986542 IP (tos 0x0, ttl 255, id 55826, offset 0, flags [DF], proto TCP (6), length 249)
    localhost.39576 > localhost.webcache: Flags [P.], cksum 0xfeed (incorrect -> 0x6b08), seq 1:198, ack 1, win 342, options [nop,nop,TS val 4117419318 ecr 4117419317], length 197: HTTP, length: 197
        POST /books HTTP/1.1
        Host: localhost:8080
        User-Agent: curl/7.61.1
        Accept: */*
        Content-type:application/json
        Content-Length: 62

        {"name":"TestingOfHackathon","author":"Ramesh","price":"9.99"}[!http]
05:24:42.986547 IP (tos 0x0, ttl 255, id 9514, offset 0, flags [DF], proto TCP (6), length 52)
    localhost.webcache > localhost.39576: Flags [.], cksum 0xfe28 (incorrect -> 0x5cca), seq 1, ack 198, win 350, options [nop,nop,TS val 4117419318 ecr 4117419318], length 0
05:24:43.375901 IP (tos 0x0, ttl 255, id 9515, offset 0, flags [DF], proto TCP (6), length 253)
    localhost.webcache > localhost.39576: Flags [P.], cksum 0xfef1 (incorrect -> 0xca80), seq 1:202, ack 198, win 350, options [nop,nop,TS val 4117419707 ecr 4117419318], length 201: HTTP, length: 201
        HTTP/1.1 201
        Content-Type: application/json;charset=UTF-8
        Transfer-Encoding: chunked
        Date: Tue, 25 Jun 2019 05:24:43 GMT

        43
        {"id":4,"name":"TestingOfHackathon","author":"Ramesh","price":9.99}
05:24:43.375912 IP (tos 0x0, ttl 255, id 55827, offset 0, flags [DF], proto TCP (6), length 52)
    localhost.39576 > localhost.webcache: Flags [.], cksum 0xfe28 (incorrect -> 0x58f7), seq 198, ack 202, win 350, options [nop,nop,TS val 4117419707 ecr 4117419707], length 0
05:24:43.378387 IP (tos 0x0, ttl 255, id 9516, offset 0, flags [DF], proto TCP (6), length 57)
    localhost.webcache > localhost.39576: Flags [P.], cksum 0xfe2d (incorrect -> 0x14ce), seq 202:207, ack 198, win 350, options [nop,nop,TS val 4117419709 ecr 4117419707], length 5: HTTP
05:24:43.378392 IP (tos 0x0, ttl 255, id 55828, offset 0, flags [DF], proto TCP (6), length 52)
    localhost.39576 > localhost.webcache: Flags [.], cksum 0xfe28 (incorrect -> 0x58ee), seq 198, ack 207, win 350, options [nop,nop,TS val 4117419709 ecr 4117419709], length 0
05:24:43.378474 IP (tos 0x0, ttl 255, id 55829, offset 0, flags [DF], proto TCP (6), length 52)
    localhost.39576 > localhost.webcache: Flags [F.], cksum 0xfe28 (incorrect -> 0x58ed), seq 198, ack 207, win 350, options [nop,nop,TS val 4117419709 ecr 4117419709], length 0
05:24:43.382948 IP (tos 0x0, ttl 255, id 9517, offset 0, flags [DF], proto TCP (6), length 52)
    localhost.webcache > localhost.39576: Flags [F.], cksum 0xfe28 (incorrect -> 0x58e7), seq 207, ack 199, win 350, options [nop,nop,TS val 4117419714 ecr 4117419709], length 0
05:24:43.382959 IP (tos 0x0, ttl 255, id 55830, offset 0, flags [DF], proto TCP (6), length 52)
    localhost.39576 > localhost.webcache: Flags [.], cksum 0xfe28 (incorrect -> 0x58e2), seq 199, ack 208, win 350, options [nop,nop,TS val 4117419714 ecr 4117419714], length 0
05:24:48.422530 IP (tos 0x0, ttl 255, id 11049, offset 0, flags [DF], proto TCP (6), length 60)
    localhost.39578 > localhost.webcache: Flags [S], cksum 0xfe30 (incorrect -> 0xe7ff), seq 546177689, win 43690, options [mss 65495,sackOK,TS val 4117424754 ecr 0,nop,wscale 7], length 0
05:24:48.422539 IP (tos 0x0, ttl 255, id 0, offset 0, flags [DF], proto TCP (6), length 60)
    localhost.webcache > localhost.39578: Flags [S.], cksum 0xfe30 (incorrect -> 0x1d09), seq 1679329007, ack 546177690, win 43690, options [mss 65495,sackOK,TS val 4117424754 ecr 4117424754,nop,wscale 7], length 0
05:24:48.422548 IP (tos 0x0, ttl 255, id 11050, offset 0, flags [DF], proto TCP (6), length 52)
    localhost.39578 > localhost.webcache: Flags [.], cksum 0xfe28 (incorrect -> 0xef4d), seq 1, ack 1, win 342, options [nop,nop,TS val 4117424754 ecr 4117424754], length 0
05:24:48.422998 IP (tos 0x0, ttl 255, id 11051, offset 0, flags [DF], proto TCP (6), length 249)
    localhost.39578 > localhost.webcache: Flags [P.], cksum 0xfeed (incorrect -> 0xfcbd), seq 1:198, ack 1, win 342, options [nop,nop,TS val 4117424754 ecr 4117424754], length 197: HTTP, length: 197
        POST /books HTTP/1.1
        Host: localhost:8080
        User-Agent: curl/7.61.1
        Accept: */*
        Content-type:application/json
        Content-Length: 62

        {"name":"TestingOfHackathon","author":"Ramesh","price":"9.99"}[!http]
05:24:48.423003 IP (tos 0x0, ttl 255, id 44864, offset 0, flags [DF], proto TCP (6), length 52)
    localhost.webcache > localhost.39578: Flags [.], cksum 0xfe28 (incorrect -> 0xee80), seq 1, ack 198, win 350, options [nop,nop,TS val 4117424754 ecr 4117424754], length 0
05:24:48.433185 IP (tos 0x0, ttl 255, id 44865, offset 0, flags [DF], proto TCP (6), length 253)
    localhost.webcache > localhost.39578: Flags [P.], cksum 0xfef1 (incorrect -> 0x5cad), seq 1:202, ack 198, win 350, options [nop,nop,TS val 4117424764 ecr 4117424754], length 201: HTTP, length: 201
        HTTP/1.1 201
        Content-Type: application/json;charset=UTF-8
        Transfer-Encoding: chunked
        Date: Tue, 25 Jun 2019 05:24:48 GMT

        43
        {"id":5,"name":"TestingOfHackathon","author":"Ramesh","price":9.99}
05:24:48.433191 IP (tos 0x0, ttl 255, id 11052, offset 0, flags [DF], proto TCP (6), length 52)
    localhost.39578 > localhost.webcache: Flags [.], cksum 0xfe28 (incorrect -> 0xeda3), seq 198, ack 202, win 350, options [nop,nop,TS val 4117424764 ecr 4117424764], length 0
05:24:48.434086 IP (tos 0x0, ttl 255, id 44866, offset 0, flags [DF], proto TCP (6), length 57)
    localhost.webcache > localhost.39578: Flags [P.], cksum 0xfe2d (incorrect -> 0xa97b), seq 202:207, ack 198, win 350, options [nop,nop,TS val 4117424765 ecr 4117424764], length 5: HTTP
05:24:48.434091 IP (tos 0x0, ttl 255, id 11053, offset 0, flags [DF], proto TCP (6), length 52)
    localhost.39578 > localhost.webcache: Flags [.], cksum 0xfe28 (incorrect -> 0xed9c), seq 198, ack 207, win 350, options [nop,nop,TS val 4117424765 ecr 4117424765], length 0
05:24:48.434297 IP (tos 0x0, ttl 255, id 11054, offset 0, flags [DF], proto TCP (6), length 52)
    localhost.39578 > localhost.webcache: Flags [F.], cksum 0xfe28 (incorrect -> 0xed9b), seq 198, ack 207, win 350, options [nop,nop,TS val 4117424765 ecr 4117424765], length 0
05:24:48.435487 IP (tos 0x0, ttl 255, id 44867, offset 0, flags [DF], proto TCP (6), length 52)
    localhost.webcache > localhost.39578: Flags [F.], cksum 0xfe28 (incorrect -> 0xed98), seq 207, ack 199, win 350, options [nop,nop,TS val 4117424767 ecr 4117424765], length 0
05:24:48.435496 IP (tos 0x0, ttl 255, id 11055, offset 0, flags [DF], proto TCP (6), length 52)
    localhost.39578 > localhost.webcache: Flags [.], cksum 0xfe28 (incorrect -> 0xed96), seq 199, ack 208, win 350, options [nop,nop,TS val 4117424767 ecr 4117424767], length 0
05:24:49.751033 IP (tos 0x0, ttl 255, id 43253, offset 0, flags [DF], proto TCP (6), length 60)
    localhost.39580 > localhost.webcache: Flags [S], cksum 0xfe30 (incorrect -> 0xc9ea), seq 3120595465, win 43690, options [mss 65495,sackOK,TS val 4117426082 ecr 0,nop,wscale 7], length 0
05:24:49.751041 IP (tos 0x0, ttl 255, id 0, offset 0, flags [DF], proto TCP (6), length 60)
    localhost.webcache > localhost.39580: Flags [S.], cksum 0xfe30 (incorrect -> 0x32d8), seq 3197563740, ack 3120595466, win 43690, options [mss 65495,sackOK,TS val 4117426082 ecr 4117426082,nop,wscale 7], length 0
05:24:49.751049 IP (tos 0x0, ttl 255, id 43254, offset 0, flags [DF], proto TCP (6), length 52)
    localhost.39580 > localhost.webcache: Flags [.], cksum 0xfe28 (incorrect -> 0x051d), seq 1, ack 1, win 342, options [nop,nop,TS val 4117426082 ecr 4117426082], length 0
05:24:49.751672 IP (tos 0x0, ttl 255, id 43255, offset 0, flags [DF], proto TCP (6), length 249)
    localhost.39580 > localhost.webcache: Flags [P.], cksum 0xfeed (incorrect -> 0x128c), seq 1:198, ack 1, win 342, options [nop,nop,TS val 4117426083 ecr 4117426082], length 197: HTTP, length: 197
        POST /books HTTP/1.1
        Host: localhost:8080
        User-Agent: curl/7.61.1
        Accept: */*
        Content-type:application/json
        Content-Length: 62

        {"name":"TestingOfHackathon","author":"Ramesh","price":"9.99"}[!http]
05:24:49.751677 IP (tos 0x0, ttl 255, id 55713, offset 0, flags [DF], proto TCP (6), length 52)
    localhost.webcache > localhost.39580: Flags [.], cksum 0xfe28 (incorrect -> 0x044e), seq 1, ack 198, win 350, options [nop,nop,TS val 4117426083 ecr 4117426083], length 0
05:24:49.760084 IP (tos 0x0, ttl 255, id 55714, offset 0, flags [DF], proto TCP (6), length 253)
    localhost.webcache > localhost.39580: Flags [P.], cksum 0xfef1 (incorrect -> 0x717b), seq 1:202, ack 198, win 350, options [nop,nop,TS val 4117426091 ecr 4117426083], length 201: HTTP, length: 201
        HTTP/1.1 201
        Content-Type: application/json;charset=UTF-8
        Transfer-Encoding: chunked
        Date: Tue, 25 Jun 2019 05:24:49 GMT

        43
        {"id":6,"name":"TestingOfHackathon","author":"Ramesh","price":9.99}
05:24:49.760089 IP (tos 0x0, ttl 255, id 43256, offset 0, flags [DF], proto TCP (6), length 52)
    localhost.39580 > localhost.webcache: Flags [.], cksum 0xfe28 (incorrect -> 0x0375), seq 198, ack 202, win 350, options [nop,nop,TS val 4117426091 ecr 4117426091], length 0
05:24:49.760852 IP (tos 0x0, ttl 255, id 55715, offset 0, flags [DF], proto TCP (6), length 57)
    localhost.webcache > localhost.39580: Flags [P.], cksum 0xfe2d (incorrect -> 0xbf4c), seq 202:207, ack 198, win 350, options [nop,nop,TS val 4117426092 ecr 4117426091], length 5: HTTP
05:24:49.760856 IP (tos 0x0, ttl 255, id 43257, offset 0, flags [DF], proto TCP (6), length 52)
    localhost.39580 > localhost.webcache: Flags [.], cksum 0xfe28 (incorrect -> 0x036e), seq 198, ack 207, win 350, options [nop,nop,TS val 4117426092 ecr 4117426092], length 0
05:24:49.761044 IP (tos 0x0, ttl 255, id 43258, offset 0, flags [DF], proto TCP (6), length 52)
    localhost.39580 > localhost.webcache: Flags [F.], cksum 0xfe28 (incorrect -> 0x036d), seq 198, ack 207, win 350, options [nop,nop,TS val 4117426092 ecr 4117426092], length 0
05:24:49.762126 IP (tos 0x0, ttl 255, id 55716, offset 0, flags [DF], proto TCP (6), length 52)
    localhost.webcache > localhost.39580: Flags [F.], cksum 0xfe28 (incorrect -> 0x036b), seq 207, ack 199, win 350, options [nop,nop,TS val 4117426093 ecr 4117426092], length 0
05:24:49.762136 IP (tos 0x0, ttl 255, id 43259, offset 0, flags [DF], proto TCP (6), length 52)
    localhost.39580 > localhost.webcache: Flags [.], cksum 0xfe28 (incorrect -> 0x036a), seq 199, ack 208, win 350, options [nop,nop,TS val 4117426093 ecr 4117426093], length 0
05:25:58.022847 IP (tos 0x0, ttl 255, id 17666, offset 0, flags [DF], proto TCP (6), length 60)
    localhost.39582 > localhost.webcache: Flags [S], cksum 0xfe30 (incorrect -> 0x309a), seq 2717591722, win 43690, options [mss 65495,sackOK,TS val 4117494356 ecr 0,nop,wscale 7], length 0
05:25:58.022856 IP (tos 0x0, ttl 255, id 0, offset 0, flags [DF], proto TCP (6), length 60)
    localhost.webcache > localhost.39582: Flags [S.], cksum 0xfe30 (incorrect -> 0x8829), seq 3021210762, ack 2717591723, win 43690, options [mss 65495,sackOK,TS val 4117494356 ecr 4117494356,nop,wscale 7], length 0
05:25:58.022875 IP (tos 0x0, ttl 255, id 17667, offset 0, flags [DF], proto TCP (6), length 52)
    localhost.39582 > localhost.webcache: Flags [.], cksum 0xfe28 (incorrect -> 0x5a6e), seq 1, ack 1, win 342, options [nop,nop,TS val 4117494356 ecr 4117494356], length 0
05:25:58.023317 IP (tos 0x0, ttl 255, id 17668, offset 0, flags [DF], proto TCP (6), length 274)
    localhost.39582 > localhost.webcache: Flags [P.], cksum 0xff06 (incorrect -> 0x8151), seq 1:223, ack 1, win 342, options [nop,nop,TS val 4117494356 ecr 4117494356], length 222: HTTP, length: 222
        POST /books HTTP/1.1
        Host: localhost:8080
        User-Agent: curl/7.61.1
        Accept: */*
        Content-type:application/json
        Content-Length: 87

        {"name":"TestingOfHackathon - UNION ALL SELECT NULL#","author":"Ramesh","price":"9.99"}[!http]
05:25:58.023322 IP (tos 0x0, ttl 255, id 26915, offset 0, flags [DF], proto TCP (6), length 52)
    localhost.webcache > localhost.39582: Flags [.], cksum 0xfe28 (incorrect -> 0x5988), seq 1, ack 223, win 350, options [nop,nop,TS val 4117494356 ecr 4117494356], length 0
05:25:58.033168 IP (tos 0x0, ttl 255, id 26916, offset 0, flags [DF], proto TCP (6), length 278)
    localhost.webcache > localhost.39582: Flags [P.], cksum 0xff0a (incorrect -> 0xf3e6), seq 1:227, ack 223, win 350, options [nop,nop,TS val 4117494366 ecr 4117494356], length 226: HTTP, length: 226
        HTTP/1.1 201
        Content-Type: application/json;charset=UTF-8
        Transfer-Encoding: chunked
        Date: Tue, 25 Jun 2019 05:25:58 GMT

        5c
        {"id":7,"name":"TestingOfHackathon - UNION ALL SELECT NULL#","author":"Ramesh","price":9.99}
05:25:58.033172 IP (tos 0x0, ttl 255, id 17669, offset 0, flags [DF], proto TCP (6), length 52)
    localhost.39582 > localhost.webcache: Flags [.], cksum 0xfe28 (incorrect -> 0x5892), seq 223, ack 227, win 350, options [nop,nop,TS val 4117494366 ecr 4117494366], length 0
05:25:58.034998 IP (tos 0x0, ttl 255, id 26917, offset 0, flags [DF], proto TCP (6), length 57)
    localhost.webcache > localhost.39582: Flags [P.], cksum 0xfe2d (incorrect -> 0x1469), seq 227:232, ack 223, win 350, options [nop,nop,TS val 4117494368 ecr 4117494366], length 5: HTTP
05:25:58.035002 IP (tos 0x0, ttl 255, id 17670, offset 0, flags [DF], proto TCP (6), length 52)
    localhost.39582 > localhost.webcache: Flags [.], cksum 0xfe28 (incorrect -> 0x5889), seq 223, ack 232, win 350, options [nop,nop,TS val 4117494368 ecr 4117494368], length 0
05:25:58.035204 IP (tos 0x0, ttl 255, id 17671, offset 0, flags [DF], proto TCP (6), length 52)
    localhost.39582 > localhost.webcache: Flags [F.], cksum 0xfe28 (incorrect -> 0x5888), seq 223, ack 232, win 350, options [nop,nop,TS val 4117494368 ecr 4117494368], length 0
05:25:58.036234 IP (tos 0x0, ttl 255, id 26918, offset 0, flags [DF], proto TCP (6), length 52)
    localhost.webcache > localhost.39582: Flags [F.], cksum 0xfe28 (incorrect -> 0x5886), seq 232, ack 224, win 350, options [nop,nop,TS val 4117494369 ecr 4117494368], length 0
05:25:58.036243 IP (tos 0x0, ttl 255, id 17672, offset 0, flags [DF], proto TCP (6), length 52)
    localhost.39582 > localhost.webcache: Flags [.], cksum 0xfe28 (incorrect -> 0x5885), seq 224, ack 233, win 350, options [nop,nop,TS val 4117494369 ecr 4117494369], length 0
05:26:01.450535 IP (tos 0x0, ttl 255, id 1598, offset 0, flags [DF], proto TCP (6), length 60)
    localhost.39584 > localhost.webcache: Flags [S], cksum 0xfe30 (incorrect -> 0x2bb3), seq 1256748863, win 43690, options [mss 65495,sackOK,TS val 4117497783 ecr 0,nop,wscale 7], length 0
05:26:01.450547 IP (tos 0x0, ttl 255, id 0, offset 0, flags [DF], proto TCP (6), length 60)
    localhost.webcache > localhost.39584: Flags [S.], cksum 0xfe30 (incorrect -> 0x4852), seq 3415939728, ack 1256748864, win 43690, options [mss 65495,sackOK,TS val 4117497783 ecr 4117497783,nop,wscale 7], length 0
05:26:01.450598 IP (tos 0x0, ttl 255, id 1599, offset 0, flags [DF], proto TCP (6), length 52)
    localhost.39584 > localhost.webcache: Flags [.], cksum 0xfe28 (incorrect -> 0x1a97), seq 1, ack 1, win 342, options [nop,nop,TS val 4117497783 ecr 4117497783], length 0
05:26:01.451066 IP (tos 0x0, ttl 255, id 1600, offset 0, flags [DF], proto TCP (6), length 274)
    localhost.39584 > localhost.webcache: Flags [P.], cksum 0xff06 (incorrect -> 0x4179), seq 1:223, ack 1, win 342, options [nop,nop,TS val 4117497784 ecr 4117497783], length 222: HTTP, length: 222
        POST /books HTTP/1.1
        Host: localhost:8080
        User-Agent: curl/7.61.1
        Accept: */*
        Content-type:application/json
        Content-Length: 87

        {"name":"TestingOfHackathon - UNION ALL SELECT NULL#","author":"Ramesh","price":"9.99"}[!http]
05:26:01.451070 IP (tos 0x0, ttl 255, id 27536, offset 0, flags [DF], proto TCP (6), length 52)
    localhost.webcache > localhost.39584: Flags [.], cksum 0xfe28 (incorrect -> 0x19af), seq 1, ack 223, win 350, options [nop,nop,TS val 4117497784 ecr 4117497784], length 0
05:26:01.458602 IP (tos 0x0, ttl 255, id 27537, offset 0, flags [DF], proto TCP (6), length 278)
    localhost.webcache > localhost.39584: Flags [P.], cksum 0xff0a (incorrect -> 0xb717), seq 1:227, ack 223, win 350, options [nop,nop,TS val 4117497791 ecr 4117497784], length 226: HTTP, length: 226
        HTTP/1.1 201
        Content-Type: application/json;charset=UTF-8
        Transfer-Encoding: chunked
        Date: Tue, 25 Jun 2019 05:26:01 GMT

        5c
        {"id":8,"name":"TestingOfHackathon - UNION ALL SELECT NULL#","author":"Ramesh","price":9.99}
05:26:01.458608 IP (tos 0x0, ttl 255, id 1601, offset 0, flags [DF], proto TCP (6), length 52)
    localhost.39584 > localhost.webcache: Flags [.], cksum 0xfe28 (incorrect -> 0x18bf), seq 223, ack 227, win 350, options [nop,nop,TS val 4117497791 ecr 4117497791], length 0
05:26:01.459493 IP (tos 0x0, ttl 255, id 27538, offset 0, flags [DF], proto TCP (6), length 57)
    localhost.webcache > localhost.39584: Flags [P.], cksum 0xfe2d (incorrect -> 0xd496), seq 227:232, ack 223, win 350, options [nop,nop,TS val 4117497792 ecr 4117497791], length 5: HTTP
05:26:01.459498 IP (tos 0x0, ttl 255, id 1602, offset 0, flags [DF], proto TCP (6), length 52)
    localhost.39584 > localhost.webcache: Flags [.], cksum 0xfe28 (incorrect -> 0x18b8), seq 223, ack 232, win 350, options [nop,nop,TS val 4117497792 ecr 4117497792], length 0
05:26:01.459667 IP (tos 0x0, ttl 255, id 1603, offset 0, flags [DF], proto TCP (6), length 52)
    localhost.39584 > localhost.webcache: Flags [F.], cksum 0xfe28 (incorrect -> 0x18b7), seq 223, ack 232, win 350, options [nop,nop,TS val 4117497792 ecr 4117497792], length 0
05:26:01.460803 IP (tos 0x0, ttl 255, id 27539, offset 0, flags [DF], proto TCP (6), length 52)
    localhost.webcache > localhost.39584: Flags [F.], cksum 0xfe28 (incorrect -> 0x18b4), seq 232, ack 224, win 350, options [nop,nop,TS val 4117497794 ecr 4117497792], length 0
05:26:01.460813 IP (tos 0x0, ttl 255, id 1604, offset 0, flags [DF], proto TCP (6), length 52)
    localhost.39584 > localhost.webcache: Flags [.], cksum 0xfe28 (incorrect -> 0x18b2), seq 224, ack 233, win 350, options [nop,nop,TS val 4117497794 ecr 4117497794], length 0
05:26:33.273891 IP (tos 0x0, ttl 255, id 55788, offset 0, flags [DF], proto TCP (6), length 60)
    localhost.39586 > localhost.webcache: Flags [S], cksum 0xfe30 (incorrect -> 0x4a99), seq 3707128312, win 43690, options [mss 65495,sackOK,TS val 4117529607 ecr 0,nop,wscale 7], length 0
05:26:33.273899 IP (tos 0x0, ttl 255, id 0, offset 0, flags [DF], proto TCP (6), length 60)
    localhost.webcache > localhost.39586: Flags [S.], cksum 0xfe30 (incorrect -> 0xb8b0), seq 1161679653, ack 3707128313, win 43690, options [mss 65495,sackOK,TS val 4117529607 ecr 4117529607,nop,wscale 7], length 0
05:26:33.273906 IP (tos 0x0, ttl 255, id 55789, offset 0, flags [DF], proto TCP (6), length 52)
    localhost.39586 > localhost.webcache: Flags [.], cksum 0xfe28 (incorrect -> 0x8af5), seq 1, ack 1, win 342, options [nop,nop,TS val 4117529607 ecr 4117529607], length 0
05:26:33.274409 IP (tos 0x0, ttl 255, id 55790, offset 0, flags [DF], proto TCP (6), length 263)
    localhost.39586 > localhost.webcache: Flags [P.], cksum 0xfefb (incorrect -> 0xe3d5), seq 1:212, ack 1, win 342, options [nop,nop,TS val 4117529608 ecr 4117529607], length 211: HTTP, length: 211
        POST /books HTTP/1.1
        Host: localhost:8080
        User-Agent: curl/7.61.1
        Accept: */*
        Content-type:application/json
        Content-Length: 76

        {"name":"TestingOfHackathon - OR SLEEP(5)","author":"Ramesh","price":"9.99"}[!http]
05:26:33.274414 IP (tos 0x0, ttl 255, id 17202, offset 0, flags [DF], proto TCP (6), length 52)
    localhost.webcache > localhost.39586: Flags [.], cksum 0xfe28 (incorrect -> 0x8a18), seq 1, ack 212, win 350, options [nop,nop,TS val 4117529608 ecr 4117529608], length 0
05:26:33.285144 IP (tos 0x0, ttl 255, id 17203, offset 0, flags [DF], proto TCP (6), length 267)
    localhost.webcache > localhost.39586: Flags [P.], cksum 0xfeff (incorrect -> 0x41bd), seq 1:216, ack 212, win 350, options [nop,nop,TS val 4117529619 ecr 4117529608], length 215: HTTP, length: 215
        HTTP/1.1 201
        Content-Type: application/json;charset=UTF-8
        Transfer-Encoding: chunked
        Date: Tue, 25 Jun 2019 05:26:33 GMT

        51
        {"id":9,"name":"TestingOfHackathon - OR SLEEP(5)","author":"Ramesh","price":9.99}
05:26:33.285148 IP (tos 0x0, ttl 255, id 55791, offset 0, flags [DF], proto TCP (6), length 52)
    localhost.39586 > localhost.webcache: Flags [.], cksum 0xfe28 (incorrect -> 0x892b), seq 212, ack 216, win 350, options [nop,nop,TS val 4117529619 ecr 4117529619], length 0
05:26:33.285898 IP (tos 0x0, ttl 255, id 17204, offset 0, flags [DF], proto TCP (6), length 57)
    localhost.webcache > localhost.39586: Flags [P.], cksum 0xfe2d (incorrect -> 0x4504), seq 216:221, ack 212, win 350, options [nop,nop,TS val 4117529619 ecr 4117529619], length 5: HTTP
05:26:33.285902 IP (tos 0x0, ttl 255, id 55792, offset 0, flags [DF], proto TCP (6), length 52)
    localhost.39586 > localhost.webcache: Flags [.], cksum 0xfe28 (incorrect -> 0x8926), seq 212, ack 221, win 350, options [nop,nop,TS val 4117529619 ecr 4117529619], length 0
05:26:33.286065 IP (tos 0x0, ttl 255, id 55793, offset 0, flags [DF], proto TCP (6), length 52)
    localhost.39586 > localhost.webcache: Flags [F.], cksum 0xfe28 (incorrect -> 0x8924), seq 212, ack 221, win 350, options [nop,nop,TS val 4117529620 ecr 4117529619], length 0
05:26:33.287443 IP (tos 0x0, ttl 255, id 17205, offset 0, flags [DF], proto TCP (6), length 52)
    localhost.webcache > localhost.39586: Flags [F.], cksum 0xfe28 (incorrect -> 0x8921), seq 221, ack 213, win 350, options [nop,nop,TS val 4117529621 ecr 4117529620], length 0
05:26:33.287452 IP (tos 0x0, ttl 255, id 55794, offset 0, flags [DF], proto TCP (6), length 52)
    localhost.39586 > localhost.webcache: Flags [.], cksum 0xfe28 (incorrect -> 0x8920), seq 213, ack 222, win 350, options [nop,nop,TS val 4117529621 ecr 4117529621], length 0
05:27:45.512789 IP (tos 0x0, ttl 255, id 35520, offset 0, flags [DF], proto TCP (6), length 60)
    localhost.39592 > localhost.webcache: Flags [S], cksum 0xfe30 (incorrect -> 0x3e3f), seq 3165674592, win 43690, options [mss 65495,sackOK,TS val 4117601848 ecr 0,nop,wscale 7], length 0
05:27:45.512797 IP (tos 0x0, ttl 255, id 0, offset 0, flags [DF], proto TCP (6), length 60)
    localhost.webcache > localhost.39592: Flags [S.], cksum 0xfe30 (incorrect -> 0xbb9c), seq 3791523052, ack 3165674593, win 43690, options [mss 65495,sackOK,TS val 4117601848 ecr 4117601848,nop,wscale 7], length 0
05:27:45.512804 IP (tos 0x0, ttl 255, id 35521, offset 0, flags [DF], proto TCP (6), length 52)
    localhost.39592 > localhost.webcache: Flags [.], cksum 0xfe28 (incorrect -> 0x8de1), seq 1, ack 1, win 342, options [nop,nop,TS val 4117601848 ecr 4117601848], length 0
05:27:45.514441 IP (tos 0x0, ttl 255, id 35522, offset 0, flags [DF], proto TCP (6), length 284)
    localhost.39592 > localhost.webcache: Flags [P.], cksum 0xff10 (incorrect -> 0xd2b1), seq 1:233, ack 1, win 342, options [nop,nop,TS val 4117601850 ecr 4117601848], length 232: HTTP, length: 232
        POST /books HTTP/1.1
        Host: localhost:8080
        User-Agent: curl/7.61.1
        Accept: */*
        Content-type:application/json
        Content-Length: 97

        {"name":"TestingOfHackathon - OR SLEEP(5)","author":"Ramesh - 1")) AND 2666=3095","price":"9.99"}[!http]
05:27:45.514446 IP (tos 0x0, ttl 255, id 55885, offset 0, flags [DF], proto TCP (6), length 52)
    localhost.webcache > localhost.39592: Flags [.], cksum 0xfe28 (incorrect -> 0x8ced), seq 1, ack 233, win 350, options [nop,nop,TS val 4117601850 ecr 4117601850], length 0
05:27:45.535502 IP (tos 0x0, ttl 255, id 55886, offset 0, flags [DF], proto TCP (6), length 144)
    localhost.webcache > localhost.39592: Flags [P.], cksum 0xfe84 (incorrect -> 0x4821), seq 1:93, ack 233, win 350, options [nop,nop,TS val 4117601871 ecr 4117601850], length 92: HTTP, length: 92
        HTTP/1.1 400
        Content-Length: 0
        Date: Tue, 25 Jun 2019 05:27:45 GMT
        Connection: close

05:27:45.535508 IP (tos 0x0, ttl 255, id 35523, offset 0, flags [DF], proto TCP (6), length 52)
    localhost.39592 > localhost.webcache: Flags [.], cksum 0xfe28 (incorrect -> 0x8c6f), seq 233, ack 93, win 342, options [nop,nop,TS val 4117601871 ecr 4117601871], length 0
05:27:45.535610 IP (tos 0x0, ttl 255, id 35524, offset 0, flags [DF], proto TCP (6), length 52)
    localhost.39592 > localhost.webcache: Flags [F.], cksum 0xfe28 (incorrect -> 0x8c6e), seq 233, ack 93, win 342, options [nop,nop,TS val 4117601871 ecr 4117601871], length 0
05:27:45.537020 IP (tos 0x0, ttl 255, id 55887, offset 0, flags [DF], proto TCP (6), length 52)
    localhost.webcache > localhost.39592: Flags [F.], cksum 0xfe28 (incorrect -> 0x8c64), seq 93, ack 234, win 350, options [nop,nop,TS val 4117601872 ecr 4117601871], length 0
05:27:45.537030 IP (tos 0x0, ttl 255, id 35525, offset 0, flags [DF], proto TCP (6), length 52)
    localhost.39592 > localhost.webcache: Flags [.], cksum 0xfe28 (incorrect -> 0x8c6b), seq 234, ack 94, win 342, options [nop,nop,TS val 4117601872 ecr 4117601872], length 0
05:28:06.180254 IP (tos 0x0, ttl 255, id 49946, offset 0, flags [DF], proto TCP (6), length 60)
    localhost.39594 > localhost.webcache: Flags [S], cksum 0xfe30 (incorrect -> 0x9cb4), seq 1074276821, win 43690, options [mss 65495,sackOK,TS val 4117622516 ecr 0,nop,wscale 7], length 0
05:28:06.180263 IP (tos 0x0, ttl 255, id 0, offset 0, flags [DF], proto TCP (6), length 60)
    localhost.webcache > localhost.39594: Flags [S.], cksum 0xfe30 (incorrect -> 0xd738), seq 1048683142, ack 1074276822, win 43690, options [mss 65495,sackOK,TS val 4117622516 ecr 4117622516,nop,wscale 7], length 0
05:28:06.180271 IP (tos 0x0, ttl 255, id 49947, offset 0, flags [DF], proto TCP (6), length 52)
    localhost.39594 > localhost.webcache: Flags [.], cksum 0xfe28 (incorrect -> 0xa97d), seq 1, ack 1, win 342, options [nop,nop,TS val 4117622516 ecr 4117622516], length 0
05:28:06.180703 IP (tos 0x0, ttl 255, id 49948, offset 0, flags [DF], proto TCP (6), length 280)
    localhost.39594 > localhost.webcache: Flags [P.], cksum 0xff0c (incorrect -> 0x32b2), seq 1:229, ack 1, win 342, options [nop,nop,TS val 4117622516 ecr 4117622516], length 228: HTTP, length: 228
        POST /books HTTP/1.1
        Host: localhost:8080
        User-Agent: curl/7.61.1
        Accept: */*
        Content-type:application/json
        Content-Length: 93

        {"name":"TestingOfHackathon - OR SLEEP(5)","author":"Ramesh")) AND 2666=3095","price":"9.99"}[!http]
05:28:06.180709 IP (tos 0x0, ttl 255, id 18504, offset 0, flags [DF], proto TCP (6), length 52)
    localhost.webcache > localhost.39594: Flags [.], cksum 0xfe28 (incorrect -> 0xa891), seq 1, ack 229, win 350, options [nop,nop,TS val 4117622516 ecr 4117622516], length 0
05:28:06.187105 IP (tos 0x0, ttl 255, id 18505, offset 0, flags [DF], proto TCP (6), length 144)
    localhost.webcache > localhost.39594: Flags [P.], cksum 0xfe84 (incorrect -> 0x62d6), seq 1:93, ack 229, win 350, options [nop,nop,TS val 4117622523 ecr 4117622516], length 92: HTTP, length: 92
        HTTP/1.1 400
        Content-Length: 0
        Date: Tue, 25 Jun 2019 05:28:06 GMT
        Connection: close

05:28:06.187137 IP (tos 0x0, ttl 255, id 49949, offset 0, flags [DF], proto TCP (6), length 52)
    localhost.39594 > localhost.webcache: Flags [.], cksum 0xfe28 (incorrect -> 0xa82f), seq 229, ack 93, win 342, options [nop,nop,TS val 4117622523 ecr 4117622523], length 0
05:28:06.188261 IP (tos 0x0, ttl 255, id 18506, offset 0, flags [DF], proto TCP (6), length 52)
    localhost.webcache > localhost.39594: Flags [F.], cksum 0xfe28 (incorrect -> 0xa825), seq 93, ack 229, win 350, options [nop,nop,TS val 4117622524 ecr 4117622523], length 0
05:28:06.188347 IP (tos 0x0, ttl 255, id 49950, offset 0, flags [DF], proto TCP (6), length 52)
    localhost.39594 > localhost.webcache: Flags [F.], cksum 0xfe28 (incorrect -> 0xa82b), seq 229, ack 94, win 342, options [nop,nop,TS val 4117622524 ecr 4117622524], length 0
05:28:06.188359 IP (tos 0x0, ttl 255, id 18507, offset 0, flags [DF], proto TCP (6), length 52)
    localhost.webcache > localhost.39594: Flags [.], cksum 0xfe28 (incorrect -> 0xa823), seq 94, ack 230, win 350, options [nop,nop,TS val 4117622524 ecr 4117622524], length 0
05:28:13.961836 IP (tos 0x0, ttl 255, id 12869, offset 0, flags [DF], proto TCP (6), length 60)
    localhost.39596 > localhost.webcache: Flags [S], cksum 0xfe30 (incorrect -> 0x76a5), seq 2975252525, win 43690, options [mss 65495,sackOK,TS val 4117630298 ecr 0,nop,wscale 7], length 0
05:28:13.961845 IP (tos 0x0, ttl 255, id 0, offset 0, flags [DF], proto TCP (6), length 60)
    localhost.webcache > localhost.39596: Flags [S.], cksum 0xfe30 (incorrect -> 0x3a7a), seq 1472717193, ack 2975252526, win 43690, options [mss 65495,sackOK,TS val 4117630298 ecr 4117630298,nop,wscale 7], length 0
05:28:13.961854 IP (tos 0x0, ttl 255, id 12870, offset 0, flags [DF], proto TCP (6), length 52)
    localhost.39596 > localhost.webcache: Flags [.], cksum 0xfe28 (incorrect -> 0x0cbf), seq 1, ack 1, win 342, options [nop,nop,TS val 4117630298 ecr 4117630298], length 0
05:28:13.962288 IP (tos 0x0, ttl 255, id 12871, offset 0, flags [DF], proto TCP (6), length 280)
    localhost.39596 > localhost.webcache: Flags [P.], cksum 0xff0c (incorrect -> 0x95f3), seq 1:229, ack 1, win 342, options [nop,nop,TS val 4117630298 ecr 4117630298], length 228: HTTP, length: 228
        POST /books HTTP/1.1
        Host: localhost:8080
        User-Agent: curl/7.61.1
        Accept: */*
        Content-type:application/json
        Content-Length: 93

        {"name":"TestingOfHackathon - OR SLEEP(5)","author":"Ramesh")) AND 2666=3095","price":"9.99"}[!http]
05:28:13.962293 IP (tos 0x0, ttl 255, id 5090, offset 0, flags [DF], proto TCP (6), length 52)
    localhost.webcache > localhost.39596: Flags [.], cksum 0xfe28 (incorrect -> 0x0bd3), seq 1, ack 229, win 350, options [nop,nop,TS val 4117630298 ecr 4117630298], length 0
05:28:13.966617 IP (tos 0x0, ttl 255, id 5091, offset 0, flags [DF], proto TCP (6), length 144)
    localhost.webcache > localhost.39596: Flags [P.], cksum 0xfe84 (incorrect -> 0xc919), seq 1:93, ack 229, win 350, options [nop,nop,TS val 4117630302 ecr 4117630298], length 92: HTTP, length: 92
        HTTP/1.1 400
        Content-Length: 0
        Date: Tue, 25 Jun 2019 05:28:13 GMT
        Connection: close

05:28:13.966850 IP (tos 0x0, ttl 255, id 5092, offset 0, flags [DF], proto TCP (6), length 52)
    localhost.webcache > localhost.39596: Flags [F.], cksum 0xfe28 (incorrect -> 0x0b71), seq 93, ack 229, win 350, options [nop,nop,TS val 4117630303 ecr 4117630298], length 0
05:28:13.966902 IP (tos 0x0, ttl 255, id 12872, offset 0, flags [DF], proto TCP (6), length 52)
    localhost.39596 > localhost.webcache: Flags [.], cksum 0xfe28 (incorrect -> 0x0b76), seq 229, ack 93, win 342, options [nop,nop,TS val 4117630303 ecr 4117630302], length 0
05:28:13.967829 IP (tos 0x0, ttl 255, id 12873, offset 0, flags [DF], proto TCP (6), length 52)
    localhost.39596 > localhost.webcache: Flags [F.], cksum 0xfe28 (incorrect -> 0x0b72), seq 229, ack 94, win 342, options [nop,nop,TS val 4117630304 ecr 4117630303], length 0
05:28:13.967839 IP (tos 0x0, ttl 255, id 5093, offset 0, flags [DF], proto TCP (6), length 52)
    localhost.webcache > localhost.39596: Flags [.], cksum 0xfe28 (incorrect -> 0x0b69), seq 94, ack 230, win 350, options [nop,nop,TS val 4117630304 ecr 4117630304], length 0
05:28:14.506554 IP (tos 0x0, ttl 255, id 42198, offset 0, flags [DF], proto TCP (6), length 60)
    localhost.39598 > localhost.webcache: Flags [S], cksum 0xfe30 (incorrect -> 0x634a), seq 748049959, win 43690, options [mss 65495,sackOK,TS val 4117630842 ecr 0,nop,wscale 7], length 0
05:28:14.506564 IP (tos 0x0, ttl 255, id 0, offset 0, flags [DF], proto TCP (6), length 60)
    localhost.webcache > localhost.39598: Flags [S.], cksum 0xfe30 (incorrect -> 0xdc81), seq 4242113780, ack 748049960, win 43690, options [mss 65495,sackOK,TS val 4117630842 ecr 4117630842,nop,wscale 7], length 0
05:28:14.506573 IP (tos 0x0, ttl 255, id 42199, offset 0, flags [DF], proto TCP (6), length 52)
    localhost.39598 > localhost.webcache: Flags [.], cksum 0xfe28 (incorrect -> 0xaec6), seq 1, ack 1, win 342, options [nop,nop,TS val 4117630842 ecr 4117630842], length 0
05:28:14.507599 IP (tos 0x0, ttl 255, id 42200, offset 0, flags [DF], proto TCP (6), length 280)
    localhost.39598 > localhost.webcache: Flags [P.], cksum 0xff0c (incorrect -> 0x37fa), seq 1:229, ack 1, win 342, options [nop,nop,TS val 4117630843 ecr 4117630842], length 228: HTTP, length: 228
        POST /books HTTP/1.1
        Host: localhost:8080
        User-Agent: curl/7.61.1
        Accept: */*
        Content-type:application/json
        Content-Length: 93

        {"name":"TestingOfHackathon - OR SLEEP(5)","author":"Ramesh")) AND 2666=3095","price":"9.99"}[!http]
05:28:14.507605 IP (tos 0x0, ttl 255, id 30212, offset 0, flags [DF], proto TCP (6), length 52)
    localhost.webcache > localhost.39598: Flags [.], cksum 0xfe28 (incorrect -> 0xadd8), seq 1, ack 229, win 350, options [nop,nop,TS val 4117630843 ecr 4117630843], length 0
05:28:14.510735 IP (tos 0x0, ttl 255, id 30213, offset 0, flags [DF], proto TCP (6), length 144)
    localhost.webcache > localhost.39598: Flags [P.], cksum 0xfe84 (incorrect -> 0x6b1f), seq 1:93, ack 229, win 350, options [nop,nop,TS val 4117630847 ecr 4117630843], length 92: HTTP, length: 92
        HTTP/1.1 400
        Content-Length: 0
        Date: Tue, 25 Jun 2019 05:28:13 GMT
        Connection: close

05:28:14.510922 IP (tos 0x0, ttl 255, id 30214, offset 0, flags [DF], proto TCP (6), length 52)
    localhost.webcache > localhost.39598: Flags [F.], cksum 0xfe28 (incorrect -> 0xad77), seq 93, ack 229, win 350, options [nop,nop,TS val 4117630847 ecr 4117630843], length 0
05:28:14.510975 IP (tos 0x0, ttl 255, id 42201, offset 0, flags [DF], proto TCP (6), length 52)
    localhost.39598 > localhost.webcache: Flags [.], cksum 0xfe28 (incorrect -> 0xad7c), seq 229, ack 93, win 342, options [nop,nop,TS val 4117630847 ecr 4117630847], length 0
05:28:14.511861 IP (tos 0x0, ttl 255, id 42202, offset 0, flags [DF], proto TCP (6), length 52)
    localhost.39598 > localhost.webcache: Flags [F.], cksum 0xfe28 (incorrect -> 0xad79), seq 229, ack 94, win 342, options [nop,nop,TS val 4117630848 ecr 4117630847], length 0
05:28:14.511875 IP (tos 0x0, ttl 255, id 30215, offset 0, flags [DF], proto TCP (6), length 52)
    localhost.webcache > localhost.39598: Flags [.], cksum 0xfe28 (incorrect -> 0xad70), seq 94, ack 230, win 350, options [nop,nop,TS val 4117630848 ecr 4117630848], length 0
05:28:15.013931 IP (tos 0x0, ttl 255, id 39072, offset 0, flags [DF], proto TCP (6), length 60)
    localhost.39600 > localhost.webcache: Flags [S], cksum 0xfe30 (incorrect -> 0xe840), seq 2415487951, win 43690, options [mss 65495,sackOK,TS val 4117631350 ecr 0,nop,wscale 7], length 0
05:28:15.013940 IP (tos 0x0, ttl 255, id 0, offset 0, flags [DF], proto TCP (6), length 60)
    localhost.webcache > localhost.39600: Flags [S.], cksum 0xfe30 (incorrect -> 0x0936), seq 993041636, ack 2415487952, win 43690, options [mss 65495,sackOK,TS val 4117631350 ecr 4117631350,nop,wscale 7], length 0
05:28:15.013949 IP (tos 0x0, ttl 255, id 39073, offset 0, flags [DF], proto TCP (6), length 52)
    localhost.39600 > localhost.webcache: Flags [.], cksum 0xfe28 (incorrect -> 0xdb7a), seq 1, ack 1, win 342, options [nop,nop,TS val 4117631350 ecr 4117631350], length 0
05:28:15.014417 IP (tos 0x0, ttl 255, id 39074, offset 0, flags [DF], proto TCP (6), length 280)
    localhost.39600 > localhost.webcache: Flags [P.], cksum 0xff0c (incorrect -> 0x64af), seq 1:229, ack 1, win 342, options [nop,nop,TS val 4117631350 ecr 4117631350], length 228: HTTP, length: 228
        POST /books HTTP/1.1
        Host: localhost:8080
        User-Agent: curl/7.61.1
        Accept: */*
        Content-type:application/json
        Content-Length: 93

        {"name":"TestingOfHackathon - OR SLEEP(5)","author":"Ramesh")) AND 2666=3095","price":"9.99"}[!http]
05:28:15.014423 IP (tos 0x0, ttl 255, id 28554, offset 0, flags [DF], proto TCP (6), length 52)
    localhost.webcache > localhost.39600: Flags [.], cksum 0xfe28 (incorrect -> 0xda8e), seq 1, ack 229, win 350, options [nop,nop,TS val 4117631350 ecr 4117631350], length 0
05:28:15.018400 IP (tos 0x0, ttl 255, id 28555, offset 0, flags [DF], proto TCP (6), length 144)
    localhost.webcache > localhost.39600: Flags [P.], cksum 0xfe84 (incorrect -> 0x95d5), seq 1:93, ack 229, win 350, options [nop,nop,TS val 4117631354 ecr 4117631350], length 92: HTTP, length: 92
        HTTP/1.1 400
        Content-Length: 0
        Date: Tue, 25 Jun 2019 05:28:15 GMT
        Connection: close

05:28:15.018433 IP (tos 0x0, ttl 255, id 39075, offset 0, flags [DF], proto TCP (6), length 52)
    localhost.39600 > localhost.webcache: Flags [.], cksum 0xfe28 (incorrect -> 0xda32), seq 229, ack 93, win 342, options [nop,nop,TS val 4117631354 ecr 4117631354], length 0
05:28:15.019574 IP (tos 0x0, ttl 255, id 28556, offset 0, flags [DF], proto TCP (6), length 52)
    localhost.webcache > localhost.39600: Flags [F.], cksum 0xfe28 (incorrect -> 0xda28), seq 93, ack 229, win 350, options [nop,nop,TS val 4117631355 ecr 4117631354], length 0
05:28:15.020066 IP (tos 0x0, ttl 255, id 39076, offset 0, flags [DF], proto TCP (6), length 52)
    localhost.39600 > localhost.webcache: Flags [F.], cksum 0xfe28 (incorrect -> 0xda2d), seq 229, ack 94, win 342, options [nop,nop,TS val 4117631356 ecr 4117631355], length 0
05:28:15.020077 IP (tos 0x0, ttl 255, id 28557, offset 0, flags [DF], proto TCP (6), length 52)
    localhost.webcache > localhost.39600: Flags [.], cksum 0xfe28 (incorrect -> 0xda24), seq 94, ack 230, win 350, options [nop,nop,TS val 4117631356 ecr 4117631356], length 0
05:28:15.517973 IP (tos 0x0, ttl 255, id 15412, offset 0, flags [DF], proto TCP (6), length 60)
    localhost.39602 > localhost.webcache: Flags [S], cksum 0xfe30 (incorrect -> 0x97d2), seq 2053361625, win 43690, options [mss 65495,sackOK,TS val 4117631854 ecr 0,nop,wscale 7], length 0
05:28:15.517986 IP (tos 0x0, ttl 255, id 0, offset 0, flags [DF], proto TCP (6), length 60)
    localhost.webcache > localhost.39602: Flags [S.], cksum 0xfe30 (incorrect -> 0x3fc4), seq 4032257736, ack 2053361626, win 43690, options [mss 65495,sackOK,TS val 4117631854 ecr 4117631854,nop,wscale 7], length 0
05:28:15.517997 IP (tos 0x0, ttl 255, id 15413, offset 0, flags [DF], proto TCP (6), length 52)
    localhost.39602 > localhost.webcache: Flags [.], cksum 0xfe28 (incorrect -> 0x1209), seq 1, ack 1, win 342, options [nop,nop,TS val 4117631854 ecr 4117631854], length 0
05:28:15.518463 IP (tos 0x0, ttl 255, id 15414, offset 0, flags [DF], proto TCP (6), length 280)
    localhost.39602 > localhost.webcache: Flags [P.], cksum 0xff0c (incorrect -> 0x9b3d), seq 1:229, ack 1, win 342, options [nop,nop,TS val 4117631854 ecr 4117631854], length 228: HTTP, length: 228
        POST /books HTTP/1.1
        Host: localhost:8080
        User-Agent: curl/7.61.1
        Accept: */*
        Content-type:application/json
        Content-Length: 93

        {"name":"TestingOfHackathon - OR SLEEP(5)","author":"Ramesh")) AND 2666=3095","price":"9.99"}[!http]
05:28:15.518469 IP (tos 0x0, ttl 255, id 44324, offset 0, flags [DF], proto TCP (6), length 52)
    localhost.webcache > localhost.39602: Flags [.], cksum 0xfe28 (incorrect -> 0x111d), seq 1, ack 229, win 350, options [nop,nop,TS val 4117631854 ecr 4117631854], length 0
05:28:15.527993 IP (tos 0x0, ttl 255, id 44325, offset 0, flags [DF], proto TCP (6), length 144)
    localhost.webcache > localhost.39602: Flags [P.], cksum 0xfe84 (incorrect -> 0xcc5d), seq 1:93, ack 229, win 350, options [nop,nop,TS val 4117631864 ecr 4117631854], length 92: HTTP, length: 92
        HTTP/1.1 400
        Content-Length: 0
        Date: Tue, 25 Jun 2019 05:28:15 GMT
        Connection: close

05:28:15.527999 IP (tos 0x0, ttl 255, id 15415, offset 0, flags [DF], proto TCP (6), length 52)
    localhost.39602 > localhost.webcache: Flags [.], cksum 0xfe28 (incorrect -> 0x10b5), seq 229, ack 93, win 342, options [nop,nop,TS val 4117631864 ecr 4117631864], length 0
05:28:15.528607 IP (tos 0x0, ttl 255, id 15416, offset 0, flags [DF], proto TCP (6), length 52)
    localhost.39602 > localhost.webcache: Flags [F.], cksum 0xfe28 (incorrect -> 0x10b3), seq 229, ack 93, win 342, options [nop,nop,TS val 4117631865 ecr 4117631864], length 0
05:28:15.529763 IP (tos 0x0, ttl 255, id 44326, offset 0, flags [DF], proto TCP (6), length 52)
    localhost.webcache > localhost.39602: Flags [F.], cksum 0xfe28 (incorrect -> 0x10a8), seq 93, ack 230, win 350, options [nop,nop,TS val 4117631866 ecr 4117631865], length 0
05:28:15.529774 IP (tos 0x0, ttl 255, id 15417, offset 0, flags [DF], proto TCP (6), length 52)
    localhost.39602 > localhost.webcache: Flags [.], cksum 0xfe28 (incorrect -> 0x10af), seq 230, ack 94, win 342, options [nop,nop,TS val 4117631866 ecr 4117631866], length 0
05:28:16.067836 IP (tos 0x0, ttl 255, id 61412, offset 0, flags [DF], proto TCP (6), length 60)
    localhost.39604 > localhost.webcache: Flags [S], cksum 0xfe30 (incorrect -> 0x3fc8), seq 2223774611, win 43690, options [mss 65495,sackOK,TS val 4117632404 ecr 0,nop,wscale 7], length 0
05:28:16.067846 IP (tos 0x0, ttl 255, id 0, offset 0, flags [DF], proto TCP (6), length 60)
    localhost.webcache > localhost.39604: Flags [S.], cksum 0xfe30 (incorrect -> 0x4652), seq 3636860315, ack 2223774612, win 43690, options [mss 65495,sackOK,TS val 4117632404 ecr 4117632404,nop,wscale 7], length 0
05:28:16.067854 IP (tos 0x0, ttl 255, id 61413, offset 0, flags [DF], proto TCP (6), length 52)
    localhost.39604 > localhost.webcache: Flags [.], cksum 0xfe28 (incorrect -> 0x1897), seq 1, ack 1, win 342, options [nop,nop,TS val 4117632404 ecr 4117632404], length 0
05:28:16.068313 IP (tos 0x0, ttl 255, id 61414, offset 0, flags [DF], proto TCP (6), length 280)
    localhost.39604 > localhost.webcache: Flags [P.], cksum 0xff0c (incorrect -> 0xa1cb), seq 1:229, ack 1, win 342, options [nop,nop,TS val 4117632404 ecr 4117632404], length 228: HTTP, length: 228
        POST /books HTTP/1.1
        Host: localhost:8080
        User-Agent: curl/7.61.1
        Accept: */*
        Content-type:application/json
        Content-Length: 93

        {"name":"TestingOfHackathon - OR SLEEP(5)","author":"Ramesh")) AND 2666=3095","price":"9.99"}[!http]
05:28:16.068318 IP (tos 0x0, ttl 255, id 57835, offset 0, flags [DF], proto TCP (6), length 52)
    localhost.webcache > localhost.39604: Flags [.], cksum 0xfe28 (incorrect -> 0x17ab), seq 1, ack 229, win 350, options [nop,nop,TS val 4117632404 ecr 4117632404], length 0
05:28:16.072278 IP (tos 0x0, ttl 255, id 57836, offset 0, flags [DF], proto TCP (6), length 144)
    localhost.webcache > localhost.39604: Flags [P.], cksum 0xfe84 (incorrect -> 0xd1f1), seq 1:93, ack 229, win 350, options [nop,nop,TS val 4117632408 ecr 4117632404], length 92: HTTP, length: 92
        HTTP/1.1 400
        Content-Length: 0
        Date: Tue, 25 Jun 2019 05:28:16 GMT
        Connection: close

05:28:16.072459 IP (tos 0x0, ttl 255, id 57837, offset 0, flags [DF], proto TCP (6), length 52)
    localhost.webcache > localhost.39604: Flags [F.], cksum 0xfe28 (incorrect -> 0x174a), seq 93, ack 229, win 350, options [nop,nop,TS val 4117632408 ecr 4117632404], length 0
05:28:16.072511 IP (tos 0x0, ttl 255, id 61415, offset 0, flags [DF], proto TCP (6), length 52)
    localhost.39604 > localhost.webcache: Flags [.], cksum 0xfe28 (incorrect -> 0x174f), seq 229, ack 93, win 342, options [nop,nop,TS val 4117632408 ecr 4117632408], length 0
05:28:16.073947 IP (tos 0x0, ttl 255, id 61416, offset 0, flags [DF], proto TCP (6), length 52)
    localhost.39604 > localhost.webcache: Flags [F.], cksum 0xfe28 (incorrect -> 0x174b), seq 229, ack 94, win 342, options [nop,nop,TS val 4117632410 ecr 4117632408], lengt